,number,value,datetime_start,datetime_complete,duration,params_bootstrap,params_criterion,params_max_depth,params_max_leaf_nodes,params_min_samples_leaf,params_n_estimators,state
475,475,0.761770453248433,2023-05-25 03:35:17.178929,2023-05-25 03:35:22.871655,0 days 00:00:05.692726,True,entropy,10,9,5,387,COMPLETE
476,476,0.7577110062851524,2023-05-25 03:35:22.871655,2023-05-25 03:35:30.951633,0 days 00:00:08.079978,True,entropy,10,6,5,624,COMPLETE
477,477,0.7629406215159309,2023-05-25 03:35:30.951633,2023-05-25 03:35:41.132805,0 days 00:00:10.181172,True,entropy,10,10,5,687,COMPLETE
478,478,0.7629265193305315,2023-05-25 03:35:41.132805,2023-05-25 03:35:49.994091,0 days 00:00:08.861286,True,entropy,10,10,10,600,COMPLETE
479,479,0.762770586837903,2023-05-25 03:35:49.994091,2023-05-25 03:36:01.801208,0 days 00:00:11.807117,True,entropy,10,10,6,771,COMPLETE
480,480,0.7627723986371848,2023-05-25 03:36:01.801208,2023-05-25 03:36:12.551329,0 days 00:00:10.750121,True,entropy,10,10,4,723,COMPLETE
481,481,0.7544564316419329,2023-05-25 03:36:12.551329,2023-05-25 03:36:20.177914,0 days 00:00:07.626585,True,entropy,10,4,8,655,COMPLETE
482,482,0.7625703115090959,2023-05-25 03:36:20.177914,2023-05-25 03:36:31.155406,0 days 00:00:10.977492,True,entropy,10,10,2,741,COMPLETE
483,483,0.7610638741910636,2023-05-25 03:36:31.155406,2023-05-25 03:36:41.086187,0 days 00:00:09.930781,True,entropy,10,8,7,701,COMPLETE
484,484,0.7625501046782324,2023-05-25 03:36:41.086187,2023-05-25 03:36:53.190338,0 days 00:00:12.104151,True,entropy,9,10,5,813,COMPLETE
485,485,0.7627017966400678,2023-05-25 03:36:53.190338,2023-05-25 03:37:03.416232,0 days 00:00:10.225894,True,entropy,10,10,5,678,COMPLETE
486,486,0.7622496524999064,2023-05-25 03:37:03.416232,2023-05-25 03:37:14.211803,0 days 00:00:10.795571,True,gini,10,10,6,720,COMPLETE
487,487,0.7626518503620898,2023-05-25 03:37:14.211803,2023-05-25 03:37:26.119867,0 days 00:00:11.908064,True,entropy,10,10,5,784,COMPLETE
488,488,0.7622644723770823,2023-05-25 03:37:26.119867,2023-05-25 03:37:41.344932,0 days 00:00:15.225065,False,entropy,10,10,5,744,COMPLETE
489,489,0.7627932363298309,2023-05-25 03:37:41.344932,2023-05-25 03:37:51.822777,0 days 00:00:10.477845,True,entropy,10,10,5,702,COMPLETE
490,490,0.7626769670499298,2023-05-25 03:37:51.822777,2023-05-25 03:38:02.167206,0 days 00:00:10.344429,True,entropy,10,10,7,661,COMPLETE
491,491,0.7623567030007928,2023-05-25 03:38:02.167206,2023-05-25 03:38:13.279992,0 days 00:00:11.112786,True,entropy,10,9,9,760,COMPLETE
492,492,0.7628871276004602,2023-05-25 03:38:13.279992,2023-05-25 03:38:22.774183,0 days 00:00:09.494191,True,entropy,9,10,5,637,COMPLETE
493,493,0.7627595689517417,2023-05-25 03:38:22.774183,2023-05-25 03:38:35.556384,0 days 00:00:12.782201,True,entropy,10,10,5,852,COMPLETE
494,494,0.7632764477477408,2023-05-25 03:38:35.556384,2023-05-25 03:38:45.808528,0 days 00:00:10.252144,True,entropy,10,10,4,683,COMPLETE
495,495,0.7627019332109458,2023-05-25 03:38:45.808528,2023-05-25 03:38:58.740881,0 days 00:00:12.932353,True,entropy,10,10,3,679,COMPLETE
496,496,0.7628428621079353,2023-05-25 03:38:58.744474,2023-05-25 03:39:10.609071,0 days 00:00:11.864597,True,entropy,7,10,3,646,COMPLETE
497,497,0.7620512960690117,2023-05-25 03:39:10.612159,2023-05-25 03:39:17.847394,0 days 00:00:07.235235,True,entropy,10,10,4,487,COMPLETE
498,498,0.7629097385292424,2023-05-25 03:39:17.847394,2023-05-25 03:39:27.854850,0 days 00:00:10.007456,True,entropy,10,10,4,668,COMPLETE
499,499,0.7629795896693374,2023-05-25 03:39:27.854850,2023-05-25 03:39:40.059185,0 days 00:00:12.204335,True,entropy,10,10,4,826,COMPLETE
500,500,0.7628751943287031,2023-05-25 03:39:40.059185,2023-05-25 03:39:50.287838,0 days 00:00:10.228653,True,entropy,8,10,8,680,COMPLETE
501,501,0.7616388545077257,2023-05-25 03:39:50.287838,2023-05-25 03:39:59.489295,0 days 00:00:09.201457,True,entropy,10,9,4,618,COMPLETE
502,502,0.762394608164536,2023-05-25 03:39:59.489295,2023-05-25 03:40:11.264635,0 days 00:00:11.775340,True,entropy,10,10,8,801,COMPLETE
503,503,0.7630915163028633,2023-05-25 03:40:11.264635,2023-05-25 03:40:21.560882,0 days 00:00:10.296247,True,entropy,10,10,6,694,COMPLETE
504,504,0.762460186543563,2023-05-25 03:40:21.560882,2023-05-25 03:40:31.804355,0 days 00:00:10.243473,True,entropy,10,10,3,657,COMPLETE
505,505,0.761418528734052,2023-05-25 03:40:31.804355,2023-05-25 03:40:36.637230,0 days 00:00:04.832875,True,gini,10,10,7,314,COMPLETE
506,506,0.7628847068211742,2023-05-25 03:40:36.637230,2023-05-25 03:40:50.150442,0 days 00:00:13.513212,True,entropy,10,10,6,895,COMPLETE
507,507,0.7628910665048533,2023-05-25 03:40:50.150442,2023-05-25 03:41:04.981942,0 days 00:00:14.831500,False,entropy,10,10,5,731,COMPLETE
508,508,0.7629241610830093,2023-05-25 03:41:04.986522,2023-05-25 03:41:15.817800,0 days 00:00:10.831278,True,entropy,10,10,2,711,COMPLETE
509,509,0.7620300333647931,2023-05-25 03:41:15.817800,2023-05-25 03:41:19.830117,0 days 00:00:04.012317,True,entropy,10,9,7,263,COMPLETE
510,510,0.7624930489327045,2023-05-25 03:41:19.830117,2023-05-25 03:41:31.623532,0 days 00:00:11.793415,True,entropy,10,10,6,772,COMPLETE
511,511,0.7622400183470381,2023-05-25 03:41:31.623532,2023-05-25 03:41:41.819835,0 days 00:00:10.196303,True,entropy,10,10,5,688,COMPLETE
512,512,0.7625930833920715,2023-05-25 03:41:41.819835,2023-05-25 03:41:52.991954,0 days 00:00:11.172119,True,entropy,10,10,9,756,COMPLETE
513,513,0.7629079080474555,2023-05-25 03:41:52.991954,2023-05-25 03:42:03.871985,0 days 00:00:10.880031,True,entropy,10,10,4,719,COMPLETE
514,514,0.7618533248953916,2023-05-25 03:42:03.871985,2023-05-25 03:42:07.593423,0 days 00:00:03.721438,True,entropy,10,10,5,220,COMPLETE
515,515,0.7627207478560452,2023-05-25 03:42:07.593423,2023-05-25 03:42:21.798699,0 days 00:00:14.205276,True,entropy,10,10,5,662,COMPLETE
516,516,0.762954989733607,2023-05-25 03:42:21.803165,2023-05-25 03:42:31.180483,0 days 00:00:09.377318,True,entropy,10,10,5,632,COMPLETE
517,517,0.762712989969684,2023-05-25 03:42:31.184748,2023-05-25 03:42:42.712205,0 days 00:00:11.527457,True,entropy,10,10,7,791,COMPLETE
518,518,0.7630707826677823,2023-05-25 03:42:42.712205,2023-05-25 03:42:52.851471,0 days 00:00:10.139266,True,entropy,10,10,6,676,COMPLETE
519,519,0.7630125188431036,2023-05-25 03:42:52.851471,2023-05-25 03:43:03.780239,0 days 00:00:10.928768,True,entropy,10,10,5,737,COMPLETE
520,520,0.7630912674919446,2023-05-25 03:43:03.780239,2023-05-25 03:43:14.256658,0 days 00:00:10.476419,True,entropy,9,10,5,695,COMPLETE
521,521,0.7622315878361672,2023-05-25 03:43:14.256658,2023-05-25 03:43:20.729891,0 days 00:00:06.473233,True,entropy,10,10,8,423,COMPLETE
522,522,0.7628510309448103,2023-05-25 03:43:20.729891,2023-05-25 03:43:31.197141,0 days 00:00:10.467250,True,entropy,10,10,1,704,COMPLETE
523,523,0.763068985996189,2023-05-25 03:43:31.200177,2023-05-25 03:43:42.642225,0 days 00:00:11.442048,True,entropy,10,10,4,753,COMPLETE
524,524,0.7618574780563545,2023-05-25 03:43:42.644329,2023-05-25 03:43:54.499778,0 days 00:00:11.855449,True,gini,10,10,3,815,COMPLETE
525,525,0.7631625911567194,2023-05-25 03:43:54.499778,2023-05-25 03:44:04.207021,0 days 00:00:09.707243,True,entropy,10,10,5,653,COMPLETE
526,526,0.7627566162595885,2023-05-25 03:44:04.207021,2023-05-25 03:44:16.571800,0 days 00:00:12.364779,False,entropy,10,10,5,608,COMPLETE
527,527,0.7629980973294187,2023-05-25 03:44:16.571800,2023-05-25 03:44:26.244158,0 days 00:00:09.672358,True,entropy,10,10,5,641,COMPLETE
528,528,0.7613623696060672,2023-05-25 03:44:26.244158,2023-05-25 03:44:35.511270,0 days 00:00:09.267112,True,entropy,6,9,5,652,COMPLETE
529,529,0.7549411584399652,2023-05-25 03:44:35.511270,2023-05-25 03:44:43.440348,0 days 00:00:07.929078,True,entropy,9,5,5,630,COMPLETE
530,530,0.7630306047236464,2023-05-25 03:44:43.443274,2023-05-25 03:44:53.542143,0 days 00:00:10.098869,True,entropy,10,10,5,674,COMPLETE
531,531,0.7625470141776292,2023-05-25 03:44:53.542143,2023-05-25 03:45:03.511747,0 days 00:00:09.969604,True,entropy,10,10,4,657,COMPLETE
532,532,0.7624073095472793,2023-05-25 03:45:03.511747,2023-05-25 03:45:12.550559,0 days 00:00:09.038812,True,entropy,10,10,5,594,COMPLETE
533,533,0.7627430911661107,2023-05-25 03:45:12.550559,2023-05-25 03:45:22.069061,0 days 00:00:09.518502,True,entropy,10,10,5,638,COMPLETE
534,534,0.7631890202708347,2023-05-25 03:45:22.069061,2023-05-25 03:45:36.122535,0 days 00:00:14.053474,True,entropy,10,10,5,661,COMPLETE
535,535,0.7603433101718471,2023-05-25 03:45:36.122535,2023-05-25 03:45:46.448984,0 days 00:00:10.326449,True,entropy,5,10,5,649,COMPLETE
536,536,0.7625543892099705,2023-05-25 03:45:46.448984,2023-05-25 03:45:56.341008,0 days 00:00:09.892024,True,entropy,10,10,6,667,COMPLETE
537,537,0.762920304894085,2023-05-25 03:45:56.341008,2023-05-25 03:46:06.075500,0 days 00:00:09.734492,True,entropy,10,10,5,646,COMPLETE
538,538,0.7625593148400464,2023-05-25 03:46:06.075500,2023-05-25 03:46:15.742317,0 days 00:00:09.666817,True,entropy,10,10,5,664,COMPLETE
539,539,0.7630840925434808,2023-05-25 03:46:15.742317,2023-05-25 03:46:24.932445,0 days 00:00:09.190128,True,entropy,10,10,5,615,COMPLETE
540,540,0.7630864947455279,2023-05-25 03:46:24.932445,2023-05-25 03:46:34.198597,0 days 00:00:09.266152,True,entropy,10,10,5,615,COMPLETE
541,541,0.7631498619016737,2023-05-25 03:46:34.198597,2023-05-25 03:46:42.854483,0 days 00:00:08.655886,True,entropy,9,10,4,573,COMPLETE
542,542,0.7618694510566322,2023-05-25 03:46:42.855846,2023-05-25 03:46:52.138596,0 days 00:00:09.282750,True,entropy,10,9,6,629,COMPLETE
543,543,0.7539454206545437,2023-05-25 03:46:52.138596,2023-05-25 03:47:00.120445,0 days 00:00:07.981849,True,entropy,10,4,5,682,COMPLETE
544,544,0.7621760617094377,2023-05-25 03:47:00.120445,2023-05-25 03:47:09.845592,0 days 00:00:09.725147,True,gini,10,10,5,656,COMPLETE
545,545,0.7627967023444155,2023-05-25 03:47:09.845592,2023-05-25 03:47:27.030907,0 days 00:00:17.185315,False,entropy,10,10,5,839,COMPLETE
546,546,0.7628456704417144,2023-05-25 03:47:27.030907,2023-05-25 03:47:37.033786,0 days 00:00:10.002879,True,entropy,10,10,6,673,COMPLETE
547,547,0.7625142841726431,2023-05-25 03:47:37.033786,2023-05-25 03:47:48.660444,0 days 00:00:11.626658,True,entropy,10,10,5,779,COMPLETE
548,548,0.7628341703903995,2023-05-25 03:47:48.660444,2023-05-25 03:48:00.373330,0 days 00:00:11.712886,True,entropy,10,10,5,799,COMPLETE
549,549,0.7626062505153997,2023-05-25 03:48:00.373330,2023-05-25 03:48:10.655385,0 days 00:00:10.282055,True,entropy,10,10,4,685,COMPLETE
550,550,0.7626990551831367,2023-05-25 03:48:10.657517,2023-05-25 03:48:23.967722,0 days 00:00:13.310205,True,entropy,10,10,5,865,COMPLETE
551,551,0.7618691857289207,2023-05-25 03:48:23.967722,2023-05-25 03:48:33.598660,0 days 00:00:09.630938,True,entropy,10,9,5,650,COMPLETE
552,552,0.7631207867644705,2023-05-25 03:48:33.598660,2023-05-25 03:48:43.071228,0 days 00:00:09.472568,True,entropy,10,10,6,637,COMPLETE
553,553,0.7631305927927807,2023-05-25 03:48:43.071228,2023-05-25 03:48:53.301811,0 days 00:00:10.230583,True,entropy,10,10,5,673,COMPLETE
554,554,0.76298322654583,2023-05-25 03:48:53.301811,2023-05-25 03:49:05.365694,0 days 00:00:12.063883,True,entropy,10,10,5,822,COMPLETE
555,555,0.762458871359106,2023-05-25 03:49:05.365694,2023-05-25 03:49:15.825256,0 days 00:00:10.459562,True,entropy,10,10,7,688,COMPLETE
556,556,0.7557151004549647,2023-05-25 03:49:15.825256,2023-05-25 03:49:20.263771,0 days 00:00:04.438515,True,entropy,3,10,5,361,COMPLETE
557,557,0.7532736594793057,2023-05-25 03:49:20.263771,2023-05-25 03:49:29.765666,0 days 00:00:09.501895,True,entropy,10,3,5,784,COMPLETE
558,558,0.7622955956893036,2023-05-25 03:49:29.765666,2023-05-25 03:49:44.168800,0 days 00:00:14.403134,True,entropy,10,10,2,658,COMPLETE
559,559,0.7576567450947664,2023-05-25 03:49:44.168800,2023-05-25 03:49:53.036192,0 days 00:00:08.867392,True,entropy,4,10,6,698,COMPLETE
560,560,0.7628728193080523,2023-05-25 03:49:53.036192,2023-05-25 03:50:04.374071,0 days 00:00:11.337879,True,entropy,9,10,5,771,COMPLETE
561,561,0.761490378696894,2023-05-25 03:50:04.374071,2023-05-25 03:50:06.359734,0 days 00:00:01.985663,True,entropy,8,10,4,110,COMPLETE
562,562,0.7595994735595605,2023-05-25 03:50:06.359734,2023-05-25 03:50:10.985221,0 days 00:00:04.625487,True,entropy,10,7,7,328,COMPLETE
563,563,0.7618293092532853,2023-05-25 03:50:10.985221,2023-05-25 03:50:20.812134,0 days 00:00:09.826913,True,gini,10,10,5,668,COMPLETE
564,564,0.7611840674648771,2023-05-25 03:50:20.812134,2023-05-25 03:50:32.081957,0 days 00:00:11.269823,True,entropy,10,8,10,803,COMPLETE
565,565,0.762441133600462,2023-05-25 03:50:32.081957,2023-05-25 03:50:47.119644,0 days 00:00:15.037687,False,entropy,10,10,5,728,COMPLETE
566,566,0.7624378700130845,2023-05-25 03:50:47.123982,2023-05-25 03:50:55.878885,0 days 00:00:08.754903,True,entropy,10,10,5,586,COMPLETE
567,567,0.7623314391172157,2023-05-25 03:50:55.878885,2023-05-25 03:51:05.435472,0 days 00:00:09.556587,True,entropy,10,10,6,630,COMPLETE
568,568,0.7617714247212886,2023-05-25 03:51:05.435472,2023-05-25 03:51:15.760192,0 days 00:00:10.324720,True,entropy,10,9,3,690,COMPLETE
569,569,0.762813180531856,2023-05-25 03:51:15.760192,2023-05-25 03:51:26.801973,0 days 00:00:11.041781,True,entropy,10,10,5,751,COMPLETE
570,570,0.7629036196516232,2023-05-25 03:51:26.801973,2023-05-25 03:51:36.647705,0 days 00:00:09.845732,True,entropy,10,10,5,654,COMPLETE
571,571,0.7627908425540153,2023-05-25 03:51:36.651044,2023-05-25 03:51:43.877079,0 days 00:00:07.226035,True,entropy,7,10,4,473,COMPLETE
572,572,0.7622310913989598,2023-05-25 03:51:43.877079,2023-05-25 03:51:47.677180,0 days 00:00:03.800101,True,entropy,10,10,5,238,COMPLETE
573,573,0.7623148173545307,2023-05-25 03:51:47.677180,2023-05-25 03:51:57.707206,0 days 00:00:10.030026,True,entropy,10,10,6,676,COMPLETE
574,574,0.7627328252624472,2023-05-25 03:51:57.707206,2023-05-25 03:52:08.214841,0 days 00:00:10.507635,True,entropy,10,10,5,701,COMPLETE
575,575,0.7630255065006748,2023-05-25 03:52:08.214841,2023-05-25 03:52:16.061322,0 days 00:00:07.846481,True,entropy,9,10,5,516,COMPLETE
576,576,0.7629379865128361,2023-05-25 03:52:16.061322,2023-05-25 03:52:25.821673,0 days 00:00:09.760351,True,entropy,10,10,7,642,COMPLETE
577,577,0.762782347964223,2023-05-25 03:52:25.821673,2023-05-25 03:52:37.875903,0 days 00:00:12.054230,True,entropy,10,10,5,611,COMPLETE
578,578,0.7628749351363724,2023-05-25 03:52:37.875903,2023-05-25 03:52:46.226137,0 days 00:00:08.350234,True,entropy,10,10,1,441,COMPLETE
579,579,0.7633324800214389,2023-05-25 03:52:46.226137,2023-05-25 03:52:57.451696,0 days 00:00:11.225559,True,entropy,10,10,6,728,COMPLETE
580,580,0.7619148883032258,2023-05-25 03:52:57.451696,2023-05-25 03:53:08.176573,0 days 00:00:10.724877,True,entropy,10,9,6,730,COMPLETE
581,581,0.7613227093820802,2023-05-25 03:53:08.176573,2023-05-25 03:53:18.844734,0 days 00:00:10.668161,True,entropy,5,10,6,764,COMPLETE
582,582,0.7618404125801822,2023-05-25 03:53:18.844734,2023-05-25 03:53:29.643032,0 days 00:00:10.798298,True,gini,10,10,6,738,COMPLETE
583,583,0.7621301721779598,2023-05-25 03:53:29.643032,2023-05-25 03:53:44.234221,0 days 00:00:14.591189,False,entropy,10,10,6,717,COMPLETE
584,584,0.7629390107219918,2023-05-25 03:53:44.234221,2023-05-25 03:53:55.575598,0 days 00:00:11.341377,True,entropy,10,10,6,760,COMPLETE
585,585,0.7625732651820228,2023-05-25 03:53:55.575598,2023-05-25 03:54:06.525503,0 days 00:00:10.949905,True,entropy,10,10,6,745,COMPLETE
586,586,0.7626898804972908,2023-05-25 03:54:06.525503,2023-05-25 03:54:18.047119,0 days 00:00:11.521616,True,entropy,10,10,6,784,COMPLETE
587,587,0.7629476640870687,2023-05-25 03:54:18.047119,2023-05-25 03:54:28.754006,0 days 00:00:10.706887,True,entropy,10,10,6,720,COMPLETE
588,588,0.7632589487216686,2023-05-25 03:54:28.754006,2023-05-25 03:54:30.559037,0 days 00:00:01.805031,True,entropy,10,10,7,100,COMPLETE
589,589,0.761914481381535,2023-05-25 03:54:30.559037,2023-05-25 03:54:32.547654,0 days 00:00:01.988617,True,entropy,9,10,7,109,COMPLETE
590,590,0.7631248576842793,2023-05-25 03:54:32.547654,2023-05-25 03:54:34.517744,0 days 00:00:01.970090,True,entropy,10,10,7,109,COMPLETE
591,591,0.7631484002453005,2023-05-25 03:54:34.522217,2023-05-25 03:54:36.394047,0 days 00:00:01.871830,True,entropy,10,10,7,102,COMPLETE
592,592,0.7617997935160118,2023-05-25 03:54:36.394047,2023-05-25 03:54:38.804327,0 days 00:00:02.410280,True,entropy,10,10,7,141,COMPLETE
593,593,0.7608003928183581,2023-05-25 03:54:38.804327,2023-05-25 03:54:40.840564,0 days 00:00:02.036237,True,entropy,10,9,7,117,COMPLETE
594,594,0.7632498535121195,2023-05-25 03:54:40.840564,2023-05-25 03:54:43.087119,0 days 00:00:02.246555,True,entropy,10,10,7,129,COMPLETE
595,595,0.7622942915052755,2023-05-25 03:54:43.087119,2023-05-25 03:54:45.502101,0 days 00:00:02.414982,True,entropy,10,10,7,141,COMPLETE
596,596,0.7625594189830054,2023-05-25 03:54:45.502101,2023-05-25 03:54:47.850341,0 days 00:00:02.348240,True,entropy,9,10,7,137,COMPLETE
597,597,0.7620520587819432,2023-05-25 03:54:47.850341,2023-05-25 03:54:50.464184,0 days 00:00:02.613843,True,entropy,10,10,7,158,COMPLETE
598,598,0.7623927241234206,2023-05-25 03:54:50.464184,2023-05-25 03:54:52.604415,0 days 00:00:02.140231,True,entropy,10,10,7,121,COMPLETE
599,599,0.7620414429128344,2023-05-25 03:54:52.604415,2023-05-25 03:54:55.241000,0 days 00:00:02.636585,True,entropy,10,10,7,129,COMPLETE
600,600,0.7618307846220033,2023-05-25 03:54:55.241000,2023-05-25 03:54:57.768768,0 days 00:00:02.527768,True,entropy,10,10,7,100,COMPLETE
601,601,0.7617516724601012,2023-05-25 03:54:57.768768,2023-05-25 03:55:00.757298,0 days 00:00:02.988530,True,entropy,10,9,7,126,COMPLETE
602,602,0.7619391306965471,2023-05-25 03:55:00.757298,2023-05-25 03:55:04.699817,0 days 00:00:03.942519,True,gini,10,10,7,165,COMPLETE
603,603,0.7634653347389428,2023-05-25 03:55:04.699817,2023-05-25 03:55:08.372433,0 days 00:00:03.672616,True,entropy,10,10,7,147,COMPLETE
604,604,0.7621274285949069,2023-05-25 03:55:08.372433,2023-05-25 03:55:11.060809,0 days 00:00:02.688376,True,entropy,10,10,8,150,COMPLETE
605,605,0.7623003712600401,2023-05-25 03:55:11.060809,2023-05-25 03:55:14.107913,0 days 00:00:03.047104,True,entropy,10,10,7,188,COMPLETE
606,606,0.7623975734895156,2023-05-25 03:55:14.107913,2023-05-25 03:55:16.125359,0 days 00:00:02.017446,True,entropy,6,10,7,118,COMPLETE
607,607,0.7619741580495349,2023-05-25 03:55:16.125359,2023-05-25 03:55:19.553201,0 days 00:00:03.427842,False,entropy,10,10,7,152,COMPLETE
608,608,0.7613485996249189,2023-05-25 03:55:19.554287,2023-05-25 03:55:22.453162,0 days 00:00:02.898875,True,entropy,10,10,7,102,COMPLETE
609,609,0.7620830134443894,2023-05-25 03:55:22.456837,2023-05-25 03:55:24.954946,0 days 00:00:02.498109,True,entropy,10,10,7,150,COMPLETE
610,610,0.7619629702036755,2023-05-25 03:55:24.954946,2023-05-25 03:55:27.137756,0 days 00:00:02.182810,True,entropy,10,10,7,114,COMPLETE
611,611,0.7619403920779197,2023-05-25 03:55:27.137756,2023-05-25 03:55:29.971663,0 days 00:00:02.833907,True,entropy,10,10,7,174,COMPLETE
612,612,0.7616549792146488,2023-05-25 03:55:29.971663,2023-05-25 03:55:32.185134,0 days 00:00:02.213471,True,entropy,10,10,7,127,COMPLETE
613,613,0.7615275198443036,2023-05-25 03:55:32.185134,2023-05-25 03:55:34.482746,0 days 00:00:02.297612,True,entropy,10,10,7,129,COMPLETE
614,614,0.7611953550895098,2023-05-25 03:55:34.482746,2023-05-25 03:55:36.323915,0 days 00:00:01.841169,True,entropy,10,9,7,105,COMPLETE
615,615,0.7622704039554904,2023-05-25 03:55:36.323915,2023-05-25 03:55:38.802779,0 days 00:00:02.478864,True,entropy,10,10,7,144,COMPLETE
616,616,0.762460926123639,2023-05-25 03:55:38.802779,2023-05-25 03:55:41.579584,0 days 00:00:02.776805,True,entropy,10,10,7,165,COMPLETE
617,617,0.7609874127918506,2023-05-25 03:55:41.579584,2023-05-25 03:55:43.380475,0 days 00:00:01.800891,True,entropy,10,10,7,101,COMPLETE
618,618,0.7625734719276125,2023-05-25 03:55:43.384595,2023-05-25 03:55:46.716308,0 days 00:00:03.331713,True,entropy,10,10,7,208,COMPLETE
619,619,0.7625824244770144,2023-05-25 03:55:46.716308,2023-05-25 03:55:48.801670,0 days 00:00:02.085362,True,entropy,10,10,8,115,COMPLETE
620,620,0.7582022477698157,2023-05-25 03:55:48.805049,2023-05-25 03:55:50.855344,0 days 00:00:02.050295,True,entropy,9,6,7,135,COMPLETE
621,621,0.761784916024445,2023-05-25 03:55:50.855344,2023-05-25 03:55:53.389540,0 days 00:00:02.534196,True,gini,10,10,2,154,COMPLETE
622,622,0.7624665332525317,2023-05-25 03:55:53.392716,2023-05-25 03:55:55.463618,0 days 00:00:02.070902,True,entropy,10,10,7,120,COMPLETE
623,623,0.762099878145624,2023-05-25 03:55:55.466529,2023-05-25 03:55:57.888155,0 days 00:00:02.421626,False,entropy,10,10,7,101,COMPLETE
624,624,0.7626997225938846,2023-05-25 03:55:57.888155,2023-05-25 03:56:10.046326,0 days 00:00:12.158171,True,entropy,10,10,3,831,COMPLETE
625,625,0.7624749607215663,2023-05-25 03:56:10.046861,2023-05-25 03:56:22.026863,0 days 00:00:11.980002,True,entropy,10,10,8,805,COMPLETE
626,626,0.762124036408595,2023-05-25 03:56:22.030000,2023-05-25 03:56:24.162798,0 days 00:00:02.132798,True,entropy,10,10,9,128,COMPLETE
627,627,0.7612718278243603,2023-05-25 03:56:24.166008,2023-05-25 03:56:26.671975,0 days 00:00:02.505967,True,entropy,10,10,7,150,COMPLETE
628,628,0.7626867285641608,2023-05-25 03:56:26.671975,2023-05-25 03:56:35.234321,0 days 00:00:08.562346,True,entropy,9,10,8,559,COMPLETE
629,629,0.7626192222748873,2023-05-25 03:56:35.234321,2023-05-25 03:56:37.428566,0 days 00:00:02.194245,True,entropy,10,10,7,129,COMPLETE
630,630,0.7625310426114721,2023-05-25 03:56:37.428566,2023-05-25 03:56:40.261785,0 days 00:00:02.833219,True,entropy,10,10,10,168,COMPLETE
631,631,0.7620495889855943,2023-05-25 03:56:40.261785,2023-05-25 03:56:52.217380,0 days 00:00:11.955595,True,entropy,10,9,4,816,COMPLETE
632,632,0.7628427050772982,2023-05-25 03:56:52.217380,2023-05-25 03:57:04.806539,0 days 00:00:12.589159,True,entropy,10,10,7,848,COMPLETE
