,number,value,datetime_start,datetime_complete,duration,params_bootstrap,params_criterion,params_max_depth,params_max_leaf_nodes,params_min_samples_leaf,params_n_estimators,state
949,949,0.7617313397096125,2023-05-25 04:34:57.319715,2023-05-25 04:35:00.569792,0 days 00:00:03.250077,True,entropy,10,9,3,201,COMPLETE
950,950,0.7629269375679878,2023-05-25 04:35:00.569792,2023-05-25 04:35:04.022274,0 days 00:00:03.452482,True,gini,10,10,3,216,COMPLETE
951,951,0.7628319609253622,2023-05-25 04:35:04.022274,2023-05-25 04:35:09.161271,0 days 00:00:05.138997,False,entropy,10,10,3,238,COMPLETE
952,952,0.7627553537258834,2023-05-25 04:35:09.161271,2023-05-25 04:35:12.134853,0 days 00:00:02.973582,True,entropy,10,10,3,182,COMPLETE
953,953,0.762654893833725,2023-05-25 04:35:12.134853,2023-05-25 04:35:15.318558,0 days 00:00:03.183705,True,entropy,9,10,3,198,COMPLETE
954,954,0.7619549278594853,2023-05-25 04:35:15.318558,2023-05-25 04:35:18.198817,0 days 00:00:02.880259,True,entropy,10,10,2,173,COMPLETE
955,955,0.7625746999071223,2023-05-25 04:35:18.198817,2023-05-25 04:35:21.537416,0 days 00:00:03.338599,True,entropy,10,10,3,213,COMPLETE
956,956,0.7624959710533739,2023-05-25 04:35:21.541822,2023-05-25 04:35:24.749616,0 days 00:00:03.207794,True,entropy,10,10,2,198,COMPLETE
957,957,0.761562639964714,2023-05-25 04:35:24.749616,2023-05-25 04:35:28.940596,0 days 00:00:04.190980,True,entropy,10,10,3,261,COMPLETE
958,958,0.758353555462442,2023-05-25 04:35:28.940596,2023-05-25 04:35:32.207933,0 days 00:00:03.267337,True,entropy,10,6,3,232,COMPLETE
959,959,0.7625442427879495,2023-05-25 04:35:32.207933,2023-05-25 04:35:35.212900,0 days 00:00:03.004967,True,entropy,9,10,3,165,COMPLETE
960,960,0.7621446034344752,2023-05-25 04:35:35.216163,2023-05-25 04:35:38.026206,0 days 00:00:02.810043,True,entropy,10,10,3,173,COMPLETE
961,961,0.7608649222163011,2023-05-25 04:35:38.026206,2023-05-25 04:35:41.057248,0 days 00:00:03.031042,True,entropy,10,9,3,184,COMPLETE
962,962,0.7625115582253373,2023-05-25 04:35:41.057248,2023-05-25 04:35:44.626179,0 days 00:00:03.568931,True,entropy,10,10,3,220,COMPLETE
963,963,0.7615908399449335,2023-05-25 04:35:44.630676,2023-05-25 04:35:47.371990,0 days 00:00:02.741314,True,entropy,10,10,3,152,COMPLETE
964,964,0.7632366761193214,2023-05-25 04:35:47.371990,2023-05-25 04:35:49.704822,0 days 00:00:02.332832,True,entropy,10,10,3,137,COMPLETE
965,965,0.7626589008984956,2023-05-25 04:35:49.704822,2023-05-25 04:35:52.890008,0 days 00:00:03.185186,True,entropy,10,10,3,194,COMPLETE
966,966,0.7629797091179107,2023-05-25 04:35:52.890008,2023-05-25 04:35:56.924398,0 days 00:00:04.034390,True,entropy,9,10,2,245,COMPLETE
967,967,0.7627732422810387,2023-05-25 04:35:56.924398,2023-05-25 04:35:59.759248,0 days 00:00:02.834850,True,entropy,10,10,3,162,COMPLETE
968,968,0.7605202745552793,2023-05-25 04:35:59.763823,2023-05-25 04:36:03.063795,0 days 00:00:03.299972,True,gini,10,10,3,135,COMPLETE
969,969,0.7625774109441016,2023-05-25 04:36:03.063795,2023-05-25 04:36:07.812188,0 days 00:00:04.748393,True,entropy,10,10,3,209,COMPLETE
970,970,0.7622172449631706,2023-05-25 04:36:07.812188,2023-05-25 04:36:11.573587,0 days 00:00:03.761399,True,entropy,10,10,3,153,COMPLETE
971,971,0.7617368757546004,2023-05-25 04:36:11.573587,2023-05-25 04:36:16.132409,0 days 00:00:04.558822,True,entropy,7,10,3,185,COMPLETE
972,972,0.7621917898430124,2023-05-25 04:36:16.132409,2023-05-25 04:36:22.917953,0 days 00:00:06.785544,False,entropy,10,10,3,292,COMPLETE
973,973,0.7612821600973337,2023-05-25 04:36:22.917953,2023-05-25 04:36:26.569170,0 days 00:00:03.651217,True,entropy,10,9,3,229,COMPLETE
974,974,0.7620788479794415,2023-05-25 04:36:26.573644,2023-05-25 04:36:28.820020,0 days 00:00:02.246376,True,entropy,10,10,3,128,COMPLETE
975,975,0.7624938687793452,2023-05-25 04:36:28.820020,2023-05-25 04:36:31.518689,0 days 00:00:02.698669,True,entropy,10,10,4,161,COMPLETE
976,976,0.7617112942741882,2023-05-25 04:36:31.518689,2023-05-25 04:36:33.808216,0 days 00:00:02.289527,True,entropy,8,10,2,130,COMPLETE
977,977,0.7622959373471343,2023-05-25 04:36:33.808216,2023-05-25 04:36:36.820931,0 days 00:00:03.012715,True,entropy,10,10,3,179,COMPLETE
978,978,0.7625931679571457,2023-05-25 04:36:36.820931,2023-05-25 04:36:40.238693,0 days 00:00:03.417762,True,entropy,10,10,3,207,COMPLETE
979,979,0.7623372028089521,2023-05-25 04:36:40.238693,2023-05-25 04:36:42.717446,0 days 00:00:02.478753,True,entropy,10,10,4,143,COMPLETE
980,980,0.76359408166489,2023-05-25 04:36:42.717446,2023-05-25 04:36:44.798251,0 days 00:00:02.080805,True,entropy,10,10,4,118,COMPLETE
981,981,0.7620548809202905,2023-05-25 04:36:44.800130,2023-05-25 04:36:46.805423,0 days 00:00:02.005293,True,entropy,9,10,4,115,COMPLETE
982,982,0.7619943334335615,2023-05-25 04:36:46.805423,2023-05-25 04:36:48.828607,0 days 00:00:02.023184,True,entropy,10,10,4,113,COMPLETE
983,983,0.7627632275718312,2023-05-25 04:36:48.831561,2023-05-25 04:36:52.776825,0 days 00:00:03.945264,True,entropy,10,10,4,251,COMPLETE
984,984,0.7628637384953871,2023-05-25 04:36:52.776825,2023-05-25 04:36:55.903662,0 days 00:00:03.126837,True,entropy,10,10,4,193,COMPLETE
985,985,0.7626993129734746,2023-05-25 04:36:55.903662,2023-05-25 04:36:58.396454,0 days 00:00:02.492792,True,entropy,9,10,4,147,COMPLETE
986,986,0.760971397316972,2023-05-25 04:36:58.398686,2023-05-25 04:37:01.743792,0 days 00:00:03.345106,True,entropy,10,9,4,214,COMPLETE
987,987,0.7621547127549603,2023-05-25 04:37:01.743792,2023-05-25 04:37:03.882189,0 days 00:00:02.138397,True,entropy,10,10,4,126,COMPLETE
988,988,0.7616911051649284,2023-05-25 04:37:03.882189,2023-05-25 04:37:05.829038,0 days 00:00:01.946849,True,entropy,10,10,4,101,COMPLETE
989,989,0.7618338223269976,2023-05-25 04:37:05.829038,2023-05-25 04:37:09.543971,0 days 00:00:03.714933,False,gini,10,10,4,170,COMPLETE
990,990,0.7595165004228669,2023-05-25 04:37:09.543971,2023-05-25 04:37:11.564769,0 days 00:00:02.020798,True,entropy,5,10,4,117,COMPLETE
991,991,0.7626009097612845,2023-05-25 04:37:11.564769,2023-05-25 04:37:15.311717,0 days 00:00:03.746948,True,entropy,10,10,4,234,COMPLETE
992,992,0.7625825377436325,2023-05-25 04:37:15.311717,2023-05-25 04:37:17.927545,0 days 00:00:02.615828,True,entropy,10,10,4,148,COMPLETE
993,993,0.7629936220750044,2023-05-25 04:37:17.927545,2023-05-25 04:37:21.172919,0 days 00:00:03.245374,True,entropy,10,10,3,196,COMPLETE
994,994,0.7617979588801094,2023-05-25 04:37:21.177137,2023-05-25 04:37:23.490575,0 days 00:00:02.313438,True,entropy,10,10,4,134,COMPLETE
995,995,0.7632499417441061,2023-05-25 04:37:23.495627,2023-05-25 04:37:26.286380,0 days 00:00:02.790753,True,entropy,9,10,4,167,COMPLETE
996,996,0.7621869386072856,2023-05-25 04:37:26.286380,2023-05-25 04:37:28.368966,0 days 00:00:02.082586,True,entropy,10,10,3,115,COMPLETE
997,997,0.7604640379979385,2023-05-25 04:37:28.373143,2023-05-25 04:37:31.831818,0 days 00:00:03.458675,True,entropy,10,8,3,220,COMPLETE
998,998,0.7626171076707882,2023-05-25 04:37:31.831818,2023-05-25 04:37:35.974186,0 days 00:00:04.142368,True,entropy,10,10,4,263,COMPLETE
999,999,0.7630318587848535,2023-05-25 04:37:35.974186,2023-05-25 04:37:41.819052,0 days 00:00:05.844866,True,entropy,10,10,2,369,COMPLETE
