,number,value,datetime_start,datetime_complete,duration,params_bootstrap,params_criterion,params_max_depth,params_max_leaf_nodes,params_min_samples_leaf,params_n_estimators,state
791,791,0.7626891830548951,2023-05-25 04:19:45.080567,2023-05-25 04:19:55.650474,0 days 00:00:10.569907,True,entropy,10,10,5,712,COMPLETE
792,792,0.7611006094242576,2023-05-25 04:19:55.652624,2023-05-25 04:20:05.214007,0 days 00:00:09.561383,True,gini,10,10,5,650,COMPLETE
793,793,0.762383690998331,2023-05-25 04:20:05.214007,2023-05-25 04:20:15.524713,0 days 00:00:10.310706,True,entropy,10,10,7,689,COMPLETE
794,794,0.7628845457615601,2023-05-25 04:20:15.524713,2023-05-25 04:20:18.443789,0 days 00:00:02.919076,False,entropy,9,10,5,124,COMPLETE
795,795,0.7629963898378247,2023-05-25 04:20:18.443789,2023-05-25 04:20:29.498828,0 days 00:00:11.055039,True,entropy,10,10,8,740,COMPLETE
796,796,0.7631276942917075,2023-05-25 04:20:29.498828,2023-05-25 04:20:39.206366,0 days 00:00:09.707538,True,entropy,10,10,4,635,COMPLETE
797,797,0.7604512404575308,2023-05-25 04:20:39.206366,2023-05-25 04:20:49.058579,0 days 00:00:09.852213,True,entropy,10,8,5,703,COMPLETE
798,798,0.7623359130612439,2023-05-25 04:20:49.058579,2023-05-25 04:21:00.476635,0 days 00:00:11.418056,True,entropy,10,10,2,766,COMPLETE
799,799,0.7529154566076101,2023-05-25 04:21:00.476635,2023-05-25 04:21:07.558221,0 days 00:00:07.081586,True,entropy,10,3,7,676,COMPLETE
800,800,0.7628127083068683,2023-05-25 04:21:07.558221,2023-05-25 04:21:18.261425,0 days 00:00:10.703204,True,entropy,10,10,9,719,COMPLETE
801,801,0.7614681336903328,2023-05-25 04:21:18.261425,2023-05-25 04:21:20.611407,0 days 00:00:02.349982,True,entropy,10,10,3,138,COMPLETE
802,802,0.7622743632339406,2023-05-25 04:21:20.611407,2023-05-25 04:21:26.772002,0 days 00:00:06.160595,True,entropy,10,10,10,400,COMPLETE
803,803,0.7626778440040398,2023-05-25 04:21:26.776077,2023-05-25 04:21:37.231342,0 days 00:00:10.455265,True,entropy,10,10,5,699,COMPLETE
804,804,0.7631706997325008,2023-05-25 04:21:37.231342,2023-05-25 04:21:47.203809,0 days 00:00:09.972467,True,entropy,10,10,5,662,COMPLETE
805,805,0.7605836801958521,2023-05-25 04:21:47.203809,2023-05-25 04:21:49.469381,0 days 00:00:02.265572,True,entropy,8,9,7,123,COMPLETE
806,806,0.7631782455540901,2023-05-25 04:21:49.469381,2023-05-25 04:21:52.192441,0 days 00:00:02.723060,True,entropy,10,10,5,159,COMPLETE
807,807,0.7630429690832022,2023-05-25 04:21:52.192441,2023-05-25 04:22:03.244798,0 days 00:00:11.052357,True,entropy,10,10,4,745,COMPLETE
808,808,0.7628176277686485,2023-05-25 04:22:03.244798,2023-05-25 04:22:12.490279,0 days 00:00:09.245481,True,entropy,10,10,5,622,COMPLETE
809,809,0.7628679872353581,2023-05-25 04:22:12.490279,2023-05-25 04:22:23.609919,0 days 00:00:11.119640,True,entropy,9,10,5,727,COMPLETE
810,810,0.762915883212196,2023-05-25 04:22:23.609919,2023-05-25 04:22:33.886090,0 days 00:00:10.276171,True,entropy,10,10,7,677,COMPLETE
811,811,0.7613554249900284,2023-05-25 04:22:33.886090,2023-05-25 04:22:45.007949,0 days 00:00:11.121859,True,gini,10,9,5,772,COMPLETE
812,812,0.7626567610815311,2023-05-25 04:22:45.007949,2023-05-25 04:22:55.072903,0 days 00:00:10.064954,True,entropy,10,10,5,652,COMPLETE
813,813,0.7631610958615573,2023-05-25 04:22:55.072903,2023-05-25 04:22:57.923753,0 days 00:00:02.850850,False,entropy,10,10,7,116,COMPLETE
814,814,0.7629061609656764,2023-05-25 04:22:57.926752,2023-05-25 04:23:00.990010,0 days 00:00:03.063258,True,entropy,10,10,4,191,COMPLETE
815,815,0.7629197253794985,2023-05-25 04:23:00.990010,2023-05-25 04:23:12.112474,0 days 00:00:11.122464,True,entropy,10,10,5,713,COMPLETE
816,816,0.7629559298715672,2023-05-25 04:23:12.112474,2023-05-25 04:23:22.547037,0 days 00:00:10.434563,True,entropy,9,10,1,696,COMPLETE
817,817,0.762494419802612,2023-05-25 04:23:22.549915,2023-05-25 04:23:34.352494,0 days 00:00:11.802579,True,entropy,10,10,7,681,COMPLETE
818,818,0.7627091010828454,2023-05-25 04:23:34.352494,2023-05-25 04:23:37.968112,0 days 00:00:03.615618,True,entropy,10,10,5,145,COMPLETE
819,819,0.7627757066203327,2023-05-25 04:23:37.968112,2023-05-25 04:23:51.605521,0 days 00:00:13.637409,True,entropy,10,10,8,757,COMPLETE
820,820,0.7626207932351938,2023-05-25 04:23:51.605521,2023-05-25 04:24:02.438013,0 days 00:00:10.832492,True,entropy,10,10,5,734,COMPLETE
821,821,0.7628420520635881,2023-05-25 04:24:02.438013,2023-05-25 04:24:04.262327,0 days 00:00:01.824314,True,entropy,10,10,7,101,COMPLETE
822,822,0.7629208583398627,2023-05-25 04:24:04.262327,2023-05-25 04:24:13.842667,0 days 00:00:09.580340,True,entropy,10,10,9,642,COMPLETE
823,823,0.7621829531678029,2023-05-25 04:24:13.842667,2023-05-25 04:24:23.439359,0 days 00:00:09.596692,True,entropy,10,9,5,667,COMPLETE
824,824,0.7627821798278908,2023-05-25 04:24:23.439359,2023-05-25 04:24:35.147160,0 days 00:00:11.707801,True,entropy,10,10,4,777,COMPLETE
825,825,0.7631522648278501,2023-05-25 04:24:35.149523,2023-05-25 04:24:45.658296,0 days 00:00:10.508773,True,entropy,10,10,3,711,COMPLETE
826,826,0.7587878494859177,2023-05-25 04:24:45.660289,2023-05-25 04:24:47.641886,0 days 00:00:01.981597,True,entropy,10,7,5,120,COMPLETE
827,827,0.7626110490868693,2023-05-25 04:24:47.641886,2023-05-25 04:24:57.960932,0 days 00:00:10.319046,True,entropy,10,10,7,693,COMPLETE
828,828,0.7628995007548339,2023-05-25 04:24:57.960932,2023-05-25 04:25:08.793204,0 days 00:00:10.832272,True,entropy,10,10,4,726,COMPLETE
829,829,0.761066790472741,2023-05-25 04:25:08.793204,2023-05-25 04:25:17.202707,0 days 00:00:08.409503,True,entropy,5,10,5,597,COMPLETE
830,830,0.761429332238351,2023-05-25 04:25:17.202707,2023-05-25 04:25:28.126665,0 days 00:00:10.923958,True,gini,10,10,5,744,COMPLETE
831,831,0.7565420712172931,2023-05-25 04:25:28.126665,2023-05-25 04:25:36.722532,0 days 00:00:08.595867,True,entropy,9,6,5,653,COMPLETE
832,832,0.7618176793196607,2023-05-25 04:25:36.722532,2023-05-25 04:25:39.795597,0 days 00:00:03.073065,False,entropy,10,10,7,138,COMPLETE
833,833,0.7538079776790193,2023-05-25 04:25:39.795597,2023-05-25 04:25:47.751932,0 days 00:00:07.956335,True,entropy,10,4,8,683,COMPLETE
834,834,0.7618094847171953,2023-05-25 04:25:47.751932,2023-05-25 04:25:50.464628,0 days 00:00:02.712696,True,entropy,10,10,5,162,COMPLETE
835,835,0.7624180473793871,2023-05-25 04:25:50.464628,2023-05-25 04:25:59.935037,0 days 00:00:09.470409,True,entropy,10,10,5,624,COMPLETE
836,836,0.7629829189815389,2023-05-25 04:25:59.939415,2023-05-25 04:26:06.759283,0 days 00:00:06.819868,True,entropy,10,10,7,447,COMPLETE
837,837,0.7624360311840926,2023-05-25 04:26:06.759283,2023-05-25 04:26:10.742881,0 days 00:00:03.983598,True,entropy,10,10,9,248,COMPLETE
838,838,0.7631971437768148,2023-05-25 04:26:10.742881,2023-05-25 04:26:21.175062,0 days 00:00:10.432181,True,entropy,10,10,4,703,COMPLETE
839,839,0.7628935184612896,2023-05-25 04:26:21.175062,2023-05-25 04:26:32.265531,0 days 00:00:11.090469,True,entropy,10,10,5,753,COMPLETE
840,840,0.7628469213891964,2023-05-25 04:26:32.269996,2023-05-25 04:26:42.325263,0 days 00:00:10.055267,True,entropy,10,10,5,666,COMPLETE
841,841,0.7622099426926267,2023-05-25 04:26:42.325263,2023-05-25 04:26:44.409693,0 days 00:00:02.084430,True,entropy,10,10,7,119,COMPLETE
842,842,0.7631046461203358,2023-05-25 04:26:44.409693,2023-05-25 04:26:46.655763,0 days 00:00:02.246070,True,entropy,10,10,5,100,COMPLETE
843,843,0.7628607248777821,2023-05-25 04:26:46.655763,2023-05-25 04:27:03.585950,0 days 00:00:16.930187,True,entropy,10,10,5,780,COMPLETE
844,844,0.7555650966833551,2023-05-25 04:27:03.585950,2023-05-25 04:27:12.389628,0 days 00:00:08.803678,True,entropy,10,5,4,722,COMPLETE
845,845,0.7618943664497246,2023-05-25 04:27:12.394185,2023-05-25 04:27:22.318155,0 days 00:00:09.923970,True,entropy,6,9,7,687,COMPLETE
846,846,0.7619999738717851,2023-05-25 04:27:22.318155,2023-05-25 04:27:24.573850,0 days 00:00:02.255695,True,entropy,10,10,6,131,COMPLETE
847,847,0.7621599989160319,2023-05-25 04:27:24.573850,2023-05-25 04:27:35.512313,0 days 00:00:10.938463,True,entropy,10,10,10,736,COMPLETE
848,848,0.7628839642129208,2023-05-25 04:27:35.512313,2023-05-25 04:27:46.921336,0 days 00:00:11.409023,True,entropy,10,10,8,764,COMPLETE
849,849,0.7616552383476707,2023-05-25 04:27:46.921336,2023-05-25 04:27:57.336460,0 days 00:00:10.415124,True,gini,7,10,5,708,COMPLETE
850,850,0.7626564236568425,2023-05-25 04:27:57.336460,2023-05-25 04:28:07.082191,0 days 00:00:09.745731,True,entropy,10,10,5,641,COMPLETE
851,851,0.7624120454683677,2023-05-25 04:28:07.082191,2023-05-25 04:28:20.848212,0 days 00:00:13.766021,False,entropy,10,10,7,676,COMPLETE
852,852,0.762988703205848,2023-05-25 04:28:20.848212,2023-05-25 04:28:31.654446,0 days 00:00:10.806234,True,entropy,10,10,5,717,COMPLETE
853,853,0.7631269979685749,2023-05-25 04:28:31.656600,2023-05-25 04:28:34.518506,0 days 00:00:02.861906,True,entropy,10,10,3,173,COMPLETE
854,854,0.7632793711919927,2023-05-25 04:28:34.518506,2023-05-25 04:28:36.597248,0 days 00:00:02.078742,True,entropy,9,10,4,117,COMPLETE
855,855,0.7622211489839106,2023-05-25 04:28:36.597248,2023-05-25 04:28:38.676057,0 days 00:00:02.078809,True,entropy,9,10,4,115,COMPLETE
856,856,0.7617333447723897,2023-05-25 04:28:38.676057,2023-05-25 04:28:50.542727,0 days 00:00:11.866670,True,entropy,9,9,4,790,COMPLETE
857,857,0.7624153691848705,2023-05-25 04:28:50.546975,2023-05-25 04:28:52.459880,0 days 00:00:01.912905,True,entropy,8,10,4,100,COMPLETE
858,858,0.7625920169792515,2023-05-25 04:28:52.459880,2023-05-25 04:29:02.287015,0 days 00:00:09.827135,True,entropy,8,10,4,657,COMPLETE
859,859,0.7629414565034568,2023-05-25 04:29:02.287015,2023-05-25 04:29:12.775667,0 days 00:00:10.488652,True,entropy,9,10,4,696,COMPLETE
860,860,0.7631033420678136,2023-05-25 04:29:12.775667,2023-05-25 04:29:21.909804,0 days 00:00:09.134137,True,entropy,9,10,4,615,COMPLETE
861,861,0.7633672222649737,2023-05-25 04:29:21.909804,2023-05-25 04:29:24.229966,0 days 00:00:02.320162,True,entropy,9,10,4,134,COMPLETE
862,862,0.7612286114250154,2023-05-25 04:29:24.229966,2023-05-25 04:29:26.856485,0 days 00:00:02.626519,True,entropy,9,10,4,156,COMPLETE
863,863,0.7631848097123806,2023-05-25 04:29:26.857006,2023-05-25 04:29:29.272769,0 days 00:00:02.415763,True,entropy,9,10,4,137,COMPLETE
864,864,0.7499082740538168,2023-05-25 04:29:29.272769,2023-05-25 04:29:30.778449,0 days 00:00:01.505680,True,entropy,9,2,4,135,COMPLETE
865,865,0.7630407520213289,2023-05-25 04:29:30.778449,2023-05-25 04:29:33.483694,0 days 00:00:02.705245,True,entropy,9,10,4,153,COMPLETE
866,866,0.7616581221686685,2023-05-25 04:29:33.483694,2023-05-25 04:29:35.791821,0 days 00:00:02.308127,True,entropy,9,10,4,129,COMPLETE
867,867,0.7605943675759896,2023-05-25 04:29:35.791821,2023-05-25 04:29:38.484011,0 days 00:00:02.692190,True,entropy,9,8,4,170,COMPLETE
868,868,0.7615947564474302,2023-05-25 04:29:38.484011,2023-05-25 04:29:40.586353,0 days 00:00:02.102342,True,entropy,9,10,4,118,COMPLETE
869,869,0.7621002927301354,2023-05-25 04:29:40.586353,2023-05-25 04:29:43.050232,0 days 00:00:02.463879,True,gini,8,10,4,149,COMPLETE
870,870,0.7625772147114294,2023-05-25 04:29:43.050232,2023-05-25 04:29:45.109679,0 days 00:00:02.059447,True,entropy,8,10,4,113,COMPLETE
871,871,0.7618895587275855,2023-05-25 04:29:45.109679,2023-05-25 04:29:48.539819,0 days 00:00:03.430140,True,entropy,9,9,4,150,COMPLETE
872,872,0.7625471704248282,2023-05-25 04:29:48.539819,2023-05-25 04:29:52.945444,0 days 00:00:04.405625,True,entropy,9,10,4,193,COMPLETE
873,873,0.7626375809681903,2023-05-25 04:29:52.945444,2023-05-25 04:29:56.768300,0 days 00:00:03.822856,False,entropy,9,10,4,116,COMPLETE
874,874,0.7619470943609212,2023-05-25 04:29:56.768300,2023-05-25 04:30:00.575300,0 days 00:00:03.807000,True,entropy,8,10,3,143,COMPLETE
875,875,0.7630886321662212,2023-05-25 04:30:00.575300,2023-05-25 04:30:03.747559,0 days 00:00:03.172259,True,entropy,9,10,4,136,COMPLETE
876,876,0.760437207571336,2023-05-25 04:30:03.747559,2023-05-25 04:30:05.521224,0 days 00:00:01.773665,True,entropy,9,10,4,100,COMPLETE
877,877,0.7613956867223219,2023-05-25 04:30:05.521224,2023-05-25 04:30:07.700962,0 days 00:00:02.179738,True,entropy,9,9,4,123,COMPLETE
878,878,0.7626104596057229,2023-05-25 04:30:07.700962,2023-05-25 04:30:18.757939,0 days 00:00:11.056977,True,entropy,9,10,4,751,COMPLETE
879,879,0.7631816683252367,2023-05-25 04:30:18.762222,2023-05-25 04:30:30.036874,0 days 00:00:11.274652,True,entropy,9,10,4,768,COMPLETE
880,880,0.7628658788982998,2023-05-25 04:30:30.036874,2023-05-25 04:30:33.022118,0 days 00:00:02.985244,True,entropy,9,10,4,174,COMPLETE
881,881,0.7613269969354741,2023-05-25 04:30:33.022118,2023-05-25 04:30:34.863939,0 days 00:00:01.841821,True,entropy,9,10,4,100,COMPLETE
882,882,0.7631730716462563,2023-05-25 04:30:34.863939,2023-05-25 04:30:45.956877,0 days 00:00:11.092938,True,entropy,9,10,8,744,COMPLETE
883,883,0.762876585790492,2023-05-25 04:30:45.956877,2023-05-25 04:30:50.949222,0 days 00:00:04.992345,True,entropy,8,10,3,322,COMPLETE
884,884,0.7608638943205147,2023-05-25 04:30:50.949222,2023-05-25 04:30:53.167503,0 days 00:00:02.218281,True,entropy,9,10,7,128,COMPLETE
885,885,0.7625707509242274,2023-05-25 04:30:53.171941,2023-05-25 04:31:05.082169,0 days 00:00:11.910228,True,entropy,7,10,7,798,COMPLETE
886,886,0.7629487348379891,2023-05-25 04:31:05.082169,2023-05-25 04:31:07.783531,0 days 00:00:02.701362,True,entropy,9,10,4,160,COMPLETE
887,887,0.7628367339352528,2023-05-25 04:31:07.783531,2023-05-25 04:31:15.980763,0 days 00:00:08.197232,True,entropy,10,10,7,555,COMPLETE
888,888,0.7616924697482311,2023-05-25 04:31:15.980763,2023-05-25 04:31:18.030693,0 days 00:00:02.049930,True,gini,10,10,4,115,COMPLETE
889,889,0.763041371132622,2023-05-25 04:31:18.030693,2023-05-25 04:31:28.959910,0 days 00:00:10.929217,True,entropy,10,10,2,735,COMPLETE
890,890,0.762421883470463,2023-05-25 04:31:28.959910,2023-05-25 04:31:45.871185,0 days 00:00:16.911275,False,entropy,10,10,8,834,COMPLETE
891,891,0.7635498410627564,2023-05-25 04:31:45.871185,2023-05-25 04:31:48.314041,0 days 00:00:02.442856,True,entropy,10,10,3,142,COMPLETE
892,892,0.7633464601910516,2023-05-25 04:31:48.314041,2023-05-25 04:31:51.641803,0 days 00:00:03.327762,True,entropy,9,10,3,203,COMPLETE
893,893,0.7632573124450227,2023-05-25 04:31:51.641803,2023-05-25 04:31:54.797807,0 days 00:00:03.156004,True,entropy,10,10,3,186,COMPLETE
894,894,0.7621371158528154,2023-05-25 04:31:54.801093,2023-05-25 04:31:58.385862,0 days 00:00:03.584769,True,entropy,10,10,3,217,COMPLETE
895,895,0.7586535506165907,2023-05-25 04:31:58.385862,2023-05-25 04:32:01.262484,0 days 00:00:02.876622,True,entropy,4,10,3,197,COMPLETE
896,896,0.7627895385934083,2023-05-25 04:32:01.262484,2023-05-25 04:32:04.345044,0 days 00:00:03.082560,True,entropy,10,10,3,183,COMPLETE
897,897,0.7608227024037783,2023-05-25 04:32:04.349597,2023-05-25 04:32:07.679978,0 days 00:00:03.330381,True,entropy,9,9,3,208,COMPLETE
898,898,0.7627494328122333,2023-05-25 04:32:07.679978,2023-05-25 04:32:10.897047,0 days 00:00:03.217069,True,entropy,10,10,2,184,COMPLETE
899,899,0.7623746458462356,2023-05-25 04:32:10.898241,2023-05-25 04:32:14.336639,0 days 00:00:03.438398,True,entropy,10,10,3,155,COMPLETE
900,900,0.7622929032233501,2023-05-25 04:32:14.336639,2023-05-25 04:32:18.125821,0 days 00:00:03.789182,True,entropy,10,10,3,228,COMPLETE
901,901,0.7625517553258305,2023-05-25 04:32:18.125821,2023-05-25 04:32:20.615215,0 days 00:00:02.489394,True,entropy,10,10,3,146,COMPLETE
902,902,0.762601320224441,2023-05-25 04:32:20.615215,2023-05-25 04:32:23.414632,0 days 00:00:02.799417,True,entropy,10,10,3,163,COMPLETE
903,903,0.7554521430362258,2023-05-25 04:32:23.414632,2023-05-25 04:32:25.871950,0 days 00:00:02.457318,True,entropy,3,10,3,195,COMPLETE
904,904,0.7614747319024182,2023-05-25 04:32:25.871950,2023-05-25 04:32:28.770818,0 days 00:00:02.898868,True,entropy,10,10,3,179,COMPLETE
905,905,0.7624717838915233,2023-05-25 04:32:28.770818,2023-05-25 04:32:32.237342,0 days 00:00:03.466524,True,entropy,8,10,3,214,COMPLETE
906,906,0.7611878751767293,2023-05-25 04:32:32.237342,2023-05-25 04:32:35.077875,0 days 00:00:02.840533,True,entropy,10,9,3,175,COMPLETE
907,907,0.7626042191136644,2023-05-25 04:32:35.077875,2023-05-25 04:32:38.135085,0 days 00:00:03.057210,True,entropy,9,10,3,177,COMPLETE
908,908,0.7628412927211803,2023-05-25 04:32:38.135085,2023-05-25 04:32:40.987134,0 days 00:00:02.852049,True,entropy,10,10,3,171,COMPLETE
909,909,0.7633623429923697,2023-05-25 04:32:40.987134,2023-05-25 04:32:44.463110,0 days 00:00:03.475976,True,entropy,10,10,3,199,COMPLETE
910,910,0.7607932031697922,2023-05-25 04:32:44.466059,2023-05-25 04:32:47.707559,0 days 00:00:03.241500,True,gini,10,10,3,199,COMPLETE
911,911,0.7626937734853036,2023-05-25 04:32:47.709870,2023-05-25 04:32:51.141049,0 days 00:00:03.431179,True,entropy,10,10,3,204,COMPLETE
912,912,0.7620821383794751,2023-05-25 04:32:51.141049,2023-05-25 04:32:56.350532,0 days 00:00:05.209483,False,entropy,10,10,3,230,COMPLETE
913,913,0.7618109975495141,2023-05-25 04:32:56.350532,2023-05-25 04:32:59.983743,0 days 00:00:03.633211,True,entropy,9,10,3,230,COMPLETE
914,914,0.7625242203732847,2023-05-25 04:32:59.983743,2023-05-25 04:33:03.205634,0 days 00:00:03.221891,True,entropy,10,10,3,189,COMPLETE
915,915,0.7629158281389333,2023-05-25 04:33:03.205634,2023-05-25 04:33:06.416347,0 days 00:00:03.210713,True,entropy,10,10,3,195,COMPLETE
916,916,0.7634369250835473,2023-05-25 04:33:06.419186,2023-05-25 04:33:09.978166,0 days 00:00:03.558980,True,entropy,10,10,3,214,COMPLETE
917,917,0.761795168261567,2023-05-25 04:33:09.978166,2023-05-25 04:33:13.711906,0 days 00:00:03.733740,True,entropy,10,10,3,230,COMPLETE
918,918,0.7616828610120852,2023-05-25 04:33:13.711906,2023-05-25 04:33:17.793775,0 days 00:00:04.081869,True,entropy,10,10,3,249,COMPLETE
919,919,0.7625645924037903,2023-05-25 04:33:17.793775,2023-05-25 04:33:20.999234,0 days 00:00:03.205459,True,entropy,6,10,3,198,COMPLETE
920,920,0.7608867475432064,2023-05-25 04:33:20.999234,2023-05-25 04:33:24.380862,0 days 00:00:03.381628,True,entropy,10,9,3,210,COMPLETE
921,921,0.7625427711979316,2023-05-25 04:33:24.380862,2023-05-25 04:33:27.795119,0 days 00:00:03.414257,True,entropy,10,10,3,210,COMPLETE
922,922,0.7621993838323966,2023-05-25 04:33:27.795119,2023-05-25 04:33:31.119269,0 days 00:00:03.324150,True,entropy,9,10,3,186,COMPLETE
923,923,0.762236290144552,2023-05-25 04:33:31.119269,2023-05-25 04:33:35.326155,0 days 00:00:04.206886,True,entropy,10,10,3,263,COMPLETE
924,924,0.7626545342178268,2023-05-25 04:33:35.326155,2023-05-25 04:33:38.242185,0 days 00:00:02.916030,True,entropy,10,10,3,169,COMPLETE
925,925,0.7626318209629304,2023-05-25 04:33:38.242185,2023-05-25 04:33:41.862517,0 days 00:00:03.620332,True,entropy,10,10,3,213,COMPLETE
926,926,0.7626846712914145,2023-05-25 04:33:41.864999,2023-05-25 04:33:45.760278,0 days 00:00:03.895279,True,entropy,8,10,3,243,COMPLETE
927,927,0.7624172059139799,2023-05-25 04:33:45.760278,2023-05-25 04:33:48.531538,0 days 00:00:02.771260,True,entropy,10,10,3,164,COMPLETE
928,928,0.7623215956248423,2023-05-25 04:33:48.531538,2023-05-25 04:33:52.086056,0 days 00:00:03.554518,True,entropy,10,10,3,219,COMPLETE
929,929,0.7618587512742273,2023-05-25 04:33:52.086056,2023-05-25 04:33:55.043284,0 days 00:00:02.957228,True,gini,10,10,3,182,COMPLETE
930,930,0.7630547196767326,2023-05-25 04:33:55.043284,2023-05-25 04:33:57.632371,0 days 00:00:02.589087,True,entropy,7,10,3,153,COMPLETE
931,931,0.7625160492457128,2023-05-25 04:33:57.632371,2023-05-25 04:34:01.043916,0 days 00:00:03.411545,False,entropy,10,10,3,156,COMPLETE
932,932,0.7628181573971862,2023-05-25 04:34:01.043916,2023-05-25 04:34:04.199867,0 days 00:00:03.155951,True,entropy,9,10,3,198,COMPLETE
933,933,0.7609513462729606,2023-05-25 04:34:04.199867,2023-05-25 04:34:06.501601,0 days 00:00:02.301734,True,entropy,10,9,3,142,COMPLETE
934,934,0.7617033273316682,2023-05-25 04:34:06.501601,2023-05-25 04:34:09.541641,0 days 00:00:03.040040,True,entropy,10,10,3,184,COMPLETE
935,935,0.7626410389318048,2023-05-25 04:34:09.545949,2023-05-25 04:34:12.433930,0 days 00:00:02.887981,True,entropy,10,10,3,166,COMPLETE
936,936,0.7627017984044333,2023-05-25 04:34:12.433930,2023-05-25 04:34:16.169329,0 days 00:00:03.735399,True,entropy,10,10,2,233,COMPLETE
937,937,0.7630061108598152,2023-05-25 04:34:16.169329,2023-05-25 04:34:20.517914,0 days 00:00:04.348585,True,entropy,10,10,3,273,COMPLETE
938,938,0.7621657995321495,2023-05-25 04:34:20.517914,2023-05-25 04:34:22.976932,0 days 00:00:02.459018,True,entropy,10,10,3,141,COMPLETE
939,939,0.763278719547206,2023-05-25 04:34:22.976932,2023-05-25 04:34:26.490972,0 days 00:00:03.514040,True,entropy,10,10,3,221,COMPLETE
940,940,0.7594971703292137,2023-05-25 04:34:26.490972,2023-05-25 04:34:29.908737,0 days 00:00:03.417765,True,entropy,10,7,3,227,COMPLETE
941,941,0.7623910783209983,2023-05-25 04:34:29.908737,2023-05-25 04:34:34.094663,0 days 00:00:04.185926,True,entropy,9,10,3,253,COMPLETE
942,942,0.7623900799171774,2023-05-25 04:34:34.097536,2023-05-25 04:34:37.532989,0 days 00:00:03.435453,True,entropy,10,10,3,213,COMPLETE
943,943,0.7633387303549188,2023-05-25 04:34:37.532989,2023-05-25 04:34:40.878699,0 days 00:00:03.345710,True,entropy,10,10,3,203,COMPLETE
944,944,0.7623168588082199,2023-05-25 04:34:40.879230,2023-05-25 04:34:44.431166,0 days 00:00:03.551936,True,entropy,10,10,3,222,COMPLETE
945,945,0.7613365767980551,2023-05-25 04:34:44.431166,2023-05-25 04:34:47.834114,0 days 00:00:03.402948,True,entropy,10,10,3,201,COMPLETE
946,946,0.7627705448581218,2023-05-25 04:34:47.838393,2023-05-25 04:34:51.236592,0 days 00:00:03.398199,True,entropy,10,10,3,210,COMPLETE
947,947,0.7533604302232645,2023-05-25 04:34:51.240673,2023-05-25 04:34:54.212525,0 days 00:00:02.971852,True,entropy,10,3,3,241,COMPLETE
948,948,0.7631172661371239,2023-05-25 04:34:54.212525,2023-05-25 04:34:57.315301,0 days 00:00:03.102776,True,entropy,10,10,3,185,COMPLETE
