,number,value,datetime_start,datetime_complete,duration,params_bootstrap,params_criterion,params_max_depth,params_max_leaf_nodes,params_min_samples_leaf,params_n_estimators,state
0,0,0.7507862800080471,2023-05-25 02:18:11.369435,2023-05-25 02:18:15.779052,0 days 00:00:04.409617,False,entropy,4,2,2,411,COMPLETE
1,1,0.7580563511909261,2023-05-25 02:18:15.779052,2023-05-25 02:18:27.520228,0 days 00:00:11.741176,False,entropy,4,9,1,704,COMPLETE
2,2,0.7625739926231512,2023-05-25 02:18:27.520228,2023-05-25 02:18:42.292419,0 days 00:00:14.772191,False,entropy,9,10,4,723,COMPLETE
3,3,0.7571660822949858,2023-05-25 02:18:42.292419,2023-05-25 02:18:50.493520,0 days 00:00:08.201101,False,gini,4,9,1,479,COMPLETE
4,4,0.7611844132828824,2023-05-25 02:18:50.493520,2023-05-25 02:19:01.452602,0 days 00:00:10.959082,True,gini,8,9,1,775,COMPLETE
5,5,0.7548846500574676,2023-05-25 02:19:01.452602,2023-05-25 02:19:05.608421,0 days 00:00:04.155819,True,entropy,3,6,10,364,COMPLETE
6,6,0.7534128004600836,2023-05-25 02:19:05.608421,2023-05-25 02:19:07.608628,0 days 00:00:02.000207,True,entropy,4,4,5,148,COMPLETE
7,7,0.7547569782865253,2023-05-25 02:19:07.608628,2023-05-25 02:19:12.876384,0 days 00:00:05.267756,True,entropy,3,5,7,473,COMPLETE
8,8,0.7599467337887117,2023-05-25 02:19:12.876384,2023-05-25 02:19:17.093359,0 days 00:00:04.216975,False,gini,10,7,10,223,COMPLETE
9,9,0.754732676185298,2023-05-25 02:19:17.093359,2023-05-25 02:19:29.093419,0 days 00:00:12.000060,False,gini,10,5,8,754,COMPLETE
10,10,0.7623702966958937,2023-05-25 02:19:29.093419,2023-05-25 02:19:48.802963,0 days 00:00:19.709544,False,entropy,7,10,4,977,COMPLETE
11,11,0.7620533737490379,2023-05-25 02:19:48.802963,2023-05-25 02:20:07.980153,0 days 00:00:19.177190,False,entropy,7,10,4,971,COMPLETE
12,12,0.7628447596837781,2023-05-25 02:20:07.980153,2023-05-25 02:20:27.752121,0 days 00:00:19.771968,False,entropy,8,10,4,996,COMPLETE
13,13,0.7608658322235604,2023-05-25 02:20:27.755251,2023-05-25 02:20:40.036217,0 days 00:00:12.280966,False,entropy,9,8,3,644,COMPLETE
14,14,0.760942386271733,2023-05-25 02:20:40.036217,2023-05-25 02:20:56.720709,0 days 00:00:16.684492,False,entropy,8,8,6,878,COMPLETE
15,15,0.7617728234242163,2023-05-25 02:20:56.720709,2023-05-25 02:21:08.763140,0 days 00:00:12.042431,False,entropy,6,10,5,608,COMPLETE
16,16,0.7590462495207222,2023-05-25 02:21:08.763140,2023-05-25 02:21:23.974193,0 days 00:00:15.211053,False,entropy,9,7,3,851,COMPLETE
17,17,0.7520736509390082,2023-05-25 02:21:23.974193,2023-05-25 02:21:33.012267,0 days 00:00:09.038074,False,entropy,6,2,7,866,COMPLETE
18,18,0.7602425172718188,2023-05-25 02:21:33.012267,2023-05-25 02:21:40.861373,0 days 00:00:07.849106,True,gini,8,8,3,562,COMPLETE
19,19,0.7628014115188322,2023-05-25 02:21:40.863366,2023-05-25 02:22:04.483008,0 days 00:00:23.619642,False,entropy,9,10,4,987,COMPLETE
20,20,0.7599619848723037,2023-05-25 02:22:04.483008,2023-05-25 02:22:22.691740,0 days 00:00:18.208732,False,entropy,10,7,6,997,COMPLETE
21,21,0.7621290565308687,2023-05-25 02:22:22.692271,2023-05-25 02:22:41.165307,0 days 00:00:18.473036,False,entropy,9,10,4,902,COMPLETE
22,22,0.7617742310602973,2023-05-25 02:22:41.165307,2023-05-25 02:22:57.097359,0 days 00:00:15.932052,False,entropy,9,9,4,817,COMPLETE
23,23,0.7619966409785277,2023-05-25 02:22:57.097359,2023-05-25 02:23:11.228566,0 days 00:00:14.131207,False,entropy,8,10,2,699,COMPLETE
24,24,0.7611998412647095,2023-05-25 02:23:11.228566,2023-05-25 02:23:29.073121,0 days 00:00:17.844555,False,entropy,7,9,5,923,COMPLETE
25,25,0.7611987105754779,2023-05-25 02:23:29.073121,2023-05-25 02:23:44.058382,0 days 00:00:14.985261,False,entropy,9,8,3,786,COMPLETE
26,26,0.7624920087661566,2023-05-25 02:23:44.058382,2023-05-25 02:23:57.889092,0 days 00:00:13.830710,True,gini,8,10,2,946,COMPLETE
27,27,0.7527163881137067,2023-05-25 02:23:57.889092,2023-05-25 02:24:07.013518,0 days 00:00:09.124426,False,entropy,10,3,6,699,COMPLETE
28,28,0.7610908701079123,2023-05-25 02:24:07.013518,2023-05-25 02:24:23.407568,0 days 00:00:16.394050,False,entropy,6,9,5,833,COMPLETE
29,29,0.7574618577398569,2023-05-25 02:24:23.407568,2023-05-25 02:24:28.110547,0 days 00:00:04.702979,False,entropy,5,6,4,268,COMPLETE
30,30,0.7627949731090707,2023-05-25 02:24:28.110547,2023-05-25 02:24:46.784628,0 days 00:00:18.674081,False,entropy,9,10,2,929,COMPLETE
31,31,0.7626399116394907,2023-05-25 02:24:46.784628,2023-05-25 02:25:05.040401,0 days 00:00:18.255773,False,entropy,9,10,2,909,COMPLETE
32,32,0.7617202865055365,2023-05-25 02:25:05.040401,2023-05-25 02:25:23.000216,0 days 00:00:17.959815,False,entropy,8,9,2,923,COMPLETE
33,33,0.7628762704843538,2023-05-25 02:25:23.000216,2023-05-25 02:25:46.003897,0 days 00:00:23.003681,False,entropy,9,10,1,996,COMPLETE
34,34,0.7619329520913037,2023-05-25 02:25:46.003897,2023-05-25 02:26:06.531729,0 days 00:00:20.527832,False,entropy,10,9,1,990,COMPLETE
35,35,0.7624860228058541,2023-05-25 02:26:06.531729,2023-05-25 02:26:26.898972,0 days 00:00:20.367243,False,entropy,9,10,1,997,COMPLETE
36,36,0.7602981376536657,2023-05-25 02:26:26.898972,2023-05-25 02:26:44.368330,0 days 00:00:17.469358,False,gini,7,8,1,938,COMPLETE
37,37,0.7617931541338228,2023-05-25 02:26:44.368330,2023-05-25 02:26:55.793656,0 days 00:00:11.425326,True,entropy,8,9,3,803,COMPLETE
38,38,0.7621995820926001,2023-05-25 02:26:55.793656,2023-05-25 02:27:13.111161,0 days 00:00:17.317505,False,entropy,9,10,2,872,COMPLETE
39,39,0.7613431163030344,2023-05-25 02:27:13.111161,2023-05-25 02:27:18.573927,0 days 00:00:05.462766,True,entropy,10,8,1,378,COMPLETE
40,40,0.7618706733154589,2023-05-25 02:27:18.573927,2023-05-25 02:27:27.994742,0 days 00:00:09.420815,False,gini,8,9,2,483,COMPLETE
41,41,0.7624581553065565,2023-05-25 02:27:27.994742,2023-05-25 02:27:46.037400,0 days 00:00:18.042658,False,entropy,9,10,2,909,COMPLETE
42,42,0.7627738379110711,2023-05-25 02:27:46.037400,2023-05-25 02:28:05.564079,0 days 00:00:19.526679,False,entropy,9,10,3,958,COMPLETE
43,43,0.7623000387066128,2023-05-25 02:28:05.564079,2023-05-25 02:28:24.701966,0 days 00:00:19.137887,False,entropy,10,10,3,961,COMPLETE
44,44,0.7617948646997055,2023-05-25 02:28:24.701966,2023-05-25 02:28:43.116994,0 days 00:00:18.415028,False,entropy,10,9,4,947,COMPLETE
45,45,0.7619063459934055,2023-05-25 02:28:43.116994,2023-05-25 02:28:57.847715,0 days 00:00:14.730721,False,entropy,9,9,3,751,COMPLETE
46,46,0.7624301094474142,2023-05-25 02:28:57.847715,2023-05-25 02:29:15.715809,0 days 00:00:17.868094,False,entropy,8,10,1,878,COMPLETE
47,47,0.7629610475407634,2023-05-25 02:29:15.715809,2023-05-25 02:29:33.247898,0 days 00:00:17.532089,True,entropy,7,10,3,959,COMPLETE
48,48,0.7549959576127696,2023-05-25 02:29:33.247898,2023-05-25 02:29:44.750034,0 days 00:00:11.502136,True,gini,7,5,9,840,COMPLETE
49,49,0.762751490776348,2023-05-25 02:29:44.750034,2023-05-25 02:29:59.260037,0 days 00:00:14.510003,True,entropy,7,10,5,997,COMPLETE
50,50,0.7577947151774188,2023-05-25 02:29:59.260037,2023-05-25 02:30:10.714773,0 days 00:00:11.454736,True,entropy,6,6,2,893,COMPLETE
51,51,0.7630232481502348,2023-05-25 02:30:10.714773,2023-05-25 02:30:24.779374,0 days 00:00:14.064601,True,entropy,9,10,3,965,COMPLETE
52,52,0.7616471223199096,2023-05-25 02:30:24.781135,2023-05-25 02:30:38.418171,0 days 00:00:13.637036,True,entropy,8,9,4,958,COMPLETE
53,53,0.7627507382341416,2023-05-25 02:30:38.418171,2023-05-25 02:30:52.674071,0 days 00:00:14.255900,True,entropy,8,10,3,969,COMPLETE
54,54,0.762717961075049,2023-05-25 02:30:52.675833,2023-05-25 02:31:06.127431,0 days 00:00:13.451598,True,entropy,9,10,4,924,COMPLETE
55,55,0.7619130456494224,2023-05-25 02:31:06.127431,2023-05-25 02:31:18.475625,0 days 00:00:12.348194,True,entropy,7,9,4,857,COMPLETE
56,56,0.7597128241815392,2023-05-25 02:31:18.475625,2023-05-25 02:31:30.410873,0 days 00:00:11.935248,True,entropy,8,7,3,890,COMPLETE
57,57,0.7632151823324632,2023-05-25 02:31:30.410873,2023-05-25 02:31:40.203724,0 days 00:00:09.792851,True,entropy,10,10,1,656,COMPLETE
58,58,0.7598912626633564,2023-05-25 02:31:40.203724,2023-05-25 02:31:47.896006,0 days 00:00:07.692282,True,gini,10,8,1,547,COMPLETE
59,59,0.7621484002579941,2023-05-25 02:31:47.896006,2023-05-25 02:31:57.642958,0 days 00:00:09.746952,True,entropy,10,9,5,670,COMPLETE
60,60,0.7548749484880691,2023-05-25 02:31:57.642958,2023-05-25 02:32:01.316373,0 days 00:00:03.673415,True,entropy,3,10,7,310,COMPLETE
61,61,0.7627659533348439,2023-05-25 02:32:01.317438,2023-05-25 02:32:20.299145,0 days 00:00:18.981707,True,entropy,9,10,2,973,COMPLETE
62,62,0.7628106542138315,2023-05-25 02:32:20.299145,2023-05-25 02:32:32.716127,0 days 00:00:12.416982,True,entropy,9,10,2,771,COMPLETE
63,63,0.7625901024456789,2023-05-25 02:32:32.716127,2023-05-25 02:32:42.307067,0 days 00:00:09.590940,True,entropy,10,10,1,638,COMPLETE
64,64,0.7620413421799895,2023-05-25 02:32:42.307067,2023-05-25 02:32:52.868041,0 days 00:00:10.560974,True,entropy,9,9,3,733,COMPLETE
65,65,0.7534678374172924,2023-05-25 02:32:52.868041,2023-05-25 02:32:59.714352,0 days 00:00:06.846311,True,entropy,9,4,1,572,COMPLETE
66,66,0.7630372571468383,2023-05-25 02:32:59.714352,2023-05-25 02:33:01.626901,0 days 00:00:01.912549,True,entropy,8,10,4,109,COMPLETE
67,67,0.760337170017962,2023-05-25 02:33:01.626901,2023-05-25 02:33:03.698432,0 days 00:00:02.071531,True,entropy,5,10,3,128,COMPLETE
68,68,0.7620254711294695,2023-05-25 02:33:03.698432,2023-05-25 02:33:11.379965,0 days 00:00:07.681533,True,entropy,8,9,2,521,COMPLETE
69,69,0.7469509401261208,2023-05-25 02:33:11.383443,2023-05-25 02:33:13.439935,0 days 00:00:02.056492,True,entropy,7,2,1,203,COMPLETE
70,70,0.7621676639820291,2023-05-25 02:33:13.441714,2023-05-25 02:33:22.983870,0 days 00:00:09.542156,True,gini,8,10,4,614,COMPLETE
71,71,0.7625468638219011,2023-05-25 02:33:22.983870,2023-05-25 02:33:35.818373,0 days 00:00:12.834503,True,entropy,9,10,4,820,COMPLETE
72,72,0.7627623096648255,2023-05-25 02:33:35.818373,2023-05-25 02:33:45.976859,0 days 00:00:10.158486,True,entropy,8,10,5,682,COMPLETE
73,73,0.7629935340341406,2023-05-25 02:33:45.976859,2023-05-25 02:33:57.279320,0 days 00:00:11.302461,True,entropy,10,10,6,775,COMPLETE
74,74,0.762112545685413,2023-05-25 02:33:57.279320,2023-05-25 02:34:08.689734,0 days 00:00:11.410414,True,entropy,10,9,7,778,COMPLETE
75,75,0.7630971967594753,2023-05-25 02:34:08.692018,2023-05-25 02:34:19.382914,0 days 00:00:10.690896,True,entropy,10,10,6,717,COMPLETE
76,76,0.7626816923922711,2023-05-25 02:34:19.382914,2023-05-25 02:34:26.195859,0 days 00:00:06.812945,True,entropy,10,10,6,433,COMPLETE
77,77,0.7630077897023442,2023-05-25 02:34:26.195859,2023-05-25 02:34:37.038430,0 days 00:00:10.842571,True,entropy,10,10,6,713,COMPLETE
78,78,0.7623236427333846,2023-05-25 02:34:37.038430,2023-05-25 02:34:47.085187,0 days 00:00:10.046757,True,entropy,10,9,6,684,COMPLETE
79,79,0.7625596293230019,2023-05-25 02:34:47.085187,2023-05-25 02:34:58.096501,0 days 00:00:11.011314,True,entropy,10,10,7,725,COMPLETE
80,80,0.7621746395710527,2023-05-25 02:34:58.096501,2023-05-25 02:35:07.901647,0 days 00:00:09.805146,True,entropy,10,9,6,657,COMPLETE
81,81,0.7629569510789395,2023-05-25 02:35:07.903742,2023-05-25 02:35:16.961404,0 days 00:00:09.057662,True,entropy,10,10,6,603,COMPLETE
82,82,0.7625044245059776,2023-05-25 02:35:16.961404,2023-05-25 02:35:25.994887,0 days 00:00:09.033483,True,entropy,10,10,6,617,COMPLETE
83,83,0.7627772233431388,2023-05-25 02:35:25.997598,2023-05-25 02:35:34.896655,0 days 00:00:08.899057,True,entropy,10,10,7,581,COMPLETE
84,84,0.7629381456435097,2023-05-25 02:35:34.896655,2023-05-25 02:35:45.567657,0 days 00:00:10.671002,True,entropy,10,10,6,715,COMPLETE
85,85,0.7622322931058039,2023-05-25 02:35:45.567657,2023-05-25 02:35:57.296083,0 days 00:00:11.728426,True,entropy,10,10,6,707,COMPLETE
86,86,0.7629960204196334,2023-05-25 02:35:57.296083,2023-05-25 02:36:12.517125,0 days 00:00:15.221042,True,entropy,10,10,6,756,COMPLETE
87,87,0.7630313734073837,2023-05-25 02:36:12.517125,2023-05-25 02:36:23.480637,0 days 00:00:10.963512,True,entropy,10,10,8,748,COMPLETE
88,88,0.7624400667203108,2023-05-25 02:36:23.480637,2023-05-25 02:36:34.364778,0 days 00:00:10.884141,True,entropy,10,9,9,758,COMPLETE
89,89,0.7622524595037357,2023-05-25 02:36:34.364778,2023-05-25 02:36:45.945570,0 days 00:00:11.580792,True,gini,10,10,8,801,COMPLETE
90,90,0.7622552341783908,2023-05-25 02:36:45.945570,2023-05-25 02:36:56.910610,0 days 00:00:10.965040,True,entropy,10,9,8,758,COMPLETE
91,91,0.7625964040080461,2023-05-25 02:36:56.910610,2023-05-25 02:37:06.303124,0 days 00:00:09.392514,True,entropy,10,10,5,632,COMPLETE
92,92,0.7623642283559475,2023-05-25 02:37:06.303124,2023-05-25 02:37:17.113929,0 days 00:00:10.810805,True,entropy,10,10,7,738,COMPLETE
93,93,0.7625032765297125,2023-05-25 02:37:17.117186,2023-05-25 02:37:26.121477,0 days 00:00:09.004291,True,entropy,10,10,6,591,COMPLETE
94,94,0.7626292989567667,2023-05-25 02:37:26.121477,2023-05-25 02:37:33.965798,0 days 00:00:07.844321,True,entropy,10,10,5,530,COMPLETE
95,95,0.7625549188649018,2023-05-25 02:37:33.965798,2023-05-25 02:37:44.149323,0 days 00:00:10.183525,True,entropy,10,10,10,662,COMPLETE
96,96,0.7619683397385157,2023-05-25 02:37:44.149323,2023-05-25 02:37:54.249009,0 days 00:00:10.099686,True,entropy,9,9,6,686,COMPLETE
97,97,0.7626802079194579,2023-05-25 02:37:54.249009,2023-05-25 02:38:05.913658,0 days 00:00:11.664649,True,entropy,10,10,7,788,COMPLETE
98,98,0.7624994475482697,2023-05-25 02:38:05.913658,2023-05-25 02:38:14.901411,0 days 00:00:08.987753,True,entropy,10,10,5,596,COMPLETE
99,99,0.752608522321488,2023-05-25 02:38:14.904638,2023-05-25 02:38:22.317556,0 days 00:00:07.412918,True,entropy,9,3,9,699,COMPLETE
100,100,0.7613712551140465,2023-05-25 02:38:22.317556,2023-05-25 02:38:31.531320,0 days 00:00:09.213764,True,entropy,6,9,6,649,COMPLETE
101,101,0.7627317210435256,2023-05-25 02:38:31.531320,2023-05-25 02:38:42.174881,0 days 00:00:10.643561,True,entropy,10,10,6,716,COMPLETE
102,102,0.7631627307557742,2023-05-25 02:38:42.174881,2023-05-25 02:38:53.478750,0 days 00:00:11.303869,True,entropy,10,10,6,746,COMPLETE
103,103,0.7626671513117043,2023-05-25 02:38:53.481930,2023-05-25 02:39:05.756196,0 days 00:00:12.274266,True,entropy,10,10,5,826,COMPLETE
104,104,0.7621278139043524,2023-05-25 02:39:05.756196,2023-05-25 02:39:16.764319,0 days 00:00:11.008123,True,entropy,10,10,7,748,COMPLETE
105,105,0.762904750775425,2023-05-25 02:39:16.764319,2023-05-25 02:39:28.621994,0 days 00:00:11.857675,True,entropy,9,10,8,807,COMPLETE
106,106,0.7627671122915115,2023-05-25 02:39:28.621994,2023-05-25 02:39:41.174452,0 days 00:00:12.552458,True,entropy,10,10,6,848,COMPLETE
107,107,0.7606743511295263,2023-05-25 02:39:41.174452,2023-05-25 02:39:50.081717,0 days 00:00:08.907265,True,gini,10,9,5,625,COMPLETE
108,108,0.7632217678393711,2023-05-25 02:39:50.081717,2023-05-25 02:40:00.306551,0 days 00:00:10.224834,True,entropy,9,10,7,673,COMPLETE
109,109,0.7627288856668397,2023-05-25 02:40:00.306551,2023-05-25 02:40:15.460390,0 days 00:00:15.153839,True,entropy,9,10,8,738,COMPLETE
110,110,0.763041663694363,2023-05-25 02:40:15.460390,2023-05-25 02:40:27.059316,0 days 00:00:11.598926,True,entropy,9,10,7,773,COMPLETE
111,111,0.7624545741091472,2023-05-25 02:40:27.059316,2023-05-25 02:40:38.871832,0 days 00:00:11.812516,True,entropy,9,10,7,790,COMPLETE
112,112,0.7626279057571599,2023-05-25 02:40:38.871832,2023-05-25 02:40:50.129111,0 days 00:00:11.257279,True,entropy,9,10,7,764,COMPLETE
113,113,0.7625862184436065,2023-05-25 02:40:50.129111,2023-05-25 02:41:00.170484,0 days 00:00:10.041373,True,entropy,9,10,8,672,COMPLETE
114,114,0.7621073936922723,2023-05-25 02:41:00.170484,2023-05-25 02:41:10.919395,0 days 00:00:10.748911,True,entropy,9,10,7,729,COMPLETE
115,115,0.7621787843654007,2023-05-25 02:41:10.919395,2023-05-25 02:41:21.109134,0 days 00:00:10.189739,True,entropy,7,9,6,700,COMPLETE
116,116,0.76244216992248,2023-05-25 02:41:21.109664,2023-05-25 02:41:26.220694,0 days 00:00:05.111030,True,entropy,10,10,6,332,COMPLETE
117,117,0.7628017460932692,2023-05-25 02:41:26.223936,2023-05-25 02:41:37.824315,0 days 00:00:11.600379,True,entropy,9,10,7,779,COMPLETE
118,118,0.7628264104962251,2023-05-25 02:41:37.824315,2023-05-25 02:41:48.887358,0 days 00:00:11.063043,True,entropy,8,10,6,748,COMPLETE
119,119,0.7551589207349239,2023-05-25 02:41:48.887358,2023-05-25 02:41:57.987185,0 days 00:00:09.099827,True,entropy,10,5,8,724,COMPLETE
120,120,0.7601568956825429,2023-05-25 02:41:57.987696,2023-05-25 02:42:07.284891,0 days 00:00:09.297195,True,entropy,10,7,7,691,COMPLETE
121,121,0.7624876724197373,2023-05-25 02:42:07.284891,2023-05-25 02:42:17.100226,0 days 00:00:09.815335,True,entropy,10,10,6,646,COMPLETE
122,122,0.7628694921353238,2023-05-25 02:42:17.100226,2023-05-25 02:42:27.167704,0 days 00:00:10.067478,True,entropy,10,10,6,665,COMPLETE
123,123,0.7616658614119607,2023-05-25 02:42:27.167704,2023-05-25 02:42:31.174782,0 days 00:00:04.007078,True,entropy,10,10,6,254,COMPLETE
124,124,0.7630894770873919,2023-05-25 02:42:31.174782,2023-05-25 02:42:41.998499,0 days 00:00:10.823717,True,entropy,10,10,5,716,COMPLETE
125,125,0.7626209421227911,2023-05-25 02:42:41.998499,2023-05-25 02:42:57.202321,0 days 00:00:15.203822,True,entropy,10,10,5,766,COMPLETE
126,126,0.7616854786494278,2023-05-25 02:42:57.202321,2023-05-25 02:43:07.853455,0 days 00:00:10.651134,True,gini,9,9,5,714,COMPLETE
127,127,0.7624153811792699,2023-05-25 02:43:07.853455,2023-05-25 02:43:19.409025,0 days 00:00:11.555570,True,entropy,6,10,4,807,COMPLETE
128,128,0.7623115840554451,2023-05-25 02:43:19.411242,2023-05-25 02:43:25.928129,0 days 00:00:06.516887,True,entropy,7,9,3,450,COMPLETE
129,129,0.7631196859882695,2023-05-25 02:43:25.928129,2023-05-25 02:43:29.020220,0 days 00:00:03.092091,True,entropy,10,10,5,193,COMPLETE
130,130,0.758229808844112,2023-05-25 02:43:29.020220,2023-05-25 02:43:31.351771,0 days 00:00:02.331551,True,entropy,4,10,5,158,COMPLETE
131,131,0.7629166744754476,2023-05-25 02:43:31.351771,2023-05-25 02:43:34.307083,0 days 00:00:02.955312,True,entropy,10,10,5,174,COMPLETE
132,132,0.7618414054938787,2023-05-25 02:43:34.307083,2023-05-25 02:43:37.341112,0 days 00:00:03.034029,True,entropy,10,10,4,189,COMPLETE
133,133,0.7630429363854421,2023-05-25 02:43:37.341112,2023-05-25 02:43:48.356355,0 days 00:00:11.015243,True,entropy,10,10,4,741,COMPLETE
134,134,0.7626887082494974,2023-05-25 02:43:48.356355,2023-05-25 02:43:59.465566,0 days 00:00:11.109211,True,entropy,10,10,5,750,COMPLETE
135,135,0.7633646763426707,2023-05-25 02:43:59.465566,2023-05-25 02:44:01.577851,0 days 00:00:02.112285,True,entropy,10,10,4,121,COMPLETE
136,136,0.7624170245327877,2023-05-25 02:44:01.577851,2023-05-25 02:44:05.173724,0 days 00:00:03.595873,True,entropy,10,10,9,221,COMPLETE
137,137,0.7614451809790441,2023-05-25 02:44:05.176584,2023-05-25 02:44:07.210708,0 days 00:00:02.034124,True,entropy,10,10,4,119,COMPLETE
138,138,0.7623885928965609,2023-05-25 02:44:07.210708,2023-05-25 02:44:09.192946,0 days 00:00:01.982238,True,entropy,10,10,4,117,COMPLETE
139,139,0.7629093956074459,2023-05-25 02:44:09.192946,2023-05-25 02:44:11.567894,0 days 00:00:02.374948,True,entropy,10,10,4,142,COMPLETE
140,140,0.7621246503121852,2023-05-25 02:44:11.567894,2023-05-25 02:44:13.832660,0 days 00:00:02.264766,True,entropy,9,9,5,137,COMPLETE
141,141,0.762581758639201,2023-05-25 02:44:13.832660,2023-05-25 02:44:15.774241,0 days 00:00:01.941581,True,entropy,10,10,4,103,COMPLETE
142,142,0.7619403342731772,2023-05-25 02:44:15.774241,2023-05-25 02:44:17.529391,0 days 00:00:01.755150,True,entropy,10,10,6,101,COMPLETE
143,143,0.7620120223063398,2023-05-25 02:44:17.529391,2023-05-25 02:44:20.158848,0 days 00:00:02.629457,True,entropy,10,10,6,154,COMPLETE
144,144,0.7629647564286846,2023-05-25 02:44:20.158848,2023-05-25 02:44:31.048273,0 days 00:00:10.889425,True,entropy,10,10,5,739,COMPLETE
145,145,0.7630193792559785,2023-05-25 02:44:31.048273,2023-05-25 02:44:41.616832,0 days 00:00:10.568559,True,entropy,10,10,6,708,COMPLETE
146,146,0.7633404194208062,2023-05-25 02:44:41.616832,2023-05-25 02:44:51.961234,0 days 00:00:10.344402,True,entropy,10,10,5,706,COMPLETE
147,147,0.7632102319304591,2023-05-25 02:44:51.961234,2023-05-25 02:45:01.993046,0 days 00:00:10.031812,True,entropy,10,10,5,679,COMPLETE
148,148,0.7631162275506485,2023-05-25 02:45:01.993046,2023-05-25 02:45:12.269299,0 days 00:00:10.276253,True,entropy,10,10,5,690,COMPLETE
149,149,0.7614295295111053,2023-05-25 02:45:12.269299,2023-05-25 02:45:22.124794,0 days 00:00:09.855495,True,gini,9,10,5,678,COMPLETE
150,150,0.7620035886227434,2023-05-25 02:45:22.124794,2023-05-25 02:45:32.173826,0 days 00:00:10.049032,True,entropy,10,9,5,689,COMPLETE
151,151,0.7630641288030071,2023-05-25 02:45:32.173826,2023-05-25 02:45:42.835285,0 days 00:00:10.661459,True,entropy,10,10,5,704,COMPLETE
152,152,0.761846736998734,2023-05-25 02:45:42.835285,2023-05-25 02:45:56.700052,0 days 00:00:13.864767,True,entropy,10,10,5,655,COMPLETE
153,153,0.7625856014978717,2023-05-25 02:45:56.700052,2023-05-25 02:46:07.945745,0 days 00:00:11.245693,True,entropy,10,10,5,726,COMPLETE
154,154,0.7624390698041849,2023-05-25 02:46:07.945745,2023-05-25 02:46:18.156691,0 days 00:00:10.210946,True,entropy,10,10,4,694,COMPLETE
155,155,0.7626109845800533,2023-05-25 02:46:18.156691,2023-05-25 02:46:28.201072,0 days 00:00:10.044381,True,entropy,10,10,5,670,COMPLETE
156,156,0.7629254150718652,2023-05-25 02:46:28.201072,2023-05-25 02:46:39.409269,0 days 00:00:11.208197,True,entropy,10,10,5,714,COMPLETE
157,157,0.7629385514327407,2023-05-25 02:46:39.409269,2023-05-25 02:46:48.735960,0 days 00:00:09.326691,True,entropy,9,10,4,628,COMPLETE
158,158,0.7624215041976534,2023-05-25 02:46:48.735960,2023-05-25 02:46:58.422514,0 days 00:00:09.686554,True,entropy,10,10,5,648,COMPLETE
