,number,value,datetime_start,datetime_complete,duration,params_bootstrap,params_criterion,params_max_depth,params_max_leaf_nodes,params_min_samples_leaf,params_n_estimators,state
633,633,0.7609289708968865,2023-05-25 03:57:04.806539,2023-05-25 03:57:06.659199,0 days 00:00:01.852660,True,entropy,10,10,7,100,COMPLETE
634,634,0.7619668590444025,2023-05-25 03:57:06.659199,2023-05-25 03:57:08.972676,0 days 00:00:02.313477,True,entropy,10,10,7,134,COMPLETE
635,635,0.7613905642871309,2023-05-25 03:57:08.972676,2023-05-25 03:57:11.833126,0 days 00:00:02.860450,True,entropy,10,10,9,179,COMPLETE
636,636,0.761551179510414,2023-05-25 03:57:11.834824,2023-05-25 03:57:14.170801,0 days 00:00:02.335977,True,entropy,10,10,8,137,COMPLETE
637,637,0.7626534636376943,2023-05-25 03:57:14.170801,2023-05-25 03:57:26.190520,0 days 00:00:12.019719,True,entropy,10,10,4,801,COMPLETE
638,638,0.7624632021231774,2023-05-25 03:57:26.190520,2023-05-25 03:57:34.454778,0 days 00:00:08.264258,True,entropy,10,10,7,541,COMPLETE
639,639,0.7620690327613341,2023-05-25 03:57:34.454778,2023-05-25 03:57:36.523321,0 days 00:00:02.068543,True,entropy,10,10,1,116,COMPLETE
640,640,0.7537285518832751,2023-05-25 03:57:36.527762,2023-05-25 03:57:44.657040,0 days 00:00:08.129278,True,gini,10,3,4,782,COMPLETE
641,641,0.7620394836481287,2023-05-25 03:57:44.658597,2023-05-25 03:57:46.668265,0 days 00:00:02.009668,True,entropy,10,10,7,116,COMPLETE
642,642,0.7625667650764143,2023-05-25 03:57:46.668784,2023-05-25 03:58:03.551034,0 days 00:00:16.882250,False,entropy,10,10,6,827,COMPLETE
643,643,0.7620592566985331,2023-05-25 03:58:03.551034,2023-05-25 03:58:14.704805,0 days 00:00:11.153771,True,entropy,8,9,6,773,COMPLETE
644,644,0.7627565518186022,2023-05-25 03:58:14.704805,2023-05-25 03:58:17.062588,0 days 00:00:02.357783,True,entropy,10,10,2,140,COMPLETE
645,645,0.7628975526875846,2023-05-25 03:58:17.062588,2023-05-25 03:58:28.713925,0 days 00:00:11.651337,True,entropy,10,10,8,793,COMPLETE
646,646,0.7626661477993879,2023-05-25 03:58:28.713925,2023-05-25 03:58:34.850370,0 days 00:00:06.136445,True,entropy,10,10,7,393,COMPLETE
647,647,0.7616225678992128,2023-05-25 03:58:34.850370,2023-05-25 03:58:36.737560,0 days 00:00:01.887190,True,entropy,10,10,5,101,COMPLETE
648,648,0.7605257613992195,2023-05-25 03:58:36.737560,2023-05-25 03:58:46.478961,0 days 00:00:09.741401,True,entropy,9,8,5,684,COMPLETE
649,649,0.7630366690479663,2023-05-25 03:58:46.478961,2023-05-25 03:58:56.715830,0 days 00:00:10.236869,True,entropy,10,10,4,670,COMPLETE
650,650,0.7627104182883123,2023-05-25 03:58:56.715830,2023-05-25 03:59:01.268904,0 days 00:00:04.553074,True,entropy,10,10,9,290,COMPLETE
651,651,0.7627476593722404,2023-05-25 03:59:01.268904,2023-05-25 03:59:11.981170,0 days 00:00:10.712266,True,entropy,10,10,5,703,COMPLETE
652,652,0.7628167969943928,2023-05-25 03:59:11.985297,2023-05-25 03:59:21.456829,0 days 00:00:09.471532,True,entropy,10,10,6,626,COMPLETE
653,653,0.762424478922963,2023-05-25 03:59:21.456829,2023-05-25 03:59:32.709295,0 days 00:00:11.252466,True,entropy,10,10,7,747,COMPLETE
654,654,0.7622516581290678,2023-05-25 03:59:32.709295,2023-05-25 03:59:35.744944,0 days 00:00:03.035649,True,entropy,10,10,3,128,COMPLETE
655,655,0.7629294058108117,2023-05-25 03:59:35.744944,2023-05-25 03:59:51.171990,0 days 00:00:15.427046,True,entropy,10,10,5,811,COMPLETE
656,656,0.7517426030361165,2023-05-25 03:59:51.171990,2023-05-25 03:59:53.178422,0 days 00:00:02.006432,True,entropy,10,2,5,201,COMPLETE
657,657,0.7626652607138348,2023-05-25 03:59:53.182557,2023-05-25 04:00:04.200314,0 days 00:00:11.017757,True,entropy,10,10,7,728,COMPLETE
658,658,0.7631674486857263,2023-05-25 04:00:04.200314,2023-05-25 04:00:15.634344,0 days 00:00:11.434030,True,entropy,10,10,6,759,COMPLETE
659,659,0.7628247639171946,2023-05-25 04:00:15.638672,2023-05-25 04:00:26.054430,0 days 00:00:10.415758,True,entropy,10,10,5,695,COMPLETE
660,660,0.7620862164814225,2023-05-25 04:00:26.058865,2023-05-25 04:00:35.861570,0 days 00:00:09.802705,True,gini,10,10,10,669,COMPLETE
661,661,0.7630708796880652,2023-05-25 04:00:35.861570,2023-05-25 04:00:38.180222,0 days 00:00:02.318652,False,entropy,9,10,5,100,COMPLETE
662,662,0.7619620930585971,2023-05-25 04:00:38.180222,2023-05-25 04:00:48.466255,0 days 00:00:10.286033,True,entropy,10,9,8,710,COMPLETE
663,663,0.7593226477836634,2023-05-25 04:00:48.466255,2023-05-25 04:00:52.335144,0 days 00:00:03.868889,True,entropy,10,7,5,267,COMPLETE
664,664,0.762622389026583,2023-05-25 04:00:52.335144,2023-05-25 04:01:01.351735,0 days 00:00:09.016591,True,entropy,10,10,7,604,COMPLETE
665,665,0.7628366144933552,2023-05-25 04:01:01.354175,2023-05-25 04:01:12.852969,0 days 00:00:11.498794,True,entropy,10,10,4,773,COMPLETE
666,666,0.7628000823324711,2023-05-25 04:01:12.852969,2023-05-25 04:01:15.579715,0 days 00:00:02.726746,True,entropy,10,10,5,158,COMPLETE
667,667,0.7619419257587643,2023-05-25 04:01:15.583712,2023-05-25 04:01:17.803695,0 days 00:00:02.219983,True,entropy,10,10,7,126,COMPLETE
668,668,0.7619869556427298,2023-05-25 04:01:17.803695,2023-05-25 04:01:27.870129,0 days 00:00:10.066434,True,entropy,10,9,6,683,COMPLETE
669,669,0.7629498246140696,2023-05-25 04:01:27.870129,2023-05-25 04:01:37.601671,0 days 00:00:09.731542,True,entropy,10,10,5,641,COMPLETE
670,670,0.7630586240336061,2023-05-25 04:01:37.601671,2023-05-25 04:01:48.543009,0 days 00:00:10.941338,True,entropy,10,10,4,732,COMPLETE
671,671,0.7625309712516672,2023-05-25 04:01:48.543009,2023-05-25 04:02:00.805872,0 days 00:00:12.262863,True,entropy,10,10,3,836,COMPLETE
672,672,0.7630173714611048,2023-05-25 04:02:00.805872,2023-05-25 04:02:10.819608,0 days 00:00:10.013736,True,entropy,9,10,5,661,COMPLETE
673,673,0.763012400526836,2023-05-25 04:02:10.819608,2023-05-25 04:02:22.912290,0 days 00:00:12.092682,True,entropy,10,10,7,792,COMPLETE
674,674,0.762318467192845,2023-05-25 04:02:22.912290,2023-05-25 04:02:25.351734,0 days 00:00:02.439444,True,entropy,10,10,5,143,COMPLETE
675,675,0.762776097729488,2023-05-25 04:02:25.351734,2023-05-25 04:02:35.710229,0 days 00:00:10.358495,True,entropy,10,10,6,713,COMPLETE
676,676,0.7623317604662028,2023-05-25 04:02:35.710229,2023-05-25 04:02:48.292341,0 days 00:00:12.582112,True,entropy,10,10,7,862,COMPLETE
677,677,0.7631497302152537,2023-05-25 04:02:48.296514,2023-05-25 04:02:50.513924,0 days 00:00:02.217410,True,entropy,10,10,8,123,COMPLETE
678,678,0.7623039381459595,2023-05-25 04:02:50.516861,2023-05-25 04:03:00.625857,0 days 00:00:10.108996,True,gini,10,10,5,691,COMPLETE
679,679,0.7626471877687203,2023-05-25 04:03:00.630138,2023-05-25 04:03:11.892431,0 days 00:00:11.262293,True,entropy,10,10,5,750,COMPLETE
680,680,0.7617809098876606,2023-05-25 04:03:11.892431,2023-05-25 04:03:25.619353,0 days 00:00:13.726922,False,entropy,10,9,5,623,COMPLETE
681,681,0.7629442107183527,2023-05-25 04:03:25.619353,2023-05-25 04:03:38.400618,0 days 00:00:12.781265,True,entropy,10,10,6,647,COMPLETE
682,682,0.7629585515507755,2023-05-25 04:03:38.403340,2023-05-25 04:03:50.529740,0 days 00:00:12.126400,True,entropy,10,10,7,815,COMPLETE
683,683,0.7622590339644111,2023-05-25 04:03:50.529740,2023-05-25 04:03:54.355475,0 days 00:00:03.825735,True,entropy,8,10,9,240,COMPLETE
684,684,0.7627428704315052,2023-05-25 04:03:54.355475,2023-05-25 04:04:04.470104,0 days 00:00:10.114629,True,entropy,10,10,5,679,COMPLETE
685,685,0.7627093031810576,2023-05-25 04:04:04.470104,2023-05-25 04:04:15.261817,0 days 00:00:10.791713,True,entropy,10,10,5,723,COMPLETE
686,686,0.7627643711441661,2023-05-25 04:04:15.265903,2023-05-25 04:04:22.807349,0 days 00:00:07.541446,True,entropy,10,10,7,504,COMPLETE
687,687,0.7627198001082061,2023-05-25 04:04:22.807349,2023-05-25 04:04:32.673674,0 days 00:00:09.866325,True,entropy,10,10,5,665,COMPLETE
688,688,0.762788150100796,2023-05-25 04:04:32.673674,2023-05-25 04:04:43.979092,0 days 00:00:11.305418,True,entropy,10,10,6,762,COMPLETE
689,689,0.7610786019325684,2023-05-25 04:04:43.979092,2023-05-25 04:04:49.228204,0 days 00:00:05.249112,True,entropy,10,9,4,352,COMPLETE
690,690,0.7617383846503196,2023-05-25 04:04:49.228204,2023-05-25 04:04:51.344301,0 days 00:00:02.116097,True,entropy,10,10,5,116,COMPLETE
691,691,0.7629264019424046,2023-05-25 04:04:51.347798,2023-05-25 04:05:01.840550,0 days 00:00:10.492752,True,entropy,10,10,7,699,COMPLETE
692,692,0.7625515842995024,2023-05-25 04:05:01.840550,2023-05-25 04:05:10.815259,0 days 00:00:08.974709,True,entropy,10,10,8,592,COMPLETE
693,693,0.7629380166365533,2023-05-25 04:05:10.815259,2023-05-25 04:05:21.796887,0 days 00:00:10.981628,True,entropy,7,10,5,740,COMPLETE
694,694,0.7624267878110758,2023-05-25 04:05:21.796887,2023-05-25 04:05:24.635363,0 days 00:00:02.838476,True,entropy,9,10,4,168,COMPLETE
695,695,0.7627965436153972,2023-05-25 04:05:24.638400,2023-05-25 04:05:27.021727,0 days 00:00:02.383327,True,entropy,10,10,5,141,COMPLETE
696,696,0.7627414248379452,2023-05-25 04:05:27.021727,2023-05-25 04:05:41.254632,0 days 00:00:14.232905,True,entropy,10,10,7,943,COMPLETE
697,697,0.7616392013464032,2023-05-25 04:05:41.254632,2023-05-25 04:05:52.706309,0 days 00:00:11.451677,True,gini,10,10,6,778,COMPLETE
698,698,0.762166086234872,2023-05-25 04:05:52.710824,2023-05-25 04:05:54.681843,0 days 00:00:01.971019,True,entropy,10,10,3,114,COMPLETE
699,699,0.7623969524823511,2023-05-25 04:05:54.681843,2023-05-25 04:06:09.284340,0 days 00:00:14.602497,False,entropy,10,10,5,713,COMPLETE
700,700,0.7630120658932447,2023-05-25 04:06:09.284340,2023-05-25 04:06:19.086855,0 days 00:00:09.802515,True,entropy,9,10,5,645,COMPLETE
701,701,0.7555620614471373,2023-05-25 04:06:19.086855,2023-05-25 04:06:27.856447,0 days 00:00:08.769592,True,entropy,10,5,7,684,COMPLETE
702,702,0.7627258406152861,2023-05-25 04:06:27.856447,2023-05-25 04:06:39.806010,0 days 00:00:11.949563,True,entropy,10,10,1,795,COMPLETE
703,703,0.7631587349414012,2023-05-25 04:06:39.806010,2023-05-25 04:06:50.426690,0 days 00:00:10.620680,True,entropy,10,10,2,701,COMPLETE
704,704,0.7626506007245311,2023-05-25 04:06:50.426690,2023-05-25 04:07:00.361584,0 days 00:00:09.934894,True,entropy,10,10,6,663,COMPLETE
705,705,0.7626759775329962,2023-05-25 04:07:00.366373,2023-05-25 04:07:11.620431,0 days 00:00:11.254058,True,entropy,10,10,5,738,COMPLETE
706,706,0.7619555677730381,2023-05-25 04:07:11.620431,2023-05-25 04:07:24.564590,0 days 00:00:12.944159,True,entropy,10,9,5,629,COMPLETE
707,707,0.7629016245684486,2023-05-25 04:07:24.564590,2023-05-25 04:07:26.926528,0 days 00:00:02.361938,True,entropy,10,10,8,116,COMPLETE
708,708,0.7625797462761306,2023-05-25 04:07:26.926528,2023-05-25 04:07:29.339192,0 days 00:00:02.412664,True,entropy,10,10,5,142,COMPLETE
709,709,0.7625987379972369,2023-05-25 04:07:29.339192,2023-05-25 04:07:32.400390,0 days 00:00:03.061198,True,entropy,10,10,7,188,COMPLETE
710,710,0.7630592217369732,2023-05-25 04:07:32.400390,2023-05-25 04:07:43.790074,0 days 00:00:11.389684,True,entropy,10,10,6,758,COMPLETE
711,711,0.7614771251515942,2023-05-25 04:07:43.790074,2023-05-25 04:07:45.706023,0 days 00:00:01.915949,True,entropy,10,10,5,101,COMPLETE
712,712,0.7627585525103642,2023-05-25 04:07:45.706023,2023-05-25 04:07:57.816001,0 days 00:00:12.109978,True,entropy,10,10,5,816,COMPLETE
713,713,0.7626978920594649,2023-05-25 04:07:57.816001,2023-05-25 04:08:09.046592,0 days 00:00:11.230591,True,entropy,10,10,7,723,COMPLETE
714,714,0.7628020679952895,2023-05-25 04:08:09.046592,2023-05-25 04:08:19.249210,0 days 00:00:10.202618,True,entropy,10,10,6,676,COMPLETE
715,715,0.7612777704884374,2023-05-25 04:08:19.253385,2023-05-25 04:08:24.104476,0 days 00:00:04.851091,True,entropy,5,10,5,332,COMPLETE
716,716,0.7631254862552109,2023-05-25 04:08:24.108560,2023-05-25 04:08:36.081835,0 days 00:00:11.973275,True,entropy,10,10,4,771,COMPLETE
717,717,0.7626650255823456,2023-05-25 04:08:36.081835,2023-05-25 04:08:45.827954,0 days 00:00:09.746119,True,entropy,10,10,9,655,COMPLETE
718,718,0.7626950640032529,2023-05-25 04:08:45.827954,2023-05-25 04:08:58.470487,0 days 00:00:12.642533,True,entropy,10,10,7,846,COMPLETE
719,719,0.7617618665363205,2023-05-25 04:08:58.470487,2023-05-25 04:09:01.874089,0 days 00:00:03.403602,False,gini,9,10,5,155,COMPLETE
720,720,0.7621143212252883,2023-05-25 04:09:01.874089,2023-05-25 04:09:11.817146,0 days 00:00:09.943057,True,entropy,10,9,4,692,COMPLETE
721,721,0.7575339229993506,2023-05-25 04:09:11.817146,2023-05-25 04:09:21.009063,0 days 00:00:09.191917,True,entropy,10,6,8,705,COMPLETE
722,722,0.7627443011277819,2023-05-25 04:09:21.009063,2023-05-25 04:09:32.508501,0 days 00:00:11.499438,True,entropy,10,10,5,787,COMPLETE
723,723,0.7617583504577607,2023-05-25 04:09:32.508501,2023-05-25 04:09:34.738031,0 days 00:00:02.229530,True,entropy,10,10,7,130,COMPLETE
724,724,0.7624048601582105,2023-05-25 04:09:34.738031,2023-05-25 04:09:48.327753,0 days 00:00:13.589722,True,entropy,10,10,5,922,COMPLETE
725,725,0.761350585465663,2023-05-25 04:09:48.327753,2023-05-25 04:09:50.142006,0 days 00:00:01.814253,True,entropy,10,10,6,100,COMPLETE
726,726,0.7629243033942885,2023-05-25 04:09:50.142006,2023-05-25 04:10:00.980483,0 days 00:00:10.838477,True,entropy,10,10,5,726,COMPLETE
727,727,0.7628966942514046,2023-05-25 04:10:00.980483,2023-05-25 04:10:09.747412,0 days 00:00:08.766929,True,entropy,10,10,5,581,COMPLETE
728,728,0.7628278900317932,2023-05-25 04:10:09.751908,2023-05-25 04:10:19.923126,0 days 00:00:10.171218,True,entropy,8,10,7,673,COMPLETE
729,729,0.7627645559749083,2023-05-25 04:10:19.923126,2023-05-25 04:10:26.701790,0 days 00:00:06.778664,True,entropy,10,10,6,422,COMPLETE
730,730,0.7633750768291171,2023-05-25 04:10:26.701790,2023-05-25 04:10:41.698042,0 days 00:00:14.996252,True,entropy,10,10,5,747,COMPLETE
731,731,0.7625723481770721,2023-05-25 04:10:41.698042,2023-05-25 04:10:52.795580,0 days 00:00:11.097538,True,entropy,10,10,4,748,COMPLETE
732,732,0.7539718362867189,2023-05-25 04:10:52.795580,2023-05-25 04:11:01.115248,0 days 00:00:08.319668,True,entropy,3,4,5,768,COMPLETE
733,733,0.7629902861405273,2023-05-25 04:11:01.115248,2023-05-25 04:11:12.352154,0 days 00:00:11.236906,True,entropy,10,10,7,746,COMPLETE
734,734,0.7628199733569507,2023-05-25 04:11:12.352154,2023-05-25 04:11:23.144419,0 days 00:00:10.792265,True,entropy,10,10,5,734,COMPLETE
735,735,0.7609183779701271,2023-05-25 04:11:23.144419,2023-05-25 04:11:33.999967,0 days 00:00:10.855548,True,gini,10,9,8,766,COMPLETE
736,736,0.7626036080536498,2023-05-25 04:11:33.999967,2023-05-25 04:11:45.100695,0 days 00:00:11.100728,True,entropy,10,10,5,749,COMPLETE
737,737,0.7628725732682037,2023-05-25 04:11:45.100695,2023-05-25 04:11:56.639240,0 days 00:00:11.538545,True,entropy,10,10,6,789,COMPLETE
738,738,0.7627002455670776,2023-05-25 04:11:56.639240,2023-05-25 04:12:07.687167,0 days 00:00:11.047927,True,entropy,9,10,7,724,COMPLETE
739,739,0.762592049216202,2023-05-25 04:12:07.690020,2023-05-25 04:12:23.032225,0 days 00:00:15.342205,False,entropy,10,10,5,758,COMPLETE
740,740,0.7625736881792609,2023-05-25 04:12:23.033907,2023-05-25 04:12:36.049012,0 days 00:00:13.015105,True,entropy,10,10,10,884,COMPLETE
741,741,0.7629046455725116,2023-05-25 04:12:36.049012,2023-05-25 04:12:48.043513,0 days 00:00:11.994501,True,entropy,10,10,5,806,COMPLETE
742,742,0.7608751006119531,2023-05-25 04:12:48.048080,2023-05-25 04:12:58.374660,0 days 00:00:10.326580,True,entropy,10,8,7,713,COMPLETE
743,743,0.7624810567430005,2023-05-25 04:12:58.374660,2023-05-25 04:13:09.854358,0 days 00:00:11.479698,True,entropy,10,10,2,777,COMPLETE
744,744,0.7619045872859671,2023-05-25 04:13:09.854358,2023-05-25 04:13:20.469581,0 days 00:00:10.615223,True,entropy,10,9,9,731,COMPLETE
745,745,0.7630952830026652,2023-05-25 04:13:20.469581,2023-05-25 04:13:31.674615,0 days 00:00:11.205034,True,entropy,9,10,5,739,COMPLETE
746,746,0.7626012765726721,2023-05-25 04:13:31.674615,2023-05-25 04:13:38.912930,0 days 00:00:07.238315,True,entropy,10,10,6,475,COMPLETE
747,747,0.7616765506022671,2023-05-25 04:13:38.912930,2023-05-25 04:13:40.926863,0 days 00:00:02.013933,True,entropy,10,10,5,117,COMPLETE
748,748,0.7629726644139754,2023-05-25 04:13:40.926863,2023-05-25 04:13:51.443619,0 days 00:00:10.516756,True,entropy,10,10,4,712,COMPLETE
749,749,0.7624485127142594,2023-05-25 04:13:51.443619,2023-05-25 04:14:06.218089,0 days 00:00:14.774470,True,entropy,10,10,7,823,COMPLETE
750,750,0.7627572191636747,2023-05-25 04:14:06.218089,2023-05-25 04:14:13.435933,0 days 00:00:07.217844,True,entropy,10,10,3,304,COMPLETE
751,751,0.7625014635914493,2023-05-25 04:14:13.435933,2023-05-25 04:14:16.628822,0 days 00:00:03.192889,True,entropy,10,10,5,144,COMPLETE
752,752,0.7627768525359974,2023-05-25 04:14:16.628822,2023-05-25 04:14:27.851516,0 days 00:00:11.222694,True,entropy,10,10,8,755,COMPLETE
753,753,0.7625745848561121,2023-05-25 04:14:27.851516,2023-05-25 04:14:39.636972,0 days 00:00:11.785456,True,entropy,10,10,6,796,COMPLETE
754,754,0.7623727698559366,2023-05-25 04:14:39.639210,2023-05-25 04:14:42.382210,0 days 00:00:02.743000,True,entropy,10,10,5,164,COMPLETE
755,755,0.7615932143866198,2023-05-25 04:14:42.382210,2023-05-25 04:14:46.719956,0 days 00:00:04.337746,True,gini,10,10,7,278,COMPLETE
756,756,0.7621706432101679,2023-05-25 04:14:46.719956,2023-05-25 04:14:51.318583,0 days 00:00:04.598627,False,entropy,10,10,5,216,COMPLETE
757,757,0.7616173630048888,2023-05-25 04:14:51.318583,2023-05-25 04:14:53.514952,0 days 00:00:02.196369,True,entropy,10,10,5,127,COMPLETE
758,758,0.7632923480728644,2023-05-25 04:14:53.514952,2023-05-25 04:15:03.584228,0 days 00:00:10.069276,True,entropy,10,10,4,690,COMPLETE
759,759,0.7630538920292446,2023-05-25 04:15:03.584228,2023-05-25 04:15:13.899100,0 days 00:00:10.314872,True,entropy,10,10,4,699,COMPLETE
760,760,0.7624478742885554,2023-05-25 04:15:13.903587,2023-05-25 04:15:24.331822,0 days 00:00:10.428235,True,entropy,10,10,4,693,COMPLETE
761,761,0.7619228334824307,2023-05-25 04:15:24.333185,2023-05-25 04:15:34.860529,0 days 00:00:10.527344,True,entropy,6,9,4,713,COMPLETE
762,762,0.7595737318753236,2023-05-25 04:15:34.860529,2023-05-25 04:15:44.731525,0 days 00:00:09.870996,True,entropy,10,7,4,694,COMPLETE
763,763,0.762827739090271,2023-05-25 04:15:44.735878,2023-05-25 04:15:55.024990,0 days 00:00:10.289112,True,entropy,10,10,4,681,COMPLETE
764,764,0.7625201408889087,2023-05-25 04:15:55.024990,2023-05-25 04:16:05.785729,0 days 00:00:10.760739,True,entropy,10,10,4,723,COMPLETE
765,765,0.7624756749901862,2023-05-25 04:16:05.785729,2023-05-25 04:16:16.481464,0 days 00:00:10.695735,True,entropy,10,10,4,704,COMPLETE
766,766,0.7628971516708697,2023-05-25 04:16:16.481464,2023-05-25 04:16:27.337167,0 days 00:00:10.855703,True,entropy,10,10,3,733,COMPLETE
767,767,0.7631711476727634,2023-05-25 04:16:27.337167,2023-05-25 04:16:41.934919,0 days 00:00:14.597752,True,entropy,9,10,4,981,COMPLETE
768,768,0.763073500972294,2023-05-25 04:16:41.934919,2023-05-25 04:16:52.034558,0 days 00:00:10.099639,True,entropy,10,10,4,682,COMPLETE
769,769,0.762722066450462,2023-05-25 04:16:52.034558,2023-05-25 04:17:02.573190,0 days 00:00:10.538632,True,entropy,7,10,4,712,COMPLETE
770,770,0.7627179517799854,2023-05-25 04:17:02.573190,2023-05-25 04:17:08.291679,0 days 00:00:05.718489,True,entropy,10,10,4,377,COMPLETE
771,771,0.762544194764857,2023-05-25 04:17:08.291679,2023-05-25 04:17:16.403927,0 days 00:00:08.112248,True,entropy,10,10,3,536,COMPLETE
772,772,0.7560003479928726,2023-05-25 04:17:16.403927,2023-05-25 04:17:24.953725,0 days 00:00:08.549798,True,entropy,10,5,1,690,COMPLETE
773,773,0.7623229708198073,2023-05-25 04:17:24.953725,2023-05-25 04:17:35.056742,0 days 00:00:10.103017,True,entropy,10,10,4,672,COMPLETE
774,774,0.7625082458379508,2023-05-25 04:17:35.056742,2023-05-25 04:17:46.017863,0 days 00:00:10.961121,True,entropy,10,10,5,743,COMPLETE
775,775,0.7622497127211011,2023-05-25 04:17:46.017863,2023-05-25 04:17:55.559277,0 days 00:00:09.541414,True,gini,9,10,4,642,COMPLETE
776,776,0.7622023252084764,2023-05-25 04:17:55.562282,2023-05-25 04:17:58.666424,0 days 00:00:03.104142,False,entropy,10,10,5,133,COMPLETE
777,777,0.7578861607262002,2023-05-25 04:17:58.667985,2023-05-25 04:18:00.416468,0 days 00:00:01.748483,True,entropy,4,10,5,101,COMPLETE
778,778,0.7629126905039418,2023-05-25 04:18:00.416468,2023-05-25 04:18:10.859382,0 days 00:00:10.442914,True,entropy,10,10,5,706,COMPLETE
779,779,0.7621007114810341,2023-05-25 04:18:10.859382,2023-05-25 04:18:19.238787,0 days 00:00:08.379405,True,entropy,10,9,7,565,COMPLETE
780,780,0.7629238752755123,2023-05-25 04:18:19.238787,2023-05-25 04:18:28.993822,0 days 00:00:09.755035,True,entropy,10,10,8,662,COMPLETE
781,781,0.7627520459469008,2023-05-25 04:18:28.993822,2023-05-25 04:18:39.914204,0 days 00:00:10.920382,True,entropy,10,10,9,724,COMPLETE
782,782,0.7624952714912234,2023-05-25 04:18:39.914204,2023-05-25 04:18:48.981283,0 days 00:00:09.067079,True,entropy,10,10,5,608,COMPLETE
783,783,0.7617149528085754,2023-05-25 04:18:48.981283,2023-05-25 04:18:51.080032,0 days 00:00:02.098749,True,entropy,10,10,4,117,COMPLETE
784,784,0.762708098906846,2023-05-25 04:18:51.080032,2023-05-25 04:19:01.330326,0 days 00:00:10.250294,True,entropy,10,10,7,688,COMPLETE
785,785,0.7620244111679829,2023-05-25 04:19:01.330326,2023-05-25 04:19:04.242823,0 days 00:00:02.912497,True,entropy,10,10,5,176,COMPLETE
786,786,0.7624246212805083,2023-05-25 04:19:04.246862,2023-05-25 04:19:14.872729,0 days 00:00:10.625867,True,entropy,10,9,4,733,COMPLETE
787,787,0.7624404477705286,2023-05-25 04:19:14.872729,2023-05-25 04:19:17.461098,0 days 00:00:02.588369,True,entropy,10,10,8,149,COMPLETE
788,788,0.76320792104773,2023-05-25 04:19:17.461098,2023-05-25 04:19:28.081894,0 days 00:00:10.620796,True,entropy,10,10,5,669,COMPLETE
789,789,0.7625938422604733,2023-05-25 04:19:28.081894,2023-05-25 04:19:43.378040,0 days 00:00:15.296146,True,entropy,10,10,7,755,COMPLETE
790,790,0.762049716287802,2023-05-25 04:19:43.378040,2023-05-25 04:19:45.076122,0 days 00:00:01.698082,True,entropy,10,10,5,100,COMPLETE
