,number,value,datetime_start,datetime_complete,duration,params_ccp_alpha,params_criterion,params_learning_rate,params_loss,params_max_depth,params_max_features,params_min_impurity_decrease,params_min_samples_leaf,params_min_samples_split,params_min_weight_fraction_leaf,params_n_estimators,params_subsample,params_tol,state
394,394,0.5,2023-05-01 20:51:00.393595,2023-05-01 20:51:07.422749,0 days 00:00:07.029154,0.39698805933771386,friedman_mse,0.004908830952474969,exponential,4,sqrt,0.2590587441876864,10,9,0.2568670849693734,861,0.5509885286827698,0.031708898959283915,COMPLETE
395,395,0.5711488438530147,2023-05-01 20:51:07.427747,2023-05-01 20:51:14.795934,0 days 00:00:07.368187,0.15686027332966634,friedman_mse,0.0036409379339432603,exponential,4,sqrt,0.11060683004077744,10,9,0.017238471328679478,932,0.25988946042004346,0.0006200740077248282,COMPLETE
396,396,0.666384751523944,2023-05-01 20:51:14.801010,2023-05-01 20:51:26.931040,0 days 00:00:12.130030,0.09470082579550487,friedman_mse,0.015556513980543658,exponential,4,sqrt,0.1444595253218107,9,9,0.032615937687247014,914,0.6511361189032423,0.0015089863055673825,COMPLETE
397,397,0.6650764887094113,2023-05-01 20:51:26.936005,2023-05-01 20:51:35.219380,0 days 00:00:08.283375,0.009716719287160547,friedman_mse,0.009841069722840047,exponential,4,sqrt,0.17173496850209544,10,9,0.26555908088702507,961,0.708009604430591,0.00025493046762674896,COMPLETE
398,398,0.5,2023-05-01 20:51:35.223446,2023-05-01 20:51:44.062288,0 days 00:00:08.838842,0.23428890961049773,friedman_mse,0.0005976505914557599,exponential,5,sqrt,0.25200307262467647,10,9,0.19520477542659542,875,0.6998756418820749,0.00031763335966261875,COMPLETE
399,399,0.5,2023-05-01 20:51:44.067328,2023-05-01 20:51:51.280950,0 days 00:00:07.213622,0.009593407267702097,squared_error,0.001550806607547547,exponential,4,sqrt,0.21691210988201912,10,9,0.009866929017322223,907,0.72747531842781,0.0002752507533602551,COMPLETE
400,400,0.6983754329221332,2023-05-01 20:51:51.285505,2023-05-01 20:52:00.533021,0 days 00:00:09.247516,0.024854648678768496,friedman_mse,0.00454128292671582,exponential,4,sqrt,0.4016780633623151,10,9,0.18222995585502916,945,0.6086727036962244,0.0005533961202740052,COMPLETE
401,401,0.770062398051808,2023-05-01 20:52:00.538012,2023-05-01 20:52:14.529316,0 days 00:00:13.991304,0.00048139808632369045,friedman_mse,0.0032221014532179473,exponential,4,sqrt,0.4109671610096722,10,9,0.0006618167534590942,833,0.7050555227942179,0.00023583547786992255,COMPLETE
402,402,0.5,2023-05-01 20:52:14.534314,2023-05-01 20:52:25.875234,0 days 00:00:11.340920,0.20033093531339147,friedman_mse,0.005428205162237516,exponential,4,sqrt,0.032434143581713634,10,8,0.10246165402245827,853,0.7384511382024486,0.0029906390756367527,COMPLETE
403,403,0.5,2023-05-01 20:52:25.880992,2023-05-01 20:52:32.364861,0 days 00:00:06.483869,0.17988165865824385,friedman_mse,0.0013552315459183872,exponential,4,sqrt,0.43918474633435983,10,9,0.04532064259600358,893,0.23177035413387678,0.00750054241358638,COMPLETE
404,404,0.7542545851025423,2023-05-01 20:52:32.370682,2023-05-01 20:52:46.827501,0 days 00:00:14.456819,0.01732630037140498,friedman_mse,0.002245954489671203,exponential,4,sqrt,0.23730125143609881,10,10,0.02434519119679586,926,0.7720503051439903,0.00035654143623467267,COMPLETE
405,405,0.5,2023-05-01 20:52:46.833546,2023-05-01 20:52:59.412671,0 days 00:00:12.579125,0.4270741030006528,friedman_mse,0.004181040051317863,exponential,4,sqrt,0.013029217382246041,10,9,0.009766063383038781,883,0.6769769455229078,0.002467699550619612,COMPLETE
406,406,0.5,2023-05-01 20:52:59.418788,2023-05-01 20:53:11.596589,0 days 00:00:12.177801,0.2838832150591526,friedman_mse,0.002638639225413534,exponential,4,sqrt,0.3827362206557473,9,10,0.019248641802478806,979,0.567641974879225,0.0035913607998340597,COMPLETE
407,407,0.706458297858464,2023-05-01 20:53:11.599841,2023-05-01 20:53:19.088214,0 days 00:00:07.488373,0.03263527514526635,friedman_mse,0.0016861573584658134,exponential,4,sqrt,0.2777258441672108,10,9,0.13139581135525696,682,0.5753213152650328,0.0016125160401731164,COMPLETE
408,408,0.7393580811173626,2023-05-01 20:53:19.092788,2023-05-01 20:53:33.205455,0 days 00:00:14.112667,0.009443980594765672,friedman_mse,0.005913573953246044,exponential,4,sqrt,0.35934366663791584,10,10,0.09148989176434086,953,0.8619644426511457,0.00046036551771405003,COMPLETE
409,409,0.6812166259908319,2023-05-01 20:53:33.210481,2023-05-01 20:53:36.722943,0 days 00:00:03.512462,0.00033750421943904677,friedman_mse,0.09729793713890357,log_loss,4,sqrt,0.2664638664943689,10,9,0.3516054879692342,404,0.5460793886919973,0.0021077934339335325,COMPLETE
410,410,0.5,2023-05-01 20:53:36.728278,2023-05-01 20:53:48.948488,0 days 00:00:12.220210,0.2187991702588626,friedman_mse,0.004990463092062066,exponential,4,sqrt,0.2897094016932478,10,10,0.03343755208325398,824,0.7400055196404709,0.00020604500116982395,COMPLETE
411,411,0.7267250304500702,2023-05-01 20:53:48.953123,2023-05-01 20:54:02.428639,0 days 00:00:13.475516,0.049220260950742716,friedman_mse,0.012676594592588405,exponential,3,sqrt,0.46513337873282967,10,10,0.010007559329825225,864,0.9883136222006046,0.00029828096248946015,COMPLETE
412,412,0.7568670089513729,2023-05-01 20:54:02.433207,2023-05-01 20:54:17.538617,0 days 00:00:15.105410,0.016612866429104964,friedman_mse,0.06381210317965076,exponential,4,sqrt,0.12891048967378305,10,8,0.000258552901134447,922,0.8255488514541077,0.0013960831789162596,COMPLETE
413,413,0.7537735171222435,2023-05-01 20:54:17.542944,2023-05-01 20:54:19.298453,0 days 00:00:01.755509,0.010612757509445542,friedman_mse,0.003520325742942312,exponential,4,sqrt,0.026989272671892106,10,9,0.025955134356444157,129,0.27757252669253785,0.00011730975885959282,COMPLETE
414,414,0.5,2023-05-01 20:54:19.303583,2023-05-01 20:54:26.141503,0 days 00:00:06.837920,0.1398315106517262,friedman_mse,0.007434334732955103,exponential,4,sqrt,0.17855357340799133,10,10,0.33801211602170717,897,0.6235738036027026,0.00017639487502132224,COMPLETE
415,415,0.5,2023-05-01 20:54:26.146636,2023-05-01 20:54:33.333420,0 days 00:00:07.186784,0.17086399309586556,friedman_mse,0.0042691848095615745,exponential,4,sqrt,0.05401248425978546,10,9,0.01655280048123417,844,0.30194456662199815,0.00023807004974540544,COMPLETE
416,416,0.7510963361290514,2023-05-01 20:54:33.339490,2023-05-01 20:54:45.637338,0 days 00:00:12.297848,0.025179141217654803,friedman_mse,0.008776831673400872,exponential,4,sqrt,0.1178155935134042,9,9,0.06706387602867514,938,0.6388722234640621,0.0003283128776378325,COMPLETE
417,417,0.6925074936136429,2023-05-01 20:54:45.642066,2023-05-01 20:54:53.066097,0 days 00:00:07.424031,0.009243705452624021,friedman_mse,0.006205791061520213,exponential,4,sqrt,0.15354702596855557,10,10,0.22188915171016566,742,0.7579697806762622,0.0004077010971406565,COMPLETE
418,418,0.5,2023-05-01 20:54:53.069132,2023-05-01 20:55:05.123922,0 days 00:00:12.054790,0.35209247188644155,friedman_mse,0.0010134411296940213,exponential,4,sqrt,0.4196211886848501,10,10,0.056820258148081795,910,0.6783004066894076,0.0002721655825884362,COMPLETE
419,419,0.5,2023-05-01 20:55:05.128969,2023-05-01 20:55:11.966589,0 days 00:00:06.837620,0.000672873039838729,squared_error,0.005013168306641883,exponential,4,sqrt,0.30645224694482726,10,9,0.0003684683811501852,875,0.652630884243364,0.000495681929602996,COMPLETE
420,420,0.5,2023-05-01 20:55:11.972157,2023-05-01 20:55:18.422361,0 days 00:00:06.450204,0.33740181392737184,friedman_mse,0.0031298278637041186,exponential,4,sqrt,0.4343721892165693,10,10,0.30989971227761764,822,0.6288628723311402,0.0007064254961334661,COMPLETE
421,421,0.6777856367550092,2023-05-01 20:55:18.426867,2023-05-01 20:55:26.143220,0 days 00:00:07.716353,0.0917683151986361,friedman_mse,0.0038949508702355207,exponential,4,sqrt,0.0025092882165745965,10,9,0.00984395090183942,579,0.5990410964300628,0.003287887221498739,COMPLETE
422,422,0.7497554408429496,2023-05-01 20:55:26.147852,2023-05-01 20:55:37.607621,0 days 00:00:11.459769,0.018528656515766198,friedman_mse,0.034932224862007706,exponential,4,sqrt,0.06511516595569145,10,10,0.042994767631635816,965,0.5344146063241847,0.0011600467450400102,COMPLETE
423,423,0.7481010992950858,2023-05-01 20:55:37.613183,2023-05-01 20:55:43.941381,0 days 00:00:06.328198,0.04190919713503559,friedman_mse,0.0045007612342853965,exponential,4,sqrt,0.3989823861912098,9,9,0.025012043134757782,515,0.5117074546387619,0.004677469628637345,COMPLETE
424,424,0.7767981996432431,2023-05-01 20:55:43.946635,2023-05-01 20:55:54.745965,0 days 00:00:10.799330,9.188728766245538e-05,friedman_mse,0.010749962651852409,exponential,5,sqrt,0.2032292902071151,10,8,0.017489185266095997,851,0.357366473916423,0.0002292366250135628,COMPLETE
425,425,0.5,2023-05-01 20:55:54.750972,2023-05-01 20:56:01.586054,0 days 00:00:06.835082,0.2506613077109574,friedman_mse,0.010274859005402872,exponential,3,sqrt,0.2518937843634443,10,8,0.3847703053592531,844,0.7855706931721689,0.00019604305978603292,COMPLETE
426,426,0.7125896505106339,2023-05-01 20:56:01.591676,2023-05-01 20:56:10.808258,0 days 00:00:09.216582,0.01019432374158406,friedman_mse,0.012583805199154204,exponential,5,sqrt,0.22541708965832535,10,8,0.15824319792144934,855,0.6450259922840442,0.00022760082881171772,COMPLETE
427,427,0.7026171843634283,2023-05-01 20:56:10.812522,2023-05-01 20:56:27.120569,0 days 00:00:16.308047,0.06663763170282504,friedman_mse,0.013752397858314074,exponential,5,sqrt,0.15366857139138174,10,10,0.013988642989815782,838,0.8933968046260177,0.0018374662609417975,COMPLETE
428,428,0.6229400462211727,2023-05-01 20:56:27.125749,2023-05-01 20:56:40.674270,0 days 00:00:13.548521,0.11694218606003605,friedman_mse,0.010418814399943622,exponential,5,sqrt,0.058567408176355945,10,10,0.008159891237351852,807,0.7185595236460061,0.008578540217825966,COMPLETE
429,429,0.632714103018278,2023-05-01 20:56:40.679784,2023-05-01 20:56:47.417704,0 days 00:00:06.737920,0.030845289504837885,friedman_mse,0.008943806058022113,exponential,3,sqrt,0.09543001103645703,10,10,0.4438010485334224,865,0.6687555677004408,0.00017595424401330742,COMPLETE
430,430,0.7629033792011064,2023-05-01 20:56:47.423558,2023-05-01 20:56:57.223650,0 days 00:00:09.800092,0.00048609542415860865,friedman_mse,0.003478805835377627,log_loss,4,sqrt,0.3649365850429392,9,10,0.018302164293181395,828,0.3801411875078271,0.00021000708422574325,COMPLETE
431,431,0.7528282198269861,2023-05-01 20:56:57.229040,2023-05-01 20:57:04.094484,0 days 00:00:06.865444,0.020522042873094004,friedman_mse,0.015351897957912366,exponential,4,sqrt,0.17689647680431228,10,10,0.030484081117235988,878,0.2668268347609363,0.0002582267540179612,COMPLETE
432,432,0.5,2023-05-01 20:57:04.099549,2023-05-01 20:57:09.750135,0 days 00:00:05.650586,0.32233175034934136,friedman_mse,0.003969463071172333,exponential,5,sqrt,0.13177858451574676,10,10,0.37639924572660743,855,0.3582274218221718,0.0009817463421238715,COMPLETE
433,433,0.5,2023-05-01 20:57:09.755517,2023-05-01 20:57:17.360362,0 days 00:00:07.604845,0.27145852458511943,friedman_mse,0.011736429286958693,exponential,4,sqrt,0.2835434868240259,10,10,0.25015213693465743,787,0.795459777257142,0.0001543227816855154,COMPLETE
434,434,0.757775871791339,2023-05-01 20:57:17.364947,2023-05-01 20:57:25.422798,0 days 00:00:08.057851,0.009440912839310152,friedman_mse,0.0027314308968734383,exponential,4,sqrt,0.0006404633804570903,10,9,0.0008333766120158462,817,0.32658122914358984,0.00036400033436701087,COMPLETE
435,435,0.7328765587946189,2023-05-01 20:57:25.428625,2023-05-01 20:57:41.689401,0 days 00:00:16.260776,0.00027889058855270663,friedman_mse,0.0008658199754444083,exponential,4,sqrt,0.24425158772090916,10,10,0.09353558264068124,1000,0.8672314568960477,0.001351437818030703,COMPLETE
436,436,0.7296451762787195,2023-05-01 20:57:41.694242,2023-05-01 20:57:48.479607,0 days 00:00:06.785365,0.01793559616462408,friedman_mse,0.008081763268379059,exponential,4,sqrt,0.13654846991020175,10,9,0.11215717062492295,489,0.7735015005612681,0.0005669303388892296,COMPLETE
437,437,0.5,2023-05-01 20:57:48.484617,2023-05-01 20:57:58.152335,0 days 00:00:09.667718,0.1916772623345272,friedman_mse,0.006791494132759718,exponential,4,sqrt,0.029794841733786964,10,9,0.08070150297771353,896,0.4857149914606247,0.022797896236759513,COMPLETE
438,438,0.5,2023-05-01 20:57:58.157400,2023-05-01 20:58:07.032290,0 days 00:00:08.874890,0.3325842073004102,friedman_mse,0.0019487075537603323,exponential,4,sqrt,0.27503608791058837,10,10,0.15585630139731407,838,0.6336710169366274,0.011040285917131673,COMPLETE
439,439,0.6777856367550092,2023-05-01 20:58:07.037896,2023-05-01 20:58:12.988150,0 days 00:00:05.950254,0.10359152208583794,squared_error,0.016767246081566187,exponential,4,sqrt,0.0166435449366697,10,9,0.018788703091104843,867,0.29057420163101366,0.00022807372875684182,COMPLETE
440,440,0.7579335994806005,2023-05-01 20:58:12.993223,2023-05-01 20:58:29.148509,0 days 00:00:16.155286,0.010076020848036478,friedman_mse,0.0031740704178326823,exponential,4,sqrt,0.2092768136834896,10,8,0.010021856105576344,937,0.8096320820302416,0.0008384508583176772,COMPLETE
441,441,0.6446070975315423,2023-05-01 20:58:29.153585,2023-05-01 20:58:38.926259,0 days 00:00:09.772674,0.0339996033202475,friedman_mse,0.004594769851646942,exponential,4,sqrt,0.04591786239353457,10,10,0.2314463696791604,971,0.8286708416288109,0.005460846790165716,COMPLETE
442,442,0.6777856367550092,2023-05-01 20:58:38.932400,2023-05-01 20:58:49.969970,0 days 00:00:11.037570,0.0860959070207291,friedman_mse,0.00037919274941375705,exponential,4,sqrt,0.0772010394816336,10,10,0.037161719873968546,885,0.5831254539559392,0.00027696741774101504,COMPLETE
443,443,0.5,2023-05-01 20:58:49.974541,2023-05-01 20:58:54.582989,0 days 00:00:04.608448,0.22946005347159742,friedman_mse,0.003642392947760109,exponential,4,sqrt,0.16274778907271792,10,9,0.42110730687861697,811,0.17455336030852825,0.004312292195251949,COMPLETE
444,444,0.6578284824601287,2023-05-01 20:58:54.587890,2023-05-01 20:59:01.463812,0 days 00:00:06.875922,0.009050920952846079,friedman_mse,0.005115845614489393,exponential,3,sqrt,0.215557703856047,9,10,0.29562908013272104,851,0.6937826096167748,0.001605723279625201,COMPLETE
445,445,0.776131726301373,2023-05-01 20:59:01.469368,2023-05-01 20:59:10.972908,0 days 00:00:09.503540,0.0002502007568734532,friedman_mse,0.0106961164137262,exponential,5,sqrt,0.3244349807315986,10,9,0.023927370275373054,908,0.23916263352478145,0.0004169998509131008,COMPLETE
446,446,0.7064574680919923,2023-05-01 20:59:10.977252,2023-05-01 20:59:16.650286,0 days 00:00:05.673034,0.02440824857140233,friedman_mse,0.011972587056797879,exponential,5,sqrt,0.3083342308017295,10,9,0.1716554934914293,919,0.20252807093672626,0.00043708334510195136,COMPLETE
447,447,0.5,2023-05-01 20:59:16.654836,2023-05-01 20:59:23.600706,0 days 00:00:06.945870,0.30470988641692137,friedman_mse,0.012944486895307654,exponential,5,log2,0.06268789261171401,10,9,0.00014367075048558713,945,0.22872744219496013,0.0005399953370294208,COMPLETE
448,448,0.5,2023-05-01 20:59:23.605395,2023-05-01 20:59:25.623348,0 days 00:00:02.017953,0.20630630207075012,friedman_mse,0.009441673657447289,exponential,6,sqrt,0.3439553387245016,10,9,0.05038416880226532,197,0.2410811224727155,0.00039637339163021187,COMPLETE
449,449,0.7608966984105726,2023-05-01 20:59:25.627670,2023-05-01 20:59:33.698404,0 days 00:00:08.070734,0.008555379133106831,friedman_mse,0.008236215420419338,exponential,5,sqrt,0.12309564765367934,10,9,0.02567055011659706,955,0.25601365913384255,0.0003357973940882586,COMPLETE
450,450,0.7760660404416244,2023-05-01 20:59:33.703636,2023-05-01 20:59:41.606160,0 days 00:00:07.902524,5.757197252760586e-05,friedman_mse,0.013954226435565294,exponential,4,sqrt,0.32180453062583486,9,9,0.02003713608074569,832,0.21940599144984912,0.00047336906196823714,COMPLETE
451,451,0.7045920554461943,2023-05-01 20:59:41.610140,2023-05-01 20:59:47.062342,0 days 00:00:05.452202,0.01800119301620102,friedman_mse,0.010461729161163046,exponential,6,sqrt,0.31554385907922905,9,9,0.1911021521343557,799,0.21810131839051378,0.0004564225708760947,COMPLETE
452,452,0.7425296101636135,2023-05-01 20:59:47.066949,2023-05-01 20:59:54.088942,0 days 00:00:07.021993,0.00910320721169033,friedman_mse,0.011713010312637624,log_loss,7,sqrt,0.3253012519310583,9,9,0.038563216963388464,825,0.20613799210426806,0.00042739888589234413,COMPLETE
453,453,0.7756599012922817,2023-05-01 20:59:54.094995,2023-05-01 21:00:02.607716,0 days 00:00:08.512721,0.0004561668225559863,friedman_mse,0.0172602216002462,exponential,5,sqrt,0.2955942222736906,8,9,0.023318706420210798,842,0.2451779247263955,0.000655661038542661,COMPLETE
454,454,0.5,2023-05-01 21:00:02.611738,2023-05-01 21:00:08.600263,0 days 00:00:05.988525,0.25374981758509574,friedman_mse,0.017225701021566092,exponential,5,sqrt,0.30166368742005056,7,9,0.018369405662306434,842,0.18705341031147266,0.0006686465678096862,COMPLETE
455,455,0.680796078098966,2023-05-01 21:00:08.605246,2023-05-01 21:00:13.907833,0 days 00:00:05.302587,0.0002508250616896087,friedman_mse,0.014995451090688462,exponential,5,sqrt,0.29592412425758613,8,9,0.26761282399193204,821,0.23623118012931546,0.0007039504073073044,COMPLETE
456,456,0.7020731216410538,2023-05-01 21:00:13.913654,2023-05-01 21:00:19.335081,0 days 00:00:05.421427,0.02754915124229064,friedman_mse,0.02047710497678412,exponential,5,sqrt,0.19431053613998062,9,9,0.20055184840967696,841,0.21841930602852397,0.0005187286258276964,COMPLETE
457,457,0.5,2023-05-01 21:00:19.339742,2023-05-01 21:00:24.850786,0 days 00:00:05.511044,0.1229038857966534,friedman_mse,0.014677633613583197,exponential,5,sqrt,0.3235094125499978,9,8,0.14003310971682653,797,0.24573808481908316,0.00060318424894238,COMPLETE
458,458,0.7539572424297989,2023-05-01 21:00:24.855902,2023-05-01 21:00:40.707922,0 days 00:00:15.852020,0.01759076968528319,friedman_mse,0.017753434232755824,exponential,5,sqrt,0.3364134810708522,8,9,0.029874878829964827,773,0.9998075747382165,0.0005005485810038566,COMPLETE
459,459,0.5,2023-05-01 21:00:40.713125,2023-05-01 21:00:45.777824,0 days 00:00:05.064699,0.4985482099930058,squared_error,0.014297181728708202,exponential,5,sqrt,0.3142864941042306,9,9,0.21541704390463948,825,0.26331360768409506,0.0006039694635306047,COMPLETE
460,460,0.7315884920063145,2023-05-01 21:00:45.782824,2023-05-01 21:00:56.523110,0 days 00:00:10.740286,0.05752055442820573,friedman_mse,0.013054901520684174,exponential,4,sqrt,0.35128557841284763,8,9,0.008579244447870615,847,0.5575469937234577,0.0008433940386572999,COMPLETE
461,461,0.7414280188313515,2023-05-01 21:00:56.528805,2023-05-01 21:01:03.074286,0 days 00:00:06.545481,0.043594455655026315,friedman_mse,0.017357594137097386,exponential,5,sqrt,0.04367927010733841,9,9,0.04620014604922407,861,0.2284992313759554,0.0007586326866116491,COMPLETE
462,462,0.5455893287974873,2023-05-01 21:01:03.079738,2023-05-01 21:01:12.697655,0 days 00:00:09.617917,0.14719517821849756,friedman_mse,0.010737100604407506,exponential,5,sqrt,0.2909700262650022,10,9,0.01902302847252043,811,0.4640134672873228,0.00051942298318702,COMPLETE
463,463,0.5,2023-05-01 21:01:12.702191,2023-05-01 21:01:25.466615,0 days 00:00:12.764424,0.1663833486427959,friedman_mse,0.0221647259625119,exponential,5,sqrt,0.3056275036978912,10,9,0.091628379066208,826,0.8526246653910747,0.00413223829527516,COMPLETE
464,464,0.7572453330160147,2023-05-01 21:01:25.472301,2023-05-01 21:01:37.239477,0 days 00:00:11.767176,0.009780323340089296,friedman_mse,0.009349071846930887,exponential,4,sqrt,0.06558497329741428,8,9,0.009174264917625524,863,0.6052963109651694,0.0004522969411467787,COMPLETE
465,465,0.7744991951506781,2023-05-01 21:01:37.244114,2023-05-01 21:01:46.415546,0 days 00:00:09.171432,6.415176546967203e-06,friedman_mse,0.01331053501556807,exponential,3,sqrt,0.01630212292134464,10,9,0.034950929701846926,840,0.4015107841515788,0.001153219015549794,COMPLETE
466,466,0.7536064591703543,2023-05-01 21:01:46.420897,2023-05-01 21:01:53.262996,0 days 00:00:06.842099,0.01731264343279735,friedman_mse,0.016440287346382896,exponential,3,log2,0.1833716023762378,9,9,0.031150361975498544,835,0.41195102967791986,0.0010795128779302215,COMPLETE
467,467,0.5,2023-05-01 21:01:53.267705,2023-05-01 21:02:00.391708,0 days 00:00:07.124003,0.2637014739052629,friedman_mse,0.01377368061555028,exponential,3,sqrt,0.024728137669048276,10,8,0.14551146507741117,794,0.3902411744794281,0.0011768043291879669,COMPLETE
468,468,0.7459150146467489,2023-05-01 21:02:00.396267,2023-05-01 21:02:08.138729,0 days 00:00:07.742462,0.02660697916941221,friedman_mse,0.019759721711241355,exponential,3,sqrt,0.1681471386680278,10,9,0.06022124861724182,839,0.4131259942233784,0.0009301677648180641,COMPLETE
469,469,0.681147494043405,2023-05-01 21:02:08.144304,2023-05-01 21:02:13.821587,0 days 00:00:05.677283,0.0002477566872390397,friedman_mse,0.025429427125887298,log_loss,3,sqrt,0.016726062392425516,10,9,0.33019889652849665,759,0.4000936538097332,0.0012011128548550395,COMPLETE
470,470,0.7576523965434154,2023-05-01 21:02:13.826491,2023-05-01 21:02:19.549052,0 days 00:00:05.722561,0.010997919986820844,friedman_mse,0.01144239581212645,exponential,3,sqrt,0.28425676393280036,10,9,0.00021920480248867726,845,0.1974555606741774,0.0012514517651354051,COMPLETE
471,471,0.5,2023-05-01 21:02:19.554062,2023-05-01 21:02:30.327586,0 days 00:00:10.773524,0.18418089790994407,friedman_mse,0.014509344580509622,exponential,3,sqrt,0.1132454007449421,7,9,0.024984427147742436,815,0.765213475058562,0.09375639148754622,COMPLETE
472,472,0.5,2023-05-01 21:02:30.332891,2023-05-01 21:02:39.336629,0 days 00:00:09.003738,0.30145428489084714,friedman_mse,0.011301026452026675,exponential,6,sqrt,0.00696623148953667,9,9,0.03870386714114356,782,0.4332493661314776,0.0018554188432727658,COMPLETE
