,number,value,datetime_start,datetime_complete,duration,params_ccp_alpha,params_criterion,params_learning_rate,params_loss,params_max_depth,params_max_features,params_min_impurity_decrease,params_min_samples_leaf,params_min_samples_split,params_min_weight_fraction_leaf,params_n_estimators,params_subsample,params_tol,state
0,0,0.5,2023-05-01 19:58:09.890766,2023-05-01 19:58:18.456676,0 days 00:00:08.565910,0.3352337550892011,squared_error,0.00010007903854383786,exponential,6,log2,0.34260975019837975,4,5,0.2694083670016785,372,0.23208030173540176,0.00012082666253305466,COMPLETE
1,1,0.5,2023-05-01 19:58:18.459940,2023-05-01 19:58:22.382547,0 days 00:00:03.922607,0.21055381250252608,friedman_mse,0.0002637307779092464,exponential,3,log2,0.01952739161644118,9,8,0.44730333175192366,278,0.820670111807983,0.0001972606689184097,COMPLETE
2,2,0.5,2023-05-01 19:58:22.382547,2023-05-01 19:58:26.925780,0 days 00:00:04.543233,0.14680707418683975,friedman_mse,0.011902312313548788,log_loss,5,log2,0.39463966422574426,10,8,0.3740828271899197,384,0.7178508349134253,0.05318467494773383,COMPLETE
3,3,0.5,2023-05-01 19:58:26.925780,2023-05-01 19:58:31.356991,0 days 00:00:04.431211,0.20708963476345132,squared_error,0.0001143143822054878,log_loss,7,log2,0.3498791800104656,6,2,0.07336428745290507,711,0.29046530440005314,0.012111570825917514,COMPLETE
4,4,0.5,2023-05-01 19:58:31.361053,2023-05-01 19:58:36.006814,0 days 00:00:04.645761,0.36299899267522573,squared_error,0.00980356281034032,exponential,6,sqrt,0.08267709855846639,2,3,0.4036956443547619,563,0.950135280391732,0.01788283252760715,COMPLETE
5,5,0.5,2023-05-01 19:58:36.010101,2023-05-01 19:58:38.707381,0 days 00:00:02.697280,0.11851349012151385,friedman_mse,0.017898939582128164,log_loss,3,log2,0.4747446293535356,7,10,0.3108478601045609,414,0.34293510258852344,0.0016765264451568493,COMPLETE
6,6,0.5,2023-05-01 19:58:38.707381,2023-05-01 19:58:42.792205,0 days 00:00:04.084824,0.06856787481443888,squared_error,0.00010200253875097672,log_loss,3,log2,0.46471861687188065,10,5,0.31168005789590136,656,0.3939804115948865,0.00032886793022793,COMPLETE
7,7,0.5,2023-05-01 19:58:42.792205,2023-05-01 19:58:53.156688,0 days 00:00:10.364483,0.42101544617980285,friedman_mse,0.0001577613151982774,log_loss,3,sqrt,0.12310553380152295,1,3,0.013105493438859639,780,0.7784885696151217,0.0045547645941085005,COMPLETE
8,8,0.5,2023-05-01 19:58:53.158646,2023-05-01 19:58:59.996297,0 days 00:00:06.837651,0.060671727870368675,squared_error,0.005718443234994137,exponential,9,sqrt,0.3735608213685923,9,4,0.19393032203208588,973,0.604927197330139,0.00015127009113209103,COMPLETE
9,9,0.5,2023-05-01 19:58:59.999048,2023-05-01 19:59:05.001100,0 days 00:00:05.002052,0.4234144007450176,squared_error,0.00047547535988922844,exponential,5,log2,0.37191292703754647,6,10,0.10164661733049524,742,0.6037452838487282,0.08129427593316357,COMPLETE
10,10,0.5,2023-05-01 19:59:05.001100,2023-05-01 19:59:06.019746,0 days 00:00:01.018646,0.32450995532952304,squared_error,0.0011570663728610738,exponential,9,log2,0.24084516136570258,3,6,0.4966951841619159,118,0.1366253853308313,0.000738337246541617,COMPLETE
11,11,0.5,2023-05-01 19:59:06.019746,2023-05-01 19:59:07.354010,0 days 00:00:01.334264,0.263411837752892,friedman_mse,0.0006170670448124653,exponential,7,log2,0.0021854341594734726,4,8,0.19518082148324434,207,0.11342714523990899,0.0001428786873360864,COMPLETE
12,12,0.5,2023-05-01 19:59:07.354010,2023-05-01 19:59:10.238753,0 days 00:00:02.884743,0.48976253162861044,friedman_mse,0.0021128333792387634,exponential,5,log2,0.23689611634175017,8,8,0.4905729714293408,330,0.9721382075580045,0.00010149869901426796,COMPLETE
13,13,0.5,2023-05-01 19:59:10.238753,2023-05-01 19:59:12.353914,0 days 00:00:02.115161,0.2360367498692048,friedman_mse,0.00026208640714677395,exponential,10,log2,0.17465256433668905,4,7,0.25274278666157957,273,0.5286075704099181,0.0005554615489258706,COMPLETE
14,14,0.5,2023-05-01 19:59:12.357845,2023-05-01 19:59:15.568009,0 days 00:00:03.210164,0.28102791881950123,squared_error,0.00036653957449235916,exponential,4,log2,0.28151905977919156,5,6,0.4145029300210723,485,0.4736479383682718,0.0003108437183884412,COMPLETE
15,15,0.5,2023-05-01 19:59:15.569343,2023-05-01 19:59:17.123779,0 days 00:00:01.554436,0.18527880759021828,friedman_mse,0.07349967747480415,exponential,8,sqrt,2.8960385985273007e-05,8,5,0.3394181337447599,183,0.23327165460456703,0.0011753828748122782,COMPLETE
16,16,0.5,2023-05-01 19:59:17.123779,2023-05-01 19:59:21.225918,0 days 00:00:04.102139,0.31395884136303454,squared_error,0.00022811408090185807,exponential,6,log2,0.1749792330495842,5,9,0.426891177788028,515,0.4305660653644051,0.0003665803681919448,COMPLETE
17,17,0.6591588139305788,2023-05-01 19:59:21.225918,2023-05-01 19:59:23.154082,0 days 00:00:01.928164,0.001435017847460196,friedman_mse,0.0007965914515071496,exponential,4,log2,0.32057340867355627,3,7,0.23968174800803252,294,0.2365662060224698,0.00020241361897109479,COMPLETE
18,18,0.5,2023-05-01 19:59:23.154082,2023-05-01 19:59:25.848217,0 days 00:00:02.694135,0.0010803764673323179,squared_error,0.0013761271424097374,exponential,4,sqrt,0.3162545767271279,2,5,0.2647726571463626,433,0.23369281666374447,0.00011247101287886494,COMPLETE
19,19,0.5,2023-05-01 19:59:25.853773,2023-05-01 19:59:26.995922,0 days 00:00:01.142149,0.14730217183621386,friedman_mse,0.0006797859611215578,exponential,4,log2,0.31640155841769774,3,7,0.17709563514394952,102,0.3167972844348284,0.0006966456310545377,COMPLETE
20,20,0.5,2023-05-01 19:59:26.999419,2023-05-01 19:59:31.140939,0 days 00:00:04.141520,0.3078593158137687,friedman_mse,0.0008942321264169055,exponential,6,log2,0.4250426637364409,1,4,0.2798458419278884,598,0.19721931369399992,0.0002636914406663782,COMPLETE
21,21,0.5,2023-05-01 19:59:31.140939,2023-05-01 19:59:33.888577,0 days 00:00:02.747638,0.22687235784426918,friedman_mse,0.0002531876799343927,exponential,4,log2,0.2819491496920282,4,7,0.2269106070807294,291,0.3571442517382548,0.0002101733065537962,COMPLETE
22,22,0.5,2023-05-01 19:59:33.888577,2023-05-01 19:59:36.203246,0 days 00:00:02.314669,0.18572172849742524,friedman_mse,0.00020078540653433862,exponential,3,log2,0.4159026023720078,3,9,0.355667645664033,341,0.10526948025135438,0.00010254105905067252,COMPLETE
23,23,0.5,2023-05-01 19:59:36.210410,2023-05-01 19:59:38.433165,0 days 00:00:02.222755,0.250208797612454,friedman_mse,0.0004032926437248673,exponential,5,log2,0.331215824063993,7,7,0.31940456967982456,249,0.2265710624203513,0.0002071055142222689,COMPLETE
24,24,0.5,2023-05-01 19:59:38.438835,2023-05-01 19:59:40.396821,0 days 00:00:01.957986,0.0682021087549288,friedman_mse,0.00011429829943447293,exponential,4,log2,0.2677130729165519,5,6,0.4553371342207358,183,0.4546825746054907,0.000454312109390637,COMPLETE
25,25,0.6215938709901028,2023-05-01 19:59:40.400175,2023-05-01 19:59:43.976960,0 days 00:00:03.576785,0.02200603317351895,friedman_mse,0.00039958222889778305,exponential,7,log2,0.22051843791896444,4,9,0.37057002396365035,457,0.28018838739920865,0.00022850843548035367,COMPLETE
26,26,0.5,2023-05-01 19:59:43.976960,2023-05-01 19:59:46.972752,0 days 00:00:02.995792,0.024399611590617737,squared_error,0.0006691912407354811,log_loss,8,sqrt,0.22620724474242732,2,9,0.3703942983668635,459,0.18420970680890245,0.000981145914495229,COMPLETE
27,27,0.6440313622122684,2023-05-01 19:59:46.977072,2023-05-01 19:59:49.338125,0 days 00:00:02.361053,0.006880228330758605,friedman_mse,0.0016914749339257157,exponential,7,log2,0.31364630022956264,4,4,0.2804190916693333,367,0.29155603855848256,0.00042690772489898754,COMPLETE
28,28,0.6497673227703783,2023-05-01 19:59:49.342490,2023-05-01 19:59:52.636317,0 days 00:00:03.293827,2.3586771908470222e-05,friedman_mse,0.0031525930897826977,exponential,8,log2,0.3108520453082708,3,2,0.29553810149676607,530,0.317604989260716,0.0004925112319542313,COMPLETE
29,29,0.647724505292764,2023-05-01 19:59:52.639104,2023-05-01 19:59:57.525231,0 days 00:00:04.886127,0.0024886164634372503,friedman_mse,0.0031289584019768553,exponential,8,log2,0.30932926563249874,3,2,0.28735484960147406,831,0.3602554985580013,0.0004517686294807461,COMPLETE
30,30,0.632714103018278,2023-05-01 19:59:57.525231,2023-05-01 20:00:02.932617,0 days 00:00:05.407386,0.04513950968475891,friedman_mse,0.0029554131882416064,exponential,8,log2,0.35145360869686126,3,2,0.23577427165686438,872,0.38115484324739723,0.0019576828383703416,COMPLETE
31,31,0.6461163586016804,2023-05-01 20:00:02.932617,2023-05-01 20:00:06.705916,0 days 00:00:03.773299,0.0036624486750905416,friedman_mse,0.0019804412174990343,exponential,9,log2,0.30290400952329904,2,3,0.29782831941750876,630,0.28733955152246166,0.00046090344800516685,COMPLETE
32,32,0.5,2023-05-01 20:00:06.713633,2023-05-01 20:00:14.234743,0 days 00:00:07.521110,0.09322684842080106,friedman_mse,0.002318256191235438,exponential,9,log2,0.2985692791092031,2,3,0.2940475890266108,848,0.328096429323827,0.0005629072245346854,COMPLETE
33,33,0.632714103018278,2023-05-01 20:00:14.234743,2023-05-01 20:00:20.870815,0 days 00:00:06.636072,0.043160205885350314,friedman_mse,0.0032970605279777536,exponential,10,log2,0.27359563482386323,1,2,0.32933250714297463,632,0.3977707420393225,0.0009035370194800419,COMPLETE
34,34,0.6439884469914023,2023-05-01 20:00:20.877778,2023-05-01 20:00:27.625703,0 days 00:00:06.747925,0.003984508355358467,friedman_mse,0.0010685949835379648,exponential,8,log2,0.3431698918923917,3,2,0.2846215739205457,919,0.27840342416402464,0.0004473253448719639,COMPLETE
35,35,0.5,2023-05-01 20:00:27.625703,2023-05-01 20:00:31.847301,0 days 00:00:04.221598,0.039051604750217225,friedman_mse,0.004415727878651327,log_loss,9,log2,0.30600704837475734,2,3,0.2421087201390742,678,0.15484460395261887,0.0002900733791081986,COMPLETE
36,36,0.5,2023-05-01 20:00:31.847301,2023-05-01 20:00:35.044021,0 days 00:00:03.196720,0.09597931406806023,friedman_mse,0.0018772300651405125,exponential,8,log2,0.36673872858135165,1,2,0.34532588189411373,544,0.2581544555339686,0.00017954151391666928,COMPLETE
37,37,0.6447023657040437,2023-05-01 20:00:35.046225,2023-05-01 20:00:39.642105,0 days 00:00:04.595880,0.0021075831949690137,friedman_mse,0.0015213415563562012,log_loss,10,log2,0.33797354999819906,2,3,0.30787552788469885,791,0.18609531216614575,0.0005532477244870603,COMPLETE
38,38,0.6301311184980374,2023-05-01 20:00:39.646991,2023-05-01 20:00:43.361158,0 days 00:00:03.714167,0.030025242901651324,friedman_mse,0.005585124896887992,exponential,9,sqrt,0.4009382763975911,3,4,0.39591263153611844,602,0.3320617904754129,0.0013618934226574564,COMPLETE
39,39,0.5,2023-05-01 20:00:43.361158,2023-05-01 20:00:48.047152,0 days 00:00:04.685994,0.08101271563285288,friedman_mse,0.0009493509576534016,log_loss,7,log2,0.2525365948093317,2,3,0.2647581382800042,710,0.3637477599958264,0.0021836429788292876,COMPLETE
40,40,0.5,2023-05-01 20:00:48.052967,2023-05-01 20:00:53.345449,0 days 00:00:05.292482,0.11666133325605604,friedman_mse,0.0024978165480154003,exponential,8,log2,0.3832246560568397,5,2,0.30451145154185016,976,0.29506132855088973,0.00015361546478776932,COMPLETE
41,41,0.5,2023-05-01 20:00:53.345449,2023-05-01 20:00:59.461593,0 days 00:00:06.116144,0.056997231459147736,friedman_mse,0.0014182459454709928,log_loss,10,log2,0.34035695746828215,2,3,0.297721425989025,804,0.16630773137489596,0.0006782845234602741,COMPLETE
42,42,0.5,2023-05-01 20:00:59.461593,2023-05-01 20:01:07.265150,0 days 00:00:07.803557,0.02108479274236752,friedman_mse,0.0017362359000658884,log_loss,10,log2,0.2933651015968355,1,3,0.3274312842030376,781,0.21377035521307428,0.0003474184818892553,COMPLETE
43,43,0.5,2023-05-01 20:01:07.274283,2023-05-01 20:01:15.603971,0 days 00:00:08.329688,0.05053043274623174,friedman_mse,0.0031327190698988714,log_loss,9,log2,0.326273807207736,3,2,0.3172422961029948,848,0.25639719610256234,0.0004709980578996792,COMPLETE
44,44,0.6774277213514519,2023-05-01 20:01:15.610591,2023-05-01 20:01:20.425876,0 days 00:00:04.815285,0.0007348966467171135,friedman_mse,0.003964642465986061,log_loss,9,log2,0.3582882201632462,2,3,0.21479932932946189,737,0.1858014882775551,0.0009191787964448968,COMPLETE
45,45,0.5,2023-05-01 20:01:20.429651,2023-05-01 20:01:24.646206,0 days 00:00:04.216555,0.06350856442126995,friedman_mse,0.008671160577823883,log_loss,9,log2,0.3598493050023514,3,4,0.21150112474781396,699,0.14573816235056097,0.0008982406499769311,COMPLETE
46,46,0.5,2023-05-01 20:01:24.649643,2023-05-01 20:01:30.365638,0 days 00:00:05.715995,0.022230355004454028,friedman_mse,0.0023661856537471083,log_loss,8,sqrt,0.39215800042549354,1,2,0.17202985547433722,736,0.31673099029804774,0.0002685382249340583,COMPLETE
47,47,0.5,2023-05-01 20:01:30.365638,2023-05-01 20:01:34.043011,0 days 00:00:03.677373,0.07597543404138518,friedman_mse,0.003602322099552675,exponential,9,log2,0.3667417639687574,4,4,0.2504321296250362,655,0.237197595159638,0.00015937067895086242,COMPLETE
48,48,0.632714103018278,2023-05-01 20:01:34.044996,2023-05-01 20:01:40.119373,0 days 00:00:06.074377,0.04020724398477709,friedman_mse,0.004452374315642495,exponential,7,log2,0.29685823697692415,6,3,0.2202168075626889,909,0.40428591104855244,0.0013800488346145782,COMPLETE
49,49,0.6380680717594719,2023-05-01 20:01:40.127372,2023-05-01 20:01:44.221452,0 days 00:00:04.094080,0.0034203137281794633,friedman_mse,0.007668155718936065,log_loss,6,log2,0.44252699914814586,4,5,0.26596643772604345,565,0.3533454825320952,0.0003621210504248018,COMPLETE
50,50,0.5,2023-05-01 20:01:44.225873,2023-05-01 20:01:48.623038,0 days 00:00:04.397165,0.05427518410834545,squared_error,0.011086865347476741,exponential,9,sqrt,0.35373426632276034,2,2,0.20192925478487825,749,0.2032511304433403,0.0032410598521514958,COMPLETE
51,51,0.632714103018278,2023-05-01 20:01:48.627050,2023-05-01 20:01:53.816968,0 days 00:00:05.189918,0.007830383875925558,friedman_mse,0.0012286460813800725,log_loss,10,log2,0.33837484451222954,2,3,0.2962536187819072,812,0.17475645643065746,0.0005932643571305016,COMPLETE
52,52,0.5,2023-05-01 20:01:53.821466,2023-05-01 20:01:59.596361,0 days 00:00:05.774895,0.025603631210010174,friedman_mse,0.0016019340018058419,log_loss,10,log2,0.330217478309005,3,3,0.2506593866218175,773,0.12417518790837204,0.0008250954110996496,COMPLETE
53,53,0.6473115638777898,2023-05-01 20:01:59.601269,2023-05-01 20:02:06.014367,0 days 00:00:06.413098,0.002510375257476383,friedman_mse,0.002197516528790237,log_loss,10,log2,0.38066838252139357,1,6,0.3066190705428633,912,0.18216802540532284,0.00054708996579139,COMPLETE
54,54,0.5,2023-05-01 20:02:06.020240,2023-05-01 20:02:12.053068,0 days 00:00:06.032828,0.03497454434203401,friedman_mse,0.0022669553072084637,log_loss,9,log2,0.384488644341357,1,8,0.27766077580800574,901,0.2583814548573556,0.0002634129246101048,COMPLETE
55,55,0.5,2023-05-01 20:02:12.053068,2023-05-01 20:02:17.827324,0 days 00:00:05.774256,0.08208862368032357,friedman_mse,0.004691019937355406,log_loss,8,log2,0.489107234017381,1,7,0.3460898123991231,938,0.2118716464550201,0.0007083429872551115,COMPLETE
56,56,0.632714103018278,2023-05-01 20:02:17.827324,2023-05-01 20:02:21.260348,0 days 00:00:03.433024,0.05690254102485058,friedman_mse,0.006593902176459256,exponential,5,log2,0.3211374292336821,2,5,0.26356701013423556,629,0.14739727247898393,0.0003247005271524357,COMPLETE
57,57,0.6810460966339036,2023-05-01 20:02:21.260348,2023-05-01 20:02:24.375603,0 days 00:00:03.115255,0.01872063257079201,friedman_mse,0.003780023343359423,exponential,9,log2,0.3714233087471728,3,6,0.22534897655339428,523,0.10746104407469685,0.00012525366774447064,COMPLETE
58,58,0.5,2023-05-01 20:02:24.379073,2023-05-01 20:02:27.215295,0 days 00:00:02.836222,0.021427075062233177,squared_error,0.003777649893031343,exponential,10,log2,0.40250184013195245,3,6,0.22994143346750592,398,0.12015031602819067,0.00012126885317159444,COMPLETE
59,59,0.5,2023-05-01 20:02:27.221128,2023-05-01 20:02:30.629793,0 days 00:00:03.408665,0.03743134726214323,friedman_mse,0.006108244640750091,log_loss,8,log2,0.37941775274258405,10,7,0.17771469371926976,504,0.1167282325723112,0.0002012867382361853,COMPLETE
60,60,0.5,2023-05-01 20:02:30.634314,2023-05-01 20:02:36.450880,0 days 00:00:05.816566,0.10590775534556265,friedman_mse,0.002956556244176864,exponential,7,sqrt,0.361279302009814,4,6,0.23986971582922006,997,0.17602875346046054,0.0001647494916141953,COMPLETE
61,61,0.6385209804517482,2023-05-01 20:02:36.450880,2023-05-01 20:02:39.746267,0 days 00:00:03.295387,0.014943977712239414,friedman_mse,0.0020259581525760052,exponential,9,log2,0.30601338394520505,3,7,0.2834673039745173,544,0.2361776034347586,0.00041301725538377094,COMPLETE
62,62,0.6741881829162376,2023-05-01 20:02:39.746267,2023-05-01 20:02:44.748622,0 days 00:00:05.002355,0.00529168789331645,friedman_mse,0.0026852203963352366,exponential,9,log2,0.31942553521320666,2,6,0.21254074553814414,843,0.15164393462249126,0.00023741176529326494,COMPLETE
63,63,0.6838791740702337,2023-05-01 20:02:44.755237,2023-05-01 20:02:49.362658,0 days 00:00:04.607421,0.017729762364965096,friedman_mse,0.002617637376195438,exponential,9,log2,0.35098606283066325,1,6,0.21193261419073067,853,0.10173777718356786,0.0001275677437132963,COMPLETE
64,64,0.6040520369134832,2023-05-01 20:02:49.362658,2023-05-01 20:02:53.884985,0 days 00:00:04.522327,0.07084041636278053,friedman_mse,0.0028204290757899144,exponential,8,log2,0.3228781621730291,3,8,0.21208830857210656,826,0.10822580971734172,0.0001421757090661515,COMPLETE
65,65,0.6976778144193329,2023-05-01 20:02:53.886757,2023-05-01 20:02:58.689982,0 days 00:00:04.803225,0.03094620794361049,friedman_mse,0.00523510939410859,exponential,9,log2,0.35051861485992225,2,5,0.19292016835412404,873,0.1435110081533285,0.0001272311158559616,COMPLETE
66,66,0.6984722825799763,2023-05-01 20:02:58.689982,2023-05-01 20:03:03.866318,0 days 00:00:05.176336,0.03189561168041253,friedman_mse,0.014139877959457306,exponential,9,log2,0.3515868876937665,2,5,0.19192505425240072,874,0.13981907908745989,0.00012568726780041867,COMPLETE
67,67,0.5,2023-05-01 20:03:03.866318,2023-05-01 20:03:08.629965,0 days 00:00:04.763647,0.04908591835050367,squared_error,0.0076235668923910075,exponential,9,log2,0.3536841198669826,1,5,0.1589700529502766,873,0.13424356435328133,0.0001228792849546765,COMPLETE
68,68,0.7046036000519499,2023-05-01 20:03:08.629965,2023-05-01 20:03:13.457820,0 days 00:00:04.827855,0.029640776190739352,friedman_mse,0.011118691665279642,exponential,3,log2,0.4120364296339561,2,6,0.15365723629875466,879,0.15215139844602654,0.00010817912290017011,COMPLETE
69,69,0.6707119664278792,2023-05-01 20:03:13.465237,2023-05-01 20:03:18.298441,0 days 00:00:04.833204,0.06901669168314481,friedman_mse,0.014334317444489568,exponential,3,log2,0.4141064257948068,2,6,0.13631152838950764,949,0.10210520284252633,0.00011048038859050259,COMPLETE
70,70,0.6995870623248752,2023-05-01 20:03:18.303495,2023-05-01 20:03:23.083498,0 days 00:00:04.780003,0.03271522394725628,friedman_mse,0.010349751331977037,exponential,9,log2,0.41967702925730255,1,5,0.19153218394961702,878,0.14568097129994323,0.00012946485941943108,COMPLETE
71,71,0.701695927055082,2023-05-01 20:03:23.083498,2023-05-01 20:03:27.941922,0 days 00:00:04.858424,0.03022251224767282,friedman_mse,0.014007610546461904,exponential,9,log2,0.4366462605442395,1,5,0.19048941886345194,872,0.14835415374447156,0.00010330243484629287,COMPLETE
72,72,0.6934806578366799,2023-05-01 20:03:27.949673,2023-05-01 20:03:32.551451,0 days 00:00:04.601778,0.035944563786210984,friedman_mse,0.02089910944798775,exponential,9,log2,0.4614581915028492,1,5,0.19220279892140177,881,0.10147353642947174,0.00012997208163061252,COMPLETE
73,73,0.6911145833031525,2023-05-01 20:03:32.551451,2023-05-01 20:03:37.359125,0 days 00:00:04.807674,0.03618346751742766,friedman_mse,0.020910874317561327,exponential,9,log2,0.44149524977499016,1,5,0.19376563255654106,880,0.13265252642964648,0.000133960830319592,COMPLETE
74,74,0.6694777648611995,2023-05-01 20:03:37.359125,2023-05-01 20:03:42.083603,0 days 00:00:04.724478,0.037263123969028616,friedman_mse,0.02366511065400584,exponential,9,log2,0.4514386089035477,1,5,0.1913485386133977,882,0.13484769107390276,0.00010646031917153888,COMPLETE
75,75,0.6676611481312184,2023-05-01 20:03:42.090799,2023-05-01 20:03:47.439498,0 days 00:00:05.348699,0.05912432961041975,friedman_mse,0.018287273442060638,exponential,9,log2,0.4329674861770833,1,5,0.14588054579352605,955,0.14629184268491857,0.00010125914682340649,COMPLETE
76,76,0.5,2023-05-01 20:03:47.443700,2023-05-01 20:03:52.235633,0 days 00:00:04.791933,0.09620539420748289,friedman_mse,0.025187583429625862,exponential,10,log2,0.46003280981432476,1,5,0.18923179358409667,872,0.1622852862736527,0.00013863566063816477,COMPLETE
77,77,0.6866235079842778,2023-05-01 20:03:52.235633,2023-05-01 20:03:57.363229,0 days 00:00:05.127596,0.032801011288967986,friedman_mse,0.012738643197719467,exponential,9,log2,0.4726854053970512,1,5,0.19646317969588808,933,0.20498462602803844,0.00018253234003883775,COMPLETE
78,78,0.5266912721307766,2023-05-01 20:03:57.368927,2023-05-01 20:04:02.620257,0 days 00:00:05.251330,0.13968417604576538,friedman_mse,0.01230125872190754,exponential,9,log2,0.4351637337485655,1,5,0.1277529714045325,929,0.19666133919344775,0.00017220725512548087,COMPLETE
79,79,0.5,2023-05-01 20:04:02.623785,2023-05-01 20:04:07.354216,0 days 00:00:04.730431,0.03429706637070408,squared_error,0.009787519604247357,exponential,8,sqrt,0.4753939418884022,1,4,0.16824975863582342,893,0.16616392764138072,0.00018858165144973015,COMPLETE
