,number,value,datetime_start,datetime_complete,duration,params_ccp_alpha,params_criterion,params_learning_rate,params_loss,params_max_depth,params_max_features,params_min_impurity_decrease,params_min_samples_leaf,params_min_samples_split,params_min_weight_fraction_leaf,params_n_estimators,params_subsample,params_tol,state
473,473,0.7548995583841464,2023-05-01 21:02:39.341671,2023-05-01 21:02:50.821369,0 days 00:00:11.479698,0.01764975785781273,friedman_mse,0.020002205724598394,exponential,5,sqrt,0.14109057312050438,10,8,0.018131268324153883,864,0.5187801754352978,0.0027017747918401053,COMPLETE
474,474,0.5,2023-05-01 21:02:50.826031,2023-05-01 21:02:54.222006,0 days 00:00:03.395975,0.2074817477362723,friedman_mse,0.016624677967190145,exponential,3,sqrt,0.00026573935978916816,10,9,0.009104315640997188,263,0.6675544998376953,0.0014446556182544116,COMPLETE
475,475,0.5,2023-05-01 21:02:54.228378,2023-05-01 21:03:00.140231,0 days 00:00:05.911853,0.2412474356416172,friedman_mse,0.010421527983898754,exponential,5,sqrt,0.3207953698063348,10,9,0.27349767848858064,852,0.3856930403751216,0.0022417569572080226,COMPLETE
476,476,0.5,2023-05-01 21:03:00.141665,2023-05-01 21:03:08.149137,0 days 00:00:08.007472,0.1489905506810406,friedman_mse,0.012663787993218682,exponential,5,sqrt,0.33538264234879434,10,9,0.3618266942168683,876,0.9036789378064574,0.00013818277841011408,COMPLETE
477,477,0.5,2023-05-01 21:03:08.154804,2023-05-01 21:03:13.506274,0 days 00:00:05.351470,0.48177329795584495,friedman_mse,0.013517711486755984,exponential,3,sqrt,0.019610951482453752,6,9,0.05194051796354682,811,0.21579624321873067,0.0009813534925009668,COMPLETE
478,478,0.6260405224821055,2023-05-01 21:03:13.511492,2023-05-01 21:03:27.696812,0 days 00:00:14.185320,0.07769920042475481,friedman_mse,0.007099311943026918,exponential,5,sqrt,0.34647277478118244,10,7,0.12088536766755403,860,0.9325011419559599,0.0006229972695356815,COMPLETE
479,479,0.5455893287974873,2023-05-01 21:03:27.701244,2023-05-01 21:03:33.146225,0 days 00:00:05.444981,5.0911455118597e-05,squared_error,0.00967248175041451,exponential,4,sqrt,0.1509146461498982,10,9,0.07289129438638453,829,0.3730888207553851,0.0036619064374514483,COMPLETE
480,480,0.7515102162736261,2023-05-01 21:03:33.150384,2023-05-01 21:03:40.089336,0 days 00:00:06.938952,0.03440688403051146,friedman_mse,0.00884693405994543,exponential,4,sqrt,0.36377967003599265,10,8,0.028122530435649627,879,0.24624984786580573,0.0007720868759764371,COMPLETE
481,481,0.656861356915672,2023-05-01 21:03:40.094635,2023-05-01 21:03:46.387850,0 days 00:00:06.293215,0.009929355831330127,friedman_mse,0.00790609495521559,exponential,4,sqrt,0.2995405361551161,10,9,0.3040150000545938,839,0.4680426717224353,0.001050672242303738,COMPLETE
482,482,0.7520479590220488,2023-05-01 21:03:46.393876,2023-05-01 21:04:00.690436,0 days 00:00:14.296560,0.024629455081063022,friedman_mse,0.0059321874542210985,exponential,4,sqrt,0.20269868116929946,10,9,0.018299936792152548,812,0.9093657752755829,0.001596651048452205,COMPLETE
483,483,0.7769886787325281,2023-05-01 21:04:00.694519,2023-05-01 21:04:16.024815,0 days 00:00:15.330296,1.5231297872169086e-06,friedman_mse,0.01145776628036576,exponential,6,sqrt,0.10601465784232222,10,9,0.008544925201243591,857,0.5698443541884267,0.0014203158224529728,COMPLETE
484,484,0.7562296313519383,2023-05-01 21:04:16.029527,2023-05-01 21:04:33.198289,0 days 00:00:17.168762,0.01036792839749337,friedman_mse,0.011381060729705687,exponential,6,sqrt,0.12552355603157644,9,9,0.039268166483646186,883,0.8796707723752062,0.0016535404171457437,COMPLETE
485,485,0.5,2023-05-01 21:04:33.203529,2023-05-01 21:04:43.865143,0 days 00:00:10.661614,0.36555037762696585,friedman_mse,0.018833111059576687,exponential,7,log2,0.01648542491873084,10,9,0.010329786980511861,872,0.5702177225952136,0.0019548591680187202,COMPLETE
486,486,0.7536857744117045,2023-05-01 21:04:43.870399,2023-05-01 21:04:56.887739,0 days 00:00:13.017340,0.018852164867367616,friedman_mse,0.013259761082539727,exponential,6,sqrt,0.03488838762107854,10,9,1.5707482493155026e-05,859,0.5484743480906996,0.0015324308906249453,COMPLETE
487,487,0.7579062373713814,2023-05-01 21:04:56.892396,2023-05-01 21:05:10.124997,0 days 00:00:13.232601,0.008895083699255915,friedman_mse,0.012132006118904436,exponential,6,sqrt,0.007884034476669164,10,9,0.027235589354769156,898,0.5761460676289524,0.001291275886305844,COMPLETE
488,488,0.6229400462211727,2023-05-01 21:05:10.131079,2023-05-01 21:05:28.949707,0 days 00:00:18.818628,0.11186916600200703,friedman_mse,0.00014742582492357494,exponential,7,sqrt,0.1605951001649422,10,9,0.01931244419984558,830,0.947445375097117,0.0018498088960736466,COMPLETE
489,489,0.7274223816431231,2023-05-01 21:05:28.954389,2023-05-01 21:05:37.726539,0 days 00:00:08.772150,7.028490751069487e-05,friedman_mse,0.015847630033522356,log_loss,5,sqrt,0.0706949901490812,5,9,0.17029279665215363,803,0.5145994162255381,0.0013949522484517844,COMPLETE
490,490,0.5,2023-05-01 21:05:37.732476,2023-05-01 21:05:50.505396,0 days 00:00:12.772920,0.28042175175461886,friedman_mse,0.011034639284682712,exponential,6,sqrt,0.049722846465511096,10,9,0.03453731177700201,855,0.5879435591141757,0.001342107162652566,COMPLETE
491,491,0.632714103018278,2023-05-01 21:05:50.511273,2023-05-01 21:05:56.637767,0 days 00:00:06.126494,0.0393238065220733,friedman_mse,0.00012816257719605674,exponential,5,sqrt,0.19789745313536547,10,9,0.2804021593464672,785,0.5326533682665413,0.002539082379802334,COMPLETE
492,492,0.5,2023-05-01 21:05:56.643892,2023-05-01 21:06:04.273915,0 days 00:00:07.630023,0.0676334697110276,friedman_mse,0.009622265395347416,exponential,5,sqrt,0.10052032884627116,10,8,0.2298937807482074,827,0.6064618821360271,0.002124490443722932,COMPLETE
493,493,0.6229400462211727,2023-05-01 21:06:04.277956,2023-05-01 21:06:15.342611,0 days 00:00:11.064655,0.13111475090282423,friedman_mse,0.0073147338507965525,exponential,5,sqrt,0.12201135841608529,9,9,0.010152735713791938,875,0.4980833378305923,0.00041504007303666475,COMPLETE
494,494,0.7251311635016912,2023-05-01 21:06:15.347714,2023-05-01 21:06:26.635528,0 days 00:00:11.287814,0.017850169389837203,friedman_mse,0.0006549106116492294,exponential,7,sqrt,0.22700216885530858,10,9,0.10841721822624317,899,0.6444507879210704,0.00047900069239281874,COMPLETE
495,495,0.5,2023-05-01 21:06:26.641374,2023-05-01 21:06:40.110305,0 days 00:00:13.468931,0.4482135812669423,friedman_mse,0.0009695522852252665,exponential,4,sqrt,0.051500663476006826,10,9,0.023606864076893823,849,0.8247547681809309,0.0003749079066541625,COMPLETE
496,496,0.7563101885941124,2023-05-01 21:06:40.114460,2023-05-01 21:06:52.272838,0 days 00:00:12.158378,0.011149146692599839,friedman_mse,0.014126374846337908,exponential,3,sqrt,0.2707755409023347,10,9,0.010294954852104927,831,0.8636080382948563,0.002936335704660954,COMPLETE
497,497,0.5,2023-05-01 21:06:52.277407,2023-05-01 21:07:04.718993,0 days 00:00:12.441586,0.22418990170692393,friedman_mse,0.006672799171872311,exponential,5,sqrt,0.08121077574883484,10,9,0.04212574674062908,803,0.6957620009400108,0.001689461855700226,COMPLETE
498,498,0.5,2023-05-01 21:07:04.724538,2023-05-01 21:07:11.578973,0 days 00:00:06.854435,7.425813825755336e-05,squared_error,0.0017597023708568762,exponential,4,sqrt,0.29071040000355564,10,9,0.018631155571173307,881,0.6262114503044063,0.0011281126678299013,COMPLETE
499,499,0.6303230442605553,2023-05-01 21:07:11.584585,2023-05-01 21:07:14.259160,0 days 00:00:02.674575,0.028039206236934282,friedman_mse,0.07507892860702603,exponential,4,sqrt,0.3781025038170787,9,9,0.3195309808961532,315,0.4835690989587909,0.001450043351429355,COMPLETE
500,500,0.7362669597791982,2023-05-01 21:07:14.265101,2023-05-01 21:07:20.922173,0 days 00:00:06.657072,0.049302935395384724,friedman_mse,0.008387596471599711,exponential,6,sqrt,0.1082256252095545,10,8,0.08258862129875402,621,0.4255150307898853,0.00032468941576245595,COMPLETE
501,501,0.7571375496624402,2023-05-01 21:07:20.927590,2023-05-01 21:07:32.614755,0 days 00:00:11.687165,0.010390878649995005,friedman_mse,0.005655951491793011,exponential,4,sqrt,0.14664549926441095,10,9,0.0005407643352388304,862,0.5911278609689297,0.0005509167961572428,COMPLETE
502,502,0.6215938709901028,2023-05-01 21:07:32.620333,2023-05-01 21:07:39.029088,0 days 00:00:06.408755,0.021594264197769237,friedman_mse,0.023662266721901127,exponential,8,sqrt,0.18345749376610793,10,2,0.4616151779723434,911,0.45481869222177596,0.04422796177154097,COMPLETE
503,503,0.7173290029907702,2023-05-01 21:07:39.034653,2023-05-01 21:07:53.052982,0 days 00:00:14.018329,0.00806747478401429,friedman_mse,0.00010616328120581458,exponential,4,sqrt,0.03493178570120416,10,9,0.12615524414181917,890,0.9251982492807485,0.004737095113457161,COMPLETE
504,504,0.5,2023-05-01 21:07:53.058023,2023-05-01 21:07:58.837550,0 days 00:00:05.779527,0.2172038439122451,friedman_mse,0.009938870337841675,exponential,4,log2,0.1365174678208606,10,4,0.4180130792093484,820,0.544939903230573,0.0004223786650791154,COMPLETE
505,505,0.5,2023-05-01 21:07:58.842802,2023-05-01 21:08:10.790046,0 days 00:00:11.947244,0.17211979097374838,friedman_mse,0.015224342310978823,exponential,4,sqrt,0.09717138302140473,8,8,0.030069967238951105,844,0.667495153502622,0.0030594425534347536,COMPLETE
506,506,0.7553780469413807,2023-05-01 21:08:10.794947,2023-05-01 21:08:15.436400,0 days 00:00:04.641453,0.00875376231330718,friedman_mse,0.00020934039377516604,exponential,5,sqrt,0.0995997955475213,10,9,0.014265777279077747,443,0.2504562133121493,0.009800581551039647,COMPLETE
507,507,0.656174524892994,2023-05-01 21:08:15.441104,2023-05-01 21:08:20.681669,0 days 00:00:05.240565,0.017760789796682813,friedman_mse,0.012606997259087116,exponential,4,sqrt,0.30729133299481304,10,10,0.3689195481894183,861,0.18242505646546878,0.017457793767576096,COMPLETE
508,508,0.5,2023-05-01 21:08:20.686685,2023-05-01 21:08:31.331032,0 days 00:00:10.644347,0.03249979812511981,friedman_mse,0.018440427578618714,log_loss,4,sqrt,0.23491150848148545,10,9,0.009467373926722833,787,0.5616026035397169,0.001203875298352196,COMPLETE
509,509,0.7647230411305811,2023-05-01 21:08:31.336107,2023-05-01 21:08:46.967752,0 days 00:00:15.631645,0.0010806876990037176,friedman_mse,0.0056518915738331095,exponential,4,sqrt,0.11523027578318575,9,10,0.052036662282164345,836,0.9659755749877457,0.00036775096079682607,COMPLETE
510,510,0.5,2023-05-01 21:08:46.973703,2023-05-01 21:08:55.318146,0 days 00:00:08.344443,0.31774914022482825,friedman_mse,0.0007165659169211983,exponential,4,sqrt,0.07706191397182074,10,9,0.18301131280433974,903,0.5300773937765261,0.0001072795363256751,COMPLETE
511,511,0.7377111199545541,2023-05-01 21:08:55.323154,2023-05-01 21:09:02.977115,0 days 00:00:07.653961,0.0003997263023980089,friedman_mse,0.006571998943212786,exponential,4,sqrt,0.001014870832268153,10,10,0.1452032257799261,875,0.2761658815599218,0.011866079149820019,COMPLETE
512,512,0.6215938709901028,2023-05-01 21:09:02.982741,2023-05-01 21:09:10.330425,0 days 00:00:07.347684,0.017343609054958832,friedman_mse,0.0008208011260294538,exponential,4,sqrt,0.26509193014967686,10,9,0.40098175545583964,922,0.7405493857833398,0.0006541151981475053,COMPLETE
513,513,0.754648674836711,2023-05-01 21:09:10.335876,2023-05-01 21:09:23.857680,0 days 00:00:13.521804,0.009259930508790247,friedman_mse,0.00031142617973091544,exponential,4,sqrt,0.27904674487408765,4,9,0.00022293106839541544,818,0.7228534176196721,0.0004662398029192495,COMPLETE
514,514,0.5,2023-05-01 21:09:23.863516,2023-05-01 21:09:28.609403,0 days 00:00:04.745887,0.3766485448103703,friedman_mse,0.03887376074266216,exponential,5,sqrt,0.019597922212740145,10,10,0.2541726651962364,765,0.22564426170396157,0.06072440885056579,COMPLETE
515,515,0.7547921720644213,2023-05-01 21:09:28.614827,2023-05-01 21:09:35.894621,0 days 00:00:07.279794,0.00016403736927271938,friedman_mse,0.0002541019486438536,exponential,3,sqrt,0.19121254069536753,10,9,0.023043779029247834,889,0.16834002812282645,0.003993301146143777,COMPLETE
516,516,0.5,2023-05-01 21:09:35.898635,2023-05-01 21:09:49.028242,0 days 00:00:13.129607,0.19232813236743584,friedman_mse,0.010582143850143371,exponential,4,sqrt,0.332803781831975,10,10,0.03218733366560157,849,0.7917151368017981,0.005232193270674931,COMPLETE
517,517,0.5,2023-05-01 21:09:49.033148,2023-05-01 21:09:55.397831,0 days 00:00:06.364683,0.1514385165637957,squared_error,0.0001738458373916358,exponential,4,sqrt,0.03966760779460682,10,9,0.13002370481771866,802,0.6127822364826151,0.0022636321202311603,COMPLETE
518,518,0.7499175961391024,2023-05-01 21:09:55.403421,2023-05-01 21:10:05.035113,0 days 00:00:09.631692,0.022842971381405622,friedman_mse,0.022051843543518895,exponential,4,sqrt,0.10239424172826131,9,9,0.014673914276721252,838,0.5005077404750651,0.0009853503539265938,COMPLETE
519,519,0.6592387793597775,2023-05-01 21:10:05.040336,2023-05-01 21:10:12.034439,0 days 00:00:06.994103,0.01005224450601306,friedman_mse,0.004998794666393281,exponential,5,sqrt,0.14354532518670415,10,10,0.2831746327185647,865,0.6527416869157788,0.00027871189763007575,COMPLETE
520,520,0.5,2023-05-01 21:10:12.039753,2023-05-01 21:10:17.527298,0 days 00:00:05.487545,0.21326386799179337,friedman_mse,0.007744403054544335,exponential,4,sqrt,0.08941823516360109,10,7,0.3348550402426431,909,0.25853787449384924,0.0001913443740571094,COMPLETE
521,521,0.753851440999933,2023-05-01 21:10:17.532881,2023-05-01 21:10:29.459779,0 days 00:00:11.926898,0.0372730169991937,friedman_mse,0.005219922944149936,exponential,4,sqrt,0.2098506439616199,10,9,0.008886886952446778,666,0.8983279702763588,0.001386311343146479,COMPLETE
522,522,0.747444923568886,2023-05-01 21:10:29.464348,2023-05-01 21:10:44.231236,0 days 00:00:14.766888,0.0272411165169297,friedman_mse,0.01393399752140673,exponential,4,sqrt,0.3136643619295676,10,10,0.021502664750875686,815,0.9387623720227201,0.0032537850817098567,COMPLETE
523,523,0.6525232673151373,2023-05-01 21:10:44.237556,2023-05-01 21:10:49.471542,0 days 00:00:05.233986,0.01616558918854826,friedman_mse,0.008993295660384716,exponential,6,log2,0.028578544142811562,10,9,0.3511342181655647,929,0.21167855326668852,0.0017960369356427434,COMPLETE
524,524,0.5,2023-05-01 21:10:49.476684,2023-05-01 21:10:54.828838,0 days 00:00:05.352154,0.08938684587148706,friedman_mse,0.016906559501302123,exponential,4,sqrt,0.353931537805988,9,10,0.43332774837585325,887,0.2817191603676473,0.0002580595639700082,COMPLETE
525,525,0.5,2023-05-01 21:10:54.833927,2023-05-01 21:11:04.000934,0 days 00:00:09.167007,0.25566873409063773,friedman_mse,0.006326757582603335,exponential,3,sqrt,0.2940027564326054,10,9,0.06871250889582692,852,0.5611635383369704,0.00034044068187655594,COMPLETE
526,526,0.5,2023-05-01 21:11:04.005669,2023-05-01 21:11:13.751871,0 days 00:00:09.746202,0.238281916432056,friedman_mse,0.011958831004379337,exponential,4,sqrt,0.16837837697827018,10,9,0.23908262931194782,979,0.8629907653481688,0.0005239571643000484,COMPLETE
527,527,0.5,2023-05-01 21:11:13.756886,2023-05-01 21:11:26.135936,0 days 00:00:12.379050,0.062172709076378604,friedman_mse,0.0045863888779157915,log_loss,4,sqrt,0.37322517185095533,10,8,0.00013016234037769065,703,0.8767270974915411,0.00016132500686711227,COMPLETE
528,528,0.7153704287473216,2023-05-01 21:11:26.140937,2023-05-01 21:11:37.114203,0 days 00:00:10.973266,0.0003670867740516551,friedman_mse,0.005471812783060175,exponential,5,sqrt,0.106756039297226,10,10,0.16714103672132094,829,0.8405547616474142,0.0004050325573563006,COMPLETE
529,529,0.5,2023-05-01 21:11:37.119245,2023-05-01 21:11:42.274606,0 days 00:00:05.155361,0.3891067303882818,friedman_mse,0.00028182871715088514,exponential,4,sqrt,0.38796427800742606,10,9,0.48052403341328387,872,0.23641443860521985,0.03386734839108649,COMPLETE
530,530,0.6873095225618747,2023-05-01 21:11:42.279904,2023-05-01 21:11:56.036183,0 days 00:00:13.756279,0.07646037161823657,friedman_mse,0.004202803886521006,exponential,4,sqrt,0.15907094686224096,10,10,0.03973742255932721,903,0.7585444600388214,0.0011028549126625253,COMPLETE
531,531,0.6229400462211727,2023-05-01 21:11:56.041266,2023-05-01 21:12:08.525382,0 days 00:00:12.484116,0.11805080791230363,friedman_mse,0.007064882096337225,exponential,4,sqrt,0.0868086902917267,10,9,0.015941910941387038,924,0.6352693350135097,0.000901014344189262,COMPLETE
532,532,0.7090283550418439,2023-05-01 21:12:08.530655,2023-05-01 21:12:13.703610,0 days 00:00:05.172955,0.009737069521590947,friedman_mse,0.009209353937097962,exponential,4,sqrt,0.061175750981474236,10,9,0.1893072953254725,793,0.19611035049661488,0.006213532950609947,COMPLETE
533,533,0.6319967269802949,2023-05-01 21:12:13.710032,2023-05-01 21:12:20.015203,0 days 00:00:06.305171,0.00033645479150330395,friedman_mse,0.001458159549052082,exponential,4,sqrt,0.1815181095742365,6,10,0.4559051809521321,849,0.4770624822202857,0.00010023774633427981,COMPLETE
534,534,0.7331477488524837,2023-05-01 21:12:20.021329,2023-05-01 21:12:27.788540,0 days 00:00:07.767211,0.016171780846865443,friedman_mse,0.005787260867838695,exponential,3,sqrt,0.2492643809182662,8,10,0.09941352861813313,816,0.4509725718588087,0.00030751884528707266,COMPLETE
535,535,0.7303551451137033,2023-05-01 21:12:27.795110,2023-05-01 21:12:40.528541,0 days 00:00:12.733431,0.05008710303537741,friedman_mse,0.01028324275767527,exponential,4,sqrt,0.11966287977627377,9,9,0.02815212842870074,873,0.7229457492589821,0.00020997484220476617,COMPLETE
536,536,0.5,2023-05-01 21:12:40.534057,2023-05-01 21:12:46.507973,0 days 00:00:05.973916,0.16175570451215623,squared_error,0.004845106549825526,exponential,4,sqrt,0.2834142675796494,10,9,0.49859293787338477,889,0.40156639947244865,0.0013289519503678477,COMPLETE
537,537,0.5,2023-05-01 21:12:46.513333,2023-05-01 21:12:53.304888,0 days 00:00:06.791555,0.4190426183052143,friedman_mse,0.0001844352287339469,exponential,5,sqrt,0.4145830940886809,10,10,0.15556423846442374,831,0.35245798631334563,0.001577312412487835,COMPLETE
538,538,0.6504745439657049,2023-05-01 21:12:53.309695,2023-05-01 21:13:00.097554,0 days 00:00:06.787859,8.304339481900853e-05,friedman_mse,0.0024953432804211964,exponential,4,sqrt,0.010083496275950676,10,9,0.3935401603514191,935,0.423975100174305,0.001985439215123408,COMPLETE
539,539,0.5,2023-05-01 21:13:00.103587,2023-05-01 21:13:16.339519,0 days 00:00:16.235932,0.18030965577967836,friedman_mse,0.0042983025994292965,exponential,4,sqrt,0.3259421773127179,10,10,0.008795186211276049,912,0.9708998341501761,0.00024214543807430324,COMPLETE
540,540,0.5,2023-05-01 21:13:16.344556,2023-05-01 21:13:28.709352,0 days 00:00:12.364796,0.2820211343942869,friedman_mse,0.026509046091161434,exponential,7,sqrt,0.42546153469539816,10,9,0.048567541630469294,960,0.5291829100250933,0.0006897085093850329,COMPLETE
541,541,0.7499285254042019,2023-05-01 21:13:28.715137,2023-05-01 21:13:40.752539,0 days 00:00:12.037402,0.026605133115462642,friedman_mse,0.05450501121767786,exponential,5,sqrt,0.2031371015101768,10,8,0.020419299512580796,852,0.5814410132302645,0.0004741880155332632,COMPLETE
542,542,0.7609656231908823,2023-05-01 21:13:40.756880,2023-05-01 21:13:48.824812,0 days 00:00:08.067932,0.009034379572899754,friedman_mse,0.014006362587263612,exponential,4,log2,0.2600346486689283,10,9,0.008849912604349705,777,0.5095703512298078,0.00036120137556369507,COMPLETE
543,543,0.7560269209654248,2023-05-01 21:13:48.829654,2023-05-01 21:13:56.522776,0 days 00:00:07.693122,0.017652278528657733,friedman_mse,0.00623747056672833,exponential,4,sqrt,0.4406395970803431,9,10,0.033158445764306856,864,0.3035199251519273,0.0005889729746591125,COMPLETE
544,544,0.7578936517109901,2023-05-01 21:13:56.526813,2023-05-01 21:14:03.127859,0 days 00:00:06.601046,0.010291137759417668,friedman_mse,0.015919744758575115,exponential,4,sqrt,0.1320531631203262,10,9,0.01650129709373167,833,0.2543732766125223,0.0001844989801650043,COMPLETE
545,545,0.776761278131048,2023-05-01 21:14:03.132898,2023-05-01 21:14:11.684765,0 days 00:00:08.551867,0.00013499702474592388,friedman_mse,0.019569458807023644,exponential,4,sqrt,0.225483245888547,10,9,0.025971338825788563,802,0.29013785927974606,0.00031706533658767223,COMPLETE
546,546,0.7475463063976733,2023-05-01 21:14:11.689688,2023-05-01 21:14:18.062292,0 days 00:00:06.372604,0.037178281952080845,friedman_mse,0.021065121289678277,exponential,4,sqrt,0.22784982229401368,10,9,0.058449681363172544,791,0.2862066976694305,0.0002947594089699778,COMPLETE
547,547,0.7517875290994432,2023-05-01 21:14:18.068255,2023-05-01 21:14:24.862343,0 days 00:00:06.794088,0.021529179561116614,friedman_mse,0.032274872418410976,exponential,4,sqrt,0.24163631981012038,10,9,0.0005431692446111335,755,0.31098377135879474,0.00032795632963849013,COMPLETE
548,548,0.5,2023-05-01 21:14:24.868338,2023-05-01 21:14:31.258666,0 days 00:00:06.390328,0.36655604766359495,friedman_mse,0.012396881864422456,exponential,6,sqrt,0.21406004761086078,7,9,0.04152287067576997,732,0.272657830977494,0.00039535071921745473,COMPLETE
549,549,0.5,2023-05-01 21:14:31.263388,2023-05-01 21:14:38.852760,0 days 00:00:07.589372,0.3379393933425,friedman_mse,0.01930663799173927,log_loss,3,sqrt,0.22104662998429292,10,9,0.11729350781713851,900,0.333974367791375,0.0002541596598124597,COMPLETE
550,550,0.5,2023-05-01 21:14:38.857838,2023-05-01 21:14:43.954600,0 days 00:00:05.096762,0.09774344929558246,friedman_mse,0.018345103176401378,exponential,5,sqrt,0.23583954854591443,10,9,0.2899658064901868,805,0.29741582503453123,0.0002999473009100869,COMPLETE
551,551,0.5484731646102219,2023-05-01 21:14:43.959058,2023-05-01 21:14:50.211510,0 days 00:00:06.252452,0.15941168346680767,friedman_mse,0.0005836175973644614,exponential,4,sqrt,0.1989181379147429,10,9,0.02749484651957193,782,0.26506168635106186,0.00036225602545000016,COMPLETE
552,552,0.7592718839363906,2023-05-01 21:14:50.214860,2023-05-01 21:14:57.746885,0 days 00:00:07.532025,0.010057538096614598,friedman_mse,0.016846576368448246,exponential,4,sqrt,0.2544516095326928,10,9,0.009448671077271698,984,0.24232713098151987,0.00012121742475858966,COMPLETE
