,number,value,datetime_start,datetime_complete,duration,params_ccp_alpha,params_criterion,params_learning_rate,params_loss,params_max_depth,params_max_features,params_min_impurity_decrease,params_min_samples_leaf,params_min_samples_split,params_min_weight_fraction_leaf,params_n_estimators,params_subsample,params_tol,state
713,713,0.7598872159754856,2023-05-01 21:38:32.696972,2023-05-01 21:38:42.217148,0 days 00:00:09.520176,0.009009086982828518,friedman_mse,0.013896453308952264,exponential,6,sqrt,0.08577941399015414,10,9,0.01788603695869196,833,0.4794631448305483,0.0006984056628568437,COMPLETE
714,714,0.6229400462211727,2023-05-01 21:38:42.225362,2023-05-01 21:38:49.482649,0 days 00:00:07.257287,0.020474699346620776,squared_error,0.02015969706555891,exponential,5,sqrt,0.11782847984265844,10,9,0.03742404997647167,850,0.8527230523567415,0.0010536702284786126,COMPLETE
715,715,0.632714103018278,2023-05-01 21:38:49.487593,2023-05-01 21:38:54.515475,0 days 00:00:05.027882,0.03963992115707019,friedman_mse,0.011299555053870763,exponential,4,sqrt,0.04201764773225234,10,9,0.3242479881100518,786,0.3738803270537646,0.004191169745336018,COMPLETE
716,716,0.753883294050809,2023-05-01 21:38:54.519663,2023-05-01 21:39:06.228718,0 days 00:00:11.709055,0.01519355224071689,friedman_mse,0.02307233239308704,exponential,3,sqrt,0.010074827383433306,9,9,0.02290815735680825,876,0.8858470865024142,0.007721396759447313,COMPLETE
717,717,0.5,2023-05-01 21:39:06.233845,2023-05-01 21:39:10.223061,0 days 00:00:03.989216,0.22590788574843795,friedman_mse,0.015700762769416364,exponential,4,log2,0.3451236051430425,10,9,0.1379169100320007,825,0.12839109718660463,0.002808084936379356,COMPLETE
718,718,0.5,2023-05-01 21:39:10.229713,2023-05-01 21:39:25.491732,0 days 00:00:15.262019,0.1661254030745097,friedman_mse,0.00039509699246330127,exponential,4,sqrt,0.38952365185150983,10,6,0.008960825006345522,1000,0.929718476272202,0.0005129856782998303,COMPLETE
719,719,0.6638945035438237,2023-05-01 21:39:25.497771,2023-05-01 21:39:31.856293,0 days 00:00:06.358522,0.0003376969448324203,friedman_mse,0.00945070221474809,exponential,5,sqrt,0.31619966187556203,10,8,0.4193373957449328,801,0.9462286228885106,0.0007837745494844931,COMPLETE
720,720,0.756618835954022,2023-05-01 21:39:31.864210,2023-05-01 21:49:07.016361,0 days 00:09:35.152151,0.00891374726479717,friedman_mse,0.0073171813485279225,exponential,4,sqrt,0.3304384990921785,10,9,0.06476844186951647,763,0.45381551463205355,0.006418373166859362,COMPLETE
721,721,0.632714103018278,2023-05-01 21:49:07.024365,2023-05-01 21:49:13.813746,0 days 00:00:06.789381,0.02941392236093435,friedman_mse,0.012400787667254567,exponential,3,sqrt,0.15336570048317638,10,9,0.48471446652657446,864,0.24594798501980714,0.0023636276772587444,COMPLETE
722,722,0.7584795107030626,2023-05-01 21:49:13.820006,2023-05-01 21:49:23.043755,0 days 00:00:09.223749,0.008460244820973814,friedman_mse,0.018019363657670446,exponential,4,sqrt,0.12564174813363285,9,9,0.02870005285874366,841,0.4162577736333744,0.0005995887091971034,COMPLETE
723,723,0.7068027329591396,2023-05-01 21:49:23.049743,2023-05-01 21:49:37.149255,0 days 00:00:14.099512,0.06042915551101742,friedman_mse,0.014558192882348029,exponential,5,sqrt,0.14443375942473158,10,9,0.01742377514993994,981,0.5223548964045307,0.00043739244556638066,COMPLETE
724,724,0.5,2023-05-01 21:49:37.155330,2023-05-01 21:49:47.373697,0 days 00:00:10.218367,0.2784753671991818,friedman_mse,0.028677512455833887,log_loss,4,sqrt,0.21826495132838572,10,9,0.046115000499271946,820,0.6368351669871116,0.003822446622392434,COMPLETE
725,725,0.5,2023-05-01 21:49:47.379219,2023-05-01 21:49:53.218715,0 days 00:00:05.839496,0.07723627310195176,friedman_mse,0.0007537854534527555,exponential,4,sqrt,0.40812119077096715,8,9,0.22627493545746302,885,0.492739559767129,0.0017600514245226307,COMPLETE
726,726,0.5,2023-05-01 21:49:53.224266,2023-05-01 21:50:02.998946,0 days 00:00:09.774680,0.40976436877426203,friedman_mse,0.0008637382993976467,exponential,3,sqrt,0.023838370110540495,10,9,0.00836021941052664,962,0.6941139123144576,0.011834648655935653,COMPLETE
727,727,0.6701187686014046,2023-05-01 21:50:03.004975,2023-05-01 21:50:07.214004,0 days 00:00:04.209029,0.0007354296551879464,friedman_mse,0.008430027653754833,exponential,6,sqrt,0.058952779557305615,10,9,0.3461043314388536,851,0.22789645944246803,0.043706547021554486,COMPLETE
728,728,0.7238876572694986,2023-05-01 21:50:07.220164,2023-05-01 21:50:12.859736,0 days 00:00:05.639572,0.02238816103680906,friedman_mse,0.002193077256156947,exponential,4,log2,0.2850344660273103,10,8,0.12251266527451443,870,0.43336625333334694,0.01002855978725741,COMPLETE
729,729,0.5,2023-05-01 21:50:12.865232,2023-05-01 21:50:24.492583,0 days 00:00:11.627351,0.3419137769554253,friedman_mse,0.010384963837119475,exponential,4,sqrt,0.10244342346743629,10,9,0.02869054952170778,798,0.9182236587752388,0.02647734163983781,COMPLETE
730,730,0.7762942644512371,2023-05-01 21:50:24.498080,2023-05-01 21:50:35.149319,0 days 00:00:10.651239,0.00011230472045083994,friedman_mse,0.02160898991784014,exponential,4,sqrt,0.1752680872914391,7,9,0.018042287171856602,981,0.4763832898658373,0.018357016189682794,COMPLETE
731,731,0.6392575077947205,2023-05-01 21:50:35.155659,2023-05-01 21:50:41.242668,0 days 00:00:06.087009,0.00031687103381061667,friedman_mse,0.020597310880519085,exponential,5,sqrt,0.1570047918152409,7,9,0.46243538068131657,982,0.47806522269659524,0.017566239860967017,COMPLETE
732,732,0.5,2023-05-01 21:50:41.250741,2023-05-01 21:50:49.880223,0 days 00:00:08.629482,0.2295642255372951,friedman_mse,0.022567071750419998,exponential,4,sqrt,0.17764398206156576,8,9,0.03941812771668008,984,0.4497509158235479,0.021288996336272913,COMPLETE
733,733,0.5,2023-05-01 21:50:49.886400,2023-05-01 21:50:55.980951,0 days 00:00:06.094551,0.434385102139972,squared_error,0.001047944055419464,exponential,4,sqrt,0.184252809047572,8,7,0.05774015403352477,965,0.5060087980779928,0.016788121454808104,COMPLETE
734,734,0.6273397417972751,2023-05-01 21:50:55.989325,2023-05-01 21:51:02.460315,0 days 00:00:06.470990,0.015345265715018612,friedman_mse,0.02629108125611777,exponential,4,sqrt,0.2698420063184519,6,9,0.43134360158216806,980,0.6553668194044452,0.024372085853693517,COMPLETE
735,735,0.5,2023-05-01 21:51:02.465161,2023-05-01 21:51:10.669898,0 days 00:00:08.204737,0.1786866753156128,friedman_mse,0.019552081471889672,exponential,3,sqrt,0.17316451887628223,7,9,0.020109380650777057,960,0.4742946066899874,0.012591187838637092,COMPLETE
736,736,0.5,2023-05-01 21:51:10.676237,2023-05-01 21:51:20.734371,0 days 00:00:10.058134,0.289519203368642,friedman_mse,0.016987786103413168,exponential,4,sqrt,0.19061876174188502,8,9,0.03430005657003125,1000,0.49358642123990154,0.001098705821272194,COMPLETE
737,737,0.5,2023-05-01 21:51:20.740391,2023-05-01 21:51:28.000454,0 days 00:00:07.260063,0.4577344910543931,friedman_mse,0.0223773354564382,exponential,5,sqrt,0.2148963231352985,7,9,0.39951969220860606,999,0.8169535653399977,0.01801303832534285,COMPLETE
738,738,0.5,2023-05-01 21:51:28.006893,2023-05-01 21:51:40.192414,0 days 00:00:12.185521,0.240998274776165,friedman_mse,0.017835026989798296,exponential,4,sqrt,0.24391985351586162,7,9,0.07765522036628969,948,0.8307551952455391,0.014171081445527653,COMPLETE
739,739,0.5,2023-05-01 21:51:40.200960,2023-05-01 21:51:48.965401,0 days 00:00:08.764441,0.3158577782411641,friedman_mse,0.04246388879829909,exponential,6,sqrt,0.1661658281477629,8,9,0.02453406740638037,459,0.9571293625021513,0.01977415078017728,COMPLETE
740,740,0.6835759021296512,2023-05-01 21:51:48.973021,2023-05-01 21:51:52.893106,0 days 00:00:03.920085,0.032955192590149646,friedman_mse,0.00013233396415359057,exponential,3,log2,0.19531750228368758,7,8,0.18108178831482052,420,0.9341177787343075,0.015389583628710646,COMPLETE
741,741,0.5,2023-05-01 21:51:52.901383,2023-05-01 21:51:55.156441,0 days 00:00:02.255058,0.48839447776160017,friedman_mse,0.026879793805549997,exponential,4,sqrt,0.2995930504057583,6,9,0.05111495856129532,174,0.5455996140134348,0.0005681150317143157,COMPLETE
742,742,0.5,2023-05-01 21:51:55.163641,2023-05-01 21:52:09.388955,0 days 00:00:14.225314,0.18904578726354165,friedman_mse,0.03546560793986215,log_loss,4,sqrt,0.4140168574136215,8,9,0.01614551556378365,974,0.7750145994385531,0.0008580870212118204,COMPLETE
743,743,0.6927479001338261,2023-05-01 21:52:09.400203,2023-05-01 21:52:23.130627,0 days 00:00:13.730424,0.010385936786420023,friedman_mse,0.0006780409946457863,exponential,4,sqrt,0.1366862862527839,9,9,0.16069680500710104,963,0.43567442077641594,0.0015196791890782527,COMPLETE
744,744,0.5,2023-05-01 21:52:23.144769,2023-05-01 21:52:30.585701,0 days 00:00:07.440932,0.4284821092873325,friedman_mse,0.01288744816922819,exponential,7,sqrt,0.22996903714371816,5,9,0.03976599544683575,947,0.15892325494984372,0.005524423786080751,COMPLETE
745,745,0.6837518274659524,2023-05-01 21:52:30.593674,2023-05-01 22:00:49.865963,0 days 00:08:19.272289,0.022344331739327632,friedman_mse,0.014944936208884173,exponential,5,sqrt,0.2104900721430898,9,9,0.2501529445165982,936,0.46492341014045085,0.008835255289627426,COMPLETE
746,746,0.5,2023-05-01 22:00:49.872050,2023-05-01 22:00:55.889866,0 days 00:00:06.017816,0.309675436906482,friedman_mse,0.011455011132673764,exponential,10,sqrt,0.08011299385110354,8,8,0.25745722739299093,944,0.40288975760206763,0.05128166252169931,COMPLETE
747,747,0.7513726170182958,2023-05-01 22:00:55.894750,2023-05-01 22:01:04.730651,0 days 00:00:08.835901,0.009911867632691895,friedman_mse,0.01956878010643105,exponential,4,sqrt,0.14607711545220617,9,9,0.09041839270899986,978,0.38047402856451207,0.002131387496868938,COMPLETE
748,748,0.7544511259883706,2023-05-01 22:01:04.738488,2023-05-01 22:01:09.663997,0 days 00:00:04.925509,0.01691019201318415,friedman_mse,0.023777103142993274,exponential,3,sqrt,0.4019387133379412,8,9,0.028318773577337357,623,0.17915385600546274,0.0012919299763476694,COMPLETE
749,749,0.7751212606954198,2023-05-01 22:01:09.669955,2023-05-01 22:01:25.387653,0 days 00:00:15.717698,0.0002991395973747733,friedman_mse,0.009460895429678868,exponential,4,sqrt,0.16692115761640103,7,9,0.015037881045368108,984,0.856555445319076,0.007540742632921955,COMPLETE
750,750,0.5,2023-05-01 22:01:25.393941,2023-05-01 22:01:39.073668,0 days 00:00:13.679727,0.20242267349929316,friedman_mse,0.009077455842208208,exponential,4,sqrt,0.18519383569994505,6,9,0.032548514159015524,998,0.8817650507425897,0.007345454734038716,COMPLETE
751,751,0.7577247465178452,2023-05-01 22:01:39.078674,2023-05-01 22:01:53.266119,0 days 00:00:14.187445,0.0003038246638597307,friedman_mse,0.00022505799519186145,exponential,4,sqrt,0.1682855775483353,7,9,0.01794856821386088,983,0.7434034548032181,0.006166324204918318,COMPLETE
752,752,0.7563137875522533,2023-05-01 22:01:53.271138,2023-05-01 22:02:04.237382,0 days 00:00:10.966244,0.009782312754732382,friedman_mse,0.0079753355081523,exponential,5,log2,0.16820593212546714,7,9,0.04189884471962902,965,0.8593488697836177,0.007702313481220313,COMPLETE
753,753,0.5,2023-05-01 22:02:04.243368,2023-05-01 22:02:11.021746,0 days 00:00:06.778378,0.1596157788506943,squared_error,0.01095642526560835,exponential,4,sqrt,0.1562687222701826,7,9,0.14682620037024066,973,0.8360650376824179,0.0066579579912235285,COMPLETE
754,754,0.5,2023-05-01 22:02:11.026882,2023-05-01 22:02:19.126970,0 days 00:00:08.100088,0.35206874352393036,friedman_mse,0.009942575119615788,exponential,6,sqrt,0.16806063619597597,7,9,0.025600455293630683,965,0.341981447329325,0.0006755947995054997,COMPLETE
755,755,0.7763635372947536,2023-05-01 22:02:19.132968,2023-05-01 22:02:30.034223,0 days 00:00:10.901255,7.059471727820749e-05,friedman_mse,0.013252203930022065,exponential,3,sqrt,0.19437183275142247,8,9,0.015612229660016554,987,0.5692704987006263,0.008453922621478344,COMPLETE
756,756,0.632714103018278,2023-05-01 22:02:30.039709,2023-05-01 22:02:38.638004,0 days 00:00:08.598295,0.04575802097931541,friedman_mse,0.01329831298067223,exponential,3,sqrt,0.19412502609944368,8,9,0.16788768400532217,987,0.596516777465271,0.009153813424807271,COMPLETE
757,757,0.5,2023-05-01 22:02:38.643979,2023-05-01 22:02:47.835842,0 days 00:00:09.191863,0.10197999970308048,friedman_mse,0.09708617834547832,exponential,3,sqrt,0.20284600254788243,6,9,0.21143106283131852,984,0.7573693070751435,0.008006693095125176,COMPLETE
758,758,0.7119815185536874,2023-05-01 22:02:47.840868,2023-05-01 22:02:59.397984,0 days 00:00:11.557116,0.02632215928980354,friedman_mse,0.012555407848500266,exponential,3,sqrt,0.20215237423565008,8,8,0.11263276791404209,996,0.8731396571821205,0.010007615883780522,COMPLETE
759,759,0.7735404400600101,2023-05-01 22:02:59.403791,2023-05-01 22:03:10.354659,0 days 00:00:10.950868,1.2493810732129031e-05,friedman_mse,0.015690774570974206,exponential,3,sqrt,0.4786861579109693,8,9,0.0520406495001107,1000,0.5732604108152182,0.006964514871291241,COMPLETE
760,760,0.5,2023-05-01 22:03:10.359890,2023-05-01 22:03:21.605229,0 days 00:00:11.245339,0.4065425281327788,friedman_mse,0.00946760981384356,exponential,3,sqrt,0.18529061914116549,8,9,0.03353697878756278,965,0.7947732869796018,0.008490877336643934,COMPLETE
761,761,0.6215938709901028,2023-05-01 22:03:21.611262,2023-05-01 22:03:28.846225,0 days 00:00:07.234963,0.01817505279507321,friedman_mse,0.011512047215192308,exponential,3,sqrt,0.1844027811415146,8,9,0.3277811423073373,984,0.8901210902159692,0.01074383818703464,COMPLETE
762,762,0.6950295897198202,2023-05-01 22:03:28.851221,2023-05-01 22:03:40.770594,0 days 00:00:11.919373,0.011429388706282236,friedman_mse,0.014851931451242162,log_loss,3,sqrt,0.1764229259845005,8,9,0.018668498634571835,1000,0.772196221573753,0.07145703476050715,COMPLETE
763,763,0.5,2023-05-01 22:03:40.774708,2023-05-01 22:03:47.678286,0 days 00:00:06.903578,0.07371315061058975,friedman_mse,0.00875351549810307,exponential,3,sqrt,0.09080757639231449,8,6,0.4978033577385659,957,0.8089980699107567,0.005696484241165072,COMPLETE
764,764,0.6229400462211727,2023-05-01 22:03:47.684771,2023-05-01 22:03:58.376745,0 days 00:00:10.691974,0.10645488738296238,friedman_mse,0.011145951579343765,exponential,3,sqrt,0.19795234362221803,8,9,0.027638537802630397,972,0.6645753528796189,0.007528654636847946,COMPLETE
765,765,0.7551744566842133,2023-05-01 22:03:58.384758,2023-05-01 22:04:12.876442,0 days 00:00:14.491684,0.010319175509848132,friedman_mse,0.01719656368521859,exponential,3,log2,0.033583007476682816,8,9,0.040309294674025255,949,0.9756100967189605,0.009339261877453642,COMPLETE
766,766,0.5,2023-05-01 22:04:12.887126,2023-05-01 22:20:27.077381,0 days 00:16:14.190255,0.25426786628790776,friedman_mse,0.013094609641266854,exponential,3,sqrt,0.010626662964438349,7,9,0.013428896557308698,982,0.711760398482102,0.004398300931885805,COMPLETE
767,767,0.6400497052079444,2023-05-01 22:20:27.081816,2023-05-01 22:20:34.501574,0 days 00:00:07.419758,0.028024700322998364,friedman_mse,0.009993613908585101,exponential,3,sqrt,0.33918786546448704,8,8,0.2631978501004573,957,0.5712347686072679,0.0004798929026724751,COMPLETE
768,768,0.5,2023-05-01 22:20:34.506099,2023-05-01 22:20:41.917490,0 days 00:00:07.411391,0.4363339232217278,friedman_mse,0.014220067107243453,exponential,3,sqrt,0.16193852990962293,8,9,0.2931172858680726,983,0.5536549196663648,0.0334675976495184,COMPLETE
769,769,0.7543732630095848,2023-05-01 22:20:41.922941,2023-05-01 22:20:54.254562,0 days 00:00:12.331621,0.01780560831594066,friedman_mse,0.007735110892642864,exponential,3,sqrt,0.46603520034060636,6,9,0.02340384147680845,938,0.8410422583685,0.005000299545218282,COMPLETE
770,770,0.6229400462211727,2023-05-01 22:20:54.259586,2023-05-01 22:21:09.537448,0 days 00:00:15.277862,0.127555138056949,friedman_mse,0.019112937065349916,exponential,5,sqrt,0.17886053220511344,8,9,0.06479844980393845,962,0.9302780001885964,0.012337648901007626,COMPLETE
771,771,0.5,2023-05-01 22:21:09.542975,2023-05-01 22:21:19.522825,0 days 00:00:09.979850,0.06662380853300137,friedman_mse,0.031906418126307415,exponential,3,sqrt,0.07006175893720054,7,9,0.18868328319803707,971,0.9837198342369802,0.0004294367384317779,COMPLETE
772,772,0.5,2023-05-01 22:21:19.529262,2023-05-01 22:21:26.313484,0 days 00:00:06.784222,0.03846385885167575,squared_error,0.0015968777799429334,exponential,5,sqrt,0.0544592469821885,8,9,0.3946978584236544,986,0.8612097599998927,0.0066540685627223895,COMPLETE
773,773,0.5,2023-05-01 22:21:26.318331,2023-05-01 22:21:38.137051,0 days 00:00:11.818720,0.477858443631003,friedman_mse,0.012190248841204973,exponential,3,sqrt,0.318001539767307,8,4,0.012852765884639267,947,0.9011745379269472,0.0005268335167404361,COMPLETE
774,774,0.5,2023-05-01 22:21:38.141927,2023-05-01 22:21:45.072850,0 days 00:00:06.930923,0.3580661509505407,friedman_mse,0.016305551180518334,exponential,6,sqrt,0.21759236840981233,7,9,0.2320593501103625,921,0.6022290005473345,0.0006443611878962099,COMPLETE
775,775,0.5,2023-05-01 22:21:45.079710,2023-05-01 22:21:51.482716,0 days 00:00:06.403006,0.21100107907570753,friedman_mse,0.001271708603497265,exponential,5,log2,0.19103116543050452,8,9,0.04106476661427099,938,0.353652298425015,0.008679660083625704,COMPLETE
776,776,0.5,2023-05-01 22:21:51.489432,2023-05-01 22:21:58.261067,0 days 00:00:06.771635,0.16992104717534476,friedman_mse,0.00028898501251281534,exponential,3,sqrt,0.02037059827530751,6,9,0.4397703296743618,969,0.8229406110095097,0.010329464030080792,COMPLETE
777,777,0.6757958398899013,2023-05-01 22:21:58.266294,2023-05-01 22:22:05.403956,0 days 00:00:07.137662,0.00016659569983512704,friedman_mse,0.010239281425510295,exponential,4,sqrt,0.0015066450248440307,7,9,0.339142659062838,983,0.7304736431033301,0.0003727611276175,COMPLETE
778,778,0.6229400462211727,2023-05-01 22:22:05.409169,2023-05-01 22:22:21.369009,0 days 00:00:15.959840,0.1149456914037984,friedman_mse,0.008790569604602132,exponential,5,sqrt,0.4203392484625108,5,7,0.030297201779281226,953,0.9458848221768112,0.0007542129992029934,COMPLETE
779,779,0.6777856367550092,2023-05-01 22:22:21.374994,2023-05-01 22:22:30.263253,0 days 00:00:08.888259,0.09035834107304624,friedman_mse,0.021857611168218303,exponential,3,sqrt,0.10834129631794814,9,9,0.009150223720972371,924,0.55581168149265,0.014371352227382759,COMPLETE
780,780,0.7708209463430951,2023-05-01 22:22:30.269061,2023-05-01 22:22:42.827254,0 days 00:00:12.558193,6.760649449568466e-05,friedman_mse,0.013035568413324075,exponential,4,sqrt,0.2059078593749472,8,9,0.0796262504172271,962,0.7109471284989506,0.0033005057912885534,COMPLETE
781,781,0.5,2023-05-01 22:22:42.832752,2023-05-01 22:22:50.218800,0 days 00:00:07.386048,0.010891783079166918,friedman_mse,0.00011462296508030976,log_loss,4,sqrt,0.1501422346298933,8,8,0.48165304582707236,993,0.9729868350836528,0.007736282544464766,COMPLETE
782,782,0.5,2023-05-01 22:22:50.224785,2023-05-01 22:23:00.014369,0 days 00:00:09.789584,0.2471302581371281,friedman_mse,0.011123912835153682,exponential,4,sqrt,0.1277467802691728,9,9,0.01947034727422743,935,0.5356512847159409,0.006163731619386833,COMPLETE
783,783,0.5,2023-05-01 22:23:00.020401,2023-05-01 22:23:14.017390,0 days 00:00:13.996989,0.2178865091847158,friedman_mse,0.027296664121751982,exponential,7,sqrt,0.17550752064173802,7,9,0.05501912551487538,973,0.7678148164300954,0.00489428208993559,COMPLETE
784,784,0.5,2023-05-01 22:23:14.023400,2023-05-01 22:23:26.592343,0 days 00:00:12.568943,0.33066446354252527,friedman_mse,0.058093848911682115,exponential,6,sqrt,0.0615633061919285,9,9,0.03170422558787118,998,0.5833028802550059,0.0005024406304272385,COMPLETE
785,785,0.7216670023055476,2023-05-01 22:23:26.597884,2023-05-01 22:23:38.402970,0 days 00:00:11.805086,0.02362442596170625,friedman_mse,0.016584595054770324,exponential,3,sqrt,0.3258721381818576,8,9,0.10085531975849127,951,0.5199975493761182,0.0038799625567122226,COMPLETE
786,786,0.6994707800760145,2023-05-01 22:23:38.412560,2023-05-01 22:33:30.287610,0 days 00:09:51.875050,0.00895810742314827,friedman_mse,0.014693369756289482,exponential,5,log2,0.48925060588452585,9,9,0.20325174771431334,933,0.3696526347187233,0.002863013943722572,COMPLETE
787,787,0.757994221802616,2023-05-01 22:33:30.294167,2023-05-01 22:33:44.317210,0 days 00:00:14.023043,0.008988834674217515,friedman_mse,0.007171833196950861,exponential,4,sqrt,0.45188626376636926,8,9,0.009459011289422862,911,0.8991376200662787,0.00011908465181456847,COMPLETE
788,788,0.7481867862090725,2023-05-01 22:33:44.323064,2023-05-01 22:33:58.744378,0 days 00:00:14.421314,0.01910184162064107,friedman_mse,0.020482066245204038,exponential,4,sqrt,0.4338095963907806,6,9,0.04504888840583389,973,0.8476046066672053,0.0005647939159590608,COMPLETE
789,789,0.7747285588218034,2023-05-01 22:33:58.750368,2023-05-01 22:34:07.139755,0 days 00:00:08.389387,0.00029525067428404477,friedman_mse,0.02463308463512832,exponential,4,sqrt,0.04762792725407058,8,8,0.02047995437325547,951,0.19996300754243876,0.0713089036623043,COMPLETE
790,790,0.5,2023-05-01 22:34:07.145334,2023-05-01 22:34:12.914629,0 days 00:00:05.769295,0.27771441105391176,friedman_mse,0.024570252127547636,exponential,3,sqrt,0.07491616847937976,8,8,0.46856929494122185,984,0.1908457163418646,0.022923024995404398,COMPLETE
791,791,0.5,2023-05-01 22:34:12.920644,2023-05-01 22:34:18.516499,0 days 00:00:05.595855,0.2946224309795244,friedman_mse,0.02986605988883036,exponential,4,sqrt,0.028958940550656842,8,8,0.024413719765625633,959,0.20935274584497798,0.09936759722190476,COMPLETE
792,792,0.5,2023-05-01 22:34:18.522005,2023-05-01 22:34:22.716680,0 days 00:00:04.194675,0.30635603222225394,squared_error,0.023858399207015855,exponential,5,sqrt,0.05431894145279643,8,8,0.1324503684271138,906,0.17529746961848452,0.02732716123376606,COMPLETE
793,793,0.6860941128317632,2023-05-01 22:34:22.721674,2023-05-01 22:34:30.908901,0 days 00:00:08.187227,0.00012652520306803165,friedman_mse,0.03730972814910758,exponential,4,sqrt,0.34465148282905506,8,8,0.270035485683203,1000,0.9167080242218292,0.01164389174037212,COMPLETE
