,number,value,datetime_start,datetime_complete,duration,params_ccp_alpha,params_criterion,params_learning_rate,params_loss,params_max_depth,params_max_features,params_min_impurity_decrease,params_min_samples_leaf,params_min_samples_split,params_min_weight_fraction_leaf,params_n_estimators,params_subsample,params_tol,state
158,158,0.5,2023-05-01 20:14:36.769479,2023-05-01 20:14:43.578763,0 days 00:00:06.809284,0.20997808851013555,friedman_mse,0.00570094589333455,exponential,4,sqrt,0.41209810422415716,10,9,0.04263838031277509,883,0.28760725763305844,0.00034138779659663443,COMPLETE
159,159,0.755497818719002,2023-05-01 20:14:43.578763,2023-05-01 20:14:51.330445,0 days 00:00:07.751682,0.014882276530990033,friedman_mse,0.005127559416379272,exponential,4,sqrt,0.43708885130335656,10,9,0.0350651339960768,860,0.3382338099613098,0.0005029458694494989,COMPLETE
160,160,0.7482776040740847,2023-05-01 20:14:51.330445,2023-05-01 20:14:59.152245,0 days 00:00:07.821800,0.027218882464738654,friedman_mse,0.006015639273481473,exponential,4,sqrt,0.4471954196901948,10,9,0.06476814807037029,929,0.3082818770950359,0.0005852365993386971,COMPLETE
161,161,0.757222519093641,2023-05-01 20:14:59.152764,2023-05-01 20:15:07.778405,0 days 00:00:08.625641,0.01214021125055878,friedman_mse,0.004669412364353042,exponential,4,sqrt,0.4280317194486468,10,9,0.032499966914136424,886,0.34438780930432683,0.00029433835882188177,COMPLETE
162,162,0.7700001593400005,2023-05-01 20:15:07.778405,2023-05-01 20:15:19.049531,0 days 00:00:11.271126,6.989250966054738e-05,friedman_mse,0.005289664981549546,exponential,4,sqrt,0.4084804742210722,10,9,0.04339916631599529,911,0.3617590261600345,0.0004186689395376013,COMPLETE
163,163,0.7741460996591449,2023-05-01 20:15:19.049531,2023-05-01 20:15:32.473774,0 days 00:00:13.424243,0.00012832607340195954,friedman_mse,0.005534408155359497,exponential,4,sqrt,0.409136119301184,10,9,0.012700315006636502,949,0.2820725898177872,0.00038691757455265835,COMPLETE
164,164,0.7552121775831355,2023-05-01 20:15:32.473774,2023-05-01 20:15:43.130528,0 days 00:00:10.656754,0.01777267260154436,friedman_mse,0.00488811962996236,exponential,4,sqrt,0.40767842135351506,10,9,0.01198709481859089,914,0.3192872693132568,0.0004281490561107415,COMPLETE
165,165,0.5,2023-05-01 20:15:43.138535,2023-05-01 20:15:52.570812,0 days 00:00:09.432277,0.19798388282710533,friedman_mse,0.005487479990627038,exponential,4,sqrt,0.3729643108024021,6,9,0.01048831402045911,958,0.35123756428922137,0.0003962836841969178,COMPLETE
166,166,0.7571367229628108,2023-05-01 20:15:52.570812,2023-05-01 20:16:00.741576,0 days 00:00:08.170764,0.013008612552458084,friedman_mse,0.004551874111600825,exponential,4,sqrt,0.42331689947455403,10,9,0.018740220333787132,913,0.2991572243664385,0.0003215397289382152,COMPLETE
167,167,0.7534760876260272,2023-05-01 20:16:00.743092,2023-05-01 20:16:09.467237,0 days 00:00:08.724145,0.02835454471173986,friedman_mse,0.006158257662547003,exponential,4,sqrt,0.38152684355393907,10,9,0.04341845870169929,873,0.3915455241829068,0.0006396721933065397,COMPLETE
168,168,0.5,2023-05-01 20:16:09.474646,2023-05-01 20:16:18.054730,0 days 00:00:08.580084,0.26001555241628777,friedman_mse,0.004455680168791522,exponential,4,sqrt,0.4155283049787992,10,9,0.031308804368823176,949,0.33467084218137805,0.0004998667573865328,COMPLETE
169,169,0.5,2023-05-01 20:16:18.063047,2023-05-01 20:16:23.616784,0 days 00:00:05.553737,0.011467208516690761,squared_error,0.005253655453326732,exponential,4,sqrt,0.4055628373092362,9,9,0.05597870144902328,934,0.2809631493473712,0.0003643391360031443,COMPLETE
170,170,0.7488925857786859,2023-05-01 20:16:23.616784,2023-05-01 20:16:31.606646,0 days 00:00:07.989862,0.03440863390821379,friedman_mse,0.004082621259789679,exponential,4,sqrt,0.4331603179424617,10,10,0.06690515864242946,893,0.36507923851064106,0.0004478441346228902,COMPLETE
171,171,0.7690930407649399,2023-05-01 20:16:31.614218,2023-05-01 20:16:40.567583,0 days 00:00:08.953365,0.0009174178924279693,friedman_mse,0.005890744370101726,exponential,4,sqrt,0.4375913359819767,10,9,0.044367709678452535,937,0.2741568193552001,0.00030936645186327986,COMPLETE
172,172,0.7561274394985513,2023-05-01 20:16:40.570870,2023-05-01 20:16:48.342135,0 days 00:00:07.771265,0.009845893072139462,friedman_mse,0.006157717591919183,exponential,4,sqrt,0.42507641281101827,10,9,0.05050040081817453,916,0.31202019688630156,0.00034484056954260824,COMPLETE
173,173,0.5477519699725162,2023-05-01 20:16:48.346819,2023-05-01 20:16:55.681966,0 days 00:00:07.335147,0.1588572759974306,friedman_mse,0.004945617398645545,exponential,4,sqrt,0.45420970390104376,10,9,0.01734194071719108,931,0.2738728506295101,0.00028919475851895657,COMPLETE
174,174,0.7675443480138678,2023-05-01 20:16:55.689406,2023-05-01 20:17:04.569710,0 days 00:00:08.880304,5.3043250640027627e-05,friedman_mse,0.003458708643930611,exponential,4,sqrt,0.43540654490073194,10,10,0.035795788567966697,867,0.2970418817071179,0.0007747015121337194,COMPLETE
175,175,0.7705851397980444,2023-05-01 20:17:04.575863,2023-05-01 20:17:13.929528,0 days 00:00:09.353665,0.0006956928616256525,friedman_mse,0.0034464994232972926,exponential,4,sqrt,0.41180171120291165,10,10,0.00864748700726952,852,0.32259309194248675,0.0004098219472228409,COMPLETE
176,176,0.7550666034391187,2023-05-01 20:17:13.935056,2023-05-01 20:17:21.283238,0 days 00:00:07.348182,0.022913892131332506,friedman_mse,0.0022954260382180088,exponential,4,sqrt,0.4103836839116206,10,10,0.006971943414614571,820,0.3250524824335294,0.00039316993410724236,COMPLETE
177,177,0.7563596028013239,2023-05-01 20:17:21.283238,2023-05-01 20:17:30.196782,0 days 00:00:08.913544,0.011932479927854473,friedman_mse,0.004127543326591673,exponential,4,sqrt,0.3982461517665524,10,10,0.02007459452814135,954,0.3517488926426243,0.0005128712549413887,COMPLETE
178,178,0.7537439624990416,2023-05-01 20:17:30.196782,2023-05-01 20:17:32.216220,0 days 00:00:02.019438,0.020617507689443457,friedman_mse,0.0031358581942115093,exponential,4,sqrt,0.38877496922286675,9,10,0.009982929589397371,155,0.4069295409673412,0.0004375773934808359,COMPLETE
179,179,0.7706991897053488,2023-05-01 20:17:32.216220,2023-05-01 20:17:41.001985,0 days 00:00:08.785765,0.0008473715511709932,friedman_mse,0.005649258805108706,exponential,4,sqrt,0.4193234899093675,10,10,0.02382224892707621,849,0.34101021805849635,0.0005605010749550484,COMPLETE
180,180,0.7569380417861659,2023-05-01 20:17:41.004569,2023-05-01 20:17:48.427547,0 days 00:00:07.422978,0.012258729478085605,friedman_mse,0.0055777798199984205,exponential,4,sqrt,0.4244615028529228,9,10,0.027683608855922144,854,0.27316992585975675,0.0005948045044365076,COMPLETE
181,181,0.7578010061216022,2023-05-01 20:17:48.427547,2023-05-01 20:17:56.917248,0 days 00:00:08.489701,0.009802572253346227,friedman_mse,0.0062844915234290906,exponential,4,sqrt,0.41278912194665335,10,10,0.008068812556206211,871,0.3426828789027954,0.00034350852291523164,COMPLETE
182,182,0.768631941106508,2023-05-01 20:17:56.917248,2023-05-01 20:18:06.418343,0 days 00:00:09.501095,0.0010363214991389663,friedman_mse,0.003712712256609645,exponential,4,sqrt,0.41914293856820306,10,10,0.021996521365131416,884,0.3220606222971875,0.0007218013043303657,COMPLETE
183,183,0.7669313822998133,2023-05-01 20:18:06.418343,2023-05-01 20:18:16.338514,0 days 00:00:09.920171,0.0008229587269273161,friedman_mse,0.004417796183712599,exponential,4,sqrt,0.4062791045317295,10,10,0.043880216496202565,908,0.36820061634042633,0.0005549284841002932,COMPLETE
184,184,0.7741551447652829,2023-05-01 20:18:16.345173,2023-05-01 20:18:26.843568,0 days 00:00:10.498395,6.940352181600799e-05,friedman_mse,0.005380778677616507,exponential,4,sqrt,0.43122921162235583,10,9,0.015043014748024598,925,0.33808887022808076,0.00045154320108970803,COMPLETE
185,185,0.5,2023-05-01 20:18:26.848418,2023-05-01 20:18:33.573967,0 days 00:00:06.725549,0.29144491083845425,friedman_mse,0.005493954891037177,exponential,4,sqrt,0.42279749117411025,10,9,0.05617031514793574,838,0.30805572951313887,0.0004547876655209247,COMPLETE
186,186,0.5,2023-05-01 20:18:33.573967,2023-05-01 20:18:41.188833,0 days 00:00:07.614866,0.22789076110638837,friedman_mse,0.006359466296311376,exponential,4,sqrt,0.39745976892757445,10,9,0.02900865756637825,890,0.3303487886508585,0.0006316352377076773,COMPLETE
187,187,0.7538812225721476,2023-05-01 20:18:41.188833,2023-05-01 20:18:48.713495,0 days 00:00:07.524662,0.020246667863465864,friedman_mse,0.0048145992013872915,exponential,4,sqrt,0.37770891747173113,10,9,0.016480691956136155,929,0.284925817990456,0.00038517955802004476,COMPLETE
188,188,0.7256796681478886,2023-05-01 20:18:48.721899,2023-05-01 20:18:57.746153,0 days 00:00:09.024254,0.010608502925524106,friedman_mse,0.004146533099331631,log_loss,4,sqrt,0.42995351046208513,10,9,0.04026625041087793,965,0.34629889820499005,0.0003091942908252028,COMPLETE
189,189,0.7511658794620246,2023-05-01 20:18:57.752067,2023-05-01 20:19:05.642225,0 days 00:00:07.890158,0.028011844907525632,friedman_mse,0.0052199272574769435,exponential,4,sqrt,0.4131234153011727,10,10,0.027234009055130622,902,0.31065750463751096,0.00046172778240915357,COMPLETE
190,190,0.7732841956806372,2023-05-01 20:19:05.642225,2023-05-01 20:19:15.813547,0 days 00:00:10.171322,0.00024778407675531567,friedman_mse,0.003600977972814734,exponential,4,sqrt,0.4433376510890158,10,9,0.00034247437340346326,948,0.2941526980679448,0.0003839180773843311,COMPLETE
191,191,0.7721401273375212,2023-05-01 20:19:15.818930,2023-05-01 20:19:25.495892,0 days 00:00:09.676962,0.00010691130066637752,friedman_mse,0.003672603144505662,exponential,4,sqrt,0.4437491050907925,10,9,0.0136006916470176,945,0.27037906135472617,0.00036990699388067885,COMPLETE
192,192,0.755415616957781,2023-05-01 20:19:25.501211,2023-05-01 20:19:33.477958,0 days 00:00:07.976747,0.017022947826896687,friedman_mse,0.0037530587320947426,exponential,4,sqrt,0.45607330014181585,10,9,0.0018679471426058167,946,0.29086759176261096,0.0005354743401928851,COMPLETE
193,193,0.5,2023-05-01 20:19:33.483937,2023-05-01 20:19:41.967661,0 days 00:00:08.483724,0.3440875581008762,friedman_mse,0.003403628492460271,exponential,4,sqrt,0.449599611042706,10,9,0.013327951742996195,916,0.3327252767754668,0.00039152957779158714,COMPLETE
194,194,0.7587099322298873,2023-05-01 20:19:41.973915,2023-05-01 20:19:51.504710,0 days 00:00:09.530795,0.00813975042230604,friedman_mse,0.0043487626666815875,exponential,4,sqrt,0.42796859992027936,10,10,0.017549273926923684,881,0.35863881784007,0.00036510553922165616,COMPLETE
195,195,0.7548034835257037,2023-05-01 20:19:51.521100,2023-05-01 20:20:01.041267,0 days 00:00:09.520167,0.01933004976481842,friedman_mse,0.003644623176871583,exponential,4,sqrt,0.44353414271678426,10,10,0.010220070221873937,952,0.3181829793878726,0.00043154014171639215,COMPLETE
196,196,0.7705673290538737,2023-05-01 20:20:01.049318,2023-05-01 20:20:11.512155,0 days 00:00:10.462837,0.0008817866490050533,friedman_mse,0.0031633527273800576,exponential,4,sqrt,0.4054522157245592,10,9,0.0009437759785010129,904,0.30021171377012007,0.001012088326468913,COMPLETE
197,197,0.7584236487186748,2023-05-01 20:20:11.518881,2023-05-01 20:20:20.239195,0 days 00:00:08.720314,0.010785174620193424,friedman_mse,0.003260693747911402,exponential,4,sqrt,0.3893969942564023,10,9,0.006121825690239795,928,0.267384458082022,0.0008584854121611744,COMPLETE
198,198,0.7700425223129163,2023-05-01 20:20:20.243639,2023-05-01 20:20:30.567202,0 days 00:00:10.323563,0.00017451782960622097,friedman_mse,0.0026909092779176884,exponential,4,sqrt,0.4034971362943552,10,9,0.001364678116089221,856,0.2986765454474008,0.0005214535947566108,COMPLETE
199,199,0.7534486530245434,2023-05-01 20:20:30.572932,2023-05-01 20:20:38.891678,0 days 00:00:08.318746,0.03531952000806551,friedman_mse,0.0026138937848732605,exponential,4,sqrt,0.40278343494646596,10,9,0.005426850165593251,851,0.2975368263343714,0.0006930326199418776,COMPLETE
200,200,0.5,2023-05-01 20:20:38.897006,2023-05-01 20:20:44.359410,0 days 00:00:05.462404,0.021322609127352263,squared_error,0.002256777437925991,exponential,4,sqrt,0.40848990245555333,10,9,0.001322624703832517,863,0.26619684949919636,0.000592983272681245,COMPLETE
201,201,0.7567997777661734,2023-05-01 20:20:44.366153,2023-05-01 20:20:53.090189,0 days 00:00:08.724036,0.009838140606374283,friedman_mse,0.0018539702647975718,exponential,4,sqrt,0.415739887379994,10,9,0.02647018762998162,879,0.2915877547461837,0.001106876925651455,COMPLETE
202,202,0.7694870283437819,2023-05-01 20:20:53.093686,2023-05-01 20:21:03.952248,0 days 00:00:10.858562,0.00029094269174495774,friedman_mse,0.0029998050984093787,exponential,4,sqrt,0.4283748687496524,10,9,0.017983531493013717,899,0.3153922906506517,0.0005349877395808442,COMPLETE
203,203,0.7567768263975686,2023-05-01 20:21:03.956874,2023-05-01 20:21:11.845381,0 days 00:00:07.888507,0.01294088251925634,friedman_mse,0.0030440430048770265,exponential,4,sqrt,0.39960089075788147,10,9,0.015836257390169032,768,0.3040393303835095,0.000503293588185963,COMPLETE
204,204,0.5,2023-05-01 20:21:11.852801,2023-05-01 20:21:21.030361,0 days 00:00:09.177560,0.24507319891021115,friedman_mse,0.0030289107174502486,exponential,4,sqrt,0.4304855669998651,10,9,0.021477830284231662,893,0.34635969430558483,0.0004050762248353283,COMPLETE
205,205,0.7698608317507636,2023-05-01 20:21:21.031971,2023-05-01 20:21:33.835021,0 days 00:00:12.803050,8.812308758828383e-05,friedman_mse,0.002646918076941186,exponential,4,sqrt,0.41569458668260695,10,9,0.0019954682014063424,837,0.46857527557761186,0.0006322337520451201,COMPLETE
206,206,0.756293520414801,2023-05-01 20:21:33.841597,2023-05-01 20:21:44.113166,0 days 00:00:10.271569,0.011395344287859396,friedman_mse,0.0025089252341223773,exponential,4,sqrt,0.38965561835172924,9,9,0.000238767608324769,819,0.428177148798798,0.0006714301939258627,COMPLETE
207,207,0.7728077743886402,2023-05-01 20:21:44.119286,2023-05-01 20:21:57.460112,0 days 00:00:13.340826,0.00021760383365440129,friedman_mse,0.0048015444926462906,exponential,4,sqrt,0.41542471933741004,10,9,0.011734097572558784,848,0.516317864298349,0.0003528164381772652,COMPLETE
208,208,0.7532879906145471,2023-05-01 20:21:57.466327,2023-05-01 20:22:10.128514,0 days 00:00:12.662187,0.025578191591336327,friedman_mse,0.0019931509787628867,exponential,4,sqrt,0.4206030269645614,10,9,0.012962919538669711,834,0.6085226784608024,0.00044557757096828866,COMPLETE
209,209,0.7721574002113696,2023-05-01 20:22:10.134246,2023-05-01 20:22:23.547040,0 days 00:00:13.412794,0.00015688958847947306,friedman_mse,0.0036261396399407558,exponential,4,sqrt,0.403849976819784,10,9,0.0018406042298120973,846,0.37551447201775195,0.0008259919364238567,COMPLETE
210,210,0.7551597571441605,2023-05-01 20:22:23.547040,2023-05-01 20:22:33.661892,0 days 00:00:10.114852,0.01934391663706976,friedman_mse,0.004941797729574952,exponential,4,sqrt,0.38025290557128866,9,8,0.012602294172111424,853,0.3739778720122384,0.0009685879074935463,COMPLETE
211,211,0.7707011365944889,2023-05-01 20:22:33.667909,2023-05-01 20:22:46.288629,0 days 00:00:12.620720,0.0005821001642842515,friedman_mse,0.0035114167466026294,exponential,4,sqrt,0.40315778772012434,10,9,0.0035986963642295512,813,0.44451232860809764,0.000789250065846211,COMPLETE
212,212,0.5,2023-05-01 20:22:46.293390,2023-05-01 20:22:56.047962,0 days 00:00:09.754572,0.38254950238854973,friedman_mse,0.0035555862595900837,exponential,4,sqrt,0.3996532988285332,10,9,0.010028725412834859,814,0.44761343654468194,0.000795061975674521,COMPLETE
213,213,0.7741138375079769,2023-05-01 20:22:56.047962,2023-05-01 20:23:10.939293,0 days 00:00:14.891331,0.00013781596974778902,friedman_mse,0.0045791257062696425,exponential,4,sqrt,0.4051662752532395,10,9,0.0003937193006656878,863,0.49949508594487113,0.00108610218039006,COMPLETE
214,214,0.7562819231325164,2023-05-01 20:23:10.939293,2023-05-01 20:23:22.746617,0 days 00:00:11.807324,0.012439155641821721,friedman_mse,0.003704492038269444,exponential,4,sqrt,0.36935431728457385,10,9,0.0009664468636987996,861,0.49778060351305753,0.0010719059979924788,COMPLETE
215,215,0.7571759642186909,2023-05-01 20:23:22.752819,2023-05-01 20:23:31.832631,0 days 00:00:09.079812,0.00993604461997815,friedman_mse,0.004402973736602201,exponential,4,sqrt,0.3883443201565261,10,9,0.02320179065893429,846,0.38038129563275813,0.0012556026127475306,COMPLETE
216,216,0.5,2023-05-01 20:23:31.832631,2023-05-01 20:23:43.192462,0 days 00:00:11.359831,0.16663393358675033,friedman_mse,0.003381463025217778,exponential,4,sqrt,0.4039973600882475,10,9,0.012738929277278753,873,0.5329297651691091,0.0009477859099439788,COMPLETE
217,217,0.6673109524151458,2023-05-01 20:23:43.200422,2023-05-01 20:23:53.645600,0 days 00:00:10.445178,0.10169169447828642,friedman_mse,0.004625716099515995,exponential,4,sqrt,0.39684789455996483,10,9,0.0004399028008678723,805,0.5121714677348956,0.0008380778018774786,COMPLETE
218,218,0.7702811405285834,2023-05-01 20:23:53.652303,2023-05-01 20:24:04.940200,0 days 00:00:11.287897,0.00034422687687095486,friedman_mse,0.0040771588471109595,exponential,4,sqrt,0.4402832827120392,10,10,0.02490621944563392,838,0.48210203208033875,0.0010244734923272418,COMPLETE
219,219,0.6437822523252714,2023-05-01 20:24:04.944634,2023-05-01 20:24:14.532415,0 days 00:00:09.587781,0.01867110089870914,friedman_mse,0.003834482939887244,log_loss,4,sqrt,0.44305711211057863,10,10,0.027083200542064298,828,0.4709093225041539,0.0014072615170580387,COMPLETE
220,220,0.7567774682004715,2023-05-01 20:24:14.538019,2023-05-01 20:24:24.099099,0 days 00:00:09.561080,0.011601459850774978,friedman_mse,0.004245009210713414,exponential,4,sqrt,0.4545372112705607,10,10,0.011068183227270772,779,0.48990556226719434,0.0010888869075419646,COMPLETE
221,221,0.7690095072237506,2023-05-01 20:24:24.107162,2023-05-01 20:24:35.089265,0 days 00:00:10.982103,0.0006062195526609417,friedman_mse,0.0032791596102389074,exponential,4,sqrt,0.4324148843204934,10,10,0.01841078115862347,844,0.45004302963046816,0.000780519130271266,COMPLETE
222,222,0.7584711320532928,2023-05-01 20:24:35.089265,2023-05-01 20:24:43.067922,0 days 00:00:07.978657,0.01007631855504101,friedman_mse,0.004807753407848899,exponential,4,sqrt,0.42260655587595125,10,9,0.009822897538783293,872,0.2868710899690466,0.000953844992367652,COMPLETE
223,223,0.5,2023-05-01 20:24:43.074764,2023-05-01 20:24:46.647875,0 days 00:00:03.573111,0.2211565722003181,friedman_mse,0.0039909385864154625,exponential,4,sqrt,0.4064484202856548,10,10,0.02619842330823217,316,0.4202813502145084,0.0007526347963393332,COMPLETE
224,224,0.7723808398753003,2023-05-01 20:24:46.651852,2023-05-01 20:24:56.517793,0 days 00:00:09.865941,0.0008379339931316251,friedman_mse,0.004906987143930828,exponential,4,sqrt,0.2587775691635046,10,10,0.00013174487395381865,825,0.39340222292824634,0.001543836348776713,COMPLETE
225,225,0.7579959475489744,2023-05-01 20:24:56.517793,2023-05-01 20:25:04.923313,0 days 00:00:08.405520,0.009948637931047914,friedman_mse,0.0036490069633402706,exponential,4,sqrt,0.20467313916325644,10,10,0.00904972636924984,793,0.3990607464266378,0.001223518946284284,COMPLETE
226,226,0.7738577745231472,2023-05-01 20:25:04.929429,2023-05-01 20:25:15.852909,0 days 00:00:10.923480,7.965377275661914e-05,friedman_mse,0.004550227409582226,exponential,4,sqrt,0.287341512899777,10,10,0.0003265130200857322,819,0.4308731971860842,0.0018389543293676352,COMPLETE
227,227,0.7523043972966685,2023-05-01 20:25:15.858482,2023-05-01 20:25:24.714982,0 days 00:00:08.856500,0.024833520101616588,friedman_mse,0.004619603073413852,exponential,4,sqrt,0.3087509022945539,10,10,0.022476105382963893,815,0.4430805641422436,0.0017152362642860824,COMPLETE
228,228,0.6960028183765511,2023-05-01 20:25:24.722821,2023-05-01 20:25:33.727082,0 days 00:00:09.004261,0.07613561366594679,friedman_mse,0.004337048873445157,exponential,4,sqrt,0.23881108323142144,10,10,0.01468130043225823,827,0.42279518112869074,0.0008068620493400338,COMPLETE
229,229,0.7552455611551733,2023-05-01 20:25:33.731982,2023-05-01 20:25:42.433704,0 days 00:00:08.701722,0.016785178523929006,friedman_mse,0.00496259778113448,exponential,4,sqrt,0.4393216417855785,10,10,0.000288903433947856,751,0.4085708412068534,0.0022473191017643897,COMPLETE
230,230,0.6777856367550092,2023-05-01 20:25:42.442457,2023-05-01 20:25:52.121474,0 days 00:00:09.679017,0.08458612070076788,friedman_mse,0.003943076736144167,exponential,4,sqrt,0.2521708929607884,10,10,0.026844938418419236,807,0.47539835818240256,0.0010091132221273333,COMPLETE
231,231,0.7601659591817806,2023-05-01 20:25:52.121474,2023-05-01 20:26:00.307892,0 days 00:00:08.186418,0.007450343139741161,friedman_mse,0.003159192924831666,exponential,4,sqrt,0.287948081193904,10,10,0.008491300892805954,845,0.30387308737894975,0.0013851195985043875,COMPLETE
232,232,0.7698296158552586,2023-05-01 20:26:00.315424,2023-05-01 20:26:11.795691,0 days 00:00:11.480267,0.0009064692588340435,friedman_mse,0.003513616004263129,exponential,4,sqrt,0.2579490037976835,10,10,0.00025392984156156334,860,0.5093307302610468,0.00143313602729154,COMPLETE
233,233,0.7728123296658629,2023-05-01 20:26:11.801091,2023-05-01 20:26:20.024904,0 days 00:00:08.223813,0.0007748582092469911,friedman_mse,0.0066279012368111595,exponential,4,sqrt,0.25821605439468376,10,10,0.017427216323185026,823,0.28470193124452164,0.004215050006735329,COMPLETE
234,234,0.7576843639408903,2023-05-01 20:26:20.024904,2023-05-01 20:26:26.619879,0 days 00:00:06.594975,0.010634034662504097,friedman_mse,0.007078802706847538,exponential,4,sqrt,0.24863752928450894,5,10,0.01886273941553218,788,0.27645179868440434,0.00481237256860861,COMPLETE
235,235,0.7543405411408086,2023-05-01 20:26:26.626902,2023-05-01 20:26:34.967396,0 days 00:00:08.340494,0.01962895521619176,friedman_mse,0.0062745696662175445,exponential,4,sqrt,0.22472457972765636,10,10,0.012036669657455224,823,0.3239773390741335,0.0010733834238715106,COMPLETE
