,number,value,datetime_start,datetime_complete,duration,params_ccp_alpha,params_criterion,params_learning_rate,params_loss,params_max_depth,params_max_features,params_min_impurity_decrease,params_min_samples_leaf,params_min_samples_split,params_min_weight_fraction_leaf,params_n_estimators,params_subsample,params_tol,state
633,633,0.7783075038245431,2023-05-01 21:25:14.719762,2023-05-01 21:25:41.072400,0 days 00:00:26.352638,0.00021878723670504198,friedman_mse,0.012264008116924015,exponential,6,sqrt,0.17207083394984396,8,9,0.000237231167255585,979,0.9877254326015861,0.008585113030861725,COMPLETE
634,634,0.5,2023-05-01 21:25:41.077983,2023-05-01 21:25:50.561955,0 days 00:00:09.483972,0.29962081285736925,friedman_mse,0.01236796593193481,exponential,6,sqrt,0.07808932848141265,8,9,0.014446922371752586,382,0.958286245591985,0.008359911681249067,COMPLETE
635,635,0.6777856367550092,2023-05-01 21:25:50.568564,2023-05-01 21:26:16.833709,0 days 00:00:26.265145,0.08264487205451976,friedman_mse,0.010938921117525702,exponential,7,sqrt,0.17345083948663176,8,9,0.0001105525872917238,982,0.9896819475590697,0.011265717109937514,COMPLETE
636,636,0.677508693263377,2023-05-01 21:26:16.838804,2023-05-01 21:26:25.736750,0 days 00:00:08.897946,0.0004294214785231503,friedman_mse,0.01308250807684263,exponential,6,sqrt,0.14633825565439157,8,8,0.28426593659198746,964,0.8816615341011488,0.007018190267136772,COMPLETE
637,637,0.6229400462211727,2023-05-01 21:26:25.742251,2023-05-01 21:26:39.640841,0 days 00:00:13.898590,0.12909308409647152,friedman_mse,0.01439887886267604,exponential,6,log2,0.2000076455967048,8,9,0.031806546161197456,906,0.9056045267080214,0.00752696412942675,COMPLETE
638,638,0.5455893287974873,2023-05-01 21:26:39.645858,2023-05-01 21:26:57.977145,0 days 00:00:18.331287,0.1346748271424336,friedman_mse,0.009019896600973937,exponential,6,sqrt,0.19645331735658728,8,9,0.04753329961900753,892,0.9507950583137856,0.009840137992706825,COMPLETE
639,639,0.5,2023-05-01 21:26:57.983511,2023-05-01 21:27:06.058988,0 days 00:00:08.075477,0.35423949004976324,squared_error,0.01888923825552677,exponential,6,sqrt,0.21615606275746466,9,9,0.019350248596902167,927,0.9023226203049828,0.009443894621965192,COMPLETE
640,640,0.5,2023-05-01 21:27:06.064877,2023-05-01 21:27:14.080499,0 days 00:00:08.015622,0.21811600556879923,friedman_mse,0.009824768458455153,exponential,6,sqrt,0.18636887305849326,8,9,0.3241264709739542,950,0.9865266147791114,0.011259059497611796,COMPLETE
641,641,0.7304010880195999,2023-05-01 21:27:14.086346,2023-05-01 21:27:25.558492,0 days 00:00:11.472146,0.05953023816142061,friedman_mse,0.011332155199870856,exponential,6,sqrt,0.10657545010617064,8,9,0.011056092369720513,999,0.3815479749739864,0.012280492259408526,COMPLETE
642,642,0.6278874804089046,2023-05-01 21:27:25.563984,2023-05-01 21:27:33.728358,0 days 00:00:08.164374,0.024536934195467836,friedman_mse,0.01699622240784862,exponential,6,sqrt,0.221647798538638,8,3,0.38127456923739267,979,0.7856281892339925,0.029019900482419734,COMPLETE
643,643,0.6215938709901028,2023-05-01 21:27:33.733612,2023-05-01 21:27:41.618389,0 days 00:00:07.884777,0.016264434191984065,friedman_mse,0.008231332676219023,exponential,5,sqrt,0.1701966272596769,8,9,0.3991027881190495,914,0.9826156798295494,0.00616419780641851,COMPLETE
644,644,0.6451883171640038,2023-05-01 21:27:41.624985,2023-05-01 21:27:49.445983,0 days 00:00:07.820998,0.00014311077785642514,friedman_mse,0.0005750089606794262,exponential,7,sqrt,0.2049377136444131,8,8,0.35713871870421465,877,0.9496622789381018,0.0008190011424180751,COMPLETE
645,645,0.6724559013814514,2023-05-01 21:27:49.452132,2023-05-01 21:27:58.331313,0 days 00:00:08.879181,0.00011904564635408969,friedman_mse,0.013594056145540384,log_loss,6,sqrt,0.3902723168897328,7,9,0.41287377151172583,938,0.9656095536360526,0.016566620946019604,COMPLETE
646,646,0.7010415260825446,2023-05-01 21:27:58.337343,2023-05-01 21:28:06.112378,0 days 00:00:07.775035,0.03856603325172271,friedman_mse,0.02731990654028333,exponential,5,sqrt,0.40613359919691355,9,9,0.11452281940874255,900,0.3430793799577219,0.00015722176677453512,COMPLETE
647,647,0.5,2023-05-01 21:28:06.117499,2023-05-01 21:28:14.380965,0 days 00:00:08.263466,0.38241294387608477,friedman_mse,0.033396996827559935,exponential,3,sqrt,0.0618391292359028,8,9,0.3399467310131585,965,0.9280812148950551,0.0025381300358905414,COMPLETE
648,648,0.7553607708091045,2023-05-01 21:28:14.384733,2023-05-01 21:28:27.679296,0 days 00:00:13.294563,0.009778969489464882,friedman_mse,0.015897506054381772,exponential,6,log2,0.3560922594249713,10,9,0.05869477977882835,922,0.8889422809133948,0.007069651595511289,COMPLETE
649,649,0.7526415376862043,2023-05-01 21:28:27.684720,2023-05-01 21:28:45.193622,0 days 00:00:17.508902,0.01748586065854916,friedman_mse,0.02130762940512579,exponential,5,sqrt,0.2104596412264925,8,9,0.03627645869119676,893,0.917630138605345,0.00019656833667390893,COMPLETE
650,650,0.7555520555780886,2023-05-01 21:28:45.199167,2023-05-01 21:28:59.598771,0 days 00:00:14.399604,0.010066320609006946,friedman_mse,0.01192529227423346,exponential,3,sqrt,0.09260326405478521,10,9,0.02423904347425783,947,0.9130190511411937,0.011324348551111554,COMPLETE
651,651,0.7523722985518988,2023-05-01 21:28:59.604671,2023-05-01 21:29:16.264562,0 days 00:00:16.659891,0.03025184178399952,friedman_mse,0.00934771375293474,exponential,5,sqrt,0.16461524761004007,9,7,0.008065408035496489,877,0.825706278116009,0.008769205507580195,COMPLETE
652,652,0.7609933831380322,2023-05-01 21:29:16.269957,2023-05-01 21:29:31.362105,0 days 00:00:15.092148,3.26060053923288e-05,friedman_mse,0.01787876303083715,exponential,4,sqrt,0.030888830430194438,10,8,0.12539587402764163,966,0.8657854446537125,0.0001331315795286615,COMPLETE
653,653,0.7519733935133394,2023-05-01 21:29:31.367973,2023-05-01 21:29:45.564549,0 days 00:00:14.196576,0.02261917999192231,friedman_mse,0.03980102805292158,exponential,3,sqrt,0.0006884138224690171,10,9,0.017955131187712556,913,0.9791085558099005,0.008479673128900866,COMPLETE
654,654,0.5,2023-05-01 21:29:45.570076,2023-05-01 21:30:01.286004,0 days 00:00:15.715928,0.44350603887402107,friedman_mse,0.0005182782148368817,exponential,4,sqrt,0.4368751281290289,10,9,3.721867908919145e-05,932,0.818187560849952,0.08863093308669091,COMPLETE
655,655,0.5,2023-05-01 21:30:01.291565,2023-05-01 21:30:08.673809,0 days 00:00:07.382244,0.17494077963140675,squared_error,0.01094167022451492,exponential,4,sqrt,0.32767768538285924,10,9,0.03054343692378642,980,0.46718510571090455,0.014711569041558686,COMPLETE
656,656,0.7566174677635781,2023-05-01 21:30:08.679509,2023-05-01 21:30:26.624069,0 days 00:00:17.944560,0.010417171909816954,friedman_mse,0.014351316342151862,exponential,5,sqrt,0.15831429525588517,10,9,0.009679147538956046,866,0.9616334379684972,0.0007074053582765553,COMPLETE
657,657,0.5,2023-05-01 21:30:26.628309,2023-05-01 21:30:44.326650,0 days 00:00:17.698341,0.33341700061650303,friedman_mse,0.025892878746091325,exponential,4,sqrt,0.29969632877728897,10,9,0.043879148530319156,996,0.9439617547957724,0.002170166943834282,COMPLETE
658,658,0.7570173118020417,2023-05-01 21:30:44.333192,2023-05-01 21:30:53.149009,0 days 00:00:08.815817,0.009138395916507815,friedman_mse,0.021565396232935397,exponential,4,sqrt,0.011352502683955027,10,9,0.021242410362644907,552,0.7520779505693751,0.018061103707160693,COMPLETE
659,659,0.5,2023-05-01 21:30:53.153814,2023-05-01 21:30:59.459998,0 days 00:00:06.306184,0.15358242559843258,friedman_mse,0.008531487812170476,exponential,6,log2,0.19117470642205234,7,8,0.23743612352233856,949,0.30089072932875427,0.0008401606470750692,COMPLETE
660,660,0.5966593365279397,2023-05-01 21:30:59.465701,2023-05-01 21:31:09.055493,0 days 00:00:09.589792,0.1487156957374805,friedman_mse,0.012000196491669784,exponential,4,sqrt,0.08406113024915034,10,9,0.00925683678767629,887,0.43279318395600114,0.006440304853298235,COMPLETE
661,661,0.5,2023-05-01 21:31:09.061161,2023-05-01 21:31:22.081332,0 days 00:00:13.020171,0.23015730469372345,friedman_mse,0.001942480279561791,exponential,3,sqrt,0.05314500729810068,10,9,0.025452563259864773,905,0.8735291802609285,0.0006076530640992138,COMPLETE
662,662,0.754138607054587,2023-05-01 21:31:22.085901,2023-05-01 21:31:29.811805,0 days 00:00:07.725904,0.021654864589173328,friedman_mse,0.01919476265787407,exponential,4,sqrt,0.18442239705291796,9,9,0.034880635299788555,932,0.2818293866358211,0.000958030383191854,COMPLETE
663,663,0.5,2023-05-01 21:31:29.817378,2023-05-01 21:31:32.008492,0 days 00:00:02.191114,0.2639281250192982,friedman_mse,0.01559553147225732,exponential,5,sqrt,0.46072176106155005,10,9,0.11879672297216808,101,0.9933747687433028,0.0002208723717970531,COMPLETE
664,664,0.5,2023-05-01 21:31:32.013253,2023-05-01 21:31:42.254596,0 days 00:00:10.241343,0.23885365156555452,friedman_mse,0.0004875246393416161,exponential,7,sqrt,0.4167298279277995,10,9,0.00010829132471617403,776,0.40814339501904934,0.020821907922439306,COMPLETE
665,665,0.5,2023-05-01 21:31:42.260433,2023-05-01 21:31:51.316538,0 days 00:00:09.056105,0.1432042961431792,friedman_mse,0.024169902005282108,log_loss,4,sqrt,0.2292059379852966,8,5,0.06362161958523838,958,0.32728924580790375,0.005554675558719448,COMPLETE
666,666,0.5,2023-05-01 21:31:51.322499,2023-05-01 21:32:00.958585,0 days 00:00:09.636086,0.49573789584344163,friedman_mse,0.012976325686274067,exponential,4,sqrt,0.4271973829862358,10,9,0.016095992035288234,999,0.36039764972293126,0.02170265392600023,COMPLETE
667,667,0.7029144915547614,2023-05-01 21:32:00.963805,2023-05-01 21:32:11.010108,0 days 00:00:10.046303,0.008549042478820826,friedman_mse,0.009643581025141937,exponential,4,sqrt,0.07039622333668116,10,9,0.1994686183307659,857,0.8599975165576483,0.014592866593679324,COMPLETE
668,668,0.7471359215017715,2023-05-01 21:32:11.016916,2023-05-01 21:32:25.912505,0 days 00:00:14.895589,0.03283566683484521,friedman_mse,0.01709215392521156,exponential,4,sqrt,0.10910095405634901,10,8,0.04601899098524081,917,0.8407501415309226,0.00017354873146262296,COMPLETE
669,669,0.6332758355598268,2023-05-01 21:32:25.916943,2023-05-01 21:32:30.123025,0 days 00:00:04.206082,0.01716140432166697,friedman_mse,0.020056850106044535,exponential,3,sqrt,0.13304076428941777,10,9,0.4418231126057641,723,0.2022229573576423,0.0004012748818530267,COMPLETE
670,670,0.5,2023-05-01 21:32:30.128850,2023-05-01 21:32:40.823757,0 days 00:00:10.694907,0.06391170417823532,friedman_mse,0.08672270474825958,exponential,4,sqrt,0.017966044686045124,10,9,0.13805605803663235,750,0.9956872913163927,0.04011235105411716,COMPLETE
671,671,0.5,2023-05-01 21:32:40.829889,2023-05-01 21:32:54.789503,0 days 00:00:13.959614,0.4289767775527759,friedman_mse,0.013722716275453812,exponential,4,log2,0.11707218647211859,10,9,0.015123288785580145,976,0.998952797445793,0.008988119169440232,COMPLETE
672,672,0.5,2023-05-01 21:32:54.794569,2023-05-01 21:33:12.517526,0 days 00:00:17.722957,0.1940663544053321,friedman_mse,0.008086041858811054,exponential,5,sqrt,0.17783005834541116,9,9,0.023408439031511775,889,0.9452414931800844,0.00024403674475219526,COMPLETE
673,673,0.7774520029180095,2023-05-01 21:33:12.524083,2023-05-01 21:33:24.372197,0 days 00:00:11.848114,0.0001869764010824679,friedman_mse,0.010707644670613125,exponential,4,sqrt,0.4069090870579078,10,9,0.007800181612852671,870,0.45712703258059817,0.0005698937381127112,COMPLETE
674,674,0.5,2023-05-01 21:33:24.376710,2023-05-01 21:33:31.031067,0 days 00:00:06.654357,0.3181697398190495,friedman_mse,0.011584729597399727,exponential,4,sqrt,0.4013577972514271,10,9,0.25756597058017017,853,0.4603891129185327,0.0006062637369703435,COMPLETE
675,675,0.5,2023-05-01 21:33:31.037173,2023-05-01 21:33:37.382252,0 days 00:00:06.345079,0.04861020209061545,squared_error,0.001171613155584884,exponential,4,sqrt,0.38698613273676147,10,9,0.0901430715710949,868,0.4510790512445348,0.0005031972586148571,COMPLETE
676,676,0.7534875402341389,2023-05-01 21:33:37.387937,2023-05-01 21:33:48.042539,0 days 00:00:10.654602,0.010011826318043478,friedman_mse,0.01011348546665949,exponential,3,sqrt,0.3723533687936648,10,9,0.08655163831901463,798,0.8121323855014451,0.00044480314450222607,COMPLETE
677,677,0.5,2023-05-01 21:33:48.048083,2023-05-01 21:33:55.147363,0 days 00:00:07.099280,0.10692698503154295,friedman_mse,0.009764028287366316,exponential,5,sqrt,0.40926588544966297,6,9,0.17671254731926095,845,0.4283568176764743,0.0005437061701964746,COMPLETE
678,678,0.7349474956699351,2023-05-01 21:33:55.153607,2023-05-01 21:34:05.517900,0 days 00:00:10.364293,0.00036684121731759206,friedman_mse,0.04625324889666054,exponential,6,sqrt,0.39265776703734306,10,9,0.1641167137858232,870,0.7945273459755549,0.0006943786648683209,COMPLETE
679,679,0.777111870489891,2023-05-01 21:34:05.524070,2023-05-01 21:34:16.820582,0 days 00:00:11.296512,0.00012966289828298143,friedman_mse,0.012448968427725332,exponential,4,sqrt,0.318422770707772,10,9,0.011682080231937212,822,0.47163423576346014,0.0030087710573232797,COMPLETE
680,680,0.5,2023-05-01 21:34:16.824733,2023-05-01 21:34:21.665167,0 days 00:00:04.840434,0.36749551840668027,friedman_mse,0.01272613408949038,exponential,4,sqrt,0.31097591838454536,10,9,0.03585384856614797,821,0.10007739607541438,0.003523211004534611,COMPLETE
681,681,0.6215938709901028,2023-05-01 21:34:21.670620,2023-05-01 21:34:27.772043,0 days 00:00:06.101423,0.01777839677680744,friedman_mse,0.011263322270443374,exponential,4,sqrt,0.3215337919724666,8,9,0.4509468444283754,804,0.48683119275332615,0.002486589101042274,COMPLETE
682,682,0.6733192126743365,2023-05-01 21:34:27.777054,2023-05-01 21:34:33.957420,0 days 00:00:06.180366,0.00019213803333283184,friedman_mse,0.014987432354929178,exponential,4,sqrt,0.33315420626244985,9,9,0.3900497749723778,791,0.4651288214848811,0.0026883561498981605,COMPLETE
683,683,0.5,2023-05-01 21:34:33.962495,2023-05-01 21:34:40.395966,0 days 00:00:06.433471,0.4992510160079547,friedman_mse,0.010532353008104553,exponential,3,log2,0.30601432353192626,10,9,0.22548356558193378,825,0.4808312705984639,0.003384916071051709,COMPLETE
684,684,0.5,2023-05-01 21:34:40.401518,2023-05-01 21:34:55.193829,0 days 00:00:14.792311,0.23424382894985085,friedman_mse,0.012960241497922164,log_loss,4,sqrt,0.315663416096041,10,9,0.009425461549505727,817,0.9291186835768278,0.005246202332457044,COMPLETE
685,685,0.6276955546463866,2023-05-01 21:34:55.198844,2023-05-01 21:35:00.403708,0 days 00:00:05.204864,0.027804355374787555,friedman_mse,0.008791358223251606,exponential,4,sqrt,0.3378655962025371,10,9,0.2784429888772724,771,0.4570830192957168,0.030872340163508094,COMPLETE
686,686,0.5,2023-05-01 21:35:00.408548,2023-05-01 21:35:04.836782,0 days 00:00:04.428234,0.4033293020809047,friedman_mse,0.014758906942764747,exponential,4,sqrt,0.03684216398485175,10,8,0.37129729841607023,845,0.16061491290304342,0.002345069812528522,COMPLETE
687,687,0.7577015343636401,2023-05-01 21:35:04.845378,2023-05-01 21:35:15.439534,0 days 00:00:10.594156,0.00960274710572634,friedman_mse,0.011103985360797732,exponential,5,sqrt,0.3576238723280267,9,9,4.48686905409057e-05,836,0.43812471296173916,0.003094567727979395,COMPLETE
688,688,0.5,2023-05-01 21:35:15.443965,2023-05-01 21:35:24.510763,0 days 00:00:09.066798,0.25462475850466426,friedman_mse,0.01740567285123622,exponential,3,sqrt,0.3237904636929021,10,2,0.02786617561485851,811,0.47327285074720715,0.007938436370055105,COMPLETE
689,689,0.5,2023-05-01 21:35:24.517475,2023-05-01 21:35:34.411696,0 days 00:00:09.894221,0.37754442479016903,friedman_mse,0.030050863905069006,exponential,4,sqrt,0.29443260059903875,10,9,0.2129214407951628,837,0.724104339395213,0.00398632111522194,COMPLETE
690,690,0.7541759282665901,2023-05-01 21:35:34.415810,2023-05-01 21:35:44.511117,0 days 00:00:10.095307,0.016313653069271548,friedman_mse,0.012343358013703381,exponential,6,sqrt,0.3493906521956496,10,9,0.016593552306983967,647,0.6739380148750157,0.0020715961997955787,COMPLETE
691,691,0.747857743717826,2023-05-01 21:35:44.516949,2023-05-01 21:35:55.141565,0 days 00:00:10.624616,0.038948609016880575,friedman_mse,0.007630910141720151,exponential,4,sqrt,0.09851445887109907,10,9,0.05025239851794808,802,0.758957365562761,0.09743957921129302,COMPLETE
692,692,0.7584403814445468,2023-05-01 21:35:55.146402,2023-05-01 21:36:09.287265,0 days 00:00:14.140863,0.008336713458991651,friedman_mse,0.016049676215523008,exponential,4,sqrt,0.0496625693754718,10,8,0.009537923808111963,979,0.8432431002235398,0.02294561273066666,COMPLETE
693,693,0.7751894400568157,2023-05-01 21:36:09.294685,2023-05-01 21:36:19.197082,0 days 00:00:09.902397,0.00036956929183674134,friedman_mse,0.009797616846899594,exponential,5,sqrt,0.21805936615551466,10,9,0.028750375294915125,789,0.497629743660694,0.004803553694850497,COMPLETE
694,694,0.5,2023-05-01 21:36:19.203104,2023-05-01 21:36:23.837141,0 days 00:00:04.634037,0.20726646312174368,squared_error,0.06725703777944718,exponential,5,log2,0.20413499393292694,10,9,0.0400475683025076,779,0.44221895884305445,0.004323109855240686,COMPLETE
695,695,0.7521777744144326,2023-05-01 21:36:23.845338,2023-05-01 21:36:32.694363,0 days 00:00:08.849025,0.02469587372659359,friedman_mse,0.009003160207709617,exponential,5,sqrt,0.2300029673442183,8,9,0.0318511302388101,816,0.5061615714545262,0.005304228608878553,COMPLETE
696,696,0.5,2023-05-01 21:36:32.701144,2023-05-01 21:36:40.207826,0 days 00:00:07.506682,0.3907603873644528,friedman_mse,0.0003315882408845484,exponential,5,sqrt,0.19652279861290362,10,9,0.03876943143730379,780,0.4205551483880457,0.006453315136433033,COMPLETE
697,697,0.6749546610936953,2023-05-01 21:36:40.213848,2023-05-01 21:36:46.173083,0 days 00:00:05.959235,0.008866923745474516,friedman_mse,0.0017527756181646298,exponential,5,sqrt,0.2217235408895833,9,9,0.2442673283931474,793,0.4882986582024604,0.005782149434428048,COMPLETE
698,698,0.6229400462211727,2023-05-01 21:36:46.178432,2023-05-01 21:36:54.233449,0 days 00:00:08.055017,0.11663865112772,friedman_mse,0.010594503897263815,exponential,5,sqrt,0.026119062593300248,10,9,0.057180524118403554,770,0.5096658702575174,0.05713778190056192,COMPLETE
699,699,0.5,2023-05-01 21:36:54.241670,2023-05-01 21:36:59.986480,0 days 00:00:05.744810,0.26982720740884025,friedman_mse,0.008085123279269716,exponential,5,sqrt,0.2030632550259143,10,9,0.35640754493055604,787,0.7077144143036319,0.027267992139691687,COMPLETE
700,700,0.7096263503851216,2023-05-01 21:36:59.994542,2023-05-01 21:37:06.449069,0 days 00:00:06.454527,0.01717914793285172,friedman_mse,0.010034349588545492,exponential,5,sqrt,0.20924300977909324,9,9,0.15029348338388826,751,0.49397706621183235,0.0007668231013165519,COMPLETE
701,701,0.6777856367550092,2023-05-01 21:37:06.457587,2023-05-01 21:37:18.522510,0 days 00:00:12.064923,0.08533744710866781,friedman_mse,0.013458663309964326,exponential,5,sqrt,0.2870300951064621,10,8,0.0260458994477794,807,0.772138682721602,0.00483402822285593,COMPLETE
702,702,0.68601010916624,2023-05-01 21:37:18.527783,2023-05-01 21:37:22.901467,0 days 00:00:04.373684,0.0008133166726213722,friedman_mse,0.06135660717128039,exponential,5,sqrt,0.2108092271924649,7,9,0.29340662745721763,820,0.17705542246978212,0.00324379494527332,COMPLETE
703,703,0.6601637857591887,2023-05-01 21:37:22.909258,2023-05-01 21:37:27.925146,0 days 00:00:05.015888,0.008962894868310502,friedman_mse,0.008695749170784433,exponential,5,sqrt,0.2215794328737161,10,9,0.3005229372576117,739,0.46340184233186854,0.004983989421139169,COMPLETE
704,704,0.5,2023-05-01 21:37:27.931012,2023-05-01 21:37:32.205717,0 days 00:00:04.274705,0.34263451275958523,friedman_mse,0.011651737033960965,exponential,5,sqrt,0.48827398888792434,10,9,0.47678152955541575,797,0.22581613061748307,0.002952989349490418,COMPLETE
705,705,0.5,2023-05-01 21:37:32.214077,2023-05-01 21:37:42.955291,0 days 00:00:10.741214,0.12609695187789643,friedman_mse,0.0002649198382926472,log_loss,7,sqrt,0.06862040532073067,10,9,0.02167241648318302,842,0.5340066787366432,0.001920042647890027,COMPLETE
706,706,0.5,2023-05-01 21:37:42.962943,2023-05-01 21:37:49.489820,0 days 00:00:06.526877,0.19479115484544215,friedman_mse,0.00022780074653979567,exponential,5,sqrt,0.24031451581218125,10,7,0.38136882180562615,852,0.8989622347220321,0.006856064351778513,COMPLETE
707,707,0.7527594953474537,2023-05-01 21:37:49.496851,2023-05-01 21:37:59.260833,0 days 00:00:09.763982,0.00010005112846190676,friedman_mse,0.0014364372557344714,exponential,3,log2,0.4000474797969629,10,9,0.04718035388536536,831,0.9734481122214328,0.005722790479376092,COMPLETE
708,708,0.5,2023-05-01 21:37:59.268889,2023-05-01 21:38:07.662894,0 days 00:00:08.394005,0.4492975663082681,friedman_mse,0.00988456784237988,exponential,6,sqrt,0.30407427194835346,9,9,0.03107153221786599,865,0.39661644916348787,0.004637541543105506,COMPLETE
709,709,0.7491213279369587,2023-05-01 21:38:07.669764,2023-05-01 21:38:12.616846,0 days 00:00:04.947082,0.027780326597918376,friedman_mse,0.0009074880683207563,exponential,8,sqrt,0.3784068158988654,10,9,0.07436882579919182,764,0.19458521973862392,0.0035927168688020413,COMPLETE
710,710,0.6206882619625395,2023-05-01 21:38:12.621814,2023-05-01 21:38:16.865182,0 days 00:00:04.243368,0.016818232087288453,friedman_mse,0.0073802375005928835,exponential,5,sqrt,0.1841826317668448,10,8,0.45959168349310364,816,0.21148218761342788,0.05107602351965066,COMPLETE
711,711,0.5,2023-05-01 21:38:16.873462,2023-05-01 21:38:23.477297,0 days 00:00:06.603835,0.3598003450576538,friedman_mse,0.024676233556958284,exponential,5,sqrt,0.23320953616029524,8,9,0.3061731502767577,860,0.7362924037986103,0.0009302886928114999,COMPLETE
712,712,0.6564155977515448,2023-05-01 21:38:23.482658,2023-05-01 21:38:32.688892,0 days 00:00:09.206234,0.051897560248747754,friedman_mse,0.03425405501092309,exponential,3,sqrt,0.364647910672839,10,9,0.10265633674966901,804,0.8006476075808242,0.0006044418216203846,COMPLETE
