,number,value,datetime_start,datetime_complete,duration,params_ccp_alpha,params_criterion,params_learning_rate,params_loss,params_max_depth,params_max_features,params_min_impurity_decrease,params_min_samples_leaf,params_min_samples_split,params_min_weight_fraction_leaf,params_n_estimators,params_subsample,params_tol,state
955,955,0.5,2023-05-01 23:11:28.056521,2023-05-01 23:11:37.021715,0 days 00:00:08.965194,0.38842248522471695,friedman_mse,0.03467685533644282,exponential,4,sqrt,0.26466019959749626,10,9,0.09577716055257739,898,0.4331551025081789,0.0033607099094205817,COMPLETE
956,956,0.5,2023-05-01 23:11:37.029603,2023-05-01 23:11:45.250717,0 days 00:00:08.221114,0.45197880587197015,friedman_mse,0.048754861495123564,exponential,4,sqrt,0.030692230367936366,9,9,0.35188867460024753,844,0.5216823981640224,0.0024348558058574785,COMPLETE
957,957,0.5,2023-05-01 23:11:45.261288,2023-05-01 23:12:00.929714,0 days 00:00:15.668426,0.2875436713419561,friedman_mse,0.027678716645526368,exponential,6,sqrt,0.39671560284127083,10,9,0.033373686607682015,984,0.3667220093796351,0.0026219596037581026,COMPLETE
958,958,0.7253777123185161,2023-05-01 23:12:00.936497,2023-05-01 23:12:15.764420,0 days 00:00:14.827923,0.0400848354184497,friedman_mse,0.084751215233215,exponential,4,sqrt,0.4148067354102972,5,10,5.7003340148714665e-05,771,0.9083733115908318,0.009950785119232631,COMPLETE
959,959,0.6889208734086377,2023-05-01 23:12:15.769652,2023-05-01 23:12:22.956640,0 days 00:00:07.186988,0.02580710173630131,friedman_mse,0.023461660499783068,exponential,5,log2,0.22283548015807175,7,9,0.20562813976418087,905,0.4858905578033261,0.0030502717620215984,COMPLETE
960,960,0.6559100671840807,2023-05-01 23:12:22.965887,2023-05-01 23:12:57.539393,0 days 00:00:34.573506,0.09298288009239729,friedman_mse,0.017106103424568503,exponential,10,sqrt,0.28576544806647,10,9,0.030081914533065805,877,0.9712125748282445,0.00312783559626962,COMPLETE
961,961,0.7574262197611163,2023-05-01 23:12:57.562823,2023-05-01 23:13:16.026656,0 days 00:00:18.463833,0.008421642666358479,friedman_mse,0.03562002843528649,exponential,4,sqrt,0.3734656350788599,10,9,0.049416816818341015,984,0.7797788404040601,0.00664445554214279,COMPLETE
962,962,0.5,2023-05-01 23:13:16.033693,2023-05-01 23:13:18.429298,0 days 00:00:02.395605,0.3699866980535933,friedman_mse,0.03139189953609523,exponential,4,sqrt,0.23805251568423605,10,9,0.01552236827626538,223,0.235790808319034,0.002845874456639472,COMPLETE
963,963,0.5,2023-05-01 23:13:18.437833,2023-05-01 23:13:27.466220,0 days 00:00:09.028387,0.43719832863082553,squared_error,0.05664248412790173,exponential,3,sqrt,0.4335946758747284,3,9,0.12227958489450896,965,0.9396352391980463,0.002136031355935253,COMPLETE
964,964,0.5,2023-05-01 23:13:27.471047,2023-05-01 23:13:34.449026,0 days 00:00:06.977979,0.3171273488445203,friedman_mse,0.03829945017140326,exponential,5,sqrt,0.41273596863383555,10,9,0.10530524843162109,821,0.2858184409224927,0.004450211903430013,COMPLETE
965,965,0.632348100975401,2023-05-01 23:13:34.455810,2023-05-01 23:13:53.211286,0 days 00:00:18.755476,0.12050210906257824,friedman_mse,0.002574723583989113,exponential,4,sqrt,0.20684431273033474,9,10,0.02442395268959759,852,0.32925439179892846,0.007913122338949214,COMPLETE
966,966,0.5,2023-05-01 23:13:53.247250,2023-05-01 23:14:12.994883,0 days 00:00:19.747633,0.23545521894245697,friedman_mse,0.037092320602781156,exponential,8,sqrt,0.2946245264286515,10,9,0.040129944233671326,984,0.3047514419503766,0.012090815146362151,COMPLETE
967,967,0.6737181260279572,2023-05-01 23:14:13.003622,2023-05-01 23:14:20.142479,0 days 00:00:07.138857,0.0004594762606560281,friedman_mse,0.013818482450668239,exponential,4,log2,0.02146166591758908,1,9,0.26133647886340566,799,0.7452680597558932,0.05777835868029351,COMPLETE
968,968,0.7545802862278795,2023-05-01 23:14:20.150520,2023-05-01 23:14:32.380912,0 days 00:00:12.230392,0.020641446067957793,friedman_mse,0.019939922086826253,exponential,4,sqrt,0.16772150282570503,10,9,0.009238164387272357,743,0.7234323381792646,0.00011027384179026205,COMPLETE
969,969,0.5,2023-05-01 23:14:32.387275,2023-05-01 23:14:38.445889,0 days 00:00:06.058614,0.12407605345909262,friedman_mse,0.02469190388686197,exponential,5,sqrt,0.06306329958302309,10,10,0.2851595446514802,954,0.21648439364884253,0.024540859642810366,COMPLETE
970,970,0.7051843375497059,2023-05-01 23:14:38.452260,2023-05-01 23:14:54.148236,0 days 00:00:15.695976,0.00020262977151788686,friedman_mse,0.015477351364062232,exponential,3,sqrt,0.3938738197537674,10,9,0.23512495686288779,886,0.5418674355208493,0.0004609904654938435,COMPLETE
971,971,0.5,2023-05-01 23:14:54.173220,2023-05-01 23:15:10.084706,0 days 00:00:15.911486,0.10475862552864977,friedman_mse,0.03287459197681639,exponential,9,sqrt,0.19295351129916433,9,9,0.3151700908327072,911,0.8252716194061757,0.0008391302595633498,COMPLETE
972,972,0.6872915116934649,2023-05-01 23:15:10.094864,2023-05-01 23:15:18.220013,0 days 00:00:08.125149,0.015144932898489843,friedman_mse,0.012407767040726563,log_loss,4,sqrt,0.3516251663620221,10,9,0.05633908412570929,1000,0.10162324884906992,0.01925013748173921,COMPLETE
973,973,0.7583910118368088,2023-05-01 23:15:18.226894,2023-05-01 23:15:33.562541,0 days 00:00:15.335647,0.009267095044495799,friedman_mse,0.04370738668175447,exponential,6,sqrt,0.27267301015406,6,5,0.02585537556376064,831,0.6147117499528585,0.0038044892631188616,COMPLETE
974,974,0.5,2023-05-01 23:15:33.577255,2023-05-01 23:15:45.384131,0 days 00:00:11.806876,0.3994220447393045,friedman_mse,0.01771960596121958,exponential,4,sqrt,0.330273623047892,10,9,0.40472574137521794,974,0.45348659307834344,0.005774853899013252,COMPLETE
975,975,0.7473920169472811,2023-05-01 23:15:45.394501,2023-05-01 23:15:53.595484,0 days 00:00:08.200983,0.03760228014431158,friedman_mse,0.011078056319762244,exponential,5,log2,0.43939269541250847,7,9,0.035302623457475715,940,0.27899032787321093,0.0009285309923941423,COMPLETE
976,976,0.5,2023-05-01 23:15:53.605713,2023-05-01 23:16:01.257836,0 days 00:00:07.652123,0.33036165270581186,friedman_mse,0.00019265788039404244,exponential,7,sqrt,0.42591447265440435,10,9,0.3269392440896859,858,0.8622483892655477,0.0017578910571323034,COMPLETE
977,977,0.5,2023-05-01 23:16:01.270962,2023-05-01 23:16:10.491034,0 days 00:00:09.220072,0.4685531370924262,friedman_mse,0.021408940250098037,exponential,4,sqrt,0.31467132951597465,10,10,0.12158994598144401,966,0.1571993628877214,0.0027035759154776457,COMPLETE
978,978,0.7772472591879316,2023-05-01 23:16:10.502291,2023-05-01 23:16:28.530292,0 days 00:00:18.028001,0.0003071661578051815,friedman_mse,0.06117117637117846,exponential,4,sqrt,0.4939826246146193,8,4,0.0002534743375900289,895,0.7690582447210844,0.0005223283285056929,COMPLETE
979,979,0.5,2023-05-01 23:16:28.538914,2023-05-01 23:16:37.956084,0 days 00:00:09.417170,0.409025356510247,friedman_mse,0.00010126082737330782,exponential,3,sqrt,0.4859733183254551,8,2,4.941355622658031e-05,875,0.5010327819186028,0.0005487965262272693,COMPLETE
980,980,0.5221924549169888,2023-05-01 23:16:37.963262,2023-05-01 23:16:50.651151,0 days 00:00:12.687889,0.14221114304624127,friedman_mse,0.07416163208390257,exponential,4,sqrt,0.44859913844707855,8,5,0.008808413527334824,783,0.7672297836700526,0.0004831251911533932,COMPLETE
981,981,0.7440797106167504,2023-05-01 23:16:50.659048,2023-05-01 23:17:21.663508,0 days 00:00:31.004460,0.02853648937204486,friedman_mse,0.058902832061794946,exponential,5,sqrt,0.37202986171526237,8,4,0.00738117574559583,832,0.8950726815618797,0.0007188657246133881,COMPLETE
982,982,0.5,2023-05-01 23:17:21.673773,2023-05-01 23:17:30.480917,0 days 00:00:08.807144,0.018269955250348434,squared_error,0.08088823775391647,exponential,4,sqrt,0.45262432355743193,8,6,0.15766312827318596,985,0.9144906829795385,0.00042500307782587354,COMPLETE
983,983,0.7557207203349927,2023-05-01 23:17:30.488639,2023-05-01 23:17:40.887053,0 days 00:00:10.398414,0.009116514747411843,friedman_mse,0.09074757162064571,exponential,3,log2,0.4539230849496787,8,3,0.00045766527093168627,869,0.8683657199923378,0.0005625586303525567,COMPLETE
984,984,0.6352480568926671,2023-05-01 23:17:40.894162,2023-05-01 23:17:49.769144,0 days 00:00:08.874982,0.009259748806113433,friedman_mse,0.04656667251992554,exponential,4,sqrt,0.4935407975898443,8,4,0.4411199277776519,954,0.7911465453076214,0.0005992660167151735,COMPLETE
985,985,0.7481914578256603,2023-05-01 23:17:49.776227,2023-05-01 23:18:09.880484,0 days 00:00:20.104257,0.018910044902527866,friedman_mse,0.08713762076192723,exponential,5,sqrt,0.4915748129598008,8,10,0.01630465252026158,808,0.8785662947258901,0.00038378588708055787,COMPLETE
986,986,0.5,2023-05-01 23:18:09.898215,2023-05-01 23:18:25.431450,0 days 00:00:15.533235,0.15677669396819255,friedman_mse,0.06606136555969014,exponential,4,sqrt,0.45930285561493883,8,5,0.015497425805196715,892,0.4711748359292885,0.0005146323406027883,COMPLETE
987,987,0.6040520369134832,2023-05-01 23:18:25.438659,2023-05-01 23:18:35.583332,0 days 00:00:10.144673,0.05235919776251657,friedman_mse,0.014015491539029383,exponential,4,sqrt,0.45687447908692613,8,3,0.2141714516731154,844,0.8282737746159344,0.007824843636575176,COMPLETE
988,988,0.7580828515920324,2023-05-01 23:18:35.589310,2023-05-01 23:18:56.458706,0 days 00:00:20.869396,0.009194880859954617,friedman_mse,0.015981351611869525,exponential,4,sqrt,0.4831626790706003,8,5,0.008214070986500264,973,0.8044389225319036,0.006438987563626291,COMPLETE
989,989,0.5966593365279397,2023-05-01 23:18:56.468966,2023-05-01 23:19:16.003522,0 days 00:00:19.534556,0.13306997238123308,friedman_mse,0.018531428238365635,exponential,5,sqrt,0.44132487327791153,8,4,0.01911247723817843,932,0.8132303688534233,0.01093703763704736,COMPLETE
990,990,0.7661916732471657,2023-05-01 23:19:16.014938,2023-05-01 23:19:33.575432,0 days 00:00:17.560494,9.269640592377975e-05,friedman_mse,0.05425939169550593,exponential,6,sqrt,0.35793190618541104,8,3,0.008493842052468734,982,0.5687785181608289,0.01353681035658709,COMPLETE
991,991,0.5,2023-05-01 23:19:33.585253,2023-05-01 23:19:49.247451,0 days 00:00:15.662198,0.29552938796386957,friedman_mse,0.05671904875088546,log_loss,4,log2,0.48029351087323535,8,4,0.17346950484328402,685,0.5280997225706338,0.005104276690011961,COMPLETE
992,992,0.5,2023-05-01 23:19:49.293817,2023-05-01 23:20:14.941550,0 days 00:00:25.647733,0.2980331370899418,friedman_mse,0.03891091297579273,exponential,3,sqrt,0.4792001163702103,8,2,0.00011855979769257417,1000,0.8828949065109885,0.0007616100828937822,COMPLETE
993,993,0.7475780824410293,2023-05-01 23:20:14.944707,2023-05-01 23:20:29.817194,0 days 00:00:14.872487,0.023557534754386725,friedman_mse,0.042553057549372844,exponential,4,sqrt,0.4918655013954558,7,9,0.022787839778964415,953,0.7569420037956215,0.036817159019791455,COMPLETE
994,994,0.7773890555529992,2023-05-01 23:20:29.824472,2023-05-01 23:20:56.655227,0 days 00:00:26.830755,7.63728141381398e-05,friedman_mse,0.012041484824011168,exponential,5,sqrt,0.4712456858307147,8,10,0.015564886676315014,918,0.837707888070875,0.009281546196909572,COMPLETE
995,995,0.632714103018278,2023-05-01 23:20:56.676774,2023-05-01 23:21:07.512395,0 days 00:00:10.835621,0.03130456254660621,friedman_mse,0.050015168308555735,exponential,5,sqrt,0.46533201715271505,8,10,0.3620848619296288,907,0.8490652995450609,0.00953883031133579,COMPLETE
996,996,0.7549214148414733,2023-05-01 23:21:07.520755,2023-05-01 23:21:24.632863,0 days 00:00:17.112108,0.016753129303630973,friedman_mse,0.002183433489023178,exponential,5,sqrt,0.4796009878359365,8,10,0.013535823175892301,901,0.8074217456196233,0.008885445540957724,COMPLETE
997,997,0.692235852153231,2023-05-01 23:21:24.639962,2023-05-01 23:21:33.977674,0 days 00:00:09.337712,0.00012384606959662018,friedman_mse,0.011793131036512446,exponential,5,sqrt,0.4689392210546549,8,10,0.25501865433778353,712,0.5987401208962729,0.00813062726178479,COMPLETE
998,998,0.5,2023-05-01 23:21:33.987644,2023-05-01 23:21:47.251694,0 days 00:00:13.264050,0.2550156990144993,friedman_mse,0.010215175668169327,exponential,5,sqrt,0.4979186797860084,8,10,0.02637780054219803,297,0.8609733573756535,0.010733271106479087,COMPLETE
999,999,0.5,2023-05-01 23:21:47.265025,2023-05-01 23:22:04.079276,0 days 00:00:16.814251,0.2835974429240358,friedman_mse,0.013128607408054117,exponential,5,sqrt,0.4456822131609282,8,10,0.09127878436902268,885,0.833923151878257,0.00724623328116451,COMPLETE
