,number,value,datetime_start,datetime_complete,duration,params_bootstrap,params_criterion,params_max_depth,params_max_leaf_nodes,params_min_samples_leaf,params_n_estimators,state
949,949,0.7622959994575249,2023-06-01 02:43:55.024621,2023-06-01 02:44:03.253949,0 days 00:00:08.229328,True,gini,9,10,4,570,COMPLETE
950,950,0.7624395888735392,2023-06-01 02:44:03.257719,2023-06-01 02:44:10.967955,0 days 00:00:07.710236,True,entropy,10,10,7,533,COMPLETE
951,951,0.7628058858516271,2023-06-01 02:44:10.967955,2023-06-01 02:44:18.584318,0 days 00:00:07.616363,True,entropy,10,10,5,511,COMPLETE
952,952,0.7625871251989595,2023-06-01 02:44:18.586729,2023-06-01 02:44:27.540950,0 days 00:00:08.954221,True,entropy,10,10,4,611,COMPLETE
953,953,0.7625804011923876,2023-06-01 02:44:27.540950,2023-06-01 02:44:34.897165,0 days 00:00:07.356215,True,entropy,10,10,6,490,COMPLETE
954,954,0.7625124340538172,2023-06-01 02:44:34.897165,2023-06-01 02:44:41.563307,0 days 00:00:06.666142,True,entropy,10,10,4,449,COMPLETE
955,955,0.7630042579696108,2023-06-01 02:44:41.563307,2023-06-01 02:44:48.651122,0 days 00:00:07.087815,True,entropy,10,10,5,478,COMPLETE
956,956,0.7631651943706306,2023-06-01 02:44:48.651122,2023-06-01 02:44:57.389294,0 days 00:00:08.738172,True,entropy,10,10,5,514,COMPLETE
957,957,0.7617973242199089,2023-06-01 02:44:57.389294,2023-06-01 02:45:10.606258,0 days 00:00:13.216964,True,entropy,6,10,4,746,COMPLETE
958,958,0.761768407002201,2023-06-01 02:45:10.608542,2023-06-01 02:45:17.258735,0 days 00:00:06.650193,True,entropy,10,9,4,462,COMPLETE
959,959,0.7621935739016517,2023-06-01 02:45:17.258735,2023-06-01 02:45:33.614787,0 days 00:00:16.356052,False,entropy,10,10,7,839,COMPLETE
960,960,0.7630284676914113,2023-06-01 02:45:33.614787,2023-06-01 02:45:41.398132,0 days 00:00:07.783345,True,entropy,10,10,5,540,COMPLETE
961,961,0.7628624103689805,2023-06-01 02:45:41.400441,2023-06-01 02:45:49.622453,0 days 00:00:08.222012,True,entropy,10,10,6,562,COMPLETE
962,962,0.7628111094807809,2023-06-01 02:45:49.622453,2023-06-01 02:45:57.160201,0 days 00:00:07.537748,True,entropy,10,10,4,506,COMPLETE
963,963,0.7625912639961079,2023-06-01 02:45:57.160201,2023-06-01 02:46:04.336421,0 days 00:00:07.176220,True,entropy,10,10,5,470,COMPLETE
964,964,0.7612869546075279,2023-06-01 02:46:04.336421,2023-06-01 02:46:10.887316,0 days 00:00:06.550895,True,entropy,9,9,4,451,COMPLETE
965,965,0.7621080859472997,2023-06-01 02:46:10.887850,2023-06-01 02:46:17.909085,0 days 00:00:07.021235,True,gini,10,10,5,482,COMPLETE
966,966,0.7626220499033588,2023-06-01 02:46:17.911046,2023-06-01 02:46:25.308912,0 days 00:00:07.397866,True,entropy,10,10,4,495,COMPLETE
967,967,0.7626311177801334,2023-06-01 02:46:25.312658,2023-06-01 02:46:34.005073,0 days 00:00:08.692415,True,entropy,10,10,5,530,COMPLETE
968,968,0.7627851130079895,2023-06-01 02:46:34.005073,2023-06-01 02:46:45.950583,0 days 00:00:11.945510,True,entropy,10,10,6,602,COMPLETE
969,969,0.7626287475121265,2023-06-01 02:46:45.950583,2023-06-01 02:46:55.623055,0 days 00:00:09.672472,True,entropy,10,10,4,632,COMPLETE
970,970,0.7629240413184833,2023-06-01 02:46:55.625287,2023-06-01 02:47:02.107678,0 days 00:00:06.482391,True,entropy,10,10,7,441,COMPLETE
971,971,0.7628294902271124,2023-06-01 02:47:02.110912,2023-06-01 02:47:10.172141,0 days 00:00:08.061229,True,entropy,10,10,5,554,COMPLETE
972,972,0.7626464526254892,2023-06-01 02:47:10.172141,2023-06-01 02:47:17.023829,0 days 00:00:06.851688,True,entropy,9,10,4,467,COMPLETE
973,973,0.7627736692480994,2023-06-01 02:47:17.026255,2023-06-01 02:47:24.384860,0 days 00:00:07.358605,True,entropy,10,10,4,504,COMPLETE
974,974,0.7625599069477147,2023-06-01 02:47:24.384860,2023-06-01 02:47:32.961770,0 days 00:00:08.576910,True,entropy,10,10,5,585,COMPLETE
975,975,0.7544687906756311,2023-06-01 02:47:32.961770,2023-06-01 02:47:38.625868,0 days 00:00:05.664098,True,entropy,10,4,4,491,COMPLETE
976,976,0.7628700929985278,2023-06-01 02:47:38.628050,2023-06-01 02:47:48.261786,0 days 00:00:09.633736,True,entropy,10,10,6,656,COMPLETE
977,977,0.7621472367590607,2023-06-01 02:47:48.261786,2023-06-01 02:47:56.344884,0 days 00:00:08.083098,True,entropy,10,10,5,520,COMPLETE
978,978,0.7616301477350067,2023-06-01 02:47:56.348991,2023-06-01 02:48:04.903839,0 days 00:00:08.554848,False,entropy,10,9,4,442,COMPLETE
979,979,0.7630801797536998,2023-06-01 02:48:04.903839,2023-06-01 02:48:14.822275,0 days 00:00:09.918436,True,entropy,10,10,5,685,COMPLETE
980,980,0.7626638454282844,2023-06-01 02:48:14.822275,2023-06-01 02:48:21.842582,0 days 00:00:07.020307,True,entropy,10,10,4,464,COMPLETE
981,981,0.762554060731478,2023-06-01 02:48:21.845919,2023-06-01 02:48:30.078351,0 days 00:00:08.232432,True,entropy,9,10,5,481,COMPLETE
982,982,0.7627187309699648,2023-06-01 02:48:30.078351,2023-06-01 02:48:43.449145,0 days 00:00:13.370794,True,entropy,10,10,4,726,COMPLETE
983,983,0.7624316791109942,2023-06-01 02:48:43.449653,2023-06-01 02:48:51.741626,0 days 00:00:08.291973,True,entropy,10,10,5,569,COMPLETE
984,984,0.7628573320791286,2023-06-01 02:48:51.741626,2023-06-01 02:49:05.478032,0 days 00:00:13.736406,True,entropy,10,10,6,956,COMPLETE
985,985,0.7616127670318772,2023-06-01 02:49:05.480106,2023-06-01 02:49:12.936191,0 days 00:00:07.456085,True,gini,10,10,4,520,COMPLETE
986,986,0.7626486504321064,2023-06-01 02:49:12.936191,2023-06-01 02:49:20.932573,0 days 00:00:07.996382,True,entropy,10,10,4,547,COMPLETE
987,987,0.7619126118167927,2023-06-01 02:49:20.932573,2023-06-01 02:49:27.605479,0 days 00:00:06.672906,True,entropy,10,10,5,450,COMPLETE
988,988,0.7629199506826086,2023-06-01 02:49:27.605479,2023-06-01 02:49:35.015367,0 days 00:00:07.409888,True,entropy,10,10,4,496,COMPLETE
989,989,0.762858594955026,2023-06-01 02:49:35.018308,2023-06-01 02:49:41.453405,0 days 00:00:06.435097,True,entropy,10,10,5,429,COMPLETE
990,990,0.7622555739335206,2023-06-01 02:49:41.457351,2023-06-01 02:49:49.068473,0 days 00:00:07.611122,True,entropy,10,10,6,475,COMPLETE
991,991,0.762290011983134,2023-06-01 02:49:49.068473,2023-06-01 02:49:58.056173,0 days 00:00:08.987700,True,entropy,9,9,7,457,COMPLETE
992,992,0.7623417714035401,2023-06-01 02:49:58.056173,2023-06-01 02:50:07.120609,0 days 00:00:09.064436,True,entropy,10,10,5,535,COMPLETE
993,993,0.7630442566650436,2023-06-01 02:50:07.120609,2023-06-01 02:50:14.552387,0 days 00:00:07.431778,True,entropy,10,10,4,507,COMPLETE
994,994,0.7624419237250405,2023-06-01 02:50:14.554868,2023-06-01 02:50:21.602033,0 days 00:00:07.047165,True,entropy,10,10,4,479,COMPLETE
995,995,0.7626302804225757,2023-06-01 02:50:21.603869,2023-06-01 02:50:27.791142,0 days 00:00:06.187273,True,entropy,10,10,5,418,COMPLETE
996,996,0.7623475588206011,2023-06-01 02:50:27.791142,2023-06-01 02:50:34.617570,0 days 00:00:06.826428,True,entropy,10,10,6,463,COMPLETE
997,997,0.760418412820074,2023-06-01 02:50:34.617570,2023-06-01 02:50:42.837575,0 days 00:00:08.220005,False,entropy,10,8,4,442,COMPLETE
998,998,0.7627958539407799,2023-06-01 02:50:42.838080,2023-06-01 02:50:51.480304,0 days 00:00:08.642224,True,entropy,10,10,5,585,COMPLETE
999,999,0.7626504604341074,2023-06-01 02:50:51.482358,2023-06-01 02:50:58.783280,0 days 00:00:07.300922,True,entropy,10,10,4,495,COMPLETE
