,number,value,datetime_start,datetime_complete,duration,params_bootstrap,params_criterion,params_max_depth,params_max_leaf_nodes,params_min_samples_leaf,params_n_estimators,state
633,633,0.763015673369995,2023-06-01 02:05:08.100821,2023-06-01 02:05:14.249018,0 days 00:00:06.148197,True,entropy,10,10,6,408,COMPLETE
634,634,0.7628951261283069,2023-06-01 02:05:14.250900,2023-06-01 02:05:22.181684,0 days 00:00:07.930784,True,entropy,10,10,4,546,COMPLETE
635,635,0.7629982655185381,2023-06-01 02:05:22.181684,2023-06-01 02:05:31.695025,0 days 00:00:09.513341,True,entropy,10,10,7,656,COMPLETE
636,636,0.7620056963145452,2023-06-01 02:05:31.695025,2023-06-01 02:05:38.687247,0 days 00:00:06.992222,True,entropy,10,9,4,480,COMPLETE
637,637,0.763179482381205,2023-06-01 02:05:38.687247,2023-06-01 02:05:45.262871,0 days 00:00:06.575624,True,entropy,10,10,4,443,COMPLETE
638,638,0.7625051658701375,2023-06-01 02:05:45.262871,2023-06-01 02:05:52.764036,0 days 00:00:07.501165,True,entropy,10,10,4,513,COMPLETE
639,639,0.7603202231407866,2023-06-01 02:05:52.766440,2023-06-01 02:06:00.328135,0 days 00:00:07.561695,True,gini,10,8,3,426,COMPLETE
640,640,0.7510317517638826,2023-06-01 02:06:00.328135,2023-06-01 02:06:06.155462,0 days 00:00:05.827327,True,entropy,10,2,6,468,COMPLETE
641,641,0.7626246928389611,2023-06-01 02:06:06.155462,2023-06-01 02:06:13.828211,0 days 00:00:07.672749,True,entropy,10,10,4,488,COMPLETE
642,642,0.7621192072654874,2023-06-01 02:06:13.830046,2023-06-01 02:06:20.374636,0 days 00:00:06.544590,True,entropy,10,10,4,446,COMPLETE
643,643,0.7626216475635239,2023-06-01 02:06:20.374636,2023-06-01 02:06:27.285488,0 days 00:00:06.910852,True,entropy,8,10,7,464,COMPLETE
644,644,0.7627214020414975,2023-06-01 02:06:27.285488,2023-06-01 02:06:37.062752,0 days 00:00:09.777264,True,entropy,10,10,4,677,COMPLETE
645,645,0.7624788792318762,2023-06-01 02:06:37.062752,2023-06-01 02:06:45.327371,0 days 00:00:08.264619,True,entropy,10,10,1,560,COMPLETE
646,646,0.7543776180253122,2023-06-01 02:06:45.329276,2023-06-01 02:06:51.377767,0 days 00:00:06.048491,True,entropy,10,4,3,529,COMPLETE
647,647,0.7625861826122491,2023-06-01 02:06:51.377767,2023-06-01 02:06:58.647979,0 days 00:00:07.270212,True,entropy,10,10,2,498,COMPLETE
648,648,0.762705437328021,2023-06-01 02:06:58.649540,2023-06-01 02:07:05.098399,0 days 00:00:06.448859,True,entropy,10,10,4,427,COMPLETE
649,649,0.7632880402899618,2023-06-01 02:07:05.098399,2023-06-01 02:07:11.868590,0 days 00:00:06.770191,True,entropy,10,10,9,454,COMPLETE
650,650,0.7628884872136027,2023-06-01 02:07:11.871265,2023-06-01 02:07:19.172180,0 days 00:00:07.300915,True,entropy,10,10,9,402,COMPLETE
651,651,0.7630300281518428,2023-06-01 02:07:19.174602,2023-06-01 02:07:28.078248,0 days 00:00:08.903646,True,entropy,9,10,9,441,COMPLETE
652,652,0.7626789994520029,2023-06-01 02:07:28.078248,2023-06-01 02:07:37.478875,0 days 00:00:09.400627,False,entropy,10,10,10,419,COMPLETE
653,653,0.7635595698264398,2023-06-01 02:07:37.479393,2023-06-01 02:07:44.100568,0 days 00:00:06.621175,True,entropy,10,10,10,445,COMPLETE
654,654,0.7621082112350192,2023-06-01 02:07:44.100568,2023-06-01 02:07:49.998661,0 days 00:00:05.898093,True,entropy,7,10,10,396,COMPLETE
655,655,0.7617412600186917,2023-06-01 02:07:49.998661,2023-06-01 02:07:56.267169,0 days 00:00:06.268508,True,entropy,10,9,10,434,COMPLETE
656,656,0.7633359325672806,2023-06-01 02:07:56.267169,2023-06-01 02:08:02.903490,0 days 00:00:06.636321,True,entropy,10,10,10,446,COMPLETE
657,657,0.7626823022543039,2023-06-01 02:08:02.903490,2023-06-01 02:08:09.178538,0 days 00:00:06.275048,True,entropy,10,10,10,420,COMPLETE
658,658,0.7628577244983614,2023-06-01 02:08:09.178538,2023-06-01 02:08:15.863247,0 days 00:00:06.684709,True,entropy,10,10,10,452,COMPLETE
659,659,0.7625405855765282,2023-06-01 02:08:15.863247,2023-06-01 02:08:21.718145,0 days 00:00:05.854898,True,entropy,10,10,10,383,COMPLETE
660,660,0.7616986213826104,2023-06-01 02:08:21.718145,2023-06-01 02:08:28.089406,0 days 00:00:06.371261,True,gini,10,10,10,435,COMPLETE
661,661,0.7622804509278881,2023-06-01 02:08:28.089406,2023-06-01 02:08:34.271590,0 days 00:00:06.182184,True,entropy,10,10,10,412,COMPLETE
662,662,0.7629422725977909,2023-06-01 02:08:34.271590,2023-06-01 02:08:42.450980,0 days 00:00:08.179390,True,entropy,10,10,10,449,COMPLETE
663,663,0.7624520360142398,2023-06-01 02:08:42.450980,2023-06-01 02:08:51.555093,0 days 00:00:09.104113,True,entropy,10,10,9,452,COMPLETE
664,664,0.7629025742714678,2023-06-01 02:08:51.555093,2023-06-01 02:08:58.161546,0 days 00:00:06.606453,True,entropy,10,10,10,409,COMPLETE
665,665,0.7619496366161573,2023-06-01 02:08:58.161546,2023-06-01 02:09:04.512965,0 days 00:00:06.351419,True,entropy,10,9,9,435,COMPLETE
666,666,0.7626352054536608,2023-06-01 02:09:04.515293,2023-06-01 02:09:11.426720,0 days 00:00:06.911427,True,entropy,10,10,10,467,COMPLETE
667,667,0.7625149149555531,2023-06-01 02:09:11.426720,2023-06-01 02:09:18.127044,0 days 00:00:06.700324,True,entropy,10,10,10,456,COMPLETE
668,668,0.7621636538035331,2023-06-01 02:09:18.127044,2023-06-01 02:09:24.663527,0 days 00:00:06.536483,True,entropy,10,10,10,441,COMPLETE
669,669,0.7631974878833958,2023-06-01 02:09:24.663527,2023-06-01 02:09:31.588647,0 days 00:00:06.925120,True,entropy,10,10,9,468,COMPLETE
670,670,0.7629230219478279,2023-06-01 02:09:31.588647,2023-06-01 02:09:38.118201,0 days 00:00:06.529554,True,entropy,10,10,10,424,COMPLETE
671,671,0.7628039761894698,2023-06-01 02:09:38.118201,2023-06-01 02:09:45.193777,0 days 00:00:07.075576,True,entropy,10,10,9,452,COMPLETE
672,672,0.7618238132130264,2023-06-01 02:09:45.196103,2023-06-01 02:09:51.314028,0 days 00:00:06.117925,True,entropy,10,9,10,425,COMPLETE
673,673,0.7625021706122551,2023-06-01 02:09:51.314028,2023-06-01 02:10:01.635744,0 days 00:00:10.321716,False,entropy,10,10,9,474,COMPLETE
674,674,0.7628929450887595,2023-06-01 02:10:01.635744,2023-06-01 02:10:10.697136,0 days 00:00:09.061392,True,entropy,10,10,10,453,COMPLETE
675,675,0.7625665482653659,2023-06-01 02:10:10.699676,2023-06-01 02:10:17.458744,0 days 00:00:06.759068,True,entropy,10,10,8,395,COMPLETE
676,676,0.7630126301550041,2023-06-01 02:10:17.461434,2023-06-01 02:10:23.840196,0 days 00:00:06.378762,True,entropy,10,10,8,433,COMPLETE
677,677,0.7595160878991101,2023-06-01 02:10:23.844544,2023-06-01 02:10:30.140218,0 days 00:00:06.295674,True,entropy,10,7,9,465,COMPLETE
678,678,0.7625913796198691,2023-06-01 02:10:30.140218,2023-06-01 02:10:36.187212,0 days 00:00:06.046994,True,entropy,10,10,10,407,COMPLETE
679,679,0.7628280594255696,2023-06-01 02:10:36.187212,2023-06-01 02:10:43.301126,0 days 00:00:07.113914,True,entropy,10,10,9,479,COMPLETE
680,680,0.7624115377217626,2023-06-01 02:10:43.301126,2023-06-01 02:10:49.751719,0 days 00:00:06.450593,True,gini,10,10,10,442,COMPLETE
681,681,0.762925171356091,2023-06-01 02:10:49.753925,2023-06-01 02:10:56.517985,0 days 00:00:06.764060,True,entropy,10,10,10,461,COMPLETE
682,682,0.7624699258203178,2023-06-01 02:10:56.517985,2023-06-01 02:11:02.808083,0 days 00:00:06.290098,True,entropy,10,10,8,420,COMPLETE
683,683,0.7591107972915843,2023-06-01 02:11:02.810481,2023-06-01 02:11:10.383037,0 days 00:00:07.572556,True,entropy,4,10,9,480,COMPLETE
684,684,0.7626577910180453,2023-06-01 02:11:10.383037,2023-06-01 02:11:19.455034,0 days 00:00:09.071997,True,entropy,10,10,10,452,COMPLETE
685,685,0.7624695172528785,2023-06-01 02:11:19.458138,2023-06-01 02:11:25.947842,0 days 00:00:06.489704,True,entropy,10,10,7,435,COMPLETE
686,686,0.7623100412638301,2023-06-01 02:11:25.947842,2023-06-01 02:11:32.736102,0 days 00:00:06.788260,True,entropy,6,10,9,470,COMPLETE
687,687,0.7624652138282568,2023-06-01 02:11:32.738468,2023-06-01 02:11:39.332644,0 days 00:00:06.594176,True,entropy,10,10,8,439,COMPLETE
688,688,0.7628097060842094,2023-06-01 02:11:39.335543,2023-06-01 02:11:46.146238,0 days 00:00:06.810695,True,entropy,10,10,8,460,COMPLETE
689,689,0.7629556439324101,2023-06-01 02:11:46.147967,2023-06-01 02:11:57.014303,0 days 00:00:10.866336,True,entropy,10,10,7,744,COMPLETE
690,690,0.7628675488340694,2023-06-01 02:11:57.014303,2023-06-01 02:12:04.254481,0 days 00:00:07.240178,True,entropy,10,10,10,486,COMPLETE
691,691,0.7633247179613982,2023-06-01 02:12:04.254481,2023-06-01 02:12:09.906186,0 days 00:00:05.651705,True,entropy,10,10,9,376,COMPLETE
692,692,0.7615057165569219,2023-06-01 02:12:09.908258,2023-06-01 02:12:17.542901,0 days 00:00:07.634643,False,entropy,10,9,8,385,COMPLETE
693,693,0.7629692898896506,2023-06-01 02:12:17.542901,2023-06-01 02:12:23.361507,0 days 00:00:05.818606,True,entropy,10,10,9,388,COMPLETE
694,694,0.7627651207105203,2023-06-01 02:12:23.361507,2023-06-01 02:12:32.325593,0 days 00:00:08.964086,True,entropy,10,10,9,486,COMPLETE
695,695,0.7624114555528055,2023-06-01 02:12:32.325593,2023-06-01 02:12:39.346483,0 days 00:00:07.020890,True,entropy,10,10,9,341,COMPLETE
696,696,0.762816736424176,2023-06-01 02:12:39.351169,2023-06-01 02:12:54.088895,0 days 00:00:14.737726,True,entropy,10,10,10,943,COMPLETE
697,697,0.7616590958073906,2023-06-01 02:12:54.090526,2023-06-01 02:12:58.426169,0 days 00:00:04.335643,True,entropy,10,10,10,282,COMPLETE
698,698,0.760679592835673,2023-06-01 02:12:58.426687,2023-06-01 02:13:05.482776,0 days 00:00:07.056089,True,gini,10,9,9,479,COMPLETE
699,699,0.7627885574370307,2023-06-01 02:13:05.483293,2023-06-01 02:13:10.067044,0 days 00:00:04.583751,True,entropy,10,10,8,303,COMPLETE
700,700,0.7622738469820767,2023-06-01 02:13:10.067044,2023-06-01 02:13:15.735313,0 days 00:00:05.668269,True,entropy,10,10,10,379,COMPLETE
701,701,0.7616902578406567,2023-06-01 02:13:15.738591,2023-06-01 02:13:22.644563,0 days 00:00:06.905972,True,entropy,10,10,9,465,COMPLETE
702,702,0.7626070132345442,2023-06-01 02:13:22.646595,2023-06-01 02:13:27.743315,0 days 00:00:05.096720,True,entropy,10,10,7,336,COMPLETE
703,703,0.7624661502334747,2023-06-01 02:13:27.745534,2023-06-01 02:13:33.123984,0 days 00:00:05.378450,True,entropy,10,10,6,354,COMPLETE
704,704,0.7628693771894258,2023-06-01 02:13:33.123984,2023-06-01 02:13:40.427432,0 days 00:00:07.303448,True,entropy,10,10,8,493,COMPLETE
705,705,0.7628701377100972,2023-06-01 02:13:40.427432,2023-06-01 02:13:46.526653,0 days 00:00:06.099221,True,entropy,10,10,9,408,COMPLETE
706,706,0.7628532939888941,2023-06-01 02:13:46.526653,2023-06-01 02:13:53.173388,0 days 00:00:06.646735,True,entropy,10,10,7,366,COMPLETE
707,707,0.762881064494148,2023-06-01 02:13:53.176260,2023-06-01 02:14:00.772769,0 days 00:00:07.596509,True,entropy,10,10,10,369,COMPLETE
708,708,0.7627994431298506,2023-06-01 02:14:00.772769,2023-06-01 02:14:08.184357,0 days 00:00:07.411588,True,entropy,10,10,8,461,COMPLETE
709,709,0.7627017723685396,2023-06-01 02:14:08.187204,2023-06-01 02:14:12.057946,0 days 00:00:03.870742,True,entropy,10,10,7,253,COMPLETE
710,710,0.7628072883857338,2023-06-01 02:14:12.057946,2023-06-01 02:14:19.131683,0 days 00:00:07.073737,True,entropy,10,10,9,477,COMPLETE
711,711,0.7627068912360255,2023-06-01 02:14:19.131683,2023-06-01 02:14:26.104002,0 days 00:00:06.972319,False,entropy,10,10,6,341,COMPLETE
712,712,0.7626121799145904,2023-06-01 02:14:26.106133,2023-06-01 02:14:35.702045,0 days 00:00:09.595912,True,entropy,10,10,8,660,COMPLETE
713,713,0.7573297650769851,2023-06-01 02:14:35.702045,2023-06-01 02:14:41.647683,0 days 00:00:05.945638,True,entropy,10,6,10,448,COMPLETE
714,714,0.7628064224778561,2023-06-01 02:14:41.647683,2023-06-01 02:14:49.042467,0 days 00:00:07.394784,True,entropy,10,10,6,499,COMPLETE
715,715,0.7623530322813462,2023-06-01 02:14:49.042467,2023-06-01 02:14:55.212210,0 days 00:00:06.169743,True,entropy,10,10,7,415,COMPLETE
716,716,0.7627602450192805,2023-06-01 02:14:55.212210,2023-06-01 02:15:01.972489,0 days 00:00:06.760279,True,entropy,10,10,10,455,COMPLETE
717,717,0.7614730022854446,2023-06-01 02:15:01.972489,2023-06-01 02:15:08.930515,0 days 00:00:06.958026,True,entropy,10,9,9,476,COMPLETE
718,718,0.7628740630403267,2023-06-01 02:15:08.930515,2023-06-01 02:15:17.263044,0 days 00:00:08.332529,True,entropy,10,10,8,428,COMPLETE
719,719,0.7618097095462992,2023-06-01 02:15:17.263044,2023-06-01 02:15:26.387559,0 days 00:00:09.124515,True,gini,10,10,7,451,COMPLETE
720,720,0.7626080218620317,2023-06-01 02:15:26.387559,2023-06-01 02:15:36.421992,0 days 00:00:10.034433,True,entropy,10,10,6,695,COMPLETE
721,721,0.7626011483291271,2023-06-01 02:15:36.421992,2023-06-01 02:15:43.711945,0 days 00:00:07.289953,True,entropy,10,10,10,495,COMPLETE
722,722,0.7627675198449542,2023-06-01 02:15:43.711945,2023-06-01 02:15:50.622472,0 days 00:00:06.910527,True,entropy,10,10,5,469,COMPLETE
723,723,0.7624499898075983,2023-06-01 02:15:50.622472,2023-06-01 02:15:59.778466,0 days 00:00:09.155994,True,entropy,10,10,7,633,COMPLETE
724,724,0.7623080873968707,2023-06-01 02:15:59.778466,2023-06-01 02:16:06.190429,0 days 00:00:06.411963,True,entropy,10,10,9,436,COMPLETE
725,725,0.762725588209806,2023-06-01 02:16:06.190429,2023-06-01 02:16:12.266841,0 days 00:00:06.076412,True,entropy,10,10,5,405,COMPLETE
726,726,0.751951526786234,2023-06-01 02:16:12.266841,2023-06-01 02:16:17.255459,0 days 00:00:04.988618,True,entropy,10,3,8,479,COMPLETE
727,727,0.7622235592965451,2023-06-01 02:16:17.255459,2023-06-01 02:16:23.865207,0 days 00:00:06.609748,True,entropy,7,10,4,449,COMPLETE
728,728,0.7625008068387839,2023-06-01 02:16:23.865740,2023-06-01 02:16:30.821793,0 days 00:00:06.956053,True,entropy,8,10,4,466,COMPLETE
729,729,0.7621731723720766,2023-06-01 02:16:30.821793,2023-06-01 02:16:38.781417,0 days 00:00:07.959624,False,entropy,10,9,5,312,COMPLETE
730,730,0.7536585212181146,2023-06-01 02:16:38.781417,2023-06-01 02:16:46.648706,0 days 00:00:07.867289,True,entropy,10,4,6,491,COMPLETE
731,731,0.7623497406896982,2023-06-01 02:16:46.651183,2023-06-01 02:16:53.407036,0 days 00:00:06.755853,True,entropy,10,10,10,420,COMPLETE
732,732,0.762872408166724,2023-06-01 02:16:53.407036,2023-06-01 02:17:00.064264,0 days 00:00:06.657228,True,entropy,10,10,4,450,COMPLETE
733,733,0.7624319630421839,2023-06-01 02:17:00.064264,2023-06-01 02:17:05.346589,0 days 00:00:05.282325,True,entropy,10,10,5,355,COMPLETE
734,734,0.7624406746141211,2023-06-01 02:17:05.346589,2023-06-01 02:17:11.796859,0 days 00:00:06.450270,True,entropy,10,10,4,433,COMPLETE
735,735,0.7625388181795383,2023-06-01 02:17:11.796859,2023-06-01 02:17:18.738255,0 days 00:00:06.941396,True,entropy,10,10,7,474,COMPLETE
736,736,0.7614948420289517,2023-06-01 02:17:18.738255,2023-06-01 02:17:27.909970,0 days 00:00:09.171715,True,entropy,10,9,7,644,COMPLETE
737,737,0.7626075082301683,2023-06-01 02:17:27.909970,2023-06-01 02:17:35.201430,0 days 00:00:07.291460,True,entropy,10,10,9,498,COMPLETE
738,738,0.7627915265273595,2023-06-01 02:17:35.201430,2023-06-01 02:17:42.004874,0 days 00:00:06.803444,True,entropy,10,10,4,457,COMPLETE
739,739,0.7623430529619423,2023-06-01 02:17:42.007280,2023-06-01 02:17:48.424509,0 days 00:00:06.417229,True,gini,10,10,5,443,COMPLETE
740,740,0.7627758760535454,2023-06-01 02:17:48.424509,2023-06-01 02:17:54.738911,0 days 00:00:06.314402,True,entropy,8,10,4,396,COMPLETE
741,741,0.760895781207978,2023-06-01 02:17:54.738911,2023-06-01 02:18:03.885236,0 days 00:00:09.146325,True,entropy,5,10,10,479,COMPLETE
742,742,0.760215291739999,2023-06-01 02:18:03.885236,2023-06-01 02:18:11.726207,0 days 00:00:07.840971,True,entropy,10,8,6,464,COMPLETE
743,743,0.7624349071764456,2023-06-01 02:18:11.729722,2023-06-01 02:18:17.971181,0 days 00:00:06.241459,True,entropy,10,10,8,422,COMPLETE
744,744,0.7634708441032425,2023-06-01 02:18:17.971181,2023-06-01 02:18:25.427629,0 days 00:00:07.456448,True,entropy,10,10,4,512,COMPLETE
745,745,0.7579047844706982,2023-06-01 02:18:25.427629,2023-06-01 02:18:32.048621,0 days 00:00:06.620992,True,entropy,4,10,4,517,COMPLETE
746,746,0.7623823986438193,2023-06-01 02:18:32.052633,2023-06-01 02:18:39.463984,0 days 00:00:07.411351,True,entropy,10,10,4,507,COMPLETE
747,747,0.7632120849262382,2023-06-01 02:18:39.463984,2023-06-01 02:18:46.956985,0 days 00:00:07.493001,True,entropy,10,10,4,515,COMPLETE
748,748,0.7625312437745599,2023-06-01 02:18:46.956985,2023-06-01 02:18:54.373333,0 days 00:00:07.416348,True,entropy,10,10,4,501,COMPLETE
749,749,0.7628588359520547,2023-06-01 02:18:54.373333,2023-06-01 02:19:04.738682,0 days 00:00:10.365349,True,entropy,10,10,4,709,COMPLETE
750,750,0.7620513347706469,2023-06-01 02:19:04.739217,2023-06-01 02:19:14.594072,0 days 00:00:09.854855,False,entropy,10,10,4,490,COMPLETE
751,751,0.7628518563275326,2023-06-01 02:19:14.598311,2023-06-01 02:19:24.518518,0 days 00:00:09.920207,True,entropy,10,10,4,511,COMPLETE
752,752,0.7633856683936285,2023-06-01 02:19:24.523035,2023-06-01 02:19:33.833719,0 days 00:00:09.310684,True,entropy,10,10,4,485,COMPLETE
753,753,0.7623667696041707,2023-06-01 02:19:33.833719,2023-06-01 02:19:41.389619,0 days 00:00:07.555900,True,entropy,10,10,4,520,COMPLETE
754,754,0.7629587345384339,2023-06-01 02:19:41.389619,2023-06-01 02:19:48.650742,0 days 00:00:07.261123,True,entropy,10,10,4,493,COMPLETE
755,755,0.762604990055492,2023-06-01 02:19:48.654251,2023-06-01 02:19:55.902417,0 days 00:00:07.248166,True,entropy,10,10,4,492,COMPLETE
756,756,0.7620429160959675,2023-06-01 02:19:55.904262,2023-06-01 02:20:03.606092,0 days 00:00:07.701830,True,gini,10,10,4,536,COMPLETE
757,757,0.762595359661297,2023-06-01 02:20:03.606092,2023-06-01 02:20:11.143936,0 days 00:00:07.537844,True,entropy,10,10,4,509,COMPLETE
758,758,0.7626977613145363,2023-06-01 02:20:11.143936,2023-06-01 02:20:18.102838,0 days 00:00:06.958902,True,entropy,10,10,4,474,COMPLETE
759,759,0.761950352741058,2023-06-01 02:20:18.102838,2023-06-01 02:20:22.854199,0 days 00:00:04.751361,True,entropy,10,9,4,323,COMPLETE
760,760,0.7626775813227227,2023-06-01 02:20:22.854199,2023-06-01 02:20:29.735168,0 days 00:00:06.880969,True,entropy,10,10,4,463,COMPLETE
761,761,0.762421854419743,2023-06-01 02:20:29.738134,2023-06-01 02:20:36.752075,0 days 00:00:07.013941,True,entropy,6,10,4,485,COMPLETE
762,762,0.7611563657057946,2023-06-01 02:20:36.752075,2023-06-01 02:20:45.213201,0 days 00:00:08.461126,True,entropy,8,9,4,459,COMPLETE
763,763,0.7603680344536512,2023-06-01 02:20:45.213201,2023-06-01 02:20:53.162079,0 days 00:00:07.948878,True,entropy,10,7,4,443,COMPLETE
764,764,0.7625616798745735,2023-06-01 02:20:53.164728,2023-06-01 02:21:00.484010,0 days 00:00:07.319282,True,entropy,10,10,4,505,COMPLETE
765,765,0.7631011498435442,2023-06-01 02:21:00.484010,2023-06-01 02:21:08.185493,0 days 00:00:07.701483,True,entropy,10,10,4,526,COMPLETE
766,766,0.7626743661136728,2023-06-01 02:21:08.185493,2023-06-01 02:21:15.255904,0 days 00:00:07.070411,True,entropy,10,10,4,481,COMPLETE
767,767,0.7630317384082941,2023-06-01 02:21:15.255904,2023-06-01 02:21:22.099787,0 days 00:00:06.843883,True,entropy,10,10,4,462,COMPLETE
768,768,0.762466557931774,2023-06-01 02:21:22.099787,2023-06-01 02:21:31.837862,0 days 00:00:09.738075,False,entropy,10,10,4,490,COMPLETE
769,769,0.7640234028577633,2023-06-01 02:21:31.839325,2023-06-01 02:21:34.714341,0 days 00:00:02.875016,True,entropy,10,10,4,179,COMPLETE
770,770,0.7620329228471651,2023-06-01 02:21:34.714341,2023-06-01 02:21:38.421672,0 days 00:00:03.707331,True,entropy,10,10,4,240,COMPLETE
771,771,0.7618634265660988,2023-06-01 02:21:38.423991,2023-06-01 02:21:40.717708,0 days 00:00:02.293717,True,entropy,10,10,4,137,COMPLETE
772,772,0.762164938831204,2023-06-01 02:21:40.719785,2023-06-01 02:21:53.109842,0 days 00:00:12.390057,True,entropy,10,10,4,681,COMPLETE
773,773,0.76233212031266,2023-06-01 02:21:53.109842,2023-06-01 02:21:57.696513,0 days 00:00:04.586671,True,entropy,10,10,4,212,COMPLETE
774,774,0.7628818916808264,2023-06-01 02:21:57.696513,2023-06-01 02:22:05.538931,0 days 00:00:07.842418,True,entropy,10,10,4,542,COMPLETE
775,775,0.7620107007300119,2023-06-01 02:22:05.538931,2023-06-01 02:22:12.960597,0 days 00:00:07.421666,True,gini,10,10,4,514,COMPLETE
776,776,0.7626726020609671,2023-06-01 02:22:12.962895,2023-06-01 02:22:20.656531,0 days 00:00:07.693636,True,entropy,10,10,4,527,COMPLETE
777,777,0.7629922200017075,2023-06-01 02:22:20.656531,2023-06-01 02:22:24.582096,0 days 00:00:03.925565,True,entropy,10,10,4,255,COMPLETE
778,778,0.7619394621901739,2023-06-01 02:22:24.582096,2023-06-01 02:22:27.631268,0 days 00:00:03.049172,True,entropy,10,10,4,192,COMPLETE
779,779,0.7620781800550966,2023-06-01 02:22:27.633204,2023-06-01 02:22:29.661355,0 days 00:00:02.028151,True,entropy,10,10,4,118,COMPLETE
780,780,0.7617406721832938,2023-06-01 02:22:29.663751,2023-06-01 02:22:32.173180,0 days 00:00:02.509429,True,entropy,10,10,4,152,COMPLETE
781,781,0.7557236582477088,2023-06-01 02:22:32.173180,2023-06-01 02:22:38.310425,0 days 00:00:06.137245,True,entropy,10,5,5,501,COMPLETE
782,782,0.7629319375136943,2023-06-01 02:22:38.310425,2023-06-01 02:22:46.406860,0 days 00:00:08.096435,True,entropy,10,10,4,555,COMPLETE
783,783,0.762509670385804,2023-06-01 02:22:46.408956,2023-06-01 02:22:54.643452,0 days 00:00:08.234496,True,entropy,7,9,4,466,COMPLETE
784,784,0.7512927469751329,2023-06-01 02:22:54.647756,2023-06-01 02:22:58.937357,0 days 00:00:04.289601,True,entropy,10,3,5,287,COMPLETE
785,785,0.7625527220126648,2023-06-01 02:22:58.937357,2023-06-01 02:23:03.719901,0 days 00:00:04.782544,True,entropy,10,10,4,232,COMPLETE
786,786,0.7628642834492572,2023-06-01 02:23:03.722661,2023-06-01 02:23:14.099532,0 days 00:00:10.376871,True,entropy,10,10,4,726,COMPLETE
787,787,0.762779285803253,2023-06-01 02:23:14.101509,2023-06-01 02:23:17.017577,0 days 00:00:02.916068,True,entropy,10,10,4,179,COMPLETE
788,788,0.7618500812805703,2023-06-01 02:23:17.017577,2023-06-01 02:23:26.688975,0 days 00:00:09.671398,False,entropy,10,10,5,482,COMPLETE
789,789,0.7626828036352777,2023-06-01 02:23:26.688975,2023-06-01 02:23:29.673745,0 days 00:00:02.984770,True,entropy,10,10,4,187,COMPLETE
790,790,0.760970380546599,2023-06-01 02:23:29.677049,2023-06-01 02:23:31.554589,0 days 00:00:01.877540,True,entropy,10,10,4,103,COMPLETE
