,number,value,datetime_start,datetime_complete,duration,params_bootstrap,params_criterion,params_max_depth,params_max_leaf_nodes,params_min_samples_leaf,params_n_estimators,state
475,475,0.7613123496114491,2023-06-01 01:45:29.666991,2023-06-01 01:45:36.446374,0 days 00:00:06.779383,True,entropy,10,9,4,429,COMPLETE
476,476,0.75777776106578,2023-06-01 01:45:36.447375,2023-06-01 01:45:43.079145,0 days 00:00:06.631770,True,entropy,10,6,4,484,COMPLETE
477,477,0.7579624012327545,2023-06-01 01:45:43.079145,2023-06-01 01:45:49.158015,0 days 00:00:06.078870,True,entropy,4,10,4,449,COMPLETE
478,478,0.7627756465635587,2023-06-01 01:45:49.159994,2023-06-01 01:45:56.641914,0 days 00:00:07.481920,True,entropy,10,10,4,467,COMPLETE
479,479,0.7631125404918725,2023-06-01 01:45:56.643105,2023-06-01 01:46:03.806200,0 days 00:00:07.163095,True,entropy,10,10,4,466,COMPLETE
480,480,0.7555571285360239,2023-06-01 01:46:03.806200,2023-06-01 01:46:12.295558,0 days 00:00:08.489358,False,entropy,10,5,4,499,COMPLETE
481,481,0.7622881306016096,2023-06-01 01:46:12.295558,2023-06-01 01:46:18.767765,0 days 00:00:06.472207,True,entropy,10,10,3,400,COMPLETE
482,482,0.7625125143992542,2023-06-01 01:46:18.767765,2023-06-01 01:46:25.215452,0 days 00:00:06.447687,True,entropy,10,10,4,424,COMPLETE
483,483,0.7625294076576383,2023-06-01 01:46:25.215452,2023-06-01 01:46:31.870288,0 days 00:00:06.654836,True,entropy,10,10,4,449,COMPLETE
484,484,0.7618487055852051,2023-06-01 01:46:31.872963,2023-06-01 01:46:39.169022,0 days 00:00:07.296059,True,gini,10,10,4,482,COMPLETE
485,485,0.7631934807264015,2023-06-01 01:46:39.171340,2023-06-01 01:46:45.961887,0 days 00:00:06.790547,True,entropy,10,10,4,436,COMPLETE
486,486,0.7633915796565176,2023-06-01 01:46:45.961887,2023-06-01 01:46:54.280589,0 days 00:00:08.318702,True,entropy,10,10,6,471,COMPLETE
487,487,0.7627781560027258,2023-06-01 01:46:54.281720,2023-06-01 01:47:03.001814,0 days 00:00:08.720094,True,entropy,10,10,6,470,COMPLETE
488,488,0.7627475077065891,2023-06-01 01:47:03.002817,2023-06-01 01:47:11.587384,0 days 00:00:08.584567,True,entropy,10,10,6,503,COMPLETE
489,489,0.7627391462316029,2023-06-01 01:47:11.589388,2023-06-01 01:47:20.483236,0 days 00:00:08.893848,True,entropy,10,10,5,483,COMPLETE
490,490,0.7621075547256468,2023-06-01 01:47:20.485394,2023-06-01 01:47:28.954954,0 days 00:00:08.469560,True,entropy,10,10,6,459,COMPLETE
491,491,0.7626596730578687,2023-06-01 01:47:28.955966,2023-06-01 01:47:36.962230,0 days 00:00:08.006264,True,entropy,10,10,6,442,COMPLETE
492,492,0.7626725952738082,2023-06-01 01:47:36.963753,2023-06-01 01:47:43.812087,0 days 00:00:06.848334,True,entropy,10,10,6,386,COMPLETE
493,493,0.7618065593772263,2023-06-01 01:47:43.813214,2023-06-01 01:47:52.432966,0 days 00:00:08.619752,True,entropy,10,9,6,486,COMPLETE
494,494,0.7630945041351598,2023-06-01 01:47:52.434981,2023-06-01 01:48:04.227809,0 days 00:00:11.792828,True,entropy,10,10,5,505,COMPLETE
495,495,0.7630383981845666,2023-06-01 01:48:04.230031,2023-06-01 01:48:13.864592,0 days 00:00:09.634561,True,entropy,10,10,6,467,COMPLETE
496,496,0.7627035165342374,2023-06-01 01:48:13.865873,2023-06-01 01:48:20.889856,0 days 00:00:07.023983,True,entropy,10,10,6,410,COMPLETE
497,497,0.7591224996715162,2023-06-01 01:48:20.892763,2023-06-01 01:48:30.034169,0 days 00:00:09.141406,False,entropy,10,7,5,445,COMPLETE
498,498,0.7627631194197676,2023-06-01 01:48:30.036192,2023-06-01 01:48:37.281703,0 days 00:00:07.245511,True,entropy,10,10,2,419,COMPLETE
499,499,0.7624321357077392,2023-06-01 01:48:37.283304,2023-06-01 01:48:46.242886,0 days 00:00:08.959582,True,entropy,10,10,3,495,COMPLETE
500,500,0.7621719908093472,2023-06-01 01:48:46.243888,2023-06-01 01:48:53.764668,0 days 00:00:07.520780,True,entropy,10,10,5,468,COMPLETE
501,501,0.7626117974751142,2023-06-01 01:48:53.764668,2023-06-01 01:49:00.851501,0 days 00:00:07.086833,True,entropy,10,10,5,444,COMPLETE
502,502,0.7622620723342262,2023-06-01 01:49:00.851501,2023-06-01 01:49:09.895301,0 days 00:00:09.043800,True,entropy,10,10,5,512,COMPLETE
503,503,0.7634349465435589,2023-06-01 01:49:09.895832,2023-06-01 01:49:16.881867,0 days 00:00:06.986035,True,entropy,10,10,4,460,COMPLETE
504,504,0.7614664494169883,2023-06-01 01:49:16.885982,2023-06-01 01:49:23.572662,0 days 00:00:06.686680,True,gini,10,10,4,457,COMPLETE
505,505,0.7629132816309907,2023-06-01 01:49:23.572662,2023-06-01 01:49:31.167850,0 days 00:00:07.595188,True,entropy,10,10,4,478,COMPLETE
506,506,0.761867285375178,2023-06-01 01:49:31.167850,2023-06-01 01:49:39.713263,0 days 00:00:08.545413,True,entropy,10,10,4,429,COMPLETE
507,507,0.7629610208138095,2023-06-01 01:49:39.713263,2023-06-01 01:49:48.874804,0 days 00:00:09.161541,True,entropy,10,10,4,483,COMPLETE
508,508,0.7615549489485254,2023-06-01 01:49:48.874804,2023-06-01 01:49:55.381528,0 days 00:00:06.506724,True,entropy,10,9,4,455,COMPLETE
509,509,0.7624687854606071,2023-06-01 01:49:55.381528,2023-06-01 01:50:02.721557,0 days 00:00:07.340029,True,entropy,10,10,4,498,COMPLETE
510,510,0.7625764756579926,2023-06-01 01:50:02.721557,2023-06-01 01:50:09.125578,0 days 00:00:06.404021,True,entropy,10,10,3,433,COMPLETE
511,511,0.7621730578081154,2023-06-01 01:50:09.125578,2023-06-01 01:50:15.861093,0 days 00:00:06.735515,True,entropy,10,10,4,459,COMPLETE
512,512,0.763030386161583,2023-06-01 01:50:15.861093,2023-06-01 01:50:22.818427,0 days 00:00:06.957334,True,entropy,10,10,4,474,COMPLETE
513,513,0.7631984700800098,2023-06-01 01:50:22.821508,2023-06-01 01:50:29.090050,0 days 00:00:06.268542,True,entropy,10,10,4,417,COMPLETE
514,514,0.7626113738855609,2023-06-01 01:50:29.090050,2023-06-01 01:50:36.595405,0 days 00:00:07.505355,True,entropy,10,10,4,514,COMPLETE
515,515,0.7616513500997216,2023-06-01 01:50:36.595405,2023-06-01 01:50:40.117134,0 days 00:00:03.521729,True,entropy,10,10,3,227,COMPLETE
516,516,0.7615418995357984,2023-06-01 01:50:40.119230,2023-06-01 01:50:46.353164,0 days 00:00:06.233934,True,entropy,10,8,5,445,COMPLETE
517,517,0.762089655058121,2023-06-01 01:50:46.353164,2023-06-01 01:50:56.211068,0 days 00:00:09.857904,False,entropy,10,10,4,495,COMPLETE
518,518,0.7628151738374682,2023-06-01 01:50:56.211068,2023-06-01 01:51:03.166294,0 days 00:00:06.955226,True,entropy,10,10,5,474,COMPLETE
519,519,0.7625720330948174,2023-06-01 01:51:03.166294,2023-06-01 01:51:09.485672,0 days 00:00:06.319378,True,entropy,10,10,4,391,COMPLETE
520,520,0.7623445533129669,2023-06-01 01:51:09.487931,2023-06-01 01:51:18.522546,0 days 00:00:09.034615,True,entropy,10,10,3,464,COMPLETE
521,521,0.762620738464687,2023-06-01 01:51:18.522546,2023-06-01 01:51:26.994112,0 days 00:00:08.471566,True,entropy,10,10,4,438,COMPLETE
522,522,0.7623621603791612,2023-06-01 01:51:26.994112,2023-06-01 01:51:33.896076,0 days 00:00:06.901964,True,entropy,10,9,4,490,COMPLETE
523,523,0.7620882370605007,2023-06-01 01:51:33.896619,2023-06-01 01:51:41.399293,0 days 00:00:07.502674,True,gini,10,10,5,528,COMPLETE
524,524,0.7629041618010457,2023-06-01 01:51:41.401663,2023-06-01 01:51:47.726650,0 days 00:00:06.324987,True,entropy,10,10,4,421,COMPLETE
525,525,0.7633240643817663,2023-06-01 01:51:47.728082,2023-06-01 01:51:54.442197,0 days 00:00:06.714115,True,entropy,10,10,4,456,COMPLETE
526,526,0.7633659989461925,2023-06-01 01:51:54.444318,2023-06-01 01:52:01.167648,0 days 00:00:06.723330,True,entropy,10,10,5,445,COMPLETE
527,527,0.7621385526975156,2023-06-01 01:52:01.167648,2023-06-01 01:52:07.210463,0 days 00:00:06.042815,True,entropy,10,10,5,403,COMPLETE
528,528,0.7621980653499216,2023-06-01 01:52:07.212715,2023-06-01 01:52:12.506770,0 days 00:00:05.294055,True,entropy,10,10,5,358,COMPLETE
529,529,0.7629676676018663,2023-06-01 01:52:12.509033,2023-06-01 01:52:18.973427,0 days 00:00:06.464394,True,entropy,10,10,5,430,COMPLETE
530,530,0.7627796771692069,2023-06-01 01:52:18.975384,2023-06-01 01:52:25.566084,0 days 00:00:06.590700,True,entropy,10,10,5,448,COMPLETE
531,531,0.762900941457261,2023-06-01 01:52:25.566084,2023-06-01 01:52:32.106264,0 days 00:00:06.540180,True,entropy,10,10,5,443,COMPLETE
532,532,0.7612247578098257,2023-06-01 01:52:32.106264,2023-06-01 01:52:38.771099,0 days 00:00:06.664835,True,entropy,10,9,5,466,COMPLETE
533,533,0.7628411975900928,2023-06-01 01:52:38.771099,2023-06-01 01:52:45.012478,0 days 00:00:06.241379,True,entropy,10,10,5,415,COMPLETE
534,534,0.7629788378053027,2023-06-01 01:52:45.012478,2023-06-01 01:52:53.620387,0 days 00:00:08.607909,True,entropy,10,10,5,454,COMPLETE
535,535,0.7629780240873677,2023-06-01 01:52:53.622750,2023-06-01 01:53:03.855178,0 days 00:00:10.232428,True,entropy,10,10,5,508,COMPLETE
536,536,0.7625219747873307,2023-06-01 01:53:03.855178,2023-06-01 01:53:11.150426,0 days 00:00:07.295248,True,entropy,10,10,5,486,COMPLETE
537,537,0.7621453656732462,2023-06-01 01:53:11.150426,2023-06-01 01:53:19.515752,0 days 00:00:08.365326,False,entropy,10,10,7,427,COMPLETE
538,538,0.7609416174302502,2023-06-01 01:53:19.516269,2023-06-01 01:53:25.837122,0 days 00:00:06.320853,True,entropy,10,8,5,453,COMPLETE
539,539,0.7628216449053994,2023-06-01 01:53:25.837122,2023-06-01 01:53:32.893558,0 days 00:00:07.056436,True,entropy,10,10,5,477,COMPLETE
540,540,0.7522367504083111,2023-06-01 01:53:32.893558,2023-06-01 01:53:37.287084,0 days 00:00:04.393526,True,entropy,10,3,1,435,COMPLETE
541,541,0.7626472460546074,2023-06-01 01:53:37.287084,2023-06-01 01:53:43.222159,0 days 00:00:05.935075,True,entropy,10,10,2,399,COMPLETE
542,542,0.7630648933261076,2023-06-01 01:53:43.222159,2023-06-01 01:53:50.517897,0 days 00:00:07.295738,True,entropy,10,10,7,493,COMPLETE
543,543,0.7629087966404218,2023-06-01 01:53:50.517897,2023-06-01 01:53:57.637825,0 days 00:00:07.119928,True,entropy,9,10,5,471,COMPLETE
544,544,0.7613654292788503,2023-06-01 01:53:57.638344,2023-06-01 01:54:04.417802,0 days 00:00:06.779458,True,gini,10,10,4,452,COMPLETE
545,545,0.7628545117183438,2023-06-01 01:54:04.420019,2023-06-01 01:54:12.046764,0 days 00:00:07.626745,True,entropy,10,10,5,519,COMPLETE
546,546,0.7628013818691214,2023-06-01 01:54:12.049135,2023-06-01 01:54:23.182957,0 days 00:00:11.133822,True,entropy,10,10,4,772,COMPLETE
547,547,0.7617592246735614,2023-06-01 01:54:23.185302,2023-06-01 01:54:30.849020,0 days 00:00:07.663718,True,entropy,9,9,5,420,COMPLETE
548,548,0.7627844653397007,2023-06-01 01:54:30.849020,2023-06-01 01:54:41.081764,0 days 00:00:10.232744,True,entropy,10,10,4,503,COMPLETE
549,549,0.7623454452699352,2023-06-01 01:54:41.081764,2023-06-01 01:54:48.287685,0 days 00:00:07.205921,True,entropy,10,10,3,476,COMPLETE
550,550,0.7621489063194147,2023-06-01 01:54:48.287685,2023-06-01 01:54:54.838746,0 days 00:00:06.551061,True,entropy,10,10,7,442,COMPLETE
551,551,0.7630349723591575,2023-06-01 01:54:54.838746,2023-06-01 01:55:01.812583,0 days 00:00:06.973837,True,entropy,10,10,4,464,COMPLETE
552,552,0.7628153298742891,2023-06-01 01:55:01.812583,2023-06-01 01:55:07.443862,0 days 00:00:05.631279,True,entropy,10,10,4,383,COMPLETE
553,553,0.7626773284500659,2023-06-01 01:55:07.443862,2023-06-01 01:55:14.597512,0 days 00:00:07.153650,True,entropy,9,10,5,481,COMPLETE
554,554,0.7627039636250779,2023-06-01 01:55:14.600864,2023-06-01 01:55:22.316319,0 days 00:00:07.715455,True,entropy,10,10,9,531,COMPLETE
555,555,0.762724441635996,2023-06-01 01:55:22.316319,2023-06-01 01:55:28.885171,0 days 00:00:06.568852,True,entropy,10,10,4,440,COMPLETE
556,556,0.7627635867929039,2023-06-01 01:55:28.887532,2023-06-01 01:55:37.970492,0 days 00:00:09.082960,False,entropy,10,10,5,456,COMPLETE
557,557,0.7623681674182401,2023-06-01 01:55:37.972797,2023-06-01 01:55:44.170351,0 days 00:00:06.197554,True,entropy,10,10,4,412,COMPLETE
558,558,0.7623316408991665,2023-06-01 01:55:44.170351,2023-06-01 01:55:53.275303,0 days 00:00:09.104952,True,entropy,9,10,5,506,COMPLETE
559,559,0.7618356195579914,2023-06-01 01:55:53.275814,2023-06-01 01:56:02.972091,0 days 00:00:09.696277,True,entropy,10,9,3,485,COMPLETE
560,560,0.762536642143066,2023-06-01 01:56:02.975412,2023-06-01 01:56:09.624341,0 days 00:00:06.648929,True,entropy,10,10,4,433,COMPLETE
561,561,0.7625976518879147,2023-06-01 01:56:09.624341,2023-06-01 01:56:16.283124,0 days 00:00:06.658783,True,entropy,10,10,4,457,COMPLETE
562,562,0.7621178199444631,2023-06-01 01:56:16.286185,2023-06-01 01:56:23.669152,0 days 00:00:07.382967,True,gini,10,10,7,521,COMPLETE
563,563,0.7627030209857342,2023-06-01 01:56:23.670999,2023-06-01 01:56:30.464559,0 days 00:00:06.793560,True,entropy,9,10,5,465,COMPLETE
564,564,0.7627398326672024,2023-06-01 01:56:30.464559,2023-06-01 01:56:32.952558,0 days 00:00:02.487999,True,entropy,10,10,4,147,COMPLETE
565,565,0.7627287127379647,2023-06-01 01:56:32.952558,2023-06-01 01:56:40.231420,0 days 00:00:07.278862,True,entropy,10,10,3,493,COMPLETE
566,566,0.7629413658885497,2023-06-01 01:56:40.231420,2023-06-01 01:56:46.521435,0 days 00:00:06.290015,True,entropy,10,10,5,429,COMPLETE
567,567,0.7621699624427725,2023-06-01 01:56:46.521435,2023-06-01 01:56:53.416784,0 days 00:00:06.895349,True,entropy,6,10,4,478,COMPLETE
568,568,0.7618638946369709,2023-06-01 01:56:53.418762,2023-06-01 01:57:00.025520,0 days 00:00:06.606758,True,entropy,9,9,7,451,COMPLETE
569,569,0.7621565618335497,2023-06-01 01:57:00.025520,2023-06-01 01:57:07.407901,0 days 00:00:07.382381,True,entropy,10,10,6,504,COMPLETE
570,570,0.7631741595657474,2023-06-01 01:57:07.411953,2023-06-01 01:57:14.666135,0 days 00:00:07.254182,True,entropy,10,10,4,405,COMPLETE
571,571,0.7626257049026477,2023-06-01 01:57:14.666135,2023-06-01 01:57:24.886944,0 days 00:00:10.220809,True,entropy,10,10,5,528,COMPLETE
572,572,0.7623702095830158,2023-06-01 01:57:24.886944,2023-06-01 01:57:31.313248,0 days 00:00:06.426304,True,entropy,9,10,4,441,COMPLETE
573,573,0.7629852832919365,2023-06-01 01:57:31.313248,2023-06-01 01:57:38.171217,0 days 00:00:06.857969,True,entropy,10,10,4,469,COMPLETE
574,574,0.7630048259176924,2023-06-01 01:57:38.171735,2023-06-01 01:57:46.512301,0 days 00:00:08.340566,False,entropy,10,10,5,418,COMPLETE
575,575,0.7624836247840079,2023-06-01 01:57:46.512301,2023-06-01 01:57:53.833251,0 days 00:00:07.320950,True,entropy,10,10,10,490,COMPLETE
576,576,0.7628556594905979,2023-06-01 01:57:53.833251,2023-06-01 01:58:00.686752,0 days 00:00:06.853501,True,entropy,10,10,4,463,COMPLETE
577,577,0.7624570398634767,2023-06-01 01:58:00.686752,2023-06-01 01:58:08.555918,0 days 00:00:07.869166,True,entropy,9,10,9,536,COMPLETE
578,578,0.7623423937273032,2023-06-01 01:58:08.555918,2023-06-01 01:58:16.003143,0 days 00:00:07.447225,True,entropy,10,10,5,508,COMPLETE
579,579,0.7627456196167784,2023-06-01 01:58:16.003143,2023-06-01 01:58:22.488640,0 days 00:00:06.485497,True,entropy,10,10,4,443,COMPLETE
580,580,0.7617347579051161,2023-06-01 01:58:22.488640,2023-06-01 01:58:29.417325,0 days 00:00:06.928685,True,entropy,10,9,6,482,COMPLETE
581,581,0.7621637226484494,2023-06-01 01:58:29.417325,2023-06-01 01:58:37.439141,0 days 00:00:08.021816,True,gini,10,10,5,454,COMPLETE
582,582,0.7626308812067529,2023-06-01 01:58:37.441470,2023-06-01 01:58:46.049893,0 days 00:00:08.608423,True,entropy,9,10,4,429,COMPLETE
583,583,0.7626278834210934,2023-06-01 01:58:46.049893,2023-06-01 01:58:53.027297,0 days 00:00:06.977404,True,entropy,10,10,5,474,COMPLETE
584,584,0.7623867147410117,2023-06-01 01:58:53.029270,2023-06-01 01:58:58.867909,0 days 00:00:05.838639,True,entropy,10,10,7,397,COMPLETE
585,585,0.7623488555133675,2023-06-01 01:58:58.867909,2023-06-01 01:59:04.634430,0 days 00:00:05.766521,True,entropy,9,10,4,375,COMPLETE
586,586,0.7629310123916351,2023-06-01 01:59:04.634430,2023-06-01 01:59:12.167238,0 days 00:00:07.532808,True,entropy,10,10,3,512,COMPLETE
587,587,0.7623643829577065,2023-06-01 01:59:12.167238,2023-06-01 01:59:19.293083,0 days 00:00:07.125845,True,entropy,10,10,4,493,COMPLETE
588,588,0.7630490293195449,2023-06-01 01:59:19.295755,2023-06-01 01:59:27.159919,0 days 00:00:07.864164,True,entropy,8,10,5,540,COMPLETE
589,589,0.7635413598758773,2023-06-01 01:59:27.163615,2023-06-01 01:59:33.795287,0 days 00:00:06.631672,True,entropy,10,10,4,452,COMPLETE
590,590,0.7621419081639198,2023-06-01 01:59:33.797560,2023-06-01 01:59:38.580124,0 days 00:00:04.782564,True,entropy,10,10,2,317,COMPLETE
591,591,0.7622566144358938,2023-06-01 01:59:38.583038,2023-06-01 01:59:45.420610,0 days 00:00:06.837572,True,entropy,10,10,4,459,COMPLETE
592,592,0.7628292708750901,2023-06-01 01:59:45.422734,2023-06-01 01:59:52.783661,0 days 00:00:07.360927,True,entropy,10,10,4,477,COMPLETE
593,593,0.7624781266371908,2023-06-01 01:59:52.787180,2023-06-01 02:00:02.589169,0 days 00:00:09.801989,True,entropy,10,10,5,496,COMPLETE
594,594,0.7577602524482552,2023-06-01 02:00:02.592426,2023-06-01 02:00:12.123901,0 days 00:00:09.531475,False,entropy,10,6,3,447,COMPLETE
595,595,0.7628902140262828,2023-06-01 02:00:12.123901,2023-06-01 02:00:19.048711,0 days 00:00:06.924810,True,entropy,10,10,6,471,COMPLETE
596,596,0.763118193898902,2023-06-01 02:00:19.048711,2023-06-01 02:00:30.707606,0 days 00:00:11.658895,True,entropy,10,10,5,814,COMPLETE
597,597,0.7626184242837856,2023-06-01 02:00:30.710006,2023-06-01 02:00:38.309533,0 days 00:00:07.599527,True,entropy,10,10,4,515,COMPLETE
598,598,0.7623201493795039,2023-06-01 02:00:38.311260,2023-06-01 02:00:44.852181,0 days 00:00:06.540921,True,entropy,10,9,4,458,COMPLETE
599,599,0.7551315921856212,2023-06-01 02:00:44.852701,2023-06-01 02:00:50.796494,0 days 00:00:05.943793,True,entropy,10,5,7,483,COMPLETE
600,600,0.7626779397142457,2023-06-01 02:00:50.796494,2023-06-01 02:00:57.303251,0 days 00:00:06.506757,True,gini,10,10,6,438,COMPLETE
601,601,0.7625873541359133,2023-06-01 02:00:57.305527,2023-06-01 02:01:04.670133,0 days 00:00:07.364606,True,entropy,10,10,4,496,COMPLETE
602,602,0.7630921899412159,2023-06-01 02:01:04.670133,2023-06-01 02:01:11.422808,0 days 00:00:06.752675,True,entropy,10,10,5,454,COMPLETE
603,603,0.7627314451631519,2023-06-01 02:01:11.422808,2023-06-01 02:01:20.752027,0 days 00:00:09.329219,True,entropy,10,10,4,542,COMPLETE
604,604,0.762851571158771,2023-06-01 02:01:20.752027,2023-06-01 02:01:30.388475,0 days 00:00:09.636448,True,entropy,10,10,5,472,COMPLETE
605,605,0.7623779129687114,2023-06-01 02:01:30.388475,2023-06-01 02:01:38.027312,0 days 00:00:07.638837,True,entropy,10,10,5,435,COMPLETE
606,606,0.7628861619602294,2023-06-01 02:01:38.029599,2023-06-01 02:01:47.307057,0 days 00:00:09.277458,True,entropy,10,10,4,524,COMPLETE
607,607,0.7628151841662469,2023-06-01 02:01:47.307057,2023-06-01 02:01:53.831746,0 days 00:00:06.524689,True,entropy,10,10,4,416,COMPLETE
608,608,0.762797672237353,2023-06-01 02:01:53.834148,2023-06-01 02:02:01.322654,0 days 00:00:07.488506,True,entropy,10,10,7,494,COMPLETE
609,609,0.7628018812356067,2023-06-01 02:02:01.322654,2023-06-01 02:02:08.217492,0 days 00:00:06.894838,True,entropy,10,10,4,466,COMPLETE
610,610,0.7556746167306215,2023-06-01 02:02:08.217492,2023-06-01 02:02:13.207440,0 days 00:00:04.989948,True,entropy,3,10,5,446,COMPLETE
611,611,0.7632722596374492,2023-06-01 02:02:13.209491,2023-06-01 02:02:20.369074,0 days 00:00:07.159583,True,entropy,10,10,3,479,COMPLETE
612,612,0.762737577838818,2023-06-01 02:02:20.369074,2023-06-01 02:02:26.747541,0 days 00:00:06.378467,True,entropy,10,10,3,427,COMPLETE
613,613,0.7622574246712095,2023-06-01 02:02:26.750442,2023-06-01 02:02:33.401231,0 days 00:00:06.650789,True,entropy,10,9,3,460,COMPLETE
614,614,0.7626320002770006,2023-06-01 02:02:33.403532,2023-06-01 02:02:44.512589,0 days 00:00:11.109057,False,entropy,10,10,3,476,COMPLETE
615,615,0.7629346173733692,2023-06-01 02:02:44.514893,2023-06-01 02:02:53.259213,0 days 00:00:08.744320,True,entropy,10,10,3,440,COMPLETE
616,616,0.7626256411792696,2023-06-01 02:02:53.261301,2023-06-01 02:03:00.004144,0 days 00:00:06.742843,True,entropy,10,10,3,457,COMPLETE
617,617,0.7628517552852563,2023-06-01 02:03:00.004144,2023-06-01 02:03:07.131260,0 days 00:00:07.127116,True,entropy,10,10,3,483,COMPLETE
618,618,0.7629897094303886,2023-06-01 02:03:07.131260,2023-06-01 02:03:13.172059,0 days 00:00:06.040799,True,entropy,10,10,3,417,COMPLETE
619,619,0.7629247417628167,2023-06-01 02:03:13.174546,2023-06-01 02:03:20.702622,0 days 00:00:07.528076,True,entropy,10,10,3,506,COMPLETE
620,620,0.7616945282320013,2023-06-01 02:03:20.704898,2023-06-01 02:03:27.411369,0 days 00:00:06.706471,True,gini,10,10,3,467,COMPLETE
621,621,0.7600070292717701,2023-06-01 02:03:27.411369,2023-06-01 02:03:33.424519,0 days 00:00:06.013150,True,entropy,10,7,3,438,COMPLETE
622,622,0.7631481931378004,2023-06-01 02:03:33.426629,2023-06-01 02:03:40.496890,0 days 00:00:07.070261,True,entropy,10,10,4,483,COMPLETE
623,623,0.7625104487858242,2023-06-01 02:03:40.496890,2023-06-01 02:03:50.633839,0 days 00:00:10.136949,True,entropy,10,10,4,553,COMPLETE
624,624,0.7632096719805603,2023-06-01 02:03:50.637157,2023-06-01 02:04:06.577982,0 days 00:00:15.940825,True,entropy,10,10,3,985,COMPLETE
625,625,0.7628514197892001,2023-06-01 02:04:06.580018,2023-06-01 02:04:13.224923,0 days 00:00:06.644905,True,entropy,7,10,4,451,COMPLETE
626,626,0.762568044311205,2023-06-01 02:04:13.227088,2023-06-01 02:04:20.243200,0 days 00:00:07.016112,True,entropy,10,10,4,471,COMPLETE
627,627,0.7622222053382558,2023-06-01 02:04:20.243200,2023-06-01 02:04:27.729927,0 days 00:00:07.486727,True,entropy,8,9,7,525,COMPLETE
628,628,0.7624324187042671,2023-06-01 02:04:27.729927,2023-06-01 02:04:34.107545,0 days 00:00:06.377618,True,entropy,10,10,3,427,COMPLETE
629,629,0.7623208767481268,2023-06-01 02:04:34.110279,2023-06-01 02:04:41.327841,0 days 00:00:07.217562,True,entropy,10,10,4,492,COMPLETE
630,630,0.7610929199948171,2023-06-01 02:04:41.327841,2023-06-01 02:04:47.630623,0 days 00:00:06.302782,True,entropy,5,10,4,450,COMPLETE
631,631,0.7630611549463752,2023-06-01 02:04:47.630623,2023-06-01 02:04:56.711960,0 days 00:00:09.081337,True,entropy,10,10,4,462,COMPLETE
632,632,0.7627463696968835,2023-06-01 02:04:56.711960,2023-06-01 02:05:08.097804,0 days 00:00:11.385844,False,entropy,10,10,2,505,COMPLETE
