,number,value,datetime_start,datetime_complete,duration,params_bootstrap,params_criterion,params_max_depth,params_max_leaf_nodes,params_min_samples_leaf,params_n_estimators,state
791,791,0.7631063540728934,2023-06-01 02:23:31.556930,2023-06-01 02:23:38.924485,0 days 00:00:07.367555,True,entropy,10,10,4,503,COMPLETE
792,792,0.7626439373077396,2023-06-01 02:23:38.928460,2023-06-01 02:23:46.121062,0 days 00:00:07.192602,True,entropy,8,10,5,485,COMPLETE
793,793,0.7623096904230315,2023-06-01 02:23:46.121062,2023-06-01 02:23:52.566997,0 days 00:00:06.445935,True,entropy,10,10,5,437,COMPLETE
794,794,0.7617095758349527,2023-06-01 02:23:52.566997,2023-06-01 02:24:01.244053,0 days 00:00:08.677056,True,gini,10,10,4,471,COMPLETE
795,795,0.7625733604248975,2023-06-01 02:24:01.244053,2023-06-01 02:24:10.047571,0 days 00:00:08.803518,True,entropy,10,10,4,446,COMPLETE
796,796,0.7623658923932621,2023-06-01 02:24:10.047571,2023-06-01 02:24:17.755079,0 days 00:00:07.707508,True,entropy,10,10,4,526,COMPLETE
797,797,0.7632306458425834,2023-06-01 02:24:17.755079,2023-06-01 02:24:26.039384,0 days 00:00:08.284305,True,entropy,10,10,5,563,COMPLETE
798,798,0.7624061002372319,2023-06-01 02:24:26.039384,2023-06-01 02:24:33.498617,0 days 00:00:07.459233,True,entropy,10,10,4,504,COMPLETE
799,799,0.7557903232493463,2023-06-01 02:24:33.498617,2023-06-01 02:24:36.092085,0 days 00:00:02.593468,True,entropy,3,9,5,212,COMPLETE
800,800,0.7622455204172573,2023-06-01 02:24:36.092085,2023-06-01 02:24:42.395119,0 days 00:00:06.303034,True,entropy,10,10,4,426,COMPLETE
801,801,0.76191517160251,2023-06-01 02:24:42.395119,2023-06-01 02:24:45.133100,0 days 00:00:02.737981,True,entropy,10,10,4,166,COMPLETE
802,802,0.7627668357661895,2023-06-01 02:24:45.135331,2023-06-01 02:24:52.094253,0 days 00:00:06.958922,True,entropy,10,10,4,468,COMPLETE
803,803,0.7629945914875682,2023-06-01 02:24:52.094253,2023-06-01 02:24:58.798681,0 days 00:00:06.704428,True,entropy,10,10,5,452,COMPLETE
804,804,0.7631167604837256,2023-06-01 02:24:58.798681,2023-06-01 02:25:09.286506,0 days 00:00:10.487825,True,entropy,10,10,4,546,COMPLETE
805,805,0.7630246740342506,2023-06-01 02:25:09.286506,2023-06-01 02:25:17.723342,0 days 00:00:08.436836,True,entropy,10,10,4,487,COMPLETE
806,806,0.7625685962165004,2023-06-01 02:25:17.723342,2023-06-01 02:25:24.584133,0 days 00:00:06.860791,True,entropy,10,10,5,469,COMPLETE
807,807,0.7628920757839647,2023-06-01 02:25:24.584133,2023-06-01 02:25:30.959785,0 days 00:00:06.375652,True,entropy,10,10,4,431,COMPLETE
808,808,0.7615926998725738,2023-06-01 02:25:30.959785,2023-06-01 02:25:40.787911,0 days 00:00:09.828126,False,entropy,10,9,4,513,COMPLETE
809,809,0.7623802515790403,2023-06-01 02:25:40.789989,2023-06-01 02:25:47.355110,0 days 00:00:06.565121,True,entropy,7,10,4,446,COMPLETE
810,810,0.7636517658697158,2023-06-01 02:25:47.355110,2023-06-01 02:25:54.529566,0 days 00:00:07.174456,True,entropy,8,10,5,488,COMPLETE
811,811,0.7627135542840768,2023-06-01 02:25:54.529566,2023-06-01 02:26:06.528900,0 days 00:00:11.999334,True,entropy,7,10,5,838,COMPLETE
812,812,0.7628877691071283,2023-06-01 02:26:06.530459,2023-06-01 02:26:13.940070,0 days 00:00:07.409611,True,entropy,8,10,5,500,COMPLETE
813,813,0.7624425007116958,2023-06-01 02:26:13.944043,2023-06-01 02:26:21.760801,0 days 00:00:07.816758,True,gini,8,10,5,527,COMPLETE
814,814,0.7633115442552307,2023-06-01 02:26:21.764965,2023-06-01 02:26:27.379122,0 days 00:00:05.614157,True,entropy,8,10,5,280,COMPLETE
815,815,0.7626414374535035,2023-06-01 02:26:27.379122,2023-06-01 02:26:37.911172,0 days 00:00:10.532050,True,entropy,8,10,5,573,COMPLETE
816,816,0.7621777122450941,2023-06-01 02:26:37.911172,2023-06-01 02:26:41.652969,0 days 00:00:03.741797,True,entropy,7,10,5,240,COMPLETE
817,817,0.762652318248823,2023-06-01 02:26:41.652969,2023-06-01 02:26:45.611401,0 days 00:00:03.958432,True,entropy,8,10,5,260,COMPLETE
818,818,0.7622199483834412,2023-06-01 02:26:45.614119,2023-06-01 02:26:50.714115,0 days 00:00:05.099996,True,entropy,8,10,5,340,COMPLETE
819,819,0.7620072684400723,2023-06-01 02:26:50.714115,2023-06-01 02:26:52.621793,0 days 00:00:01.907678,True,entropy,8,9,5,113,COMPLETE
820,820,0.7624468210218502,2023-06-01 02:26:52.623821,2023-06-01 02:26:55.954829,0 days 00:00:03.331008,True,entropy,7,10,6,216,COMPLETE
821,821,0.7627642439473787,2023-06-01 02:26:55.954829,2023-06-01 02:27:00.335660,0 days 00:00:04.380831,True,entropy,8,10,5,278,COMPLETE
822,822,0.7634395248873445,2023-06-01 02:27:00.335660,2023-06-01 02:27:08.323417,0 days 00:00:07.987757,True,entropy,10,10,5,540,COMPLETE
823,823,0.7619867934048523,2023-06-01 02:27:08.323417,2023-06-01 02:27:10.898043,0 days 00:00:02.574626,True,entropy,9,10,5,159,COMPLETE
824,824,0.7621733595399357,2023-06-01 02:27:10.900135,2023-06-01 02:27:18.677851,0 days 00:00:07.777716,True,entropy,10,10,5,530,COMPLETE
825,825,0.7625710664801801,2023-06-01 02:27:18.677851,2023-06-01 02:27:23.397578,0 days 00:00:04.719727,True,entropy,10,10,5,312,COMPLETE
826,826,0.7622209912949744,2023-06-01 02:27:23.397578,2023-06-01 02:27:29.520175,0 days 00:00:06.122597,False,entropy,10,10,5,290,COMPLETE
827,827,0.7622607505734511,2023-06-01 02:27:29.522521,2023-06-01 02:27:34.028479,0 days 00:00:04.505958,True,entropy,7,10,5,298,COMPLETE
828,828,0.7626654661361503,2023-06-01 02:27:34.031108,2023-06-01 02:27:42.156669,0 days 00:00:08.125561,True,entropy,10,10,5,535,COMPLETE
829,829,0.763201482664208,2023-06-01 02:27:42.161229,2023-06-01 02:27:52.410003,0 days 00:00:10.248774,True,entropy,10,10,5,518,COMPLETE
830,830,0.7629998285132681,2023-06-01 02:27:52.414220,2023-06-01 02:27:56.262670,0 days 00:00:03.848450,True,entropy,10,10,5,171,COMPLETE
831,831,0.7622619462236327,2023-06-01 02:27:56.262670,2023-06-01 02:28:05.051035,0 days 00:00:08.788365,True,entropy,10,10,6,538,COMPLETE
832,832,0.7628464819804319,2023-06-01 02:28:05.051035,2023-06-01 02:28:13.041777,0 days 00:00:07.990742,True,entropy,6,10,5,556,COMPLETE
833,833,0.7625020486751869,2023-06-01 02:28:13.044478,2023-06-01 02:28:15.439842,0 days 00:00:02.395364,True,gini,10,10,5,140,COMPLETE
834,834,0.7628842913616178,2023-06-01 02:28:15.441820,2023-06-01 02:28:20.317948,0 days 00:00:04.876128,True,entropy,10,10,5,327,COMPLETE
835,835,0.7627665161944567,2023-06-01 02:28:20.317948,2023-06-01 02:28:24.398725,0 days 00:00:04.080777,True,entropy,10,10,6,270,COMPLETE
836,836,0.7621148028310418,2023-06-01 02:28:24.398725,2023-06-01 02:28:27.625904,0 days 00:00:03.227179,True,entropy,10,10,5,203,COMPLETE
837,837,0.7620526110494575,2023-06-01 02:28:27.628448,2023-06-01 02:28:35.360140,0 days 00:00:07.731692,True,entropy,9,9,5,545,COMPLETE
838,838,0.7626712176299386,2023-06-01 02:28:35.360140,2023-06-01 02:28:39.134775,0 days 00:00:03.774635,True,entropy,8,10,5,245,COMPLETE
839,839,0.7628670818886734,2023-06-01 02:28:39.134775,2023-06-01 02:28:47.479791,0 days 00:00:08.345016,True,entropy,10,10,5,574,COMPLETE
840,840,0.7628614832193901,2023-06-01 02:28:47.479791,2023-06-01 02:28:55.658960,0 days 00:00:08.179169,True,entropy,10,10,6,557,COMPLETE
841,841,0.7580143997934462,2023-06-01 02:28:55.658960,2023-06-01 02:29:02.853899,0 days 00:00:07.194939,True,entropy,10,6,5,556,COMPLETE
842,842,0.762768044911508,2023-06-01 02:29:02.853899,2023-06-01 02:29:12.942084,0 days 00:00:10.088185,True,entropy,10,10,5,522,COMPLETE
843,843,0.7622102967462034,2023-06-01 02:29:12.947565,2023-06-01 02:29:22.756025,0 days 00:00:09.808460,True,entropy,10,10,10,506,COMPLETE
844,844,0.7616948679675672,2023-06-01 02:29:22.756025,2023-06-01 02:29:35.302823,0 days 00:00:12.546798,True,entropy,10,9,5,905,COMPLETE
845,845,0.7622964568639472,2023-06-01 02:29:35.302823,2023-06-01 02:29:39.975343,0 days 00:00:04.672520,False,entropy,9,10,6,226,COMPLETE
846,846,0.7627210733655151,2023-06-01 02:29:39.975343,2023-06-01 02:29:47.837685,0 days 00:00:07.862342,True,entropy,10,10,10,538,COMPLETE
847,847,0.7605341699362427,2023-06-01 02:29:47.837685,2023-06-01 02:29:50.808573,0 days 00:00:02.970888,True,entropy,10,8,5,198,COMPLETE
848,848,0.7626084219833669,2023-06-01 02:29:50.811004,2023-06-01 02:29:58.554643,0 days 00:00:07.743639,True,entropy,10,10,5,516,COMPLETE
849,849,0.7626650777263306,2023-06-01 02:29:58.557343,2023-06-01 02:30:00.781175,0 days 00:00:02.223832,True,entropy,10,10,5,131,COMPLETE
850,850,0.7627647596924753,2023-06-01 02:30:00.781175,2023-06-01 02:30:09.095589,0 days 00:00:08.314414,True,entropy,10,10,6,570,COMPLETE
851,851,0.7633265807725133,2023-06-01 02:30:09.095589,2023-06-01 02:30:16.407994,0 days 00:00:07.312405,True,entropy,10,10,5,498,COMPLETE
852,852,0.7618374529692101,2023-06-01 02:30:16.407994,2023-06-01 02:30:23.762006,0 days 00:00:07.354012,True,gini,10,10,5,505,COMPLETE
853,853,0.7628838445077035,2023-06-01 02:30:23.762006,2023-06-01 02:30:33.059754,0 days 00:00:09.297748,True,entropy,10,10,10,527,COMPLETE
854,854,0.7619165989416141,2023-06-01 02:30:33.059754,2023-06-01 02:30:42.507426,0 days 00:00:09.447672,True,entropy,10,10,5,495,COMPLETE
855,855,0.7629392897951173,2023-06-01 02:30:42.509795,2023-06-01 02:30:50.016302,0 days 00:00:07.506507,True,entropy,10,10,5,516,COMPLETE
856,856,0.7631300626902366,2023-06-01 02:30:50.018886,2023-06-01 02:30:57.944616,0 days 00:00:07.925730,True,entropy,10,10,6,542,COMPLETE
857,857,0.7624770600070085,2023-06-01 02:30:57.944616,2023-06-01 02:31:05.196843,0 days 00:00:07.252227,True,entropy,10,10,5,494,COMPLETE
858,858,0.7622687146326507,2023-06-01 02:31:05.196843,2023-06-01 02:31:12.837308,0 days 00:00:07.640465,True,entropy,10,10,10,512,COMPLETE
859,859,0.7616409843516092,2023-06-01 02:31:12.837308,2023-06-01 02:31:20.770421,0 days 00:00:07.933113,True,entropy,10,9,8,550,COMPLETE
860,860,0.7630689715004062,2023-06-01 02:31:20.772531,2023-06-01 02:31:27.962869,0 days 00:00:07.190338,True,entropy,10,10,5,487,COMPLETE
861,861,0.7624932320321504,2023-06-01 02:31:27.964993,2023-06-01 02:31:35.677105,0 days 00:00:07.712112,True,entropy,10,10,4,529,COMPLETE
862,862,0.7624361928689372,2023-06-01 02:31:35.677105,2023-06-01 02:31:42.919594,0 days 00:00:07.242489,True,entropy,10,10,5,488,COMPLETE
863,863,0.7627445725776776,2023-06-01 02:31:42.921678,2023-06-01 02:31:52.308545,0 days 00:00:09.386867,True,entropy,10,10,4,577,COMPLETE
864,864,0.76199902386601,2023-06-01 02:31:52.308545,2023-06-01 02:32:04.864181,0 days 00:00:12.555636,False,entropy,10,10,4,504,COMPLETE
865,865,0.7519567904598612,2023-06-01 02:32:04.864181,2023-06-01 02:32:09.968742,0 days 00:00:05.104561,True,entropy,10,3,6,482,COMPLETE
866,866,0.7634834168803761,2023-06-01 02:32:09.968742,2023-06-01 02:32:18.043630,0 days 00:00:08.074888,True,entropy,10,10,5,546,COMPLETE
867,867,0.7622493062406557,2023-06-01 02:32:18.043630,2023-06-01 02:32:26.058492,0 days 00:00:08.014862,True,entropy,10,10,5,554,COMPLETE
868,868,0.7553835463456418,2023-06-01 02:32:26.058492,2023-06-01 02:32:32.946087,0 days 00:00:06.887595,True,entropy,10,5,5,566,COMPLETE
869,869,0.7499100967737299,2023-06-01 02:32:32.946087,2023-06-01 02:32:37.728062,0 days 00:00:04.781975,True,entropy,10,2,5,545,COMPLETE
870,870,0.7622144859360136,2023-06-01 02:32:37.730285,2023-06-01 02:32:45.339604,0 days 00:00:07.609319,True,entropy,10,9,5,535,COMPLETE
871,871,0.7616308602195427,2023-06-01 02:32:45.339604,2023-06-01 02:32:53.748566,0 days 00:00:08.408962,True,gini,10,10,5,579,COMPLETE
872,872,0.7623948555602654,2023-06-01 02:32:53.750937,2023-06-01 02:33:04.478709,0 days 00:00:10.727772,True,entropy,10,10,5,546,COMPLETE
873,873,0.7627274087315544,2023-06-01 02:33:04.478709,2023-06-01 02:33:13.821586,0 days 00:00:09.342877,True,entropy,10,10,5,561,COMPLETE
874,874,0.7630177610362994,2023-06-01 02:33:13.823606,2023-06-01 02:33:21.513259,0 days 00:00:07.689653,True,entropy,10,10,5,524,COMPLETE
875,875,0.7629998008185833,2023-06-01 02:33:21.514979,2023-06-01 02:33:29.069950,0 days 00:00:07.554971,True,entropy,10,10,5,521,COMPLETE
876,876,0.7630690046984121,2023-06-01 02:33:29.069950,2023-06-01 02:33:37.544988,0 days 00:00:08.475038,True,entropy,10,10,5,580,COMPLETE
877,877,0.7625475099169466,2023-06-01 02:33:37.547258,2023-06-01 02:33:45.448962,0 days 00:00:07.901704,True,entropy,10,10,6,539,COMPLETE
878,878,0.7627362225442118,2023-06-01 02:33:45.451889,2023-06-01 02:33:54.284962,0 days 00:00:08.833073,True,entropy,10,10,5,596,COMPLETE
879,879,0.7629527660230644,2023-06-01 02:33:54.284962,2023-06-01 02:34:01.975792,0 days 00:00:07.690830,True,entropy,10,10,5,511,COMPLETE
880,880,0.760013317984257,2023-06-01 02:34:01.978253,2023-06-01 02:34:09.407261,0 days 00:00:07.429008,True,entropy,10,7,5,551,COMPLETE
881,881,0.7628949388222663,2023-06-01 02:34:09.409195,2023-06-01 02:34:16.863411,0 days 00:00:07.454216,True,entropy,10,10,6,503,COMPLETE
882,882,0.7629299114707315,2023-06-01 02:34:16.866012,2023-06-01 02:34:24.669702,0 days 00:00:07.803690,True,entropy,10,10,8,532,COMPLETE
883,883,0.7631325373250859,2023-06-01 02:34:24.669702,2023-06-01 02:34:35.669897,0 days 00:00:11.000195,True,entropy,10,10,10,672,COMPLETE
884,884,0.7623768216259094,2023-06-01 02:34:35.672407,2023-06-01 02:34:50.022485,0 days 00:00:14.350078,False,entropy,10,10,5,569,COMPLETE
885,885,0.7629405378724757,2023-06-01 02:34:50.024793,2023-06-01 02:35:01.429211,0 days 00:00:11.404418,True,entropy,10,10,5,790,COMPLETE
886,886,0.7623494085773623,2023-06-01 02:35:01.429211,2023-06-01 02:35:08.954231,0 days 00:00:07.525020,True,entropy,10,10,9,516,COMPLETE
887,887,0.763145875428476,2023-06-01 02:35:08.954231,2023-06-01 02:35:16.234955,0 days 00:00:07.280724,True,entropy,10,10,5,496,COMPLETE
888,888,0.7628991504209568,2023-06-01 02:35:16.234955,2023-06-01 02:35:23.818299,0 days 00:00:07.583344,True,entropy,10,10,5,520,COMPLETE
889,889,0.7628624208227435,2023-06-01 02:35:23.821087,2023-06-01 02:35:32.499016,0 days 00:00:08.677929,True,entropy,10,10,10,590,COMPLETE
890,890,0.7618909425925382,2023-06-01 02:35:32.499016,2023-06-01 02:35:40.645239,0 days 00:00:08.146223,True,gini,10,10,5,560,COMPLETE
891,891,0.7621708307402459,2023-06-01 02:35:40.647354,2023-06-01 02:35:47.670467,0 days 00:00:07.023113,True,entropy,10,9,6,491,COMPLETE
892,892,0.7629134411436013,2023-06-01 02:35:47.670467,2023-06-01 02:35:59.097247,0 days 00:00:11.426780,True,entropy,10,10,5,691,COMPLETE
893,893,0.7625527690681805,2023-06-01 02:35:59.101883,2023-06-01 02:36:09.378381,0 days 00:00:10.276498,True,entropy,10,10,5,534,COMPLETE
894,894,0.7626035067280272,2023-06-01 02:36:09.381687,2023-06-01 02:36:16.424262,0 days 00:00:07.042575,True,entropy,9,10,5,482,COMPLETE
895,895,0.7628461118118717,2023-06-01 02:36:16.424262,2023-06-01 02:36:23.842691,0 days 00:00:07.418429,True,entropy,10,10,8,503,COMPLETE
896,896,0.7629977325918281,2023-06-01 02:36:23.844657,2023-06-01 02:36:30.845213,0 days 00:00:07.000556,True,entropy,10,10,10,479,COMPLETE
897,897,0.7627489811198186,2023-06-01 02:36:30.845213,2023-06-01 02:36:38.927032,0 days 00:00:08.081819,True,entropy,10,10,6,546,COMPLETE
898,898,0.7630533905824409,2023-06-01 02:36:38.927032,2023-06-01 02:36:46.536556,0 days 00:00:07.609524,True,entropy,10,10,5,511,COMPLETE
899,899,0.7624982538135235,2023-06-01 02:36:46.536556,2023-06-01 02:36:55.041228,0 days 00:00:08.504672,True,entropy,10,10,4,581,COMPLETE
900,900,0.7620940894650596,2023-06-01 02:36:55.041228,2023-06-01 02:37:02.007410,0 days 00:00:06.966182,True,entropy,10,10,9,472,COMPLETE
901,901,0.7630912917305578,2023-06-01 02:37:02.010059,2023-06-01 02:37:09.328806,0 days 00:00:07.318747,True,entropy,10,10,5,495,COMPLETE
902,902,0.7625343913498719,2023-06-01 02:37:09.328806,2023-06-01 02:37:18.236912,0 days 00:00:08.908106,True,entropy,10,10,4,530,COMPLETE
903,903,0.7621236751992735,2023-06-01 02:37:18.240064,2023-06-01 02:37:30.745362,0 days 00:00:12.505298,False,entropy,10,10,5,473,COMPLETE
904,904,0.7619170582373863,2023-06-01 02:37:30.745362,2023-06-01 02:37:39.074632,0 days 00:00:08.329270,True,entropy,10,9,4,562,COMPLETE
905,905,0.7632868396103114,2023-06-01 02:37:39.074632,2023-06-01 02:37:46.522224,0 days 00:00:07.447592,True,entropy,9,10,5,511,COMPLETE
906,906,0.7623124283645826,2023-06-01 02:37:46.522224,2023-06-01 02:37:53.794271,0 days 00:00:07.272047,True,entropy,10,10,4,489,COMPLETE
907,907,0.7629459017195476,2023-06-01 02:37:53.797491,2023-06-01 02:38:00.782087,0 days 00:00:06.984596,True,entropy,10,10,8,465,COMPLETE
908,908,0.7629744827763785,2023-06-01 02:38:00.784721,2023-06-01 02:38:10.137111,0 days 00:00:09.352390,True,entropy,10,10,6,656,COMPLETE
909,909,0.7627195618760345,2023-06-01 02:38:10.137111,2023-06-01 02:38:18.890759,0 days 00:00:08.753648,True,entropy,10,10,5,595,COMPLETE
910,910,0.7619799135589493,2023-06-01 02:38:18.892733,2023-06-01 02:38:26.066101,0 days 00:00:07.173368,True,gini,10,10,4,500,COMPLETE
911,911,0.7619304268069943,2023-06-01 02:38:26.066101,2023-06-01 02:38:33.896544,0 days 00:00:07.830443,True,entropy,10,9,10,542,COMPLETE
912,912,0.7624084604331043,2023-06-01 02:38:33.898323,2023-06-01 02:38:41.077248,0 days 00:00:07.178925,True,entropy,10,10,5,482,COMPLETE
913,913,0.7629132399606411,2023-06-01 02:38:41.077248,2023-06-01 02:38:49.970541,0 days 00:00:08.893293,True,entropy,10,10,4,611,COMPLETE
914,914,0.7576770363919593,2023-06-01 02:38:49.970541,2023-06-01 02:38:58.352201,0 days 00:00:08.381660,True,entropy,10,6,9,531,COMPLETE
915,915,0.763001753158257,2023-06-01 02:38:58.355369,2023-06-01 02:39:07.932910,0 days 00:00:09.577541,True,entropy,9,10,4,470,COMPLETE
916,916,0.7629226629900749,2023-06-01 02:39:07.932910,2023-06-01 02:39:16.875234,0 days 00:00:08.942324,True,entropy,10,10,5,559,COMPLETE
917,917,0.7631412420704279,2023-06-01 02:39:16.875234,2023-06-01 02:39:24.442116,0 days 00:00:07.566882,True,entropy,10,10,6,519,COMPLETE
918,918,0.7543681467490566,2023-06-01 02:39:24.442116,2023-06-01 02:39:30.861941,0 days 00:00:06.419825,True,entropy,10,4,4,496,COMPLETE
919,919,0.7610821361867119,2023-06-01 02:39:30.863961,2023-06-01 02:39:40.086489,0 days 00:00:09.222528,True,entropy,10,8,5,627,COMPLETE
920,920,0.7628252745208807,2023-06-01 02:39:40.086489,2023-06-01 02:39:47.150406,0 days 00:00:07.063917,True,entropy,10,10,4,467,COMPLETE
921,921,0.7625842759386784,2023-06-01 02:39:47.154209,2023-06-01 02:39:58.702092,0 days 00:00:11.547883,False,entropy,10,10,10,576,COMPLETE
922,922,0.7622836487842284,2023-06-01 02:39:58.702092,2023-06-01 02:40:05.988467,0 days 00:00:07.286375,True,entropy,10,10,5,481,COMPLETE
923,923,0.7627237561744945,2023-06-01 02:40:05.988467,2023-06-01 02:40:13.560627,0 days 00:00:07.572160,True,entropy,10,10,4,510,COMPLETE
924,924,0.7627194547508563,2023-06-01 02:40:13.560627,2023-06-01 02:40:21.564844,0 days 00:00:08.004217,True,entropy,9,10,8,547,COMPLETE
925,925,0.7630110341925188,2023-06-01 02:40:21.569598,2023-06-01 02:40:37.809340,0 days 00:00:16.239742,True,entropy,10,10,5,1000,COMPLETE
926,926,0.7624757302016303,2023-06-01 02:40:37.809340,2023-06-01 02:40:47.204626,0 days 00:00:09.395286,True,entropy,10,10,4,457,COMPLETE
927,927,0.7623478398948642,2023-06-01 02:40:47.204626,2023-06-01 02:40:57.397945,0 days 00:00:10.193319,True,gini,10,10,4,708,COMPLETE
928,928,0.7633477017315283,2023-06-01 02:40:57.397945,2023-06-01 02:41:04.720592,0 days 00:00:07.322647,True,entropy,10,10,6,499,COMPLETE
929,929,0.7617616436620882,2023-06-01 02:41:04.725448,2023-06-01 02:41:12.220122,0 days 00:00:07.494674,True,entropy,10,9,6,518,COMPLETE
930,930,0.7622164687089903,2023-06-01 02:41:12.220122,2023-06-01 02:41:23.255533,0 days 00:00:11.035411,True,entropy,10,10,6,769,COMPLETE
931,931,0.7628475480709321,2023-06-01 02:41:23.255533,2023-06-01 02:41:30.665653,0 days 00:00:07.410120,True,entropy,10,10,6,504,COMPLETE
932,932,0.762307194926614,2023-06-01 02:41:30.667745,2023-06-01 02:41:37.969424,0 days 00:00:07.301679,True,entropy,10,10,6,494,COMPLETE
933,933,0.7626540193875196,2023-06-01 02:41:37.973379,2023-06-01 02:41:45.594287,0 days 00:00:07.620908,True,entropy,9,10,6,520,COMPLETE
934,934,0.7623181025277599,2023-06-01 02:41:45.594287,2023-06-01 02:41:52.763756,0 days 00:00:07.169469,True,entropy,10,10,6,484,COMPLETE
935,935,0.762604733588274,2023-06-01 02:41:52.766905,2023-06-01 02:42:09.058678,0 days 00:00:16.291773,True,entropy,10,10,6,872,COMPLETE
936,936,0.7628211432679357,2023-06-01 02:42:09.058678,2023-06-01 02:42:16.800821,0 days 00:00:07.742143,True,entropy,10,10,6,533,COMPLETE
937,937,0.7628955242814195,2023-06-01 02:42:16.803331,2023-06-01 02:42:24.223042,0 days 00:00:07.419711,True,entropy,10,10,6,499,COMPLETE
938,938,0.7625508844148777,2023-06-01 02:42:24.223042,2023-06-01 02:42:31.198440,0 days 00:00:06.975398,True,entropy,10,10,6,478,COMPLETE
939,939,0.7621709215658395,2023-06-01 02:42:31.200515,2023-06-01 02:42:38.881674,0 days 00:00:07.681159,True,entropy,10,10,6,524,COMPLETE
940,940,0.7628661420208627,2023-06-01 02:42:38.886548,2023-06-01 02:42:46.880225,0 days 00:00:07.993677,True,entropy,10,10,6,547,COMPLETE
941,941,0.7620827683065962,2023-06-01 02:42:46.882427,2023-06-01 02:42:56.926917,0 days 00:00:10.044490,False,entropy,10,10,7,504,COMPLETE
942,942,0.7614121126013567,2023-06-01 02:42:56.930634,2023-06-01 02:43:06.229323,0 days 00:00:09.298689,True,entropy,5,10,5,670,COMPLETE
943,943,0.7627552131527305,2023-06-01 02:43:06.229323,2023-06-01 02:43:13.014911,0 days 00:00:06.785588,True,entropy,10,10,6,459,COMPLETE
944,944,0.7616753365919007,2023-06-01 02:43:13.016997,2023-06-01 02:43:21.421465,0 days 00:00:08.404468,True,entropy,9,9,5,590,COMPLETE
945,945,0.7554437471980128,2023-06-01 02:43:21.421465,2023-06-01 02:43:26.821773,0 days 00:00:05.400308,True,entropy,3,10,5,478,COMPLETE
946,946,0.7623711062005587,2023-06-01 02:43:26.823767,2023-06-01 02:43:38.168496,0 days 00:00:11.344729,True,entropy,10,10,6,642,COMPLETE
947,947,0.7628074721698728,2023-06-01 02:43:38.173603,2023-06-01 02:43:48.186974,0 days 00:00:10.013371,True,entropy,10,10,5,489,COMPLETE
948,948,0.7626833678114892,2023-06-01 02:43:48.186974,2023-06-01 02:43:55.022685,0 days 00:00:06.835711,True,entropy,10,10,5,463,COMPLETE
